12:25:13.315905 IP 172.28.5.4.60304 > 172.28.5.1.6379: Flags [S], seq 699881451, win 29200, options [mss 1460,sackOK,TS val 4068441501 ecr 0,nop,wscale 7], length 0
12:25:13.316176 IP 172.28.5.1.6379 > 172.28.5.4.60304: Flags [S.], seq 2658194953, ack 699881452, win 28960, options [mss 1460,sackOK,TS val 3585036096 ecr 4068441501,nop,wscale 7], length 0
12:25:13.316437 IP 172.28.5.4.60304 > 172.28.5.1.6379: Flags [P.], seq 1:7, ack 1, win 229, options [nop,nop,TS val 4068441502 ecr 3585036096], length 6: RESP "PING"
12:25:13.316597 IP 172.28.5.1.6379 > 172.28.5.4.60304: Flags [.], ack 7, win 227, options [nop,nop,TS val 3585036096 ecr 4068441502], length 0
12:25:13.316909 IP 172.28.5.1.6379 > 172.28.5.4.60304: Flags [P.], seq 1:8, ack 7, win 227, options [nop,nop,TS val 3585036096 ecr 4068441502], length 7: RESP "PONG"
12:25:13.317080 IP 172.28.5.4.60304 > 172.28.5.1.6379: Flags [P.], seq 7:25, ack 8, win 229, options [nop,nop,TS val 4068441503 ecr 3585036096], length 18: RESP "info replication"
12:25:13.317391 IP 172.28.5.1.6379 > 172.28.5.4.60304: Flags [P.], seq 8:526, ack 25, win 227, options [nop,nop,TS val 3585036097 ecr 4068441503], length 518: RESP "# Replication^M^Jrole:slave^M^Jmaster_host:172.28.5.0^M^Jmaster_port:6379^M^Jmaster_link_status:up^M^Jmaster_last_io_seconds_ago:1^M^Jmaster_sync_in_progress:0^M^Jslave_repl_offset:200838^M^Jslave_priority:100^M^Jslave_read_only:1^M^Jconnected_slaves:0^M^Jmaster_replid:f8eac6c8a17a641b11523474ffa3dbd0af88977a^M^Jmaster_replid2:0000000000000000000000000000000000000000^M^Jmaster_repl_offset:200838^M^Jsecond_repl_offset:-1^M^Jrepl_backlog_active:1^M^Jrepl_backlog_size:1048576^M^Jrepl_backlog_first_byte_offset:1^M^Jrepl_backlog_histlen:200838^M^J"
12:25:13.360484 IP 172.28.5.4.60304 > 172.28.5.1.6379: Flags [.], ack 526, win 237, options [nop,nop,TS val 4068441546 ecr 3585036097], length 0
12:25:13.649081 IP 172.28.5.4.36810 > 172.28.5.2.6379: Flags [S], seq 576452357, win 29200, options [mss 1460,sackOK,TS val 3591669117 ecr 0,nop,wscale 7], length 0
12:25:13.649318 IP 172.28.5.2.6379 > 172.28.5.4.36810: Flags [S.], seq 2778643761, ack 576452358, win 28960, options [mss 1460,sackOK,TS val 371132421 ecr 3591669117,nop,wscale 7], length 0
12:25:13.649481 IP 172.28.5.4.36810 > 172.28.5.2.6379: Flags [P.], seq 1:7, ack 1, win 229, options [nop,nop,TS val 3591669117 ecr 371132421], length 6: RESP "PING"
12:25:13.649611 IP 172.28.5.2.6379 > 172.28.5.4.36810: Flags [.], ack 7, win 227, options [nop,nop,TS val 371132421 ecr 3591669117], length 0
12:25:13.649893 IP 172.28.5.2.6379 > 172.28.5.4.36810: Flags [P.], seq 1:8, ack 7, win 227, options [nop,nop,TS val 371132421 ecr 3591669117], length 7: RESP "PONG"
12:25:13.650007 IP 172.28.5.4.36810 > 172.28.5.2.6379: Flags [P.], seq 7:25, ack 8, win 229, options [nop,nop,TS val 3591669118 ecr 371132421], length 18: RESP "info replication"
12:25:13.650212 IP 172.28.5.2.6379 > 172.28.5.4.36810: Flags [P.], seq 8:528, ack 25, win 227, options [nop,nop,TS val 371132422 ecr 3591669118], length 520: RESP "# Replication^M^Jrole:slave^M^Jmaster_host:172.28.5.0^M^Jmaster_port:6379^M^Jmaster_link_status:up^M^Jmaster_last_io_seconds_ago:0^M^Jmaster_sync_in_progress:0^M^Jslave_repl_offset:200986^M^Jslave_priority:100^M^Jslave_read_only:1^M^Jconnected_slaves:0^M^Jmaster_replid:f8eac6c8a17a641b11523474ffa3dbd0af88977a^M^Jmaster_replid2:0000000000000000000000000000000000000000^M^Jmaster_repl_offset:200986^M^Jsecond_repl_offset:-1^M^Jrepl_backlog_active:1^M^Jrepl_backlog_size:1048576^M^Jrepl_backlog_first_byte_offset:186^M^Jrepl_backlog_histlen:200801^M^J"
12:25:13.692088 IP 172.28.5.4.36810 > 172.28.5.2.6379: Flags [.], ack 528, win 237, options [nop,nop,TS val 3591669160 ecr 371132422], length 0
12:25:13.986839 IP 172.28.5.4.38838 > 172.28.5.0.6379: Flags [S], seq 1425747585, win 29200, options [mss 1460,sackOK,TS val 1870662746 ecr 0,nop,wscale 7], length 0
12:25:13.987045 IP 172.28.5.0.6379 > 172.28.5.4.38838: Flags [S.], seq 471878321, ack 1425747586, win 28960, options [mss 1460,sackOK,TS val 230017681 ecr 1870662746,nop,wscale 7], length 0
12:25:13.987172 IP 172.28.5.4.38838 > 172.28.5.0.6379: Flags [P.], seq 1:7, ack 1, win 229, options [nop,nop,TS val 1870662747 ecr 230017681], length 6: RESP "PING"
12:25:13.987299 IP 172.28.5.0.6379 > 172.28.5.4.38838: Flags [.], ack 7, win 227, options [nop,nop,TS val 230017681 ecr 1870662747], length 0
12:25:13.987632 IP 172.28.5.0.6379 > 172.28.5.4.38838: Flags [P.], seq 1:8, ack 7, win 227, options [nop,nop,TS val 230017681 ecr 1870662747], length 7: RESP "PONG"
12:25:13.987806 IP 172.28.5.4.38838 > 172.28.5.0.6379: Flags [P.], seq 7:25, ack 8, win 229, options [nop,nop,TS val 1870662747 ecr 230017681], length 18: RESP "info replication"
12:25:13.988162 IP 172.28.5.0.6379 > 172.28.5.4.38838: Flags [P.], seq 8:470, ack 25, win 227, options [nop,nop,TS val 230017682 ecr 1870662747], length 462: RESP "# Replication^M^Jrole:master^M^Jconnected_slaves:2^M^Jslave0:ip=172.28.5.1,port=6379,state=online,offset=200986,lag=0^M^Jslave1:ip=172.28.5.2,port=6379,state=online,offset=200986,lag=0^M^Jmaster_replid:f8eac6c8a17a641b11523474ffa3dbd0af88977a^M^Jmaster_replid2:0000000000000000000000000000000000000000^M^Jmaster_repl_offset:200986^M^Jsecond_repl_offset:-1^M^Jrepl_backlog_active:1^M^Jrepl_backlog_size:1048576^M^Jrepl_backlog_first_byte_offset:1^M^Jrepl_backlog_histlen:200986^M^J"
12:25:13.988677 IP 172.28.5.4.38838 > 172.28.5.0.6379: Flags [P.], seq 25:31, ack 470, win 237, options [nop,nop,TS val 1870662748 ecr 230017682], length 6: RESP "QUIT"
12:25:13.988898 IP 172.28.5.0.6379 > 172.28.5.4.38838: Flags [P.], seq 470:475, ack 31, win 227, options [nop,nop,TS val 230017682 ecr 1870662748], length 5: RESP "OK"
12:25:13.989063 IP 172.28.5.4.38838 > 172.28.5.0.6379: Flags [R.], seq 31, ack 475, win 237, options [nop,nop,TS val 1870662749 ecr 230017682], length 0
12:25:13.989063 IP 172.28.5.0.6379 > 172.28.5.4.38838: Flags [F.], seq 475, ack 31, win 227, options [nop,nop,TS val 230017683 ecr 1870662748], length 0
12:25:13.989126 IP 172.28.5.4.38838 > 172.28.5.0.6379: Flags [R], seq 1425747616, win 0, length 0
12:25:14.317728 IP 172.28.5.4.60304 > 172.28.5.1.6379: Flags [R.], seq 25, ack 526, win 237, options [nop,nop,TS val 4068442503 ecr 3585036097], length 0
12:25:14.650670 IP 172.28.5.4.36810 > 172.28.5.2.6379: Flags [R.], seq 25, ack 528, win 237, options [nop,nop,TS val 3591670118 ecr 371132422], length 0
12:25:14.988428 IP 172.28.5.4.38846 > 172.28.5.0.6379: Flags [S], seq 1023981826, win 29200, options [mss 1460,sackOK,TS val 1870663748 ecr 0,nop,wscale 7], length 0
12:25:14.988596 IP 172.28.5.0.6379 > 172.28.5.4.38846: Flags [S.], seq 1273106599, ack 1023981827, win 28960, options [mss 1460,sackOK,TS val 230018682 ecr 1870663748,nop,wscale 7], length 0
12:25:14.988762 IP 172.28.5.4.38846 > 172.28.5.0.6379: Flags [P.], seq 1:7, ack 1, win 229, options [nop,nop,TS val 1870663748 ecr 230018682], length 6: RESP "PING"
12:25:14.988992 IP 172.28.5.0.6379 > 172.28.5.4.38846: Flags [.], ack 7, win 227, options [nop,nop,TS val 230018682 ecr 1870663748], length 0
12:25:14.989266 IP 172.28.5.0.6379 > 172.28.5.4.38846: Flags [P.], seq 1:8, ack 7, win 227, options [nop,nop,TS val 230018683 ecr 1870663748], length 7: RESP "PONG"
12:25:14.989391 IP 172.28.5.4.38846 > 172.28.5.0.6379: Flags [P.], seq 7:25, ack 8, win 229, options [nop,nop,TS val 1870663749 ecr 230018683], length 18: RESP "info replication"
12:25:14.989687 IP 172.28.5.0.6379 > 172.28.5.4.38846: Flags [P.], seq 8:470, ack 25, win 227, options [nop,nop,TS val 230018683 ecr 1870663749], length 462: RESP "# Replication^M^Jrole:master^M^Jconnected_slaves:2^M^Jslave0:ip=172.28.5.1,port=6379,state=online,offset=201134,lag=0^M^Jslave1:ip=172.28.5.2,port=6379,state=online,offset=201134,lag=0^M^Jmaster_replid:f8eac6c8a17a641b11523474ffa3dbd0af88977a^M^Jmaster_replid2:0000000000000000000000000000000000000000^M^Jmaster_repl_offset:201282^M^Jsecond_repl_offset:-1^M^Jrepl_backlog_active:1^M^Jrepl_backlog_size:1048576^M^Jrepl_backlog_first_byte_offset:1^M^Jrepl_backlog_histlen:201282^M^J"
12:25:14.989871 IP 172.28.5.4.38846 > 172.28.5.0.6379: Flags [P.], seq 25:31, ack 470, win 237, options [nop,nop,TS val 1870663749 ecr 230018683], length 6: RESP "QUIT"
12:25:14.990142 IP 172.28.5.0.6379 > 172.28.5.4.38846: Flags [P.], seq 470:475, ack 31, win 227, options [nop,nop,TS val 230018684 ecr 1870663749], length 5: RESP "OK"
12:25:14.990332 IP 172.28.5.0.6379 > 172.28.5.4.38846: Flags [F.], seq 475, ack 31, win 227, options [nop,nop,TS val 230018684 ecr 1870663749], length 0
12:25:14.990358 IP 172.28.5.4.38846 > 172.28.5.0.6379: Flags [R.], seq 31, ack 475, win 237, options [nop,nop,TS val 1870663750 ecr 230018684], length 0
12:25:14.990397 IP 172.28.5.4.38846 > 172.28.5.0.6379: Flags [R], seq 1023981857, win 0, length 0
12:25:15.319450 IP 172.28.5.4.60324 > 172.28.5.1.6379: Flags [S], seq 1552177902, win 29200, options [mss 1460,sackOK,TS val 4068443505 ecr 0,nop,wscale 7], length 0
12:25:15.319635 IP 172.28.5.1.6379 > 172.28.5.4.60324: Flags [S.], seq 1337654233, ack 1552177903, win 28960, options [mss 1460,sackOK,TS val 3585038099 ecr 4068443505,nop,wscale 7], length 0
12:25:15.319741 IP 172.28.5.4.60324 > 172.28.5.1.6379: Flags [P.], seq 1:7, ack 1, win 229, options [nop,nop,TS val 4068443505 ecr 3585038099], length 6: RESP "PING"
12:25:15.319853 IP 172.28.5.1.6379 > 172.28.5.4.60324: Flags [.], ack 7, win 227, options [nop,nop,TS val 3585038099 ecr 4068443505], length 0
12:25:15.320238 IP 172.28.5.1.6379 > 172.28.5.4.60324: Flags [P.], seq 1:8, ack 7, win 227, options [nop,nop,TS val 3585038100 ecr 4068443505], length 7: RESP "PONG"
12:25:15.320375 IP 172.28.5.4.60324 > 172.28.5.1.6379: Flags [P.], seq 7:25, ack 8, win 229, options [nop,nop,TS val 4068443506 ecr 3585038100], length 18: RESP "info replication"
12:25:15.320599 IP 172.28.5.1.6379 > 172.28.5.4.60324: Flags [P.], seq 8:526, ack 25, win 227, options [nop,nop,TS val 3585038100 ecr 4068443506], length 518: RESP "# Replication^M^Jrole:slave^M^Jmaster_host:172.28.5.0^M^Jmaster_port:6379^M^Jmaster_link_status:up^M^Jmaster_last_io_seconds_ago:1^M^Jmaster_sync_in_progress:0^M^Jslave_repl_offset:201282^M^Jslave_priority:100^M^Jslave_read_only:1^M^Jconnected_slaves:0^M^Jmaster_replid:f8eac6c8a17a641b11523474ffa3dbd0af88977a^M^Jmaster_replid2:0000000000000000000000000000000000000000^M^Jmaster_repl_offset:201282^M^Jsecond_repl_offset:-1^M^Jrepl_backlog_active:1^M^Jrepl_backlog_size:1048576^M^Jrepl_backlog_first_byte_offset:1^M^Jrepl_backlog_histlen:201282^M^J"
12:25:15.364464 IP 172.28.5.4.60324 > 172.28.5.1.6379: Flags [.], ack 526, win 237, options [nop,nop,TS val 4068443550 ecr 3585038100], length 0
12:25:15.652662 IP 172.28.5.4.36830 > 172.28.5.2.6379: Flags [S], seq 1992691392, win 29200, options [mss 1460,sackOK,TS val 3591671120 ecr 0,nop,wscale 7], length 0
12:25:15.652884 IP 172.28.5.2.6379 > 172.28.5.4.36830: Flags [S.], seq 2484948973, ack 1992691393, win 28960, options [mss 1460,sackOK,TS val 371134424 ecr 3591671120,nop,wscale 7], length 0
12:25:15.653037 IP 172.28.5.4.36830 > 172.28.5.2.6379: Flags [P.], seq 1:7, ack 1, win 229, options [nop,nop,TS val 3591671121 ecr 371134424], length 6: RESP "PING"
12:25:15.653172 IP 172.28.5.2.6379 > 172.28.5.4.36830: Flags [.], ack 7, win 227, options [nop,nop,TS val 371134425 ecr 3591671121], length 0
12:25:15.653491 IP 172.28.5.2.6379 > 172.28.5.4.36830: Flags [P.], seq 1:8, ack 7, win 227, options [nop,nop,TS val 371134425 ecr 3591671121], length 7: RESP "PONG"
12:25:15.653663 IP 172.28.5.4.36830 > 172.28.5.2.6379: Flags [P.], seq 7:25, ack 8, win 229, options [nop,nop,TS val 3591671121 ecr 371134425], length 18: RESP "info replication"
12:25:15.653975 IP 172.28.5.2.6379 > 172.28.5.4.36830: Flags [P.], seq 8:528, ack 25, win 227, options [nop,nop,TS val 371134425 ecr 3591671121], length 520: RESP "# Replication^M^Jrole:slave^M^Jmaster_host:172.28.5.0^M^Jmaster_port:6379^M^Jmaster_link_status:up^M^Jmaster_last_io_seconds_ago:0^M^Jmaster_sync_in_progress:0^M^Jslave_repl_offset:201430^M^Jslave_priority:100^M^Jslave_read_only:1^M^Jconnected_slaves:0^M^Jmaster_replid:f8eac6c8a17a641b11523474ffa3dbd0af88977a^M^Jmaster_replid2:0000000000000000000000000000000000000000^M^Jmaster_repl_offset:201430^M^Jsecond_repl_offset:-1^M^Jrepl_backlog_active:1^M^Jrepl_backlog_size:1048576^M^Jrepl_backlog_first_byte_offset:186^M^Jrepl_backlog_histlen:201245^M^J"
12:25:15.696077 IP 172.28.5.4.36830 > 172.28.5.2.6379: Flags [.], ack 528, win 237, options [nop,nop,TS val 3591671164 ecr 371134425], length 0
12:25:15.992483 IP 172.28.5.4.38858 > 172.28.5.0.6379: Flags [S], seq 2509570823, win 29200, options [mss 1460,sackOK,TS val 1870664752 ecr 0,nop,wscale 7], length 0
12:25:15.992647 IP 172.28.5.0.6379 > 172.28.5.4.38858: Flags [S.], seq 441866628, ack 2509570824, win 28960, options [mss 1460,sackOK,TS val 230019686 ecr 1870664752,nop,wscale 7], length 0
12:25:15.992754 IP 172.28.5.4.38858 > 172.28.5.0.6379: Flags [P.], seq 1:7, ack 1, win 229, options [nop,nop,TS val 1870664752 ecr 230019686], length 6: RESP "PING"
12:25:15.992854 IP 172.28.5.0.6379 > 172.28.5.4.38858: Flags [.], ack 7, win 227, options [nop,nop,TS val 230019686 ecr 1870664752], length 0
12:25:15.993088 IP 172.28.5.0.6379 > 172.28.5.4.38858: Flags [P.], seq 1:8, ack 7, win 227, options [nop,nop,TS val 230019687 ecr 1870664752], length 7: RESP "PONG"
12:25:15.993215 IP 172.28.5.4.38858 > 172.28.5.0.6379: Flags [P.], seq 7:25, ack 8, win 229, options [nop,nop,TS val 1870664753 ecr 230019687], length 18: RESP "info replication"
12:25:15.993492 IP 172.28.5.0.6379 > 172.28.5.4.38858: Flags [P.], seq 8:470, ack 25, win 227, options [nop,nop,TS val 230019687 ecr 1870664753], length 462: RESP "# Replication^M^Jrole:master^M^Jconnected_slaves:2^M^Jslave0:ip=172.28.5.1,port=6379,state=online,offset=201430,lag=0^M^Jslave1:ip=172.28.5.2,port=6379,state=online,offset=201282,lag=0^M^Jmaster_replid:f8eac6c8a17a641b11523474ffa3dbd0af88977a^M^Jmaster_replid2:0000000000000000000000000000000000000000^M^Jmaster_repl_offset:201430^M^Jsecond_repl_offset:-1^M^Jrepl_backlog_active:1^M^Jrepl_backlog_size:1048576^M^Jrepl_backlog_first_byte_offset:1^M^Jrepl_backlog_histlen:201430^M^J"
12:25:15.993611 IP 172.28.5.4.38858 > 172.28.5.0.6379: Flags [P.], seq 25:31, ack 470, win 237, options [nop,nop,TS val 1870664753 ecr 230019687], length 6: RESP "QUIT"
12:25:15.993750 IP 172.28.5.0.6379 > 172.28.5.4.38858: Flags [P.], seq 470:475, ack 31, win 227, options [nop,nop,TS val 230019687 ecr 1870664753], length 5: RESP "OK"
12:25:15.993836 IP 172.28.5.4.38858 > 172.28.5.0.6379: Flags [R.], seq 31, ack 475, win 237, options [nop,nop,TS val 1870664753 ecr 230019687], length 0
12:25:15.993840 IP 172.28.5.0.6379 > 172.28.5.4.38858: Flags [F.], seq 475, ack 31, win 227, options [nop,nop,TS val 230019687 ecr 1870664753], length 0
12:25:15.993883 IP 172.28.5.4.38858 > 172.28.5.0.6379: Flags [R], seq 2509570854, win 0, length 0
12:25:16.321861 IP 172.28.5.4.60324 > 172.28.5.1.6379: Flags [R.], seq 25, ack 526, win 237, options [nop,nop,TS val 4068444507 ecr 3585038100], length 0
12:25:16.655012 IP 172.28.5.4.36830 > 172.28.5.2.6379: Flags [R.], seq 25, ack 528, win 237, options [nop,nop,TS val 3591672123 ecr 371134425], length 0
12:25:16.995185 IP 172.28.5.4.38866 > 172.28.5.0.6379: Flags [S], seq 445600280, win 29200, options [mss 1460,sackOK,TS val 1870665755 ecr 0,nop,wscale 7], length 0
12:25:16.995383 IP 172.28.5.0.6379 > 172.28.5.4.38866: Flags [S.], seq 3202040390, ack 445600281, win 28960, options [mss 1460,sackOK,TS val 230020689 ecr 1870665755,nop,wscale 7], length 0
12:25:16.995506 IP 172.28.5.4.38866 > 172.28.5.0.6379: Flags [P.], seq 1:7, ack 1, win 229, options [nop,nop,TS val 1870665755 ecr 230020689], length 6: RESP "PING"
12:25:16.995631 IP 172.28.5.0.6379 > 172.28.5.4.38866: Flags [.], ack 7, win 227, options [nop,nop,TS val 230020689 ecr 1870665755], length 0
12:25:16.995958 IP 172.28.5.0.6379 > 172.28.5.4.38866: Flags [P.], seq 1:8, ack 7, win 227, options [nop,nop,TS val 230020689 ecr 1870665755], length 7: RESP "PONG"
12:25:16.996175 IP 172.28.5.4.38866 > 172.28.5.0.6379: Flags [P.], seq 7:25, ack 8, win 229, options [nop,nop,TS val 1870665756 ecr 230020689], length 18: RESP "info replication"
12:25:16.996463 IP 172.28.5.0.6379 > 172.28.5.4.38866: Flags [P.], seq 8:470, ack 25, win 227, options [nop,nop,TS val 230020690 ecr 1870665756], length 462: RESP "# Replication^M^Jrole:master^M^Jconnected_slaves:2^M^Jslave0:ip=172.28.5.1,port=6379,state=online,offset=201578,lag=0^M^Jslave1:ip=172.28.5.2,port=6379,state=online,offset=201578,lag=0^M^Jmaster_replid:f8eac6c8a17a641b11523474ffa3dbd0af88977a^M^Jmaster_replid2:0000000000000000000000000000000000000000^M^Jmaster_repl_offset:201726^M^Jsecond_repl_offset:-1^M^Jrepl_backlog_active:1^M^Jrepl_backlog_size:1048576^M^Jrepl_backlog_first_byte_offset:1^M^Jrepl_backlog_histlen:201726^M^J"
12:25:16.996613 IP 172.28.5.4.38866 > 172.28.5.0.6379: Flags [P.], seq 25:31, ack 470, win 237, options [nop,nop,TS val 1870665756 ecr 230020690], length 6: RESP "QUIT"
12:25:16.996989 IP 172.28.5.0.6379 > 172.28.5.4.38866: Flags [P.], seq 470:475, ack 31, win 227, options [nop,nop,TS val 230020690 ecr 1870665756], length 5: RESP "OK"
12:25:16.997125 IP 172.28.5.0.6379 > 172.28.5.4.38866: Flags [F.], seq 475, ack 31, win 227, options [nop,nop,TS val 230020691 ecr 1870665756], length 0
12:25:16.997192 IP 172.28.5.4.38866 > 172.28.5.0.6379: Flags [R.], seq 31, ack 476, win 237, options [nop,nop,TS val 1870665757 ecr 230020690], length 0
12:25:17.323290 IP 172.28.5.4.60344 > 172.28.5.1.6379: Flags [S], seq 2091147817, win 29200, options [mss 1460,sackOK,TS val 4068445509 ecr 0,nop,wscale 7], length 0
12:25:17.323519 IP 172.28.5.1.6379 > 172.28.5.4.60344: Flags [S.], seq 151273641, ack 2091147818, win 28960, options [mss 1460,sackOK,TS val 3585040103 ecr 4068445509,nop,wscale 7], length 0
12:25:17.323670 IP 172.28.5.4.60344 > 172.28.5.1.6379: Flags [P.], seq 1:7, ack 1, win 229, options [nop,nop,TS val 4068445509 ecr 3585040103], length 6: RESP "PING"
12:25:17.323815 IP 172.28.5.1.6379 > 172.28.5.4.60344: Flags [.], ack 7, win 227, options [nop,nop,TS val 3585040103 ecr 4068445509], length 0
12:25:17.324256 IP 172.28.5.1.6379 > 172.28.5.4.60344: Flags [P.], seq 1:8, ack 7, win 227, options [nop,nop,TS val 3585040104 ecr 4068445509], length 7: RESP "PONG"
12:25:17.324439 IP 172.28.5.4.60344 > 172.28.5.1.6379: Flags [P.], seq 7:25, ack 8, win 229, options [nop,nop,TS val 4068445510 ecr 3585040104], length 18: RESP "info replication"
12:25:17.324775 IP 172.28.5.1.6379 > 172.28.5.4.60344: Flags [P.], seq 8:526, ack 25, win 227, options [nop,nop,TS val 3585040104 ecr 4068445510], length 518: RESP "# Replication^M^Jrole:slave^M^Jmaster_host:172.28.5.0^M^Jmaster_port:6379^M^Jmaster_link_status:up^M^Jmaster_last_io_seconds_ago:1^M^Jmaster_sync_in_progress:0^M^Jslave_repl_offset:201726^M^Jslave_priority:100^M^Jslave_read_only:1^M^Jconnected_slaves:0^M^Jmaster_replid:f8eac6c8a17a641b11523474ffa3dbd0af88977a^M^Jmaster_replid2:0000000000000000000000000000000000000000^M^Jmaster_repl_offset:201726^M^Jsecond_repl_offset:-1^M^Jrepl_backlog_active:1^M^Jrepl_backlog_size:1048576^M^Jrepl_backlog_first_byte_offset:1^M^Jrepl_backlog_histlen:201726^M^J"
12:25:17.368020 IP 172.28.5.4.60344 > 172.28.5.1.6379: Flags [.], ack 526, win 237, options [nop,nop,TS val 4068445554 ecr 3585040104], length 0
12:25:17.656261 IP 172.28.5.4.36850 > 172.28.5.2.6379: Flags [S], seq 3712890073, win 29200, options [mss 1460,sackOK,TS val 3591673124 ecr 0,nop,wscale 7], length 0
12:25:17.656439 IP 172.28.5.2.6379 > 172.28.5.4.36850: Flags [S.], seq 2412909771, ack 3712890074, win 28960, options [mss 1460,sackOK,TS val 371136428 ecr 3591673124,nop,wscale 7], length 0
12:25:17.656544 IP 172.28.5.4.36850 > 172.28.5.2.6379: Flags [P.], seq 1:7, ack 1, win 229, options [nop,nop,TS val 3591673124 ecr 371136428], length 6: RESP "PING"
12:25:17.656648 IP 172.28.5.2.6379 > 172.28.5.4.36850: Flags [.], ack 7, win 227, options [nop,nop,TS val 371136428 ecr 3591673124], length 0
12:25:17.656957 IP 172.28.5.2.6379 > 172.28.5.4.36850: Flags [P.], seq 1:8, ack 7, win 227, options [nop,nop,TS val 371136428 ecr 3591673124], length 7: RESP "PONG"
12:25:17.657095 IP 172.28.5.4.36850 > 172.28.5.2.6379: Flags [P.], seq 7:25, ack 8, win 229, options [nop,nop,TS val 3591673125 ecr 371136428], length 18: RESP "info replication"
12:25:17.657320 IP 172.28.5.2.6379 > 172.28.5.4.36850: Flags [P.], seq 8:528, ack 25, win 227, options [nop,nop,TS val 371136429 ecr 3591673125], length 520: RESP "# Replication^M^Jrole:slave^M^Jmaster_host:172.28.5.0^M^Jmaster_port:6379^M^Jmaster_link_status:up^M^Jmaster_last_io_seconds_ago:0^M^Jmaster_sync_in_progress:0^M^Jslave_repl_offset:201874^M^Jslave_priority:100^M^Jslave_read_only:1^M^Jconnected_slaves:0^M^Jmaster_replid:f8eac6c8a17a641b11523474ffa3dbd0af88977a^M^Jmaster_replid2:0000000000000000000000000000000000000000^M^Jmaster_repl_offset:201874^M^Jsecond_repl_offset:-1^M^Jrepl_backlog_active:1^M^Jrepl_backlog_size:1048576^M^Jrepl_backlog_first_byte_offset:186^M^Jrepl_backlog_histlen:201689^M^J"
12:25:17.700083 IP 172.28.5.4.36850 > 172.28.5.2.6379: Flags [.], ack 528, win 237, options [nop,nop,TS val 3591673168 ecr 371136429], length 0
12:25:17.999532 IP 172.28.5.4.38878 > 172.28.5.0.6379: Flags [S], seq 2622788433, win 29200, options [mss 1460,sackOK,TS val 1870666759 ecr 0,nop,wscale 7], length 0
12:25:17.999697 IP 172.28.5.0.6379 > 172.28.5.4.38878: Flags [S.], seq 346399574, ack 2622788434, win 28960, options [mss 1460,sackOK,TS val 230021693 ecr 1870666759,nop,wscale 7], length 0
12:25:17.999802 IP 172.28.5.4.38878 > 172.28.5.0.6379: Flags [P.], seq 1:7, ack 1, win 229, options [nop,nop,TS val 1870666759 ecr 230021693], length 6: RESP "PING"
12:25:17.999919 IP 172.28.5.0.6379 > 172.28.5.4.38878: Flags [.], ack 7, win 227, options [nop,nop,TS val 230021693 ecr 1870666759], length 0
12:25:18.000326 IP 172.28.5.0.6379 > 172.28.5.4.38878: Flags [P.], seq 1:8, ack 7, win 227, options [nop,nop,TS val 230021694 ecr 1870666759], length 7: RESP "PONG"
12:25:18.000469 IP 172.28.5.4.38878 > 172.28.5.0.6379: Flags [P.], seq 7:25, ack 8, win 229, options [nop,nop,TS val 1870666760 ecr 230021694], length 18: RESP "info replication"
12:25:18.000713 IP 172.28.5.0.6379 > 172.28.5.4.38878: Flags [P.], seq 8:470, ack 25, win 227, options [nop,nop,TS val 230021694 ecr 1870666760], length 462: RESP "# Replication^M^Jrole:master^M^Jconnected_slaves:2^M^Jslave0:ip=172.28.5.1,port=6379,state=online,offset=201726,lag=0^M^Jslave1:ip=172.28.5.2,port=6379,state=online,offset=201726,lag=0^M^Jmaster_replid:f8eac6c8a17a641b11523474ffa3dbd0af88977a^M^Jmaster_replid2:0000000000000000000000000000000000000000^M^Jmaster_repl_offset:201874^M^Jsecond_repl_offset:-1^M^Jrepl_backlog_active:1^M^Jrepl_backlog_size:1048576^M^Jrepl_backlog_first_byte_offset:1^M^Jrepl_backlog_histlen:201874^M^J"
12:25:18.000812 IP 172.28.5.4.38878 > 172.28.5.0.6379: Flags [P.], seq 25:31, ack 470, win 237, options [nop,nop,TS val 1870666760 ecr 230021694], length 6: RESP "QUIT"
12:25:18.000945 IP 172.28.5.0.6379 > 172.28.5.4.38878: Flags [P.], seq 470:475, ack 31, win 227, options [nop,nop,TS val 230021694 ecr 1870666760], length 5: RESP "OK"
12:25:18.001040 IP 172.28.5.4.38878 > 172.28.5.0.6379: Flags [R.], seq 31, ack 475, win 237, options [nop,nop,TS val 1870666761 ecr 230021694], length 0
12:25:18.001043 IP 172.28.5.0.6379 > 172.28.5.4.38878: Flags [F.], seq 475, ack 31, win 227, options [nop,nop,TS val 230021695 ecr 1870666760], length 0
12:25:18.001083 IP 172.28.5.4.38878 > 172.28.5.0.6379: Flags [R], seq 2622788464, win 0, length 0
12:25:18.325666 IP 172.28.5.4.60344 > 172.28.5.1.6379: Flags [R.], seq 25, ack 526, win 237, options [nop,nop,TS val 4068446511 ecr 3585040104], length 0
12:25:18.658589 IP 172.28.5.4.36850 > 172.28.5.2.6379: Flags [R.], seq 25, ack 528, win 237, options [nop,nop,TS val 3591674126 ecr 371136429], length 0
12:25:19.001501 IP 172.28.5.4.38886 > 172.28.5.0.6379: Flags [S], seq 1991378582, win 29200, options [mss 1460,sackOK,TS val 1870667761 ecr 0,nop,wscale 7], length 0
12:25:19.001645 IP 172.28.5.0.6379 > 172.28.5.4.38886: Flags [S.], seq 3266320146, ack 1991378583, win 28960, options [mss 1460,sackOK,TS val 230022695 ecr 1870667761,nop,wscale 7], length 0
12:25:19.001734 IP 172.28.5.4.38886 > 172.28.5.0.6379: Flags [P.], seq 1:7, ack 1, win 229, options [nop,nop,TS val 1870667761 ecr 230022695], length 6: RESP "PING"
12:25:19.001836 IP 172.28.5.0.6379 > 172.28.5.4.38886: Flags [.], ack 7, win 227, options [nop,nop,TS val 230022695 ecr 1870667761], length 0
12:25:19.002154 IP 172.28.5.0.6379 > 172.28.5.4.38886: Flags [P.], seq 1:8, ack 7, win 227, options [nop,nop,TS val 230022696 ecr 1870667761], length 7: RESP "PONG"
12:25:19.002358 IP 172.28.5.4.38886 > 172.28.5.0.6379: Flags [P.], seq 7:25, ack 8, win 229, options [nop,nop,TS val 1870667762 ecr 230022696], length 18: RESP "info replication"
12:25:19.002657 IP 172.28.5.0.6379 > 172.28.5.4.38886: Flags [P.], seq 8:470, ack 25, win 227, options [nop,nop,TS val 230022696 ecr 1870667762], length 462: RESP "# Replication^M^Jrole:master^M^Jconnected_slaves:2^M^Jslave0:ip=172.28.5.1,port=6379,state=online,offset=202022,lag=0^M^Jslave1:ip=172.28.5.2,port=6379,state=online,offset=202022,lag=0^M^Jmaster_replid:f8eac6c8a17a641b11523474ffa3dbd0af88977a^M^Jmaster_replid2:0000000000000000000000000000000000000000^M^Jmaster_repl_offset:202170^M^Jsecond_repl_offset:-1^M^Jrepl_backlog_active:1^M^Jrepl_backlog_size:1048576^M^Jrepl_backlog_first_byte_offset:1^M^Jrepl_backlog_histlen:202170^M^J"
12:25:19.002781 IP 172.28.5.4.38886 > 172.28.5.0.6379: Flags [P.], seq 25:31, ack 470, win 237, options [nop,nop,TS val 1870667762 ecr 230022696], length 6: RESP "QUIT"
12:25:19.002932 IP 172.28.5.0.6379 > 172.28.5.4.38886: Flags [P.], seq 470:475, ack 31, win 227, options [nop,nop,TS val 230022696 ecr 1870667762], length 5: RESP "OK"
12:25:19.003027 IP 172.28.5.4.38886 > 172.28.5.0.6379: Flags [R.], seq 31, ack 475, win 237, options [nop,nop,TS val 1870667763 ecr 230022696], length 0
12:25:19.003031 IP 172.28.5.0.6379 > 172.28.5.4.38886: Flags [F.], seq 475, ack 31, win 227, options [nop,nop,TS val 230022697 ecr 1870667762], length 0
12:25:19.003073 IP 172.28.5.4.38886 > 172.28.5.0.6379: Flags [R], seq 1991378613, win 0, length 0
12:25:19.328480 IP 172.28.5.4.60364 > 172.28.5.1.6379: Flags [S], seq 3380286315, win 29200, options [mss 1460,sackOK,TS val 4068447514 ecr 0,nop,wscale 7], length 0
12:25:19.328653 IP 172.28.5.1.6379 > 172.28.5.4.60364: Flags [S.], seq 2315878484, ack 3380286316, win 28960, options [mss 1460,sackOK,TS val 3585042108 ecr 4068447514,nop,wscale 7], length 0
12:25:19.328780 IP 172.28.5.4.60364 > 172.28.5.1.6379: Flags [P.], seq 1:7, ack 1, win 229, options [nop,nop,TS val 4068447514 ecr 3585042108], length 6: RESP "PING"
12:25:19.328977 IP 172.28.5.1.6379 > 172.28.5.4.60364: Flags [.], ack 7, win 227, options [nop,nop,TS val 3585042108 ecr 4068447514], length 0
12:25:19.329274 IP 172.28.5.1.6379 > 172.28.5.4.60364: Flags [P.], seq 1:8, ack 7, win 227, options [nop,nop,TS val 3585042109 ecr 4068447514], length 7: RESP "PONG"
12:25:19.329454 IP 172.28.5.4.60364 > 172.28.5.1.6379: Flags [P.], seq 7:25, ack 8, win 229, options [nop,nop,TS val 4068447515 ecr 3585042109], length 18: RESP "info replication"
12:25:19.329762 IP 172.28.5.1.6379 > 172.28.5.4.60364: Flags [P.], seq 8:526, ack 25, win 227, options [nop,nop,TS val 3585042109 ecr 4068447515], length 518: RESP "# Replication^M^Jrole:slave^M^Jmaster_host:172.28.5.0^M^Jmaster_port:6379^M^Jmaster_link_status:up^M^Jmaster_last_io_seconds_ago:1^M^Jmaster_sync_in_progress:0^M^Jslave_repl_offset:202170^M^Jslave_priority:100^M^Jslave_read_only:1^M^Jconnected_slaves:0^M^Jmaster_replid:f8eac6c8a17a641b11523474ffa3dbd0af88977a^M^Jmaster_replid2:0000000000000000000000000000000000000000^M^Jmaster_repl_offset:202170^M^Jsecond_repl_offset:-1^M^Jrepl_backlog_active:1^M^Jrepl_backlog_size:1048576^M^Jrepl_backlog_first_byte_offset:1^M^Jrepl_backlog_histlen:202170^M^J"
12:25:19.372099 IP 172.28.5.4.60364 > 172.28.5.1.6379: Flags [.], ack 526, win 237, options [nop,nop,TS val 4068447558 ecr 3585042109], length 0
12:25:19.660583 IP 172.28.5.4.36870 > 172.28.5.2.6379: Flags [S], seq 3496796971, win 29200, options [mss 1460,sackOK,TS val 3591675128 ecr 0,nop,wscale 7], length 0
12:25:19.660859 IP 172.28.5.2.6379 > 172.28.5.4.36870: Flags [S.], seq 3138631007, ack 3496796972, win 28960, options [mss 1460,sackOK,TS val 371138432 ecr 3591675128,nop,wscale 7], length 0
12:25:19.661023 IP 172.28.5.4.36870 > 172.28.5.2.6379: Flags [P.], seq 1:7, ack 1, win 229, options [nop,nop,TS val 3591675129 ecr 371138432], length 6: RESP "PING"
12:25:19.661179 IP 172.28.5.2.6379 > 172.28.5.4.36870: Flags [.], ack 7, win 227, options [nop,nop,TS val 371138433 ecr 3591675129], length 0
12:25:19.661597 IP 172.28.5.2.6379 > 172.28.5.4.36870: Flags [P.], seq 1:8, ack 7, win 227, options [nop,nop,TS val 371138433 ecr 3591675129], length 7: RESP "PONG"
12:25:19.661782 IP 172.28.5.4.36870 > 172.28.5.2.6379: Flags [P.], seq 7:25, ack 8, win 229, options [nop,nop,TS val 3591675129 ecr 371138433], length 18: RESP "info replication"
12:25:19.662055 IP 172.28.5.2.6379 > 172.28.5.4.36870: Flags [P.], seq 8:528, ack 25, win 227, options [nop,nop,TS val 371138434 ecr 3591675129], length 520: RESP "# Replication^M^Jrole:slave^M^Jmaster_host:172.28.5.0^M^Jmaster_port:6379^M^Jmaster_link_status:up^M^Jmaster_last_io_seconds_ago:0^M^Jmaster_sync_in_progress:0^M^Jslave_repl_offset:202318^M^Jslave_priority:100^M^Jslave_read_only:1^M^Jconnected_slaves:0^M^Jmaster_replid:f8eac6c8a17a641b11523474ffa3dbd0af88977a^M^Jmaster_replid2:0000000000000000000000000000000000000000^M^Jmaster_repl_offset:202318^M^Jsecond_repl_offset:-1^M^Jrepl_backlog_active:1^M^Jrepl_backlog_size:1048576^M^Jrepl_backlog_first_byte_offset:186^M^Jrepl_backlog_histlen:202133^M^J"
12:25:19.704393 IP 172.28.5.4.36870 > 172.28.5.2.6379: Flags [.], ack 528, win 237, options [nop,nop,TS val 3591675172 ecr 371138434], length 0
12:25:20.003094 IP 172.28.5.4.38898 > 172.28.5.0.6379: Flags [S], seq 3682889939, win 29200, options [mss 1460,sackOK,TS val 1870668763 ecr 0,nop,wscale 7], length 0
12:25:20.003244 IP 172.28.5.0.6379 > 172.28.5.4.38898: Flags [S.], seq 71045290, ack 3682889940, win 28960, options [mss 1460,sackOK,TS val 230023697 ecr 1870668763,nop,wscale 7], length 0
12:25:20.003346 IP 172.28.5.4.38898 > 172.28.5.0.6379: Flags [P.], seq 1:7, ack 1, win 229, options [nop,nop,TS val 1870668763 ecr 230023697], length 6: RESP "PING"
12:25:20.003483 IP 172.28.5.0.6379 > 172.28.5.4.38898: Flags [.], ack 7, win 227, options [nop,nop,TS val 230023697 ecr 1870668763], length 0
12:25:20.003817 IP 172.28.5.0.6379 > 172.28.5.4.38898: Flags [P.], seq 1:8, ack 7, win 227, options [nop,nop,TS val 230023697 ecr 1870668763], length 7: RESP "PONG"
12:25:20.004059 IP 172.28.5.4.38898 > 172.28.5.0.6379: Flags [P.], seq 7:25, ack 8, win 229, options [nop,nop,TS val 1870668764 ecr 230023697], length 18: RESP "info replication"
12:25:20.004340 IP 172.28.5.0.6379 > 172.28.5.4.38898: Flags [P.], seq 8:470, ack 25, win 227, options [nop,nop,TS val 230023698 ecr 1870668764], length 462: RESP "# Replication^M^Jrole:master^M^Jconnected_slaves:2^M^Jslave0:ip=172.28.5.1,port=6379,state=online,offset=202170,lag=1^M^Jslave1:ip=172.28.5.2,port=6379,state=online,offset=202170,lag=1^M^Jmaster_replid:f8eac6c8a17a641b11523474ffa3dbd0af88977a^M^Jmaster_replid2:0000000000000000000000000000000000000000^M^Jmaster_repl_offset:202318^M^Jsecond_repl_offset:-1^M^Jrepl_backlog_active:1^M^Jrepl_backlog_size:1048576^M^Jrepl_backlog_first_byte_offset:1^M^Jrepl_backlog_histlen:202318^M^J"
12:25:20.004501 IP 172.28.5.4.38898 > 172.28.5.0.6379: Flags [P.], seq 25:31, ack 470, win 237, options [nop,nop,TS val 1870668764 ecr 230023698], length 6: RESP "QUIT"
12:25:20.004681 IP 172.28.5.0.6379 > 172.28.5.4.38898: Flags [P.], seq 470:475, ack 31, win 227, options [nop,nop,TS val 230023698 ecr 1870668764], length 5: RESP "OK"
12:25:20.004802 IP 172.28.5.0.6379 > 172.28.5.4.38898: Flags [F.], seq 475, ack 31, win 227, options [nop,nop,TS val 230023698 ecr 1870668764], length 0
12:25:20.004802 IP 172.28.5.4.38898 > 172.28.5.0.6379: Flags [R.], seq 31, ack 475, win 237, options [nop,nop,TS val 1870668764 ecr 230023698], length 0
12:25:20.004852 IP 172.28.5.4.38898 > 172.28.5.0.6379: Flags [R], seq 3682889970, win 0, length 0
12:25:20.329446 IP 172.28.5.4.60364 > 172.28.5.1.6379: Flags [R.], seq 25, ack 526, win 237, options [nop,nop,TS val 4068448515 ecr 3585042109], length 0
12:25:20.662428 IP 172.28.5.4.36870 > 172.28.5.2.6379: Flags [R.], seq 25, ack 528, win 237, options [nop,nop,TS val 3591676130 ecr 371138434], length 0
12:25:21.004289 IP 172.28.5.4.38906 > 172.28.5.0.6379: Flags [S], seq 1623369497, win 29200, options [mss 1460,sackOK,TS val 1870669764 ecr 0,nop,wscale 7], length 0
12:25:21.004586 IP 172.28.5.0.6379 > 172.28.5.4.38906: Flags [S.], seq 2834841124, ack 1623369498, win 28960, options [mss 1460,sackOK,TS val 230024698 ecr 1870669764,nop,wscale 7], length 0
12:25:21.004788 IP 172.28.5.4.38906 > 172.28.5.0.6379: Flags [P.], seq 1:7, ack 1, win 229, options [nop,nop,TS val 1870669764 ecr 230024698], length 6: RESP "PING"
12:25:21.004921 IP 172.28.5.0.6379 > 172.28.5.4.38906: Flags [.], ack 7, win 227, options [nop,nop,TS val 230024698 ecr 1870669764], length 0
12:25:21.005242 IP 172.28.5.0.6379 > 172.28.5.4.38906: Flags [P.], seq 1:8, ack 7, win 227, options [nop,nop,TS val 230024699 ecr 1870669764], length 7: RESP "PONG"
12:25:21.005432 IP 172.28.5.4.38906 > 172.28.5.0.6379: Flags [P.], seq 7:25, ack 8, win 229, options [nop,nop,TS val 1870669765 ecr 230024699], length 18: RESP "info replication"
12:25:21.005787 IP 172.28.5.0.6379 > 172.28.5.4.38906: Flags [P.], seq 8:470, ack 25, win 227, options [nop,nop,TS val 230024699 ecr 1870669765], length 462: RESP "# Replication^M^Jrole:master^M^Jconnected_slaves:2^M^Jslave0:ip=172.28.5.1,port=6379,state=online,offset=202466,lag=1^M^Jslave1:ip=172.28.5.2,port=6379,state=online,offset=202466,lag=1^M^Jmaster_replid:f8eac6c8a17a641b11523474ffa3dbd0af88977a^M^Jmaster_replid2:0000000000000000000000000000000000000000^M^Jmaster_repl_offset:202614^M^Jsecond_repl_offset:-1^M^Jrepl_backlog_active:1^M^Jrepl_backlog_size:1048576^M^Jrepl_backlog_first_byte_offset:1^M^Jrepl_backlog_histlen:202614^M^J"
12:25:21.005983 IP 172.28.5.4.38906 > 172.28.5.0.6379: Flags [P.], seq 25:31, ack 470, win 237, options [nop,nop,TS val 1870669765 ecr 230024699], length 6: RESP "QUIT"
12:25:21.006177 IP 172.28.5.0.6379 > 172.28.5.4.38906: Flags [P.], seq 470:475, ack 31, win 227, options [nop,nop,TS val 230024700 ecr 1870669765], length 5: RESP "OK"
12:25:21.006307 IP 172.28.5.0.6379 > 172.28.5.4.38906: Flags [F.], seq 475, ack 31, win 227, options [nop,nop,TS val 230024700 ecr 1870669765], length 0
12:25:21.006313 IP 172.28.5.4.38906 > 172.28.5.0.6379: Flags [R.], seq 31, ack 475, win 237, options [nop,nop,TS val 1870669766 ecr 230024700], length 0
12:25:21.006365 IP 172.28.5.4.38906 > 172.28.5.0.6379: Flags [R], seq 1623369528, win 0, length 0
12:25:21.331379 IP 172.28.5.4.60384 > 172.28.5.1.6379: Flags [S], seq 2608800714, win 29200, options [mss 1460,sackOK,TS val 4068449517 ecr 0,nop,wscale 7], length 0
12:25:21.331605 IP 172.28.5.1.6379 > 172.28.5.4.60384: Flags [S.], seq 2154848514, ack 2608800715, win 28960, options [mss 1460,sackOK,TS val 3585044111 ecr 4068449517,nop,wscale 7], length 0
12:25:21.331755 IP 172.28.5.4.60384 > 172.28.5.1.6379: Flags [P.], seq 1:7, ack 1, win 229, options [nop,nop,TS val 4068449517 ecr 3585044111], length 6: RESP "PING"
12:25:21.331893 IP 172.28.5.1.6379 > 172.28.5.4.60384: Flags [.], ack 7, win 227, options [nop,nop,TS val 3585044111 ecr 4068449517], length 0
12:25:21.332299 IP 172.28.5.1.6379 > 172.28.5.4.60384: Flags [P.], seq 1:8, ack 7, win 227, options [nop,nop,TS val 3585044112 ecr 4068449517], length 7: RESP "PONG"
12:25:21.332474 IP 172.28.5.4.60384 > 172.28.5.1.6379: Flags [P.], seq 7:25, ack 8, win 229, options [nop,nop,TS val 4068449518 ecr 3585044112], length 18: RESP "info replication"
12:25:21.332789 IP 172.28.5.1.6379 > 172.28.5.4.60384: Flags [P.], seq 8:526, ack 25, win 227, options [nop,nop,TS val 3585044112 ecr 4068449518], length 518: RESP "# Replication^M^Jrole:slave^M^Jmaster_host:172.28.5.0^M^Jmaster_port:6379^M^Jmaster_link_status:up^M^Jmaster_last_io_seconds_ago:0^M^Jmaster_sync_in_progress:0^M^Jslave_repl_offset:202628^M^Jslave_priority:100^M^Jslave_read_only:1^M^Jconnected_slaves:0^M^Jmaster_replid:f8eac6c8a17a641b11523474ffa3dbd0af88977a^M^Jmaster_replid2:0000000000000000000000000000000000000000^M^Jmaster_repl_offset:202628^M^Jsecond_repl_offset:-1^M^Jrepl_backlog_active:1^M^Jrepl_backlog_size:1048576^M^Jrepl_backlog_first_byte_offset:1^M^Jrepl_backlog_histlen:202628^M^J"
12:25:21.376430 IP 172.28.5.4.60384 > 172.28.5.1.6379: Flags [.], ack 526, win 237, options [nop,nop,TS val 4068449562 ecr 3585044112], length 0
12:25:21.664629 IP 172.28.5.4.36890 > 172.28.5.2.6379: Flags [S], seq 2376643702, win 29200, options [mss 1460,sackOK,TS val 3591677132 ecr 0,nop,wscale 7], length 0
12:25:21.664861 IP 172.28.5.2.6379 > 172.28.5.4.36890: Flags [S.], seq 253481917, ack 2376643703, win 28960, options [mss 1460,sackOK,TS val 371140436 ecr 3591677132,nop,wscale 7], length 0
12:25:21.665010 IP 172.28.5.4.36890 > 172.28.5.2.6379: Flags [P.], seq 1:7, ack 1, win 229, options [nop,nop,TS val 3591677133 ecr 371140436], length 6: RESP "PING"
12:25:21.665157 IP 172.28.5.2.6379 > 172.28.5.4.36890: Flags [.], ack 7, win 227, options [nop,nop,TS val 371140437 ecr 3591677133], length 0
12:25:21.665552 IP 172.28.5.2.6379 > 172.28.5.4.36890: Flags [P.], seq 1:8, ack 7, win 227, options [nop,nop,TS val 371140437 ecr 3591677133], length 7: RESP "PONG"
12:25:21.665732 IP 172.28.5.4.36890 > 172.28.5.2.6379: Flags [P.], seq 7:25, ack 8, win 229, options [nop,nop,TS val 3591677133 ecr 371140437], length 18: RESP "info replication"
12:25:21.666028 IP 172.28.5.2.6379 > 172.28.5.4.36890: Flags [P.], seq 8:528, ack 25, win 227, options [nop,nop,TS val 371140438 ecr 3591677133], length 520: RESP "# Replication^M^Jrole:slave^M^Jmaster_host:172.28.5.0^M^Jmaster_port:6379^M^Jmaster_link_status:up^M^Jmaster_last_io_seconds_ago:0^M^Jmaster_sync_in_progress:0^M^Jslave_repl_offset:202776^M^Jslave_priority:100^M^Jslave_read_only:1^M^Jconnected_slaves:0^M^Jmaster_replid:f8eac6c8a17a641b11523474ffa3dbd0af88977a^M^Jmaster_replid2:0000000000000000000000000000000000000000^M^Jmaster_repl_offset:202776^M^Jsecond_repl_offset:-1^M^Jrepl_backlog_active:1^M^Jrepl_backlog_size:1048576^M^Jrepl_backlog_first_byte_offset:186^M^Jrepl_backlog_histlen:202591^M^J"
12:25:21.708061 IP 172.28.5.4.36890 > 172.28.5.2.6379: Flags [.], ack 528, win 237, options [nop,nop,TS val 3591677176 ecr 371140438], length 0
12:25:22.008219 IP 172.28.5.4.38918 > 172.28.5.0.6379: Flags [S], seq 3228931917, win 29200, options [mss 1460,sackOK,TS val 1870670768 ecr 0,nop,wscale 7], length 0
12:25:22.008446 IP 172.28.5.0.6379 > 172.28.5.4.38918: Flags [S.], seq 4269049996, ack 3228931918, win 28960, options [mss 1460,sackOK,TS val 230025702 ecr 1870670768,nop,wscale 7], length 0
12:25:22.008610 IP 172.28.5.4.38918 > 172.28.5.0.6379: Flags [P.], seq 1:7, ack 1, win 229, options [nop,nop,TS val 1870670768 ecr 230025702], length 6: RESP "PING"
12:25:22.008787 IP 172.28.5.0.6379 > 172.28.5.4.38918: Flags [.], ack 7, win 227, options [nop,nop,TS val 230025702 ecr 1870670768], length 0
12:25:22.009135 IP 172.28.5.0.6379 > 172.28.5.4.38918: Flags [P.], seq 1:8, ack 7, win 227, options [nop,nop,TS val 230025703 ecr 1870670768], length 7: RESP "PONG"
12:25:22.009428 IP 172.28.5.4.38918 > 172.28.5.0.6379: Flags [P.], seq 7:25, ack 8, win 229, options [nop,nop,TS val 1870670769 ecr 230025703], length 18: RESP "info replication"
