13:12:28.831252 IP 172.28.5.5.53940 > 172.28.5.0.6379: Flags [S], seq 359623827, win 29200, options [mss 1460,sackOK,TS val 3500325535 ecr 0,nop,wscale 7], length 0
13:12:28.831386 IP 172.28.5.0.6379 > 172.28.5.5.53940: Flags [S.], seq 1056981452, ack 359623828, win 28960, options [mss 1460,sackOK,TS val 2883169825 ecr 3500325535,nop,wscale 7], length 0
13:12:28.831464 IP 172.28.5.5.53940 > 172.28.5.0.6379: Flags [P.], seq 1:7, ack 1, win 229, options [nop,nop,TS val 3500325535 ecr 2883169825], length 6: RESP "PING"
13:12:28.831553 IP 172.28.5.0.6379 > 172.28.5.5.53940: Flags [.], ack 7, win 227, options [nop,nop,TS val 2883169825 ecr 3500325535], length 0
13:12:28.831918 IP 172.28.5.0.6379 > 172.28.5.5.53940: Flags [P.], seq 1:8, ack 7, win 227, options [nop,nop,TS val 2883169826 ecr 3500325535], length 7: RESP "PONG"
13:12:28.832181 IP 172.28.5.5.53940 > 172.28.5.0.6379: Flags [P.], seq 7:25, ack 8, win 229, options [nop,nop,TS val 3500325536 ecr 2883169826], length 18: RESP "info replication"
13:12:28.832524 IP 172.28.5.0.6379 > 172.28.5.5.53940: Flags [P.], seq 8:470, ack 25, win 227, options [nop,nop,TS val 2883169826 ecr 3500325536], length 462: RESP "# Replication^M^Jrole:master^M^Jconnected_slaves:2^M^Jslave0:ip=172.28.5.1,port=6379,state=online,offset=821946,lag=0^M^Jslave1:ip=172.28.5.2,port=6379,state=online,offset=822094,lag=0^M^Jmaster_replid:f8eac6c8a17a641b11523474ffa3dbd0af88977a^M^Jmaster_replid2:0000000000000000000000000000000000000000^M^Jmaster_repl_offset:822094^M^Jsecond_repl_offset:-1^M^Jrepl_backlog_active:1^M^Jrepl_backlog_size:1048576^M^Jrepl_backlog_first_byte_offset:1^M^Jrepl_backlog_histlen:822094^M^J"
13:12:28.832655 IP 172.28.5.5.53940 > 172.28.5.0.6379: Flags [P.], seq 25:31, ack 470, win 237, options [nop,nop,TS val 3500325536 ecr 2883169826], length 6: RESP "QUIT"
13:12:28.832888 IP 172.28.5.0.6379 > 172.28.5.5.53940: Flags [P.], seq 470:475, ack 31, win 227, options [nop,nop,TS val 2883169826 ecr 3500325536], length 5: RESP "OK"
13:12:28.833004 IP 172.28.5.0.6379 > 172.28.5.5.53940: Flags [F.], seq 475, ack 31, win 227, options [nop,nop,TS val 2883169827 ecr 3500325536], length 0
13:12:28.833024 IP 172.28.5.5.53940 > 172.28.5.0.6379: Flags [R.], seq 31, ack 475, win 237, options [nop,nop,TS val 3500325537 ecr 2883169826], length 0
13:12:28.833044 IP 172.28.5.5.53940 > 172.28.5.0.6379: Flags [R], seq 359623858, win 0, length 0
13:12:29.160692 IP 172.28.5.5.58224 > 172.28.5.1.6379: Flags [S], seq 1064496410, win 29200, options [mss 1460,sackOK,TS val 3392236635 ecr 0,nop,wscale 7], length 0
13:12:29.160809 IP 172.28.5.1.6379 > 172.28.5.5.58224: Flags [S.], seq 685196663, ack 1064496411, win 28960, options [mss 1460,sackOK,TS val 9447660 ecr 3392236635,nop,wscale 7], length 0
13:12:29.160873 IP 172.28.5.5.58224 > 172.28.5.1.6379: Flags [P.], seq 1:7, ack 1, win 229, options [nop,nop,TS val 3392236636 ecr 9447660], length 6: RESP "PING"
13:12:29.160946 IP 172.28.5.1.6379 > 172.28.5.5.58224: Flags [.], ack 7, win 227, options [nop,nop,TS val 9447661 ecr 3392236636], length 0
13:12:29.161251 IP 172.28.5.1.6379 > 172.28.5.5.58224: Flags [P.], seq 1:8, ack 7, win 227, options [nop,nop,TS val 9447661 ecr 3392236636], length 7: RESP "PONG"
13:12:29.161414 IP 172.28.5.5.58224 > 172.28.5.1.6379: Flags [P.], seq 7:25, ack 8, win 229, options [nop,nop,TS val 3392236636 ecr 9447661], length 18: RESP "info replication"
13:12:29.161691 IP 172.28.5.1.6379 > 172.28.5.5.58224: Flags [P.], seq 8:526, ack 25, win 227, options [nop,nop,TS val 9447661 ecr 3392236636], length 518: RESP "# Replication^M^Jrole:slave^M^Jmaster_host:172.28.5.0^M^Jmaster_port:6379^M^Jmaster_link_status:up^M^Jmaster_last_io_seconds_ago:1^M^Jmaster_sync_in_progress:0^M^Jslave_repl_offset:822094^M^Jslave_priority:100^M^Jslave_read_only:1^M^Jconnected_slaves:0^M^Jmaster_replid:f8eac6c8a17a641b11523474ffa3dbd0af88977a^M^Jmaster_replid2:0000000000000000000000000000000000000000^M^Jmaster_repl_offset:822094^M^Jsecond_repl_offset:-1^M^Jrepl_backlog_active:1^M^Jrepl_backlog_size:1048576^M^Jrepl_backlog_first_byte_offset:1^M^Jrepl_backlog_histlen:822094^M^J"
13:12:29.208451 IP 172.28.5.5.58224 > 172.28.5.1.6379: Flags [.], ack 526, win 237, options [nop,nop,TS val 3392236683 ecr 9447661], length 0
13:12:29.490716 IP 172.28.5.5.52928 > 172.28.5.2.6379: Flags [S], seq 1409845073, win 29200, options [mss 1460,sackOK,TS val 1868867184 ecr 0,nop,wscale 7], length 0
13:12:29.490856 IP 172.28.5.2.6379 > 172.28.5.5.52928: Flags [S.], seq 481802292, ack 1409845074, win 28960, options [mss 1460,sackOK,TS val 1402746200 ecr 1868867184,nop,wscale 7], length 0
13:12:29.490935 IP 172.28.5.5.52928 > 172.28.5.2.6379: Flags [P.], seq 1:7, ack 1, win 229, options [nop,nop,TS val 1868867185 ecr 1402746200], length 6: RESP "PING"
13:12:29.491024 IP 172.28.5.2.6379 > 172.28.5.5.52928: Flags [.], ack 7, win 227, options [nop,nop,TS val 1402746201 ecr 1868867185], length 0
13:12:29.491388 IP 172.28.5.2.6379 > 172.28.5.5.52928: Flags [P.], seq 1:8, ack 7, win 227, options [nop,nop,TS val 1402746201 ecr 1868867185], length 7: RESP "PONG"
13:12:29.491572 IP 172.28.5.5.52928 > 172.28.5.2.6379: Flags [P.], seq 7:25, ack 8, win 229, options [nop,nop,TS val 1868867185 ecr 1402746201], length 18: RESP "info replication"
13:12:29.491890 IP 172.28.5.2.6379 > 172.28.5.5.52928: Flags [P.], seq 8:528, ack 25, win 227, options [nop,nop,TS val 1402746202 ecr 1868867185], length 520: RESP "# Replication^M^Jrole:slave^M^Jmaster_host:172.28.5.0^M^Jmaster_port:6379^M^Jmaster_link_status:up^M^Jmaster_last_io_seconds_ago:0^M^Jmaster_sync_in_progress:0^M^Jslave_repl_offset:822242^M^Jslave_priority:100^M^Jslave_read_only:1^M^Jconnected_slaves:0^M^Jmaster_replid:f8eac6c8a17a641b11523474ffa3dbd0af88977a^M^Jmaster_replid2:0000000000000000000000000000000000000000^M^Jmaster_repl_offset:822242^M^Jsecond_repl_offset:-1^M^Jrepl_backlog_active:1^M^Jrepl_backlog_size:1048576^M^Jrepl_backlog_first_byte_offset:186^M^Jrepl_backlog_histlen:822057^M^J"
13:12:29.532456 IP 172.28.5.5.52928 > 172.28.5.2.6379: Flags [.], ack 528, win 237, options [nop,nop,TS val 1868867226 ecr 1402746202], length 0
13:12:29.832601 IP 172.28.5.5.53952 > 172.28.5.0.6379: Flags [S], seq 2778970023, win 29200, options [mss 1460,sackOK,TS val 3500326536 ecr 0,nop,wscale 7], length 0
13:12:29.832700 IP 172.28.5.0.6379 > 172.28.5.5.53952: Flags [S.], seq 1711746705, ack 2778970024, win 28960, options [mss 1460,sackOK,TS val 2883170826 ecr 3500326536,nop,wscale 7], length 0
13:12:29.832756 IP 172.28.5.5.53952 > 172.28.5.0.6379: Flags [P.], seq 1:7, ack 1, win 229, options [nop,nop,TS val 3500326536 ecr 2883170826], length 6: RESP "PING"
13:12:29.832817 IP 172.28.5.0.6379 > 172.28.5.5.53952: Flags [.], ack 7, win 227, options [nop,nop,TS val 2883170826 ecr 3500326536], length 0
13:12:29.833064 IP 172.28.5.0.6379 > 172.28.5.5.53952: Flags [P.], seq 1:8, ack 7, win 227, options [nop,nop,TS val 2883170827 ecr 3500326536], length 7: RESP "PONG"
13:12:29.833200 IP 172.28.5.5.53952 > 172.28.5.0.6379: Flags [P.], seq 7:25, ack 8, win 229, options [nop,nop,TS val 3500326537 ecr 2883170827], length 18: RESP "info replication"
13:12:29.833382 IP 172.28.5.0.6379 > 172.28.5.5.53952: Flags [P.], seq 8:470, ack 25, win 227, options [nop,nop,TS val 2883170827 ecr 3500326537], length 462: RESP "# Replication^M^Jrole:master^M^Jconnected_slaves:2^M^Jslave0:ip=172.28.5.1,port=6379,state=online,offset=822094,lag=0^M^Jslave1:ip=172.28.5.2,port=6379,state=online,offset=822242,lag=0^M^Jmaster_replid:f8eac6c8a17a641b11523474ffa3dbd0af88977a^M^Jmaster_replid2:0000000000000000000000000000000000000000^M^Jmaster_repl_offset:822242^M^Jsecond_repl_offset:-1^M^Jrepl_backlog_active:1^M^Jrepl_backlog_size:1048576^M^Jrepl_backlog_first_byte_offset:1^M^Jrepl_backlog_histlen:822242^M^J"
13:12:29.833478 IP 172.28.5.5.53952 > 172.28.5.0.6379: Flags [P.], seq 25:31, ack 470, win 237, options [nop,nop,TS val 3500326537 ecr 2883170827], length 6: RESP "QUIT"
13:12:29.833604 IP 172.28.5.0.6379 > 172.28.5.5.53952: Flags [P.], seq 470:475, ack 31, win 227, options [nop,nop,TS val 2883170827 ecr 3500326537], length 5: RESP "OK"
13:12:29.833683 IP 172.28.5.0.6379 > 172.28.5.5.53952: Flags [F.], seq 475, ack 31, win 227, options [nop,nop,TS val 2883170827 ecr 3500326537], length 0
13:12:29.833686 IP 172.28.5.5.53952 > 172.28.5.0.6379: Flags [R.], seq 31, ack 475, win 237, options [nop,nop,TS val 3500326537 ecr 2883170827], length 0
13:12:29.833713 IP 172.28.5.5.53952 > 172.28.5.0.6379: Flags [R], seq 2778970054, win 0, length 0
13:12:30.162301 IP 172.28.5.5.58224 > 172.28.5.1.6379: Flags [R.], seq 25, ack 526, win 237, options [nop,nop,TS val 3392237637 ecr 9447661], length 0
13:12:30.492425 IP 172.28.5.5.52928 > 172.28.5.2.6379: Flags [R.], seq 25, ack 528, win 237, options [nop,nop,TS val 1868868186 ecr 1402746202], length 0
13:12:30.834157 IP 172.28.5.5.53956 > 172.28.5.0.6379: Flags [S], seq 3737076309, win 29200, options [mss 1460,sackOK,TS val 3500327538 ecr 0,nop,wscale 7], length 0
13:12:30.834298 IP 172.28.5.0.6379 > 172.28.5.5.53956: Flags [S.], seq 1409212517, ack 3737076310, win 28960, options [mss 1460,sackOK,TS val 2883171828 ecr 3500327538,nop,wscale 7], length 0
13:12:30.834380 IP 172.28.5.5.53956 > 172.28.5.0.6379: Flags [P.], seq 1:7, ack 1, win 229, options [nop,nop,TS val 3500327538 ecr 2883171828], length 6: RESP "PING"
13:12:30.834471 IP 172.28.5.0.6379 > 172.28.5.5.53956: Flags [.], ack 7, win 227, options [nop,nop,TS val 2883171828 ecr 3500327538], length 0
13:12:30.834832 IP 172.28.5.0.6379 > 172.28.5.5.53956: Flags [P.], seq 1:8, ack 7, win 227, options [nop,nop,TS val 2883171828 ecr 3500327538], length 7: RESP "PONG"
13:12:30.835016 IP 172.28.5.5.53956 > 172.28.5.0.6379: Flags [P.], seq 7:25, ack 8, win 229, options [nop,nop,TS val 3500327539 ecr 2883171828], length 18: RESP "info replication"
13:12:30.835350 IP 172.28.5.0.6379 > 172.28.5.5.53956: Flags [P.], seq 8:470, ack 25, win 227, options [nop,nop,TS val 2883171829 ecr 3500327539], length 462: RESP "# Replication^M^Jrole:master^M^Jconnected_slaves:2^M^Jslave0:ip=172.28.5.1,port=6379,state=online,offset=822390,lag=0^M^Jslave1:ip=172.28.5.2,port=6379,state=online,offset=822538,lag=0^M^Jmaster_replid:f8eac6c8a17a641b11523474ffa3dbd0af88977a^M^Jmaster_replid2:0000000000000000000000000000000000000000^M^Jmaster_repl_offset:822538^M^Jsecond_repl_offset:-1^M^Jrepl_backlog_active:1^M^Jrepl_backlog_size:1048576^M^Jrepl_backlog_first_byte_offset:1^M^Jrepl_backlog_histlen:822538^M^J"
13:12:30.835517 IP 172.28.5.5.53956 > 172.28.5.0.6379: Flags [P.], seq 25:31, ack 470, win 237, options [nop,nop,TS val 3500327539 ecr 2883171829], length 6: RESP "QUIT"
13:12:30.835759 IP 172.28.5.0.6379 > 172.28.5.5.53956: Flags [P.], seq 470:475, ack 31, win 227, options [nop,nop,TS val 2883171829 ecr 3500327539], length 5: RESP "OK"
13:12:30.835866 IP 172.28.5.0.6379 > 172.28.5.5.53956: Flags [F.], seq 475, ack 31, win 227, options [nop,nop,TS val 2883171830 ecr 3500327539], length 0
13:12:30.835953 IP 172.28.5.5.53956 > 172.28.5.0.6379: Flags [R.], seq 31, ack 476, win 237, options [nop,nop,TS val 3500327540 ecr 2883171829], length 0
13:12:31.164690 IP 172.28.5.5.58240 > 172.28.5.1.6379: Flags [S], seq 789100403, win 29200, options [mss 1460,sackOK,TS val 3392238639 ecr 0,nop,wscale 7], length 0
13:12:31.164807 IP 172.28.5.1.6379 > 172.28.5.5.58240: Flags [S.], seq 2665649831, ack 789100404, win 28960, options [mss 1460,sackOK,TS val 9449664 ecr 3392238639,nop,wscale 7], length 0
13:12:31.164873 IP 172.28.5.5.58240 > 172.28.5.1.6379: Flags [P.], seq 1:7, ack 1, win 229, options [nop,nop,TS val 3392238640 ecr 9449664], length 6: RESP "PING"
13:12:31.164950 IP 172.28.5.1.6379 > 172.28.5.5.58240: Flags [.], ack 7, win 227, options [nop,nop,TS val 9449665 ecr 3392238640], length 0
13:12:31.165243 IP 172.28.5.1.6379 > 172.28.5.5.58240: Flags [P.], seq 1:8, ack 7, win 227, options [nop,nop,TS val 9449665 ecr 3392238640], length 7: RESP "PONG"
13:12:31.165402 IP 172.28.5.5.58240 > 172.28.5.1.6379: Flags [P.], seq 7:25, ack 8, win 229, options [nop,nop,TS val 3392238640 ecr 9449665], length 18: RESP "info replication"
13:12:31.165693 IP 172.28.5.1.6379 > 172.28.5.5.58240: Flags [P.], seq 8:526, ack 25, win 227, options [nop,nop,TS val 9449665 ecr 3392238640], length 518: RESP "# Replication^M^Jrole:slave^M^Jmaster_host:172.28.5.0^M^Jmaster_port:6379^M^Jmaster_link_status:up^M^Jmaster_last_io_seconds_ago:1^M^Jmaster_sync_in_progress:0^M^Jslave_repl_offset:822538^M^Jslave_priority:100^M^Jslave_read_only:1^M^Jconnected_slaves:0^M^Jmaster_replid:f8eac6c8a17a641b11523474ffa3dbd0af88977a^M^Jmaster_replid2:0000000000000000000000000000000000000000^M^Jmaster_repl_offset:822538^M^Jsecond_repl_offset:-1^M^Jrepl_backlog_active:1^M^Jrepl_backlog_size:1048576^M^Jrepl_backlog_first_byte_offset:1^M^Jrepl_backlog_histlen:822538^M^J"
13:12:31.208086 IP 172.28.5.5.58240 > 172.28.5.1.6379: Flags [.], ack 526, win 237, options [nop,nop,TS val 3392238683 ecr 9449665], length 0
13:12:31.494512 IP 172.28.5.5.52944 > 172.28.5.2.6379: Flags [S], seq 941690566, win 29200, options [mss 1460,sackOK,TS val 1868869188 ecr 0,nop,wscale 7], length 0
13:12:31.494650 IP 172.28.5.2.6379 > 172.28.5.5.52944: Flags [S.], seq 2415237206, ack 941690567, win 28960, options [mss 1460,sackOK,TS val 1402748204 ecr 1868869188,nop,wscale 7], length 0
13:12:31.494727 IP 172.28.5.5.52944 > 172.28.5.2.6379: Flags [P.], seq 1:7, ack 1, win 229, options [nop,nop,TS val 1868869188 ecr 1402748204], length 6: RESP "PING"
13:12:31.494813 IP 172.28.5.2.6379 > 172.28.5.5.52944: Flags [.], ack 7, win 227, options [nop,nop,TS val 1402748204 ecr 1868869188], length 0
13:12:31.495171 IP 172.28.5.2.6379 > 172.28.5.5.52944: Flags [P.], seq 1:8, ack 7, win 227, options [nop,nop,TS val 1402748205 ecr 1868869188], length 7: RESP "PONG"
13:12:31.495355 IP 172.28.5.5.52944 > 172.28.5.2.6379: Flags [P.], seq 7:25, ack 8, win 229, options [nop,nop,TS val 1868869189 ecr 1402748205], length 18: RESP "info replication"
13:12:31.495676 IP 172.28.5.2.6379 > 172.28.5.5.52944: Flags [P.], seq 8:528, ack 25, win 227, options [nop,nop,TS val 1402748205 ecr 1868869189], length 520: RESP "# Replication^M^Jrole:slave^M^Jmaster_host:172.28.5.0^M^Jmaster_port:6379^M^Jmaster_link_status:up^M^Jmaster_last_io_seconds_ago:0^M^Jmaster_sync_in_progress:0^M^Jslave_repl_offset:822686^M^Jslave_priority:100^M^Jslave_read_only:1^M^Jconnected_slaves:0^M^Jmaster_replid:f8eac6c8a17a641b11523474ffa3dbd0af88977a^M^Jmaster_replid2:0000000000000000000000000000000000000000^M^Jmaster_repl_offset:822686^M^Jsecond_repl_offset:-1^M^Jrepl_backlog_active:1^M^Jrepl_backlog_size:1048576^M^Jrepl_backlog_first_byte_offset:186^M^Jrepl_backlog_histlen:822501^M^J"
13:12:31.536465 IP 172.28.5.5.52944 > 172.28.5.2.6379: Flags [.], ack 528, win 237, options [nop,nop,TS val 1868869230 ecr 1402748205], length 0
13:12:31.835272 IP 172.28.5.5.53968 > 172.28.5.0.6379: Flags [S], seq 2357276502, win 29200, options [mss 1460,sackOK,TS val 3500328539 ecr 0,nop,wscale 7], length 0
13:12:31.835352 IP 172.28.5.0.6379 > 172.28.5.5.53968: Flags [S.], seq 4271685975, ack 2357276503, win 28960, options [mss 1460,sackOK,TS val 2883172829 ecr 3500328539,nop,wscale 7], length 0
13:12:31.835394 IP 172.28.5.5.53968 > 172.28.5.0.6379: Flags [P.], seq 1:7, ack 1, win 229, options [nop,nop,TS val 3500328539 ecr 2883172829], length 6: RESP "PING"
13:12:31.835443 IP 172.28.5.0.6379 > 172.28.5.5.53968: Flags [.], ack 7, win 227, options [nop,nop,TS val 2883172829 ecr 3500328539], length 0
13:12:31.835569 IP 172.28.5.0.6379 > 172.28.5.5.53968: Flags [P.], seq 1:8, ack 7, win 227, options [nop,nop,TS val 2883172829 ecr 3500328539], length 7: RESP "PONG"
13:12:31.835618 IP 172.28.5.5.53968 > 172.28.5.0.6379: Flags [P.], seq 7:25, ack 8, win 229, options [nop,nop,TS val 3500328539 ecr 2883172829], length 18: RESP "info replication"
13:12:31.835720 IP 172.28.5.0.6379 > 172.28.5.5.53968: Flags [P.], seq 8:470, ack 25, win 227, options [nop,nop,TS val 2883172829 ecr 3500328539], length 462: RESP "# Replication^M^Jrole:master^M^Jconnected_slaves:2^M^Jslave0:ip=172.28.5.1,port=6379,state=online,offset=822538,lag=0^M^Jslave1:ip=172.28.5.2,port=6379,state=online,offset=822686,lag=0^M^Jmaster_replid:f8eac6c8a17a641b11523474ffa3dbd0af88977a^M^Jmaster_replid2:0000000000000000000000000000000000000000^M^Jmaster_repl_offset:822686^M^Jsecond_repl_offset:-1^M^Jrepl_backlog_active:1^M^Jrepl_backlog_size:1048576^M^Jrepl_backlog_first_byte_offset:1^M^Jrepl_backlog_histlen:822686^M^J"
13:12:31.835759 IP 172.28.5.5.53968 > 172.28.5.0.6379: Flags [P.], seq 25:31, ack 470, win 237, options [nop,nop,TS val 3500328539 ecr 2883172829], length 6: RESP "QUIT"
13:12:31.835806 IP 172.28.5.0.6379 > 172.28.5.5.53968: Flags [P.], seq 470:475, ack 31, win 227, options [nop,nop,TS val 2883172829 ecr 3500328539], length 5: RESP "OK"
13:12:31.835838 IP 172.28.5.5.53968 > 172.28.5.0.6379: Flags [R.], seq 31, ack 475, win 237, options [nop,nop,TS val 3500328540 ecr 2883172829], length 0
13:12:31.835842 IP 172.28.5.0.6379 > 172.28.5.5.53968: Flags [F.], seq 475, ack 31, win 227, options [nop,nop,TS val 2883172829 ecr 3500328539], length 0
13:12:31.835857 IP 172.28.5.5.53968 > 172.28.5.0.6379: Flags [R], seq 2357276533, win 0, length 0
13:12:32.166348 IP 172.28.5.5.58240 > 172.28.5.1.6379: Flags [R.], seq 25, ack 526, win 237, options [nop,nop,TS val 3392239641 ecr 9449665], length 0
13:12:32.496382 IP 172.28.5.5.52944 > 172.28.5.2.6379: Flags [R.], seq 25, ack 528, win 237, options [nop,nop,TS val 1868870190 ecr 1402748205], length 0
13:12:32.837063 IP 172.28.5.5.53972 > 172.28.5.0.6379: Flags [S], seq 1085574421, win 29200, options [mss 1460,sackOK,TS val 3500329541 ecr 0,nop,wscale 7], length 0
13:12:32.837196 IP 172.28.5.0.6379 > 172.28.5.5.53972: Flags [S.], seq 633193661, ack 1085574422, win 28960, options [mss 1460,sackOK,TS val 2883173831 ecr 3500329541,nop,wscale 7], length 0
13:12:32.837278 IP 172.28.5.5.53972 > 172.28.5.0.6379: Flags [P.], seq 1:7, ack 1, win 229, options [nop,nop,TS val 3500329541 ecr 2883173831], length 6: RESP "PING"
13:12:32.837367 IP 172.28.5.0.6379 > 172.28.5.5.53972: Flags [.], ack 7, win 227, options [nop,nop,TS val 2883173831 ecr 3500329541], length 0
13:12:32.837685 IP 172.28.5.0.6379 > 172.28.5.5.53972: Flags [P.], seq 1:8, ack 7, win 227, options [nop,nop,TS val 2883173831 ecr 3500329541], length 7: RESP "PONG"
13:12:32.837840 IP 172.28.5.5.53972 > 172.28.5.0.6379: Flags [P.], seq 7:25, ack 8, win 229, options [nop,nop,TS val 3500329541 ecr 2883173831], length 18: RESP "info replication"
13:12:32.838131 IP 172.28.5.0.6379 > 172.28.5.5.53972: Flags [P.], seq 8:470, ack 25, win 227, options [nop,nop,TS val 2883173832 ecr 3500329541], length 462: RESP "# Replication^M^Jrole:master^M^Jconnected_slaves:2^M^Jslave0:ip=172.28.5.1,port=6379,state=online,offset=822686,lag=0^M^Jslave1:ip=172.28.5.2,port=6379,state=online,offset=822996,lag=0^M^Jmaster_replid:f8eac6c8a17a641b11523474ffa3dbd0af88977a^M^Jmaster_replid2:0000000000000000000000000000000000000000^M^Jmaster_repl_offset:822996^M^Jsecond_repl_offset:-1^M^Jrepl_backlog_active:1^M^Jrepl_backlog_size:1048576^M^Jrepl_backlog_first_byte_offset:1^M^Jrepl_backlog_histlen:822996^M^J"
13:12:32.838246 IP 172.28.5.5.53972 > 172.28.5.0.6379: Flags [P.], seq 25:31, ack 470, win 237, options [nop,nop,TS val 3500329542 ecr 2883173832], length 6: RESP "QUIT"
13:12:32.838435 IP 172.28.5.0.6379 > 172.28.5.5.53972: Flags [P.], seq 470:475, ack 31, win 227, options [nop,nop,TS val 2883173832 ecr 3500329542], length 5: RESP "OK"
13:12:32.838550 IP 172.28.5.0.6379 > 172.28.5.5.53972: Flags [F.], seq 475, ack 31, win 227, options [nop,nop,TS val 2883173832 ecr 3500329542], length 0
13:12:32.838604 IP 172.28.5.5.53972 > 172.28.5.0.6379: Flags [R.], seq 31, ack 476, win 237, options [nop,nop,TS val 3500329542 ecr 2883173832], length 0
13:12:33.168641 IP 172.28.5.5.58256 > 172.28.5.1.6379: Flags [S], seq 2764007400, win 29200, options [mss 1460,sackOK,TS val 3392240643 ecr 0,nop,wscale 7], length 0
13:12:33.168779 IP 172.28.5.1.6379 > 172.28.5.5.58256: Flags [S.], seq 1767270329, ack 2764007401, win 28960, options [mss 1460,sackOK,TS val 9451668 ecr 3392240643,nop,wscale 7], length 0
13:12:33.168858 IP 172.28.5.5.58256 > 172.28.5.1.6379: Flags [P.], seq 1:7, ack 1, win 229, options [nop,nop,TS val 3392240644 ecr 9451668], length 6: RESP "PING"
13:12:33.168943 IP 172.28.5.1.6379 > 172.28.5.5.58256: Flags [.], ack 7, win 227, options [nop,nop,TS val 9451669 ecr 3392240644], length 0
13:12:33.169296 IP 172.28.5.1.6379 > 172.28.5.5.58256: Flags [P.], seq 1:8, ack 7, win 227, options [nop,nop,TS val 9451669 ecr 3392240644], length 7: RESP "PONG"
13:12:33.169483 IP 172.28.5.5.58256 > 172.28.5.1.6379: Flags [P.], seq 7:25, ack 8, win 229, options [nop,nop,TS val 3392240644 ecr 9451669], length 18: RESP "info replication"
13:12:33.169858 IP 172.28.5.1.6379 > 172.28.5.5.58256: Flags [P.], seq 8:526, ack 25, win 227, options [nop,nop,TS val 9451669 ecr 3392240644], length 518: RESP "# Replication^M^Jrole:slave^M^Jmaster_host:172.28.5.0^M^Jmaster_port:6379^M^Jmaster_link_status:up^M^Jmaster_last_io_seconds_ago:1^M^Jmaster_sync_in_progress:0^M^Jslave_repl_offset:822996^M^Jslave_priority:100^M^Jslave_read_only:1^M^Jconnected_slaves:0^M^Jmaster_replid:f8eac6c8a17a641b11523474ffa3dbd0af88977a^M^Jmaster_replid2:0000000000000000000000000000000000000000^M^Jmaster_repl_offset:822996^M^Jsecond_repl_offset:-1^M^Jrepl_backlog_active:1^M^Jrepl_backlog_size:1048576^M^Jrepl_backlog_first_byte_offset:1^M^Jrepl_backlog_histlen:822996^M^J"
13:12:33.212077 IP 172.28.5.5.58256 > 172.28.5.1.6379: Flags [.], ack 526, win 237, options [nop,nop,TS val 3392240687 ecr 9451669], length 0
13:12:33.498495 IP 172.28.5.5.52960 > 172.28.5.2.6379: Flags [S], seq 4241350989, win 29200, options [mss 1460,sackOK,TS val 1868871192 ecr 0,nop,wscale 7], length 0
13:12:33.498599 IP 172.28.5.2.6379 > 172.28.5.5.52960: Flags [S.], seq 1989076648, ack 4241350990, win 28960, options [mss 1460,sackOK,TS val 1402750208 ecr 1868871192,nop,wscale 7], length 0
13:12:33.498646 IP 172.28.5.5.52960 > 172.28.5.2.6379: Flags [P.], seq 1:7, ack 1, win 229, options [nop,nop,TS val 1868871192 ecr 1402750208], length 6: RESP "PING"
13:12:33.498691 IP 172.28.5.2.6379 > 172.28.5.5.52960: Flags [.], ack 7, win 227, options [nop,nop,TS val 1402750208 ecr 1868871192], length 0
13:12:33.498926 IP 172.28.5.2.6379 > 172.28.5.5.52960: Flags [P.], seq 1:8, ack 7, win 227, options [nop,nop,TS val 1402750209 ecr 1868871192], length 7: RESP "PONG"
13:12:33.498985 IP 172.28.5.5.52960 > 172.28.5.2.6379: Flags [P.], seq 7:25, ack 8, win 229, options [nop,nop,TS val 1868871193 ecr 1402750209], length 18: RESP "info replication"
13:12:33.499083 IP 172.28.5.2.6379 > 172.28.5.5.52960: Flags [P.], seq 8:528, ack 25, win 227, options [nop,nop,TS val 1402750209 ecr 1868871193], length 520: RESP "# Replication^M^Jrole:slave^M^Jmaster_host:172.28.5.0^M^Jmaster_port:6379^M^Jmaster_link_status:up^M^Jmaster_last_io_seconds_ago:0^M^Jmaster_sync_in_progress:0^M^Jslave_repl_offset:823144^M^Jslave_priority:100^M^Jslave_read_only:1^M^Jconnected_slaves:0^M^Jmaster_replid:f8eac6c8a17a641b11523474ffa3dbd0af88977a^M^Jmaster_replid2:0000000000000000000000000000000000000000^M^Jmaster_repl_offset:823144^M^Jsecond_repl_offset:-1^M^Jrepl_backlog_active:1^M^Jrepl_backlog_size:1048576^M^Jrepl_backlog_first_byte_offset:186^M^Jrepl_backlog_histlen:822959^M^J"
13:12:33.540059 IP 172.28.5.5.52960 > 172.28.5.2.6379: Flags [.], ack 528, win 237, options [nop,nop,TS val 1868871234 ecr 1402750209], length 0
13:12:33.839825 IP 172.28.5.5.53984 > 172.28.5.0.6379: Flags [S], seq 1546676498, win 29200, options [mss 1460,sackOK,TS val 3500330543 ecr 0,nop,wscale 7], length 0
13:12:33.839924 IP 172.28.5.0.6379 > 172.28.5.5.53984: Flags [S.], seq 3552675089, ack 1546676499, win 28960, options [mss 1460,sackOK,TS val 2883174834 ecr 3500330543,nop,wscale 7], length 0
13:12:33.840040 IP 172.28.5.5.53984 > 172.28.5.0.6379: Flags [P.], seq 1:7, ack 1, win 229, options [nop,nop,TS val 3500330544 ecr 2883174834], length 6: RESP "PING"
13:12:33.840104 IP 172.28.5.0.6379 > 172.28.5.5.53984: Flags [.], ack 7, win 227, options [nop,nop,TS val 2883174834 ecr 3500330544], length 0
13:12:33.840307 IP 172.28.5.0.6379 > 172.28.5.5.53984: Flags [P.], seq 1:8, ack 7, win 227, options [nop,nop,TS val 2883174834 ecr 3500330544], length 7: RESP "PONG"
13:12:33.840445 IP 172.28.5.5.53984 > 172.28.5.0.6379: Flags [P.], seq 7:25, ack 8, win 229, options [nop,nop,TS val 3500330544 ecr 2883174834], length 18: RESP "info replication"
13:12:33.840617 IP 172.28.5.0.6379 > 172.28.5.5.53984: Flags [P.], seq 8:470, ack 25, win 227, options [nop,nop,TS val 2883174834 ecr 3500330544], length 462: RESP "# Replication^M^Jrole:master^M^Jconnected_slaves:2^M^Jslave0:ip=172.28.5.1,port=6379,state=online,offset=822996,lag=0^M^Jslave1:ip=172.28.5.2,port=6379,state=online,offset=823144,lag=0^M^Jmaster_replid:f8eac6c8a17a641b11523474ffa3dbd0af88977a^M^Jmaster_replid2:0000000000000000000000000000000000000000^M^Jmaster_repl_offset:823144^M^Jsecond_repl_offset:-1^M^Jrepl_backlog_active:1^M^Jrepl_backlog_size:1048576^M^Jrepl_backlog_first_byte_offset:1^M^Jrepl_backlog_histlen:823144^M^J"
13:12:33.840668 IP 172.28.5.5.53984 > 172.28.5.0.6379: Flags [P.], seq 25:31, ack 470, win 237, options [nop,nop,TS val 3500330544 ecr 2883174834], length 6: RESP "QUIT"
13:12:33.840745 IP 172.28.5.0.6379 > 172.28.5.5.53984: Flags [P.], seq 470:475, ack 31, win 227, options [nop,nop,TS val 2883174834 ecr 3500330544], length 5: RESP "OK"
13:12:33.840802 IP 172.28.5.0.6379 > 172.28.5.5.53984: Flags [F.], seq 475, ack 31, win 227, options [nop,nop,TS val 2883174834 ecr 3500330544], length 0
13:12:33.840804 IP 172.28.5.5.53984 > 172.28.5.0.6379: Flags [R.], seq 31, ack 475, win 237, options [nop,nop,TS val 3500330544 ecr 2883174834], length 0
13:12:33.840828 IP 172.28.5.5.53984 > 172.28.5.0.6379: Flags [R], seq 1546676529, win 0, length 0
13:12:34.170321 IP 172.28.5.5.58256 > 172.28.5.1.6379: Flags [R.], seq 25, ack 526, win 237, options [nop,nop,TS val 3392241645 ecr 9451669], length 0
13:12:34.500447 IP 172.28.5.5.52960 > 172.28.5.2.6379: Flags [R.], seq 25, ack 528, win 237, options [nop,nop,TS val 1868872194 ecr 1402750209], length 0
13:12:34.841422 IP 172.28.5.5.53990 > 172.28.5.0.6379: Flags [S], seq 371454391, win 29200, options [mss 1460,sackOK,TS val 3500331545 ecr 0,nop,wscale 7], length 0
13:12:34.841560 IP 172.28.5.0.6379 > 172.28.5.5.53990: Flags [S.], seq 568342450, ack 371454392, win 28960, options [mss 1460,sackOK,TS val 2883175835 ecr 3500331545,nop,wscale 7], length 0
13:12:34.841635 IP 172.28.5.5.53990 > 172.28.5.0.6379: Flags [P.], seq 1:7, ack 1, win 229, options [nop,nop,TS val 3500331545 ecr 2883175835], length 6: RESP "PING"
13:12:34.841721 IP 172.28.5.0.6379 > 172.28.5.5.53990: Flags [.], ack 7, win 227, options [nop,nop,TS val 2883175835 ecr 3500331545], length 0
13:12:34.842067 IP 172.28.5.0.6379 > 172.28.5.5.53990: Flags [P.], seq 1:8, ack 7, win 227, options [nop,nop,TS val 2883175836 ecr 3500331545], length 7: RESP "PONG"
13:12:34.842245 IP 172.28.5.5.53990 > 172.28.5.0.6379: Flags [P.], seq 7:25, ack 8, win 229, options [nop,nop,TS val 3500331546 ecr 2883175836], length 18: RESP "info replication"
13:12:34.842602 IP 172.28.5.0.6379 > 172.28.5.5.53990: Flags [P.], seq 8:470, ack 25, win 227, options [nop,nop,TS val 2883175836 ecr 3500331546], length 462: RESP "# Replication^M^Jrole:master^M^Jconnected_slaves:2^M^Jslave0:ip=172.28.5.1,port=6379,state=online,offset=823144,lag=0^M^Jslave1:ip=172.28.5.2,port=6379,state=online,offset=823440,lag=0^M^Jmaster_replid:f8eac6c8a17a641b11523474ffa3dbd0af88977a^M^Jmaster_replid2:0000000000000000000000000000000000000000^M^Jmaster_repl_offset:823440^M^Jsecond_repl_offset:-1^M^Jrepl_backlog_active:1^M^Jrepl_backlog_size:1048576^M^Jrepl_backlog_first_byte_offset:1^M^Jrepl_backlog_histlen:823440^M^J"
13:12:34.842737 IP 172.28.5.5.53990 > 172.28.5.0.6379: Flags [P.], seq 25:31, ack 470, win 237, options [nop,nop,TS val 3500331546 ecr 2883175836], length 6: RESP "QUIT"
13:12:34.842960 IP 172.28.5.0.6379 > 172.28.5.5.53990: Flags [P.], seq 470:475, ack 31, win 227, options [nop,nop,TS val 2883175837 ecr 3500331546], length 5: RESP "OK"
13:12:34.843068 IP 172.28.5.0.6379 > 172.28.5.5.53990: Flags [F.], seq 475, ack 31, win 227, options [nop,nop,TS val 2883175837 ecr 3500331546], length 0
13:12:34.843151 IP 172.28.5.5.53990 > 172.28.5.0.6379: Flags [R.], seq 31, ack 476, win 237, options [nop,nop,TS val 3500331547 ecr 2883175837], length 0
13:12:35.171663 IP 172.28.5.5.58274 > 172.28.5.1.6379: Flags [S], seq 530042140, win 29200, options [mss 1460,sackOK,TS val 3392242646 ecr 0,nop,wscale 7], length 0
13:12:35.171717 IP 172.28.5.1.6379 > 172.28.5.5.58274: Flags [S.], seq 2602814733, ack 530042141, win 28960, options [mss 1460,sackOK,TS val 9453671 ecr 3392242646,nop,wscale 7], length 0
13:12:35.171742 IP 172.28.5.5.58274 > 172.28.5.1.6379: Flags [P.], seq 1:7, ack 1, win 229, options [nop,nop,TS val 3392242646 ecr 9453671], length 6: RESP "PING"
13:12:35.171768 IP 172.28.5.1.6379 > 172.28.5.5.58274: Flags [.], ack 7, win 227, options [nop,nop,TS val 9453671 ecr 3392242646], length 0
13:12:35.171850 IP 172.28.5.1.6379 > 172.28.5.5.58274: Flags [P.], seq 1:8, ack 7, win 227, options [nop,nop,TS val 9453672 ecr 3392242646], length 7: RESP "PONG"
13:12:35.171929 IP 172.28.5.5.58274 > 172.28.5.1.6379: Flags [P.], seq 7:25, ack 8, win 229, options [nop,nop,TS val 3392242647 ecr 9453672], length 18: RESP "info replication"
13:12:35.171994 IP 172.28.5.1.6379 > 172.28.5.5.58274: Flags [P.], seq 8:526, ack 25, win 227, options [nop,nop,TS val 9453672 ecr 3392242647], length 518: RESP "# Replication^M^Jrole:slave^M^Jmaster_host:172.28.5.0^M^Jmaster_port:6379^M^Jmaster_link_status:up^M^Jmaster_last_io_seconds_ago:1^M^Jmaster_sync_in_progress:0^M^Jslave_repl_offset:823440^M^Jslave_priority:100^M^Jslave_read_only:1^M^Jconnected_slaves:0^M^Jmaster_replid:f8eac6c8a17a641b11523474ffa3dbd0af88977a^M^Jmaster_replid2:0000000000000000000000000000000000000000^M^Jmaster_repl_offset:823440^M^Jsecond_repl_offset:-1^M^Jrepl_backlog_active:1^M^Jrepl_backlog_size:1048576^M^Jrepl_backlog_first_byte_offset:1^M^Jrepl_backlog_histlen:823440^M^J"
13:12:35.215978 IP 172.28.5.5.58274 > 172.28.5.1.6379: Flags [.], ack 526, win 237, options [nop,nop,TS val 3392242691 ecr 9453672], length 0
13:12:35.501544 IP 172.28.5.5.52982 > 172.28.5.2.6379: Flags [S], seq 3739660212, win 29200, options [mss 1460,sackOK,TS val 1868873195 ecr 0,nop,wscale 7], length 0
13:12:35.501663 IP 172.28.5.2.6379 > 172.28.5.5.52982: Flags [S.], seq 2322055284, ack 3739660213, win 28960, options [mss 1460,sackOK,TS val 1402752211 ecr 1868873195,nop,wscale 7], length 0
13:12:35.501731 IP 172.28.5.5.52982 > 172.28.5.2.6379: Flags [P.], seq 1:7, ack 1, win 229, options [nop,nop,TS val 1868873195 ecr 1402752211], length 6: RESP "PING"
13:12:35.501805 IP 172.28.5.2.6379 > 172.28.5.5.52982: Flags [.], ack 7, win 227, options [nop,nop,TS val 1402752211 ecr 1868873195], length 0
13:12:35.502097 IP 172.28.5.2.6379 > 172.28.5.5.52982: Flags [P.], seq 1:8, ack 7, win 227, options [nop,nop,TS val 1402752212 ecr 1868873195], length 7: RESP "PONG"
13:12:35.502249 IP 172.28.5.5.52982 > 172.28.5.2.6379: Flags [P.], seq 7:25, ack 8, win 229, options [nop,nop,TS val 1868873196 ecr 1402752212], length 18: RESP "info replication"
13:12:35.502554 IP 172.28.5.2.6379 > 172.28.5.5.52982: Flags [P.], seq 8:528, ack 25, win 227, options [nop,nop,TS val 1402752212 ecr 1868873196], length 520: RESP "# Replication^M^Jrole:slave^M^Jmaster_host:172.28.5.0^M^Jmaster_port:6379^M^Jmaster_link_status:up^M^Jmaster_last_io_seconds_ago:0^M^Jmaster_sync_in_progress:0^M^Jslave_repl_offset:823588^M^Jslave_priority:100^M^Jslave_read_only:1^M^Jconnected_slaves:0^M^Jmaster_replid:f8eac6c8a17a641b11523474ffa3dbd0af88977a^M^Jmaster_replid2:0000000000000000000000000000000000000000^M^Jmaster_repl_offset:823588^M^Jsecond_repl_offset:-1^M^Jrepl_backlog_active:1^M^Jrepl_backlog_size:1048576^M^Jrepl_backlog_first_byte_offset:186^M^Jrepl_backlog_histlen:823403^M^J"
13:12:35.544122 IP 172.28.5.5.52982 > 172.28.5.2.6379: Flags [.], ack 528, win 237, options [nop,nop,TS val 1868873238 ecr 1402752212], length 0
13:12:35.843174 IP 172.28.5.5.54012 > 172.28.5.0.6379: Flags [S], seq 1904985437, win 29200, options [mss 1460,sackOK,TS val 3500332547 ecr 0,nop,wscale 7], length 0
13:12:35.843296 IP 172.28.5.0.6379 > 172.28.5.5.54012: Flags [S.], seq 4185484920, ack 1904985438, win 28960, options [mss 1460,sackOK,TS val 2883176837 ecr 3500332547,nop,wscale 7], length 0
13:12:35.843387 IP 172.28.5.5.54012 > 172.28.5.0.6379: Flags [P.], seq 1:7, ack 1, win 229, options [nop,nop,TS val 3500332547 ecr 2883176837], length 6: RESP "PING"
13:12:35.843464 IP 172.28.5.0.6379 > 172.28.5.5.54012: Flags [.], ack 7, win 227, options [nop,nop,TS val 2883176837 ecr 3500332547], length 0
13:12:35.843744 IP 172.28.5.0.6379 > 172.28.5.5.54012: Flags [P.], seq 1:8, ack 7, win 227, options [nop,nop,TS val 2883176837 ecr 3500332547], length 7: RESP "PONG"
13:12:35.843849 IP 172.28.5.5.54012 > 172.28.5.0.6379: Flags [P.], seq 7:25, ack 8, win 229, options [nop,nop,TS val 3500332547 ecr 2883176837], length 18: RESP "info replication"
13:12:35.844143 IP 172.28.5.0.6379 > 172.28.5.5.54012: Flags [P.], seq 8:470, ack 25, win 227, options [nop,nop,TS val 2883176838 ecr 3500332547], length 462: RESP "# Replication^M^Jrole:master^M^Jconnected_slaves:2^M^Jslave0:ip=172.28.5.1,port=6379,state=online,offset=823440,lag=0^M^Jslave1:ip=172.28.5.2,port=6379,state=online,offset=823588,lag=0^M^Jmaster_replid:f8eac6c8a17a641b11523474ffa3dbd0af88977a^M^Jmaster_replid2:0000000000000000000000000000000000000000^M^Jmaster_repl_offset:823588^M^Jsecond_repl_offset:-1^M^Jrepl_backlog_active:1^M^Jrepl_backlog_size:1048576^M^Jrepl_backlog_first_byte_offset:1^M^Jrepl_backlog_histlen:823588^M^J"
13:12:35.844239 IP 172.28.5.5.54012 > 172.28.5.0.6379: Flags [P.], seq 25:31, ack 470, win 237, options [nop,nop,TS val 3500332548 ecr 2883176838], length 6: RESP "QUIT"
13:12:35.844401 IP 172.28.5.0.6379 > 172.28.5.5.54012: Flags [P.], seq 470:475, ack 31, win 227, options [nop,nop,TS val 2883176838 ecr 3500332548], length 5: RESP "OK"
13:12:35.844491 IP 172.28.5.0.6379 > 172.28.5.5.54012: Flags [F.], seq 475, ack 31, win 227, options [nop,nop,TS val 2883176838 ecr 3500332548], length 0
13:12:35.844603 IP 172.28.5.5.54012 > 172.28.5.0.6379: Flags [F.], seq 31, ack 476, win 237, options [nop,nop,TS val 3500332548 ecr 2883176838], length 0
13:12:35.844685 IP 172.28.5.0.6379 > 172.28.5.5.54012: Flags [.], ack 32, win 227, options [nop,nop,TS val 2883176838 ecr 3500332548], length 0
13:12:36.173359 IP 172.28.5.5.58274 > 172.28.5.1.6379: Flags [R.], seq 25, ack 526, win 237, options [nop,nop,TS val 3392243648 ecr 9453672], length 0
13:12:36.503044 IP 172.28.5.5.52982 > 172.28.5.2.6379: Flags [R.], seq 25, ack 528, win 237, options [nop,nop,TS val 1868874197 ecr 1402752212], length 0
13:12:36.844723 IP 172.28.5.5.54042 > 172.28.5.0.6379: Flags [S], seq 1003063348, win 29200, options [mss 1460,sackOK,TS val 3500333548 ecr 0,nop,wscale 7], length 0
13:12:36.845015 IP 172.28.5.0.6379 > 172.28.5.5.54042: Flags [S.], seq 124982646, ack 1003063349, win 28960, options [mss 1460,sackOK,TS val 2883177839 ecr 3500333548,nop,wscale 7], length 0
13:12:36.845209 IP 172.28.5.5.54042 > 172.28.5.0.6379: Flags [P.], seq 1:7, ack 1, win 229, options [nop,nop,TS val 3500333549 ecr 2883177839], length 6: RESP "PING"
13:12:36.845450 IP 172.28.5.0.6379 > 172.28.5.5.54042: Flags [.], ack 7, win 227, options [nop,nop,TS val 2883177839 ecr 3500333549], length 0
13:12:36.846145 IP 172.28.5.0.6379 > 172.28.5.5.54042: Flags [P.], seq 1:8, ack 7, win 227, options [nop,nop,TS val 2883177840 ecr 3500333549], length 7: RESP "PONG"
13:12:36.846412 IP 172.28.5.5.54042 > 172.28.5.0.6379: Flags [P.], seq 7:25, ack 8, win 229, options [nop,nop,TS val 3500333550 ecr 2883177840], length 18: RESP "info replication"
13:12:36.847024 IP 172.28.5.0.6379 > 172.28.5.5.54042: Flags [P.], seq 8:470, ack 25, win 227, options [nop,nop,TS val 2883177841 ecr 3500333550], length 462: RESP "# Replication^M^Jrole:master^M^Jconnected_slaves:2^M^Jslave0:ip=172.28.5.1,port=6379,state=online,offset=823588,lag=0^M^Jslave1:ip=172.28.5.2,port=6379,state=online,offset=823884,lag=0^M^Jmaster_replid:f8eac6c8a17a641b11523474ffa3dbd0af88977a^M^Jmaster_replid2:0000000000000000000000000000000000000000^M^Jmaster_repl_offset:823884^M^Jsecond_repl_offset:-1^M^Jrepl_backlog_active:1^M^Jrepl_backlog_size:1048576^M^Jrepl_backlog_first_byte_offset:1^M^Jrepl_backlog_histlen:823884^M^J"
13:12:36.847293 IP 172.28.5.5.54042 > 172.28.5.0.6379: Flags [P.], seq 25:31, ack 470, win 237, options [nop,nop,TS val 3500333551 ecr 2883177841], length 6: RESP "QUIT"
13:12:36.847713 IP 172.28.5.0.6379 > 172.28.5.5.54042: Flags [P.], seq 470:475, ack 31, win 227, options [nop,nop,TS val 2883177841 ecr 3500333551], length 5: RESP "OK"
13:12:36.847996 IP 172.28.5.5.54042 > 172.28.5.0.6379: Flags [R.], seq 31, ack 475, win 237, options [nop,nop,TS val 3500333552 ecr 2883177841], length 0
13:12:36.848049 IP 172.28.5.0.6379 > 172.28.5.5.54042: Flags [F.], seq 475, ack 31, win 227, options [nop,nop,TS val 2883177842 ecr 3500333551], length 0
13:12:36.848121 IP 172.28.5.5.54042 > 172.28.5.0.6379: Flags [R], seq 1003063379, win 0, length 0
13:12:37.175627 IP 172.28.5.5.58332 > 172.28.5.1.6379: Flags [S], seq 1665614738, win 29200, options [mss 1460,sackOK,TS val 3392244650 ecr 0,nop,wscale 7], length 0
13:12:37.175668 IP 172.28.5.1.6379 > 172.28.5.5.58332: Flags [S.], seq 1850284021, ack 1665614739, win 28960, options [mss 1460,sackOK,TS val 9455675 ecr 3392244650,nop,wscale 7], length 0
13:12:37.175687 IP 172.28.5.5.58332 > 172.28.5.1.6379: Flags [P.], seq 1:7, ack 1, win 229, options [nop,nop,TS val 3392244650 ecr 9455675], length 6: RESP "PING"
13:12:37.175711 IP 172.28.5.1.6379 > 172.28.5.5.58332: Flags [.], ack 7, win 227, options [nop,nop,TS val 9455675 ecr 3392244650], length 0
13:12:37.175832 IP 172.28.5.1.6379 > 172.28.5.5.58332: Flags [P.], seq 1:8, ack 7, win 227, options [nop,nop,TS val 9455675 ecr 3392244650], length 7: RESP "PONG"
13:12:37.175864 IP 172.28.5.5.58332 > 172.28.5.1.6379: Flags [P.], seq 7:25, ack 8, win 229, options [nop,nop,TS val 3392244651 ecr 9455675], length 18: RESP "info replication"
13:12:37.175937 IP 172.28.5.1.6379 > 172.28.5.5.58332: Flags [P.], seq 8:526, ack 25, win 227, options [nop,nop,TS val 9455676 ecr 3392244651], length 518: RESP "# Replication^M^Jrole:slave^M^Jmaster_host:172.28.5.0^M^Jmaster_port:6379^M^Jmaster_link_status:up^M^Jmaster_last_io_seconds_ago:1^M^Jmaster_sync_in_progress:0^M^Jslave_repl_offset:823884^M^Jslave_priority:100^M^Jslave_read_only:1^M^Jconnected_slaves:0^M^Jmaster_replid:f8eac6c8a17a641b11523474ffa3dbd0af88977a^M^Jmaster_replid2:0000000000000000000000000000000000000000^M^Jmaster_repl_offset:823884^M^Jsecond_repl_offset:-1^M^Jrepl_backlog_active:1^M^Jrepl_backlog_size:1048576^M^Jrepl_backlog_first_byte_offset:1^M^Jrepl_backlog_histlen:823884^M^J"
13:12:37.215988 IP 172.28.5.5.58332 > 172.28.5.1.6379: Flags [.], ack 526, win 237, options [nop,nop,TS val 3392244691 ecr 9455676], length 0
13:12:37.505285 IP 172.28.5.5.53040 > 172.28.5.2.6379: Flags [S], seq 2075260377, win 29200, options [mss 1460,sackOK,TS val 1868875199 ecr 0,nop,wscale 7], length 0
13:12:37.505326 IP 172.28.5.2.6379 > 172.28.5.5.53040: Flags [S.], seq 4137832906, ack 2075260378, win 28960, options [mss 1460,sackOK,TS val 1402754215 ecr 1868875199,nop,wscale 7], length 0
13:12:37.505344 IP 172.28.5.5.53040 > 172.28.5.2.6379: Flags [P.], seq 1:7, ack 1, win 229, options [nop,nop,TS val 1868875199 ecr 1402754215], length 6: RESP "PING"
