13:11:52.327890 IP 172.28.5.4.33586 > 172.28.5.0.6379: Flags [S], seq 482758479, win 29200, options [mss 1460,sackOK,TS val 1873461093 ecr 0,nop,wscale 7], length 0
13:11:52.328062 IP 172.28.5.0.6379 > 172.28.5.4.33586: Flags [S.], seq 4011277795, ack 482758480, win 28960, options [mss 1460,sackOK,TS val 232816028 ecr 1873461093,nop,wscale 7], length 0
13:11:52.328204 IP 172.28.5.4.33586 > 172.28.5.0.6379: Flags [P.], seq 1:7, ack 1, win 229, options [nop,nop,TS val 1873461094 ecr 232816028], length 6: RESP "PING"
13:11:52.328298 IP 172.28.5.0.6379 > 172.28.5.4.33586: Flags [.], ack 7, win 227, options [nop,nop,TS val 232816028 ecr 1873461094], length 0
13:11:52.328549 IP 172.28.5.0.6379 > 172.28.5.4.33586: Flags [P.], seq 1:8, ack 7, win 227, options [nop,nop,TS val 232816028 ecr 1873461094], length 7: RESP "PONG"
13:11:52.328633 IP 172.28.5.4.33586 > 172.28.5.0.6379: Flags [P.], seq 7:25, ack 8, win 229, options [nop,nop,TS val 1873461094 ecr 232816028], length 18: RESP "info replication"
13:11:52.328812 IP 172.28.5.0.6379 > 172.28.5.4.33586: Flags [P.], seq 8:470, ack 25, win 227, options [nop,nop,TS val 232816028 ecr 1873461094], length 462: RESP "# Replication^M^Jrole:master^M^Jconnected_slaves:2^M^Jslave0:ip=172.28.5.1,port=6379,state=online,offset=814046,lag=1^M^Jslave1:ip=172.28.5.2,port=6379,state=online,offset=813898,lag=1^M^Jmaster_replid:f8eac6c8a17a641b11523474ffa3dbd0af88977a^M^Jmaster_replid2:0000000000000000000000000000000000000000^M^Jmaster_repl_offset:814046^M^Jsecond_repl_offset:-1^M^Jrepl_backlog_active:1^M^Jrepl_backlog_size:1048576^M^Jrepl_backlog_first_byte_offset:1^M^Jrepl_backlog_histlen:814046^M^J"
13:11:52.328944 IP 172.28.5.4.33586 > 172.28.5.0.6379: Flags [P.], seq 25:31, ack 470, win 237, options [nop,nop,TS val 1873461095 ecr 232816028], length 6: RESP "QUIT"
13:11:52.329123 IP 172.28.5.0.6379 > 172.28.5.4.33586: Flags [P.], seq 470:475, ack 31, win 227, options [nop,nop,TS val 232816029 ecr 1873461095], length 5: RESP "OK"
13:11:52.329227 IP 172.28.5.0.6379 > 172.28.5.4.33586: Flags [F.], seq 475, ack 31, win 227, options [nop,nop,TS val 232816029 ecr 1873461095], length 0
13:11:52.329264 IP 172.28.5.4.33586 > 172.28.5.0.6379: Flags [R.], seq 31, ack 475, win 237, options [nop,nop,TS val 1873461095 ecr 232816029], length 0
13:11:52.651874 IP 172.28.5.4.55064 > 172.28.5.1.6379: Flags [S], seq 1087945032, win 29200, options [mss 1460,sackOK,TS val 4071240843 ecr 0,nop,wscale 7], length 0
13:11:52.652090 IP 172.28.5.1.6379 > 172.28.5.4.55064: Flags [S.], seq 3222450974, ack 1087945033, win 28960, options [mss 1460,sackOK,TS val 3587835438 ecr 4071240843,nop,wscale 7], length 0
13:11:52.652237 IP 172.28.5.4.55064 > 172.28.5.1.6379: Flags [P.], seq 1:7, ack 1, win 229, options [nop,nop,TS val 4071240844 ecr 3587835438], length 6: RESP "PING"
13:11:52.652435 IP 172.28.5.1.6379 > 172.28.5.4.55064: Flags [.], ack 7, win 227, options [nop,nop,TS val 3587835438 ecr 4071240844], length 0
13:11:52.652747 IP 172.28.5.1.6379 > 172.28.5.4.55064: Flags [P.], seq 1:8, ack 7, win 227, options [nop,nop,TS val 3587835438 ecr 4071240844], length 7: RESP "PONG"
13:11:52.652924 IP 172.28.5.4.55064 > 172.28.5.1.6379: Flags [P.], seq 7:25, ack 8, win 229, options [nop,nop,TS val 4071240845 ecr 3587835438], length 18: RESP "info replication"
13:11:52.653169 IP 172.28.5.1.6379 > 172.28.5.4.55064: Flags [P.], seq 8:526, ack 25, win 227, options [nop,nop,TS val 3587835439 ecr 4071240845], length 518: RESP "# Replication^M^Jrole:slave^M^Jmaster_host:172.28.5.0^M^Jmaster_port:6379^M^Jmaster_link_status:up^M^Jmaster_last_io_seconds_ago:0^M^Jmaster_sync_in_progress:0^M^Jslave_repl_offset:814208^M^Jslave_priority:100^M^Jslave_read_only:1^M^Jconnected_slaves:0^M^Jmaster_replid:f8eac6c8a17a641b11523474ffa3dbd0af88977a^M^Jmaster_replid2:0000000000000000000000000000000000000000^M^Jmaster_repl_offset:814208^M^Jsecond_repl_offset:-1^M^Jrepl_backlog_active:1^M^Jrepl_backlog_size:1048576^M^Jrepl_backlog_first_byte_offset:1^M^Jrepl_backlog_histlen:814208^M^J"
13:11:52.696088 IP 172.28.5.4.55064 > 172.28.5.1.6379: Flags [.], ack 526, win 237, options [nop,nop,TS val 4071240888 ecr 3587835439], length 0
13:11:52.991246 IP 172.28.5.4.59802 > 172.28.5.2.6379: Flags [S], seq 1611701098, win 29200, options [mss 1460,sackOK,TS val 3594468465 ecr 0,nop,wscale 7], length 0
13:11:52.991391 IP 172.28.5.2.6379 > 172.28.5.4.59802: Flags [S.], seq 285079122, ack 1611701099, win 28960, options [mss 1460,sackOK,TS val 373931769 ecr 3594468465,nop,wscale 7], length 0
13:11:52.991478 IP 172.28.5.4.59802 > 172.28.5.2.6379: Flags [P.], seq 1:7, ack 1, win 229, options [nop,nop,TS val 3594468465 ecr 373931769], length 6: RESP "PING"
13:11:52.991583 IP 172.28.5.2.6379 > 172.28.5.4.59802: Flags [.], ack 7, win 227, options [nop,nop,TS val 373931769 ecr 3594468465], length 0
13:11:52.991941 IP 172.28.5.2.6379 > 172.28.5.4.59802: Flags [P.], seq 1:8, ack 7, win 227, options [nop,nop,TS val 373931769 ecr 3594468465], length 7: RESP "PONG"
13:11:52.992108 IP 172.28.5.4.59802 > 172.28.5.2.6379: Flags [P.], seq 7:25, ack 8, win 229, options [nop,nop,TS val 3594468466 ecr 373931769], length 18: RESP "info replication"
13:11:52.992360 IP 172.28.5.2.6379 > 172.28.5.4.59802: Flags [P.], seq 8:528, ack 25, win 227, options [nop,nop,TS val 373931770 ecr 3594468466], length 520: RESP "# Replication^M^Jrole:slave^M^Jmaster_host:172.28.5.0^M^Jmaster_port:6379^M^Jmaster_link_status:up^M^Jmaster_last_io_seconds_ago:0^M^Jmaster_sync_in_progress:0^M^Jslave_repl_offset:814208^M^Jslave_priority:100^M^Jslave_read_only:1^M^Jconnected_slaves:0^M^Jmaster_replid:f8eac6c8a17a641b11523474ffa3dbd0af88977a^M^Jmaster_replid2:0000000000000000000000000000000000000000^M^Jmaster_repl_offset:814208^M^Jsecond_repl_offset:-1^M^Jrepl_backlog_active:1^M^Jrepl_backlog_size:1048576^M^Jrepl_backlog_first_byte_offset:186^M^Jrepl_backlog_histlen:814023^M^J"
13:11:53.036072 IP 172.28.5.4.59802 > 172.28.5.2.6379: Flags [.], ack 528, win 237, options [nop,nop,TS val 3594468510 ecr 373931770], length 0
13:11:53.331520 IP 172.28.5.4.33598 > 172.28.5.0.6379: Flags [S], seq 556476650, win 29200, options [mss 1460,sackOK,TS val 1873462097 ecr 0,nop,wscale 7], length 0
13:11:53.331706 IP 172.28.5.0.6379 > 172.28.5.4.33598: Flags [S.], seq 3413962066, ack 556476651, win 28960, options [mss 1460,sackOK,TS val 232817031 ecr 1873462097,nop,wscale 7], length 0
13:11:53.331848 IP 172.28.5.4.33598 > 172.28.5.0.6379: Flags [P.], seq 1:7, ack 1, win 229, options [nop,nop,TS val 1873462097 ecr 232817031], length 6: RESP "PING"
13:11:53.331997 IP 172.28.5.0.6379 > 172.28.5.4.33598: Flags [.], ack 7, win 227, options [nop,nop,TS val 232817032 ecr 1873462097], length 0
13:11:53.332306 IP 172.28.5.0.6379 > 172.28.5.4.33598: Flags [P.], seq 1:8, ack 7, win 227, options [nop,nop,TS val 232817032 ecr 1873462097], length 7: RESP "PONG"
13:11:53.332462 IP 172.28.5.4.33598 > 172.28.5.0.6379: Flags [P.], seq 7:25, ack 8, win 229, options [nop,nop,TS val 1873462098 ecr 232817032], length 18: RESP "info replication"
13:11:53.332751 IP 172.28.5.0.6379 > 172.28.5.4.33598: Flags [P.], seq 8:470, ack 25, win 227, options [nop,nop,TS val 232817032 ecr 1873462098], length 462: RESP "# Replication^M^Jrole:master^M^Jconnected_slaves:2^M^Jslave0:ip=172.28.5.1,port=6379,state=online,offset=814208,lag=1^M^Jslave1:ip=172.28.5.2,port=6379,state=online,offset=814208,lag=1^M^Jmaster_replid:f8eac6c8a17a641b11523474ffa3dbd0af88977a^M^Jmaster_replid2:0000000000000000000000000000000000000000^M^Jmaster_repl_offset:814208^M^Jsecond_repl_offset:-1^M^Jrepl_backlog_active:1^M^Jrepl_backlog_size:1048576^M^Jrepl_backlog_first_byte_offset:1^M^Jrepl_backlog_histlen:814208^M^J"
13:11:53.332887 IP 172.28.5.4.33598 > 172.28.5.0.6379: Flags [P.], seq 25:31, ack 470, win 237, options [nop,nop,TS val 1873462098 ecr 232817032], length 6: RESP "QUIT"
13:11:53.333048 IP 172.28.5.0.6379 > 172.28.5.4.33598: Flags [P.], seq 470:475, ack 31, win 227, options [nop,nop,TS val 232817033 ecr 1873462098], length 5: RESP "OK"
13:11:53.333151 IP 172.28.5.0.6379 > 172.28.5.4.33598: Flags [F.], seq 475, ack 31, win 227, options [nop,nop,TS val 232817033 ecr 1873462098], length 0
13:11:53.333156 IP 172.28.5.4.33598 > 172.28.5.0.6379: Flags [R.], seq 31, ack 475, win 237, options [nop,nop,TS val 1873462099 ecr 232817033], length 0
13:11:53.333199 IP 172.28.5.4.33598 > 172.28.5.0.6379: Flags [R], seq 556476681, win 0, length 0
13:11:53.652627 IP 172.28.5.4.55064 > 172.28.5.1.6379: Flags [R.], seq 25, ack 526, win 237, options [nop,nop,TS val 4071241844 ecr 3587835439], length 0
13:11:53.993375 IP 172.28.5.4.59802 > 172.28.5.2.6379: Flags [R.], seq 25, ack 528, win 237, options [nop,nop,TS val 3594469467 ecr 373931770], length 0
13:11:54.335707 IP 172.28.5.4.33606 > 172.28.5.0.6379: Flags [S], seq 509187122, win 29200, options [mss 1460,sackOK,TS val 1873463101 ecr 0,nop,wscale 7], length 0
13:11:54.335943 IP 172.28.5.0.6379 > 172.28.5.4.33606: Flags [S.], seq 479582106, ack 509187123, win 28960, options [mss 1460,sackOK,TS val 232818036 ecr 1873463101,nop,wscale 7], length 0
13:11:54.336204 IP 172.28.5.4.33606 > 172.28.5.0.6379: Flags [P.], seq 1:7, ack 1, win 229, options [nop,nop,TS val 1873463102 ecr 232818036], length 6: RESP "PING"
13:11:54.336321 IP 172.28.5.0.6379 > 172.28.5.4.33606: Flags [.], ack 7, win 227, options [nop,nop,TS val 232818036 ecr 1873463102], length 0
13:11:54.336609 IP 172.28.5.0.6379 > 172.28.5.4.33606: Flags [P.], seq 1:8, ack 7, win 227, options [nop,nop,TS val 232818036 ecr 1873463102], length 7: RESP "PONG"
13:11:54.336732 IP 172.28.5.4.33606 > 172.28.5.0.6379: Flags [P.], seq 7:25, ack 8, win 229, options [nop,nop,TS val 1873463102 ecr 232818036], length 18: RESP "info replication"
13:11:54.336956 IP 172.28.5.0.6379 > 172.28.5.4.33606: Flags [P.], seq 8:470, ack 25, win 227, options [nop,nop,TS val 232818037 ecr 1873463102], length 462: RESP "# Replication^M^Jrole:master^M^Jconnected_slaves:2^M^Jslave0:ip=172.28.5.1,port=6379,state=online,offset=814504,lag=1^M^Jslave1:ip=172.28.5.2,port=6379,state=online,offset=814356,lag=1^M^Jmaster_replid:f8eac6c8a17a641b11523474ffa3dbd0af88977a^M^Jmaster_replid2:0000000000000000000000000000000000000000^M^Jmaster_repl_offset:814504^M^Jsecond_repl_offset:-1^M^Jrepl_backlog_active:1^M^Jrepl_backlog_size:1048576^M^Jrepl_backlog_first_byte_offset:1^M^Jrepl_backlog_histlen:814504^M^J"
13:11:54.337051 IP 172.28.5.4.33606 > 172.28.5.0.6379: Flags [P.], seq 25:31, ack 470, win 237, options [nop,nop,TS val 1873463103 ecr 232818037], length 6: RESP "QUIT"
13:11:54.337185 IP 172.28.5.0.6379 > 172.28.5.4.33606: Flags [P.], seq 470:475, ack 31, win 227, options [nop,nop,TS val 232818037 ecr 1873463103], length 5: RESP "OK"
13:11:54.337282 IP 172.28.5.0.6379 > 172.28.5.4.33606: Flags [F.], seq 475, ack 31, win 227, options [nop,nop,TS val 232818037 ecr 1873463103], length 0
13:11:54.337284 IP 172.28.5.4.33606 > 172.28.5.0.6379: Flags [R.], seq 31, ack 475, win 237, options [nop,nop,TS val 1873463103 ecr 232818037], length 0
13:11:54.337322 IP 172.28.5.4.33606 > 172.28.5.0.6379: Flags [R], seq 509187153, win 0, length 0
13:11:54.653907 IP 172.28.5.4.55084 > 172.28.5.1.6379: Flags [S], seq 3000515137, win 29200, options [mss 1460,sackOK,TS val 4071242845 ecr 0,nop,wscale 7], length 0
13:11:54.654049 IP 172.28.5.1.6379 > 172.28.5.4.55084: Flags [S.], seq 1964867082, ack 3000515138, win 28960, options [mss 1460,sackOK,TS val 3587837440 ecr 4071242845,nop,wscale 7], length 0
13:11:54.654136 IP 172.28.5.4.55084 > 172.28.5.1.6379: Flags [P.], seq 1:7, ack 1, win 229, options [nop,nop,TS val 4071242846 ecr 3587837440], length 6: RESP "PING"
13:11:54.654224 IP 172.28.5.1.6379 > 172.28.5.4.55084: Flags [.], ack 7, win 227, options [nop,nop,TS val 3587837440 ecr 4071242846], length 0
13:11:54.654593 IP 172.28.5.1.6379 > 172.28.5.4.55084: Flags [P.], seq 1:8, ack 7, win 227, options [nop,nop,TS val 3587837440 ecr 4071242846], length 7: RESP "PONG"
13:11:54.654828 IP 172.28.5.4.55084 > 172.28.5.1.6379: Flags [P.], seq 7:25, ack 8, win 229, options [nop,nop,TS val 4071242846 ecr 3587837440], length 18: RESP "info replication"
13:11:54.655127 IP 172.28.5.1.6379 > 172.28.5.4.55084: Flags [P.], seq 8:526, ack 25, win 227, options [nop,nop,TS val 3587837441 ecr 4071242846], length 518: RESP "# Replication^M^Jrole:slave^M^Jmaster_host:172.28.5.0^M^Jmaster_port:6379^M^Jmaster_link_status:up^M^Jmaster_last_io_seconds_ago:0^M^Jmaster_sync_in_progress:0^M^Jslave_repl_offset:814652^M^Jslave_priority:100^M^Jslave_read_only:1^M^Jconnected_slaves:0^M^Jmaster_replid:f8eac6c8a17a641b11523474ffa3dbd0af88977a^M^Jmaster_replid2:0000000000000000000000000000000000000000^M^Jmaster_repl_offset:814652^M^Jsecond_repl_offset:-1^M^Jrepl_backlog_active:1^M^Jrepl_backlog_size:1048576^M^Jrepl_backlog_first_byte_offset:1^M^Jrepl_backlog_histlen:814652^M^J"
13:11:54.696070 IP 172.28.5.4.55084 > 172.28.5.1.6379: Flags [.], ack 526, win 237, options [nop,nop,TS val 4071242888 ecr 3587837441], length 0
13:11:54.995232 IP 172.28.5.4.59822 > 172.28.5.2.6379: Flags [S], seq 3117517180, win 29200, options [mss 1460,sackOK,TS val 3594470469 ecr 0,nop,wscale 7], length 0
13:11:54.995453 IP 172.28.5.2.6379 > 172.28.5.4.59822: Flags [S.], seq 2488188479, ack 3117517181, win 28960, options [mss 1460,sackOK,TS val 373933773 ecr 3594470469,nop,wscale 7], length 0
13:11:54.995577 IP 172.28.5.4.59822 > 172.28.5.2.6379: Flags [P.], seq 1:7, ack 1, win 229, options [nop,nop,TS val 3594470469 ecr 373933773], length 6: RESP "PING"
13:11:54.995687 IP 172.28.5.2.6379 > 172.28.5.4.59822: Flags [.], ack 7, win 227, options [nop,nop,TS val 373933773 ecr 3594470469], length 0
13:11:54.996021 IP 172.28.5.2.6379 > 172.28.5.4.59822: Flags [P.], seq 1:8, ack 7, win 227, options [nop,nop,TS val 373933774 ecr 3594470469], length 7: RESP "PONG"
13:11:54.996162 IP 172.28.5.4.59822 > 172.28.5.2.6379: Flags [P.], seq 7:25, ack 8, win 229, options [nop,nop,TS val 3594470470 ecr 373933774], length 18: RESP "info replication"
13:11:54.996394 IP 172.28.5.2.6379 > 172.28.5.4.59822: Flags [P.], seq 8:528, ack 25, win 227, options [nop,nop,TS val 373933774 ecr 3594470470], length 520: RESP "# Replication^M^Jrole:slave^M^Jmaster_host:172.28.5.0^M^Jmaster_port:6379^M^Jmaster_link_status:up^M^Jmaster_last_io_seconds_ago:0^M^Jmaster_sync_in_progress:0^M^Jslave_repl_offset:814652^M^Jslave_priority:100^M^Jslave_read_only:1^M^Jconnected_slaves:0^M^Jmaster_replid:f8eac6c8a17a641b11523474ffa3dbd0af88977a^M^Jmaster_replid2:0000000000000000000000000000000000000000^M^Jmaster_repl_offset:814652^M^Jsecond_repl_offset:-1^M^Jrepl_backlog_active:1^M^Jrepl_backlog_size:1048576^M^Jrepl_backlog_first_byte_offset:186^M^Jrepl_backlog_histlen:814467^M^J"
13:11:55.044069 IP 172.28.5.4.59822 > 172.28.5.2.6379: Flags [.], ack 528, win 237, options [nop,nop,TS val 3594470518 ecr 373933774], length 0
13:11:55.339324 IP 172.28.5.4.33618 > 172.28.5.0.6379: Flags [S], seq 3638625932, win 29200, options [mss 1460,sackOK,TS val 1873464105 ecr 0,nop,wscale 7], length 0
13:11:55.339565 IP 172.28.5.0.6379 > 172.28.5.4.33618: Flags [S.], seq 1318592876, ack 3638625933, win 28960, options [mss 1460,sackOK,TS val 232819039 ecr 1873464105,nop,wscale 7], length 0
13:11:55.339761 IP 172.28.5.4.33618 > 172.28.5.0.6379: Flags [P.], seq 1:7, ack 1, win 229, options [nop,nop,TS val 1873464105 ecr 232819039], length 6: RESP "PING"
13:11:55.339910 IP 172.28.5.0.6379 > 172.28.5.4.33618: Flags [.], ack 7, win 227, options [nop,nop,TS val 232819039 ecr 1873464105], length 0
13:11:55.340336 IP 172.28.5.0.6379 > 172.28.5.4.33618: Flags [P.], seq 1:8, ack 7, win 227, options [nop,nop,TS val 232819040 ecr 1873464105], length 7: RESP "PONG"
13:11:55.340565 IP 172.28.5.4.33618 > 172.28.5.0.6379: Flags [P.], seq 7:25, ack 8, win 229, options [nop,nop,TS val 1873464106 ecr 232819040], length 18: RESP "info replication"
13:11:55.340891 IP 172.28.5.0.6379 > 172.28.5.4.33618: Flags [P.], seq 8:470, ack 25, win 227, options [nop,nop,TS val 232819040 ecr 1873464106], length 462: RESP "# Replication^M^Jrole:master^M^Jconnected_slaves:2^M^Jslave0:ip=172.28.5.1,port=6379,state=online,offset=814652,lag=1^M^Jslave1:ip=172.28.5.2,port=6379,state=online,offset=814652,lag=1^M^Jmaster_replid:f8eac6c8a17a641b11523474ffa3dbd0af88977a^M^Jmaster_replid2:0000000000000000000000000000000000000000^M^Jmaster_repl_offset:814652^M^Jsecond_repl_offset:-1^M^Jrepl_backlog_active:1^M^Jrepl_backlog_size:1048576^M^Jrepl_backlog_first_byte_offset:1^M^Jrepl_backlog_histlen:814652^M^J"
13:11:55.341019 IP 172.28.5.4.33618 > 172.28.5.0.6379: Flags [P.], seq 25:31, ack 470, win 237, options [nop,nop,TS val 1873464107 ecr 232819040], length 6: RESP "QUIT"
13:11:55.341187 IP 172.28.5.0.6379 > 172.28.5.4.33618: Flags [P.], seq 470:475, ack 31, win 227, options [nop,nop,TS val 232819041 ecr 1873464107], length 5: RESP "OK"
13:11:55.341353 IP 172.28.5.0.6379 > 172.28.5.4.33618: Flags [F.], seq 475, ack 31, win 227, options [nop,nop,TS val 232819041 ecr 1873464107], length 0
13:11:55.341420 IP 172.28.5.4.33618 > 172.28.5.0.6379: Flags [R.], seq 31, ack 475, win 237, options [nop,nop,TS val 1873464107 ecr 232819041], length 0
13:11:55.655437 IP 172.28.5.4.55084 > 172.28.5.1.6379: Flags [R.], seq 25, ack 526, win 237, options [nop,nop,TS val 4071243847 ecr 3587837441], length 0
13:11:55.997159 IP 172.28.5.4.59822 > 172.28.5.2.6379: Flags [R.], seq 25, ack 528, win 237, options [nop,nop,TS val 3594471471 ecr 373933774], length 0
13:11:56.343065 IP 172.28.5.4.33626 > 172.28.5.0.6379: Flags [S], seq 3782852509, win 29200, options [mss 1460,sackOK,TS val 1873465109 ecr 0,nop,wscale 7], length 0
13:11:56.343244 IP 172.28.5.0.6379 > 172.28.5.4.33626: Flags [S.], seq 2849780320, ack 3782852510, win 28960, options [mss 1460,sackOK,TS val 232820043 ecr 1873465109,nop,wscale 7], length 0
13:11:56.343354 IP 172.28.5.4.33626 > 172.28.5.0.6379: Flags [P.], seq 1:7, ack 1, win 229, options [nop,nop,TS val 1873465109 ecr 232820043], length 6: RESP "PING"
13:11:56.343454 IP 172.28.5.0.6379 > 172.28.5.4.33626: Flags [.], ack 7, win 227, options [nop,nop,TS val 232820043 ecr 1873465109], length 0
13:11:56.343671 IP 172.28.5.0.6379 > 172.28.5.4.33626: Flags [P.], seq 1:8, ack 7, win 227, options [nop,nop,TS val 232820043 ecr 1873465109], length 7: RESP "PONG"
13:11:56.343890 IP 172.28.5.4.33626 > 172.28.5.0.6379: Flags [P.], seq 7:25, ack 8, win 229, options [nop,nop,TS val 1873465109 ecr 232820043], length 18: RESP "info replication"
13:11:56.344221 IP 172.28.5.0.6379 > 172.28.5.4.33626: Flags [P.], seq 8:470, ack 25, win 227, options [nop,nop,TS val 232820044 ecr 1873465109], length 462: RESP "# Replication^M^Jrole:master^M^Jconnected_slaves:2^M^Jslave0:ip=172.28.5.1,port=6379,state=online,offset=814948,lag=1^M^Jslave1:ip=172.28.5.2,port=6379,state=online,offset=814800,lag=1^M^Jmaster_replid:f8eac6c8a17a641b11523474ffa3dbd0af88977a^M^Jmaster_replid2:0000000000000000000000000000000000000000^M^Jmaster_repl_offset:814948^M^Jsecond_repl_offset:-1^M^Jrepl_backlog_active:1^M^Jrepl_backlog_size:1048576^M^Jrepl_backlog_first_byte_offset:1^M^Jrepl_backlog_histlen:814948^M^J"
13:11:56.344750 IP 172.28.5.4.33626 > 172.28.5.0.6379: Flags [P.], seq 25:31, ack 470, win 237, options [nop,nop,TS val 1873465110 ecr 232820044], length 6: RESP "QUIT"
13:11:56.344959 IP 172.28.5.0.6379 > 172.28.5.4.33626: Flags [P.], seq 470:475, ack 31, win 227, options [nop,nop,TS val 232820045 ecr 1873465110], length 5: RESP "OK"
13:11:56.345064 IP 172.28.5.0.6379 > 172.28.5.4.33626: Flags [F.], seq 475, ack 31, win 227, options [nop,nop,TS val 232820045 ecr 1873465110], length 0
13:11:56.345482 IP 172.28.5.4.33626 > 172.28.5.0.6379: Flags [F.], seq 31, ack 476, win 237, options [nop,nop,TS val 1873465111 ecr 232820045], length 0
13:11:56.345602 IP 172.28.5.0.6379 > 172.28.5.4.33626: Flags [.], ack 32, win 227, options [nop,nop,TS val 232820045 ecr 1873465111], length 0
13:11:56.657236 IP 172.28.5.4.55104 > 172.28.5.1.6379: Flags [S], seq 1064704580, win 29200, options [mss 1460,sackOK,TS val 4071244849 ecr 0,nop,wscale 7], length 0
13:11:56.657464 IP 172.28.5.1.6379 > 172.28.5.4.55104: Flags [S.], seq 184552604, ack 1064704581, win 28960, options [mss 1460,sackOK,TS val 3587839443 ecr 4071244849,nop,wscale 7], length 0
13:11:56.657612 IP 172.28.5.4.55104 > 172.28.5.1.6379: Flags [P.], seq 1:7, ack 1, win 229, options [nop,nop,TS val 4071244849 ecr 3587839443], length 6: RESP "PING"
13:11:56.657744 IP 172.28.5.1.6379 > 172.28.5.4.55104: Flags [.], ack 7, win 227, options [nop,nop,TS val 3587839443 ecr 4071244849], length 0
13:11:56.658174 IP 172.28.5.1.6379 > 172.28.5.4.55104: Flags [P.], seq 1:8, ack 7, win 227, options [nop,nop,TS val 3587839444 ecr 4071244849], length 7: RESP "PONG"
13:11:56.658422 IP 172.28.5.4.55104 > 172.28.5.1.6379: Flags [P.], seq 7:25, ack 8, win 229, options [nop,nop,TS val 4071244850 ecr 3587839444], length 18: RESP "info replication"
13:11:56.658719 IP 172.28.5.1.6379 > 172.28.5.4.55104: Flags [P.], seq 8:526, ack 25, win 227, options [nop,nop,TS val 3587839444 ecr 4071244850], length 518: RESP "# Replication^M^Jrole:slave^M^Jmaster_host:172.28.5.0^M^Jmaster_port:6379^M^Jmaster_link_status:up^M^Jmaster_last_io_seconds_ago:0^M^Jmaster_sync_in_progress:0^M^Jslave_repl_offset:815096^M^Jslave_priority:100^M^Jslave_read_only:1^M^Jconnected_slaves:0^M^Jmaster_replid:f8eac6c8a17a641b11523474ffa3dbd0af88977a^M^Jmaster_replid2:0000000000000000000000000000000000000000^M^Jmaster_repl_offset:815096^M^Jsecond_repl_offset:-1^M^Jrepl_backlog_active:1^M^Jrepl_backlog_size:1048576^M^Jrepl_backlog_first_byte_offset:1^M^Jrepl_backlog_histlen:815096^M^J"
13:11:56.700454 IP 172.28.5.4.55104 > 172.28.5.1.6379: Flags [.], ack 526, win 237, options [nop,nop,TS val 4071244892 ecr 3587839444], length 0
13:11:56.999372 IP 172.28.5.4.59842 > 172.28.5.2.6379: Flags [S], seq 2680706845, win 29200, options [mss 1460,sackOK,TS val 3594472473 ecr 0,nop,wscale 7], length 0
13:11:56.999554 IP 172.28.5.2.6379 > 172.28.5.4.59842: Flags [S.], seq 244371209, ack 2680706846, win 28960, options [mss 1460,sackOK,TS val 373935777 ecr 3594472473,nop,wscale 7], length 0
13:11:56.999656 IP 172.28.5.4.59842 > 172.28.5.2.6379: Flags [P.], seq 1:7, ack 1, win 229, options [nop,nop,TS val 3594472473 ecr 373935777], length 6: RESP "PING"
13:11:56.999772 IP 172.28.5.2.6379 > 172.28.5.4.59842: Flags [.], ack 7, win 227, options [nop,nop,TS val 373935777 ecr 3594472473], length 0
13:11:57.000157 IP 172.28.5.2.6379 > 172.28.5.4.59842: Flags [P.], seq 1:8, ack 7, win 227, options [nop,nop,TS val 373935778 ecr 3594472473], length 7: RESP "PONG"
13:11:57.000276 IP 172.28.5.4.59842 > 172.28.5.2.6379: Flags [P.], seq 7:25, ack 8, win 229, options [nop,nop,TS val 3594472474 ecr 373935778], length 18: RESP "info replication"
13:11:57.000488 IP 172.28.5.2.6379 > 172.28.5.4.59842: Flags [P.], seq 8:528, ack 25, win 227, options [nop,nop,TS val 373935778 ecr 3594472474], length 520: RESP "# Replication^M^Jrole:slave^M^Jmaster_host:172.28.5.0^M^Jmaster_port:6379^M^Jmaster_link_status:up^M^Jmaster_last_io_seconds_ago:0^M^Jmaster_sync_in_progress:0^M^Jslave_repl_offset:815096^M^Jslave_priority:100^M^Jslave_read_only:1^M^Jconnected_slaves:0^M^Jmaster_replid:f8eac6c8a17a641b11523474ffa3dbd0af88977a^M^Jmaster_replid2:0000000000000000000000000000000000000000^M^Jmaster_repl_offset:815096^M^Jsecond_repl_offset:-1^M^Jrepl_backlog_active:1^M^Jrepl_backlog_size:1048576^M^Jrepl_backlog_first_byte_offset:186^M^Jrepl_backlog_histlen:814911^M^J"
13:11:57.044034 IP 172.28.5.4.59842 > 172.28.5.2.6379: Flags [.], ack 528, win 237, options [nop,nop,TS val 3594472518 ecr 373935778], length 0
13:11:57.346646 IP 172.28.5.4.33638 > 172.28.5.0.6379: Flags [S], seq 2786805022, win 29200, options [mss 1460,sackOK,TS val 1873466112 ecr 0,nop,wscale 7], length 0
13:11:57.346856 IP 172.28.5.0.6379 > 172.28.5.4.33638: Flags [S.], seq 2945988768, ack 2786805023, win 28960, options [mss 1460,sackOK,TS val 232821046 ecr 1873466112,nop,wscale 7], length 0
13:11:57.346985 IP 172.28.5.4.33638 > 172.28.5.0.6379: Flags [P.], seq 1:7, ack 1, win 229, options [nop,nop,TS val 1873466113 ecr 232821046], length 6: RESP "PING"
13:11:57.347105 IP 172.28.5.0.6379 > 172.28.5.4.33638: Flags [.], ack 7, win 227, options [nop,nop,TS val 232821047 ecr 1873466113], length 0
13:11:57.347368 IP 172.28.5.0.6379 > 172.28.5.4.33638: Flags [P.], seq 1:8, ack 7, win 227, options [nop,nop,TS val 232821047 ecr 1873466113], length 7: RESP "PONG"
13:11:57.347475 IP 172.28.5.4.33638 > 172.28.5.0.6379: Flags [P.], seq 7:25, ack 8, win 229, options [nop,nop,TS val 1873466113 ecr 232821047], length 18: RESP "info replication"
13:11:57.347706 IP 172.28.5.0.6379 > 172.28.5.4.33638: Flags [P.], seq 8:470, ack 25, win 227, options [nop,nop,TS val 232821047 ecr 1873466113], length 462: RESP "# Replication^M^Jrole:master^M^Jconnected_slaves:2^M^Jslave0:ip=172.28.5.1,port=6379,state=online,offset=815096,lag=0^M^Jslave1:ip=172.28.5.2,port=6379,state=online,offset=815096,lag=1^M^Jmaster_replid:f8eac6c8a17a641b11523474ffa3dbd0af88977a^M^Jmaster_replid2:0000000000000000000000000000000000000000^M^Jmaster_repl_offset:815096^M^Jsecond_repl_offset:-1^M^Jrepl_backlog_active:1^M^Jrepl_backlog_size:1048576^M^Jrepl_backlog_first_byte_offset:1^M^Jrepl_backlog_histlen:815096^M^J"
13:11:57.348262 IP 172.28.5.4.33638 > 172.28.5.0.6379: Flags [P.], seq 25:31, ack 470, win 237, options [nop,nop,TS val 1873466114 ecr 232821047], length 6: RESP "QUIT"
13:11:57.348490 IP 172.28.5.0.6379 > 172.28.5.4.33638: Flags [P.], seq 470:475, ack 31, win 227, options [nop,nop,TS val 232821048 ecr 1873466114], length 5: RESP "OK"
13:11:57.348612 IP 172.28.5.0.6379 > 172.28.5.4.33638: Flags [F.], seq 475, ack 31, win 227, options [nop,nop,TS val 232821048 ecr 1873466114], length 0
13:11:57.348700 IP 172.28.5.4.33638 > 172.28.5.0.6379: Flags [R.], seq 31, ack 476, win 237, options [nop,nop,TS val 1873466114 ecr 232821048], length 0
13:11:57.659342 IP 172.28.5.4.55104 > 172.28.5.1.6379: Flags [R.], seq 25, ack 526, win 237, options [nop,nop,TS val 4071245851 ecr 3587839444], length 0
13:11:58.001041 IP 172.28.5.4.59842 > 172.28.5.2.6379: Flags [R.], seq 25, ack 528, win 237, options [nop,nop,TS val 3594473475 ecr 373935778], length 0
13:11:58.348824 IP 172.28.5.4.33646 > 172.28.5.0.6379: Flags [S], seq 715000847, win 29200, options [mss 1460,sackOK,TS val 1873467114 ecr 0,nop,wscale 7], length 0
13:11:58.349037 IP 172.28.5.0.6379 > 172.28.5.4.33646: Flags [S.], seq 3793437673, ack 715000848, win 28960, options [mss 1460,sackOK,TS val 232822049 ecr 1873467114,nop,wscale 7], length 0
13:11:58.349264 IP 172.28.5.4.33646 > 172.28.5.0.6379: Flags [P.], seq 1:7, ack 1, win 229, options [nop,nop,TS val 1873467115 ecr 232822049], length 6: RESP "PING"
13:11:58.349432 IP 172.28.5.0.6379 > 172.28.5.4.33646: Flags [.], ack 7, win 227, options [nop,nop,TS val 232822049 ecr 1873467115], length 0
13:11:58.349809 IP 172.28.5.0.6379 > 172.28.5.4.33646: Flags [P.], seq 1:8, ack 7, win 227, options [nop,nop,TS val 232822049 ecr 1873467115], length 7: RESP "PONG"
13:11:58.350115 IP 172.28.5.4.33646 > 172.28.5.0.6379: Flags [P.], seq 7:25, ack 8, win 229, options [nop,nop,TS val 1873467116 ecr 232822049], length 18: RESP "info replication"
13:11:58.350450 IP 172.28.5.0.6379 > 172.28.5.4.33646: Flags [P.], seq 8:470, ack 25, win 227, options [nop,nop,TS val 232822050 ecr 1873467116], length 462: RESP "# Replication^M^Jrole:master^M^Jconnected_slaves:2^M^Jslave0:ip=172.28.5.1,port=6379,state=online,offset=815392,lag=0^M^Jslave1:ip=172.28.5.2,port=6379,state=online,offset=815244,lag=1^M^Jmaster_replid:f8eac6c8a17a641b11523474ffa3dbd0af88977a^M^Jmaster_replid2:0000000000000000000000000000000000000000^M^Jmaster_repl_offset:815392^M^Jsecond_repl_offset:-1^M^Jrepl_backlog_active:1^M^Jrepl_backlog_size:1048576^M^Jrepl_backlog_first_byte_offset:1^M^Jrepl_backlog_histlen:815392^M^J"
13:11:58.350981 IP 172.28.5.4.33646 > 172.28.5.0.6379: Flags [P.], seq 25:31, ack 470, win 237, options [nop,nop,TS val 1873467117 ecr 232822050], length 6: RESP "QUIT"
13:11:58.351197 IP 172.28.5.0.6379 > 172.28.5.4.33646: Flags [P.], seq 470:475, ack 31, win 227, options [nop,nop,TS val 232822051 ecr 1873467117], length 5: RESP "OK"
13:11:58.351321 IP 172.28.5.0.6379 > 172.28.5.4.33646: Flags [F.], seq 475, ack 31, win 227, options [nop,nop,TS val 232822051 ecr 1873467117], length 0
13:11:58.351645 IP 172.28.5.4.33646 > 172.28.5.0.6379: Flags [F.], seq 31, ack 476, win 237, options [nop,nop,TS val 1873467117 ecr 232822051], length 0
13:11:58.351803 IP 172.28.5.0.6379 > 172.28.5.4.33646: Flags [.], ack 32, win 227, options [nop,nop,TS val 232822051 ecr 1873467117], length 0
13:11:58.661365 IP 172.28.5.4.55124 > 172.28.5.1.6379: Flags [S], seq 3687433051, win 29200, options [mss 1460,sackOK,TS val 4071246853 ecr 0,nop,wscale 7], length 0
13:11:58.661521 IP 172.28.5.1.6379 > 172.28.5.4.55124: Flags [S.], seq 1769989270, ack 3687433052, win 28960, options [mss 1460,sackOK,TS val 3587841447 ecr 4071246853,nop,wscale 7], length 0
13:11:58.661616 IP 172.28.5.4.55124 > 172.28.5.1.6379: Flags [P.], seq 1:7, ack 1, win 229, options [nop,nop,TS val 4071246853 ecr 3587841447], length 6: RESP "PING"
13:11:58.661704 IP 172.28.5.1.6379 > 172.28.5.4.55124: Flags [.], ack 7, win 227, options [nop,nop,TS val 3587841447 ecr 4071246853], length 0
13:11:58.661896 IP 172.28.5.1.6379 > 172.28.5.4.55124: Flags [P.], seq 1:8, ack 7, win 227, options [nop,nop,TS val 3587841447 ecr 4071246853], length 7: RESP "PONG"
13:11:58.661977 IP 172.28.5.4.55124 > 172.28.5.1.6379: Flags [P.], seq 7:25, ack 8, win 229, options [nop,nop,TS val 4071246854 ecr 3587841447], length 18: RESP "info replication"
13:11:58.662132 IP 172.28.5.1.6379 > 172.28.5.4.55124: Flags [P.], seq 8:526, ack 25, win 227, options [nop,nop,TS val 3587841448 ecr 4071246854], length 518: RESP "# Replication^M^Jrole:slave^M^Jmaster_host:172.28.5.0^M^Jmaster_port:6379^M^Jmaster_link_status:up^M^Jmaster_last_io_seconds_ago:0^M^Jmaster_sync_in_progress:0^M^Jslave_repl_offset:815540^M^Jslave_priority:100^M^Jslave_read_only:1^M^Jconnected_slaves:0^M^Jmaster_replid:f8eac6c8a17a641b11523474ffa3dbd0af88977a^M^Jmaster_replid2:0000000000000000000000000000000000000000^M^Jmaster_repl_offset:815540^M^Jsecond_repl_offset:-1^M^Jrepl_backlog_active:1^M^Jrepl_backlog_size:1048576^M^Jrepl_backlog_first_byte_offset:1^M^Jrepl_backlog_histlen:815540^M^J"
13:11:58.704449 IP 172.28.5.4.55124 > 172.28.5.1.6379: Flags [.], ack 526, win 237, options [nop,nop,TS val 4071246896 ecr 3587841448], length 0
13:11:59.001796 IP 172.28.5.4.59862 > 172.28.5.2.6379: Flags [S], seq 1496149627, win 29200, options [mss 1460,sackOK,TS val 3594474475 ecr 0,nop,wscale 7], length 0
13:11:59.002028 IP 172.28.5.2.6379 > 172.28.5.4.59862: Flags [S.], seq 34982021, ack 1496149628, win 28960, options [mss 1460,sackOK,TS val 373937780 ecr 3594474475,nop,wscale 7], length 0
13:11:59.002168 IP 172.28.5.4.59862 > 172.28.5.2.6379: Flags [P.], seq 1:7, ack 1, win 229, options [nop,nop,TS val 3594474476 ecr 373937780], length 6: RESP "PING"
13:11:59.002289 IP 172.28.5.2.6379 > 172.28.5.4.59862: Flags [.], ack 7, win 227, options [nop,nop,TS val 373937780 ecr 3594474476], length 0
13:11:59.002585 IP 172.28.5.2.6379 > 172.28.5.4.59862: Flags [P.], seq 1:8, ack 7, win 227, options [nop,nop,TS val 373937780 ecr 3594474476], length 7: RESP "PONG"
13:11:59.002756 IP 172.28.5.4.59862 > 172.28.5.2.6379: Flags [P.], seq 7:25, ack 8, win 229, options [nop,nop,TS val 3594474476 ecr 373937780], length 18: RESP "info replication"
13:11:59.003101 IP 172.28.5.2.6379 > 172.28.5.4.59862: Flags [P.], seq 8:528, ack 25, win 227, options [nop,nop,TS val 373937781 ecr 3594474476], length 520: RESP "# Replication^M^Jrole:slave^M^Jmaster_host:172.28.5.0^M^Jmaster_port:6379^M^Jmaster_link_status:up^M^Jmaster_last_io_seconds_ago:0^M^Jmaster_sync_in_progress:0^M^Jslave_repl_offset:815540^M^Jslave_priority:100^M^Jslave_read_only:1^M^Jconnected_slaves:0^M^Jmaster_replid:f8eac6c8a17a641b11523474ffa3dbd0af88977a^M^Jmaster_replid2:0000000000000000000000000000000000000000^M^Jmaster_repl_offset:815540^M^Jsecond_repl_offset:-1^M^Jrepl_backlog_active:1^M^Jrepl_backlog_size:1048576^M^Jrepl_backlog_first_byte_offset:186^M^Jrepl_backlog_histlen:815355^M^J"
13:11:59.044026 IP 172.28.5.4.59862 > 172.28.5.2.6379: Flags [.], ack 528, win 237, options [nop,nop,TS val 3594474518 ecr 373937781], length 0
13:11:59.352999 IP 172.28.5.4.33658 > 172.28.5.0.6379: Flags [S], seq 15065494, win 29200, options [mss 1460,sackOK,TS val 1873468119 ecr 0,nop,wscale 7], length 0
13:11:59.353207 IP 172.28.5.0.6379 > 172.28.5.4.33658: Flags [S.], seq 2455000371, ack 15065495, win 28960, options [mss 1460,sackOK,TS val 232823053 ecr 1873468119,nop,wscale 7], length 0
13:11:59.353350 IP 172.28.5.4.33658 > 172.28.5.0.6379: Flags [P.], seq 1:7, ack 1, win 229, options [nop,nop,TS val 1873468119 ecr 232823053], length 6: RESP "PING"
13:11:59.353488 IP 172.28.5.0.6379 > 172.28.5.4.33658: Flags [.], ack 7, win 227, options [nop,nop,TS val 232823053 ecr 1873468119], length 0
13:11:59.353812 IP 172.28.5.0.6379 > 172.28.5.4.33658: Flags [P.], seq 1:8, ack 7, win 227, options [nop,nop,TS val 232823053 ecr 1873468119], length 7: RESP "PONG"
13:11:59.354027 IP 172.28.5.4.33658 > 172.28.5.0.6379: Flags [P.], seq 7:25, ack 8, win 229, options [nop,nop,TS val 1873468120 ecr 232823053], length 18: RESP "info replication"
13:11:59.354376 IP 172.28.5.0.6379 > 172.28.5.4.33658: Flags [P.], seq 8:470, ack 25, win 227, options [nop,nop,TS val 232823054 ecr 1873468120], length 462: RESP "# Replication^M^Jrole:master^M^Jconnected_slaves:2^M^Jslave0:ip=172.28.5.1,port=6379,state=online,offset=815540,lag=0^M^Jslave1:ip=172.28.5.2,port=6379,state=online,offset=815540,lag=1^M^Jmaster_replid:f8eac6c8a17a641b11523474ffa3dbd0af88977a^M^Jmaster_replid2:0000000000000000000000000000000000000000^M^Jmaster_repl_offset:815540^M^Jsecond_repl_offset:-1^M^Jrepl_backlog_active:1^M^Jrepl_backlog_size:1048576^M^Jrepl_backlog_first_byte_offset:1^M^Jrepl_backlog_histlen:815540^M^J"
13:11:59.354564 IP 172.28.5.4.33658 > 172.28.5.0.6379: Flags [P.], seq 25:31, ack 470, win 237, options [nop,nop,TS val 1873468120 ecr 232823054], length 6: RESP "QUIT"
13:11:59.354886 IP 172.28.5.0.6379 > 172.28.5.4.33658: Flags [P.], seq 470:475, ack 31, win 227, options [nop,nop,TS val 232823054 ecr 1873468120], length 5: RESP "OK"
13:11:59.355014 IP 172.28.5.0.6379 > 172.28.5.4.33658: Flags [F.], seq 475, ack 31, win 227, options [nop,nop,TS val 232823055 ecr 1873468120], length 0
13:11:59.355084 IP 172.28.5.4.33658 > 172.28.5.0.6379: Flags [R.], seq 31, ack 476, win 237, options [nop,nop,TS val 1873468121 ecr 232823054], length 0
13:11:59.663699 IP 172.28.5.4.55124 > 172.28.5.1.6379: Flags [R.], seq 25, ack 526, win 237, options [nop,nop,TS val 4071247855 ecr 3587841448], length 0
13:12:00.003343 IP 172.28.5.4.59862 > 172.28.5.2.6379: Flags [R.], seq 25, ack 528, win 237, options [nop,nop,TS val 3594475477 ecr 373937781], length 0
13:12:00.354666 IP 172.28.5.4.33666 > 172.28.5.0.6379: Flags [S], seq 3750101694, win 29200, options [mss 1460,sackOK,TS val 1873469120 ecr 0,nop,wscale 7], length 0
13:12:00.354852 IP 172.28.5.0.6379 > 172.28.5.4.33666: Flags [S.], seq 2469821483, ack 3750101695, win 28960, options [mss 1460,sackOK,TS val 232824054 ecr 1873469120,nop,wscale 7], length 0
13:12:00.354962 IP 172.28.5.4.33666 > 172.28.5.0.6379: Flags [P.], seq 1:7, ack 1, win 229, options [nop,nop,TS val 1873469121 ecr 232824054], length 6: RESP "PING"
13:12:00.355069 IP 172.28.5.0.6379 > 172.28.5.4.33666: Flags [.], ack 7, win 227, options [nop,nop,TS val 232824055 ecr 1873469121], length 0
13:12:00.355396 IP 172.28.5.0.6379 > 172.28.5.4.33666: Flags [P.], seq 1:8, ack 7, win 227, options [nop,nop,TS val 232824055 ecr 1873469121], length 7: RESP "PONG"
13:12:00.355627 IP 172.28.5.4.33666 > 172.28.5.0.6379: Flags [P.], seq 7:25, ack 8, win 229, options [nop,nop,TS val 1873469121 ecr 232824055], length 18: RESP "info replication"
13:12:00.356051 IP 172.28.5.0.6379 > 172.28.5.4.33666: Flags [P.], seq 8:470, ack 25, win 227, options [nop,nop,TS val 232824056 ecr 1873469121], length 462: RESP "# Replication^M^Jrole:master^M^Jconnected_slaves:2^M^Jslave0:ip=172.28.5.1,port=6379,state=online,offset=815836,lag=0^M^Jslave1:ip=172.28.5.2,port=6379,state=online,offset=815688,lag=1^M^Jmaster_replid:f8eac6c8a17a641b11523474ffa3dbd0af88977a^M^Jmaster_replid2:0000000000000000000000000000000000000000^M^Jmaster_repl_offset:815836^M^Jsecond_repl_offset:-1^M^Jrepl_backlog_active:1^M^Jrepl_backlog_size:1048576^M^Jrepl_backlog_first_byte_offset:1^M^Jrepl_backlog_histlen:815836^M^J"
13:12:00.356496 IP 172.28.5.4.33666 > 172.28.5.0.6379: Flags [P.], seq 25:31, ack 470, win 237, options [nop,nop,TS val 1873469122 ecr 232824056], length 6: RESP "QUIT"
13:12:00.356713 IP 172.28.5.0.6379 > 172.28.5.4.33666: Flags [P.], seq 470:475, ack 31, win 227, options [nop,nop,TS val 232824056 ecr 1873469122], length 5: RESP "OK"
13:12:00.356941 IP 172.28.5.4.33666 > 172.28.5.0.6379: Flags [R.], seq 31, ack 475, win 237, options [nop,nop,TS val 1873469123 ecr 232824056], length 0
13:12:00.665593 IP 172.28.5.4.55144 > 172.28.5.1.6379: Flags [S], seq 179020686, win 29200, options [mss 1460,sackOK,TS val 4071248857 ecr 0,nop,wscale 7], length 0
13:12:00.665801 IP 172.28.5.1.6379 > 172.28.5.4.55144: Flags [S.], seq 3838064186, ack 179020687, win 28960, options [mss 1460,sackOK,TS val 3587843451 ecr 4071248857,nop,wscale 7], length 0
13:12:00.665977 IP 172.28.5.4.55144 > 172.28.5.1.6379: Flags [P.], seq 1:7, ack 1, win 229, options [nop,nop,TS val 4071248858 ecr 3587843451], length 6: RESP "PING"
13:12:00.666155 IP 172.28.5.1.6379 > 172.28.5.4.55144: Flags [.], ack 7, win 227, options [nop,nop,TS val 3587843452 ecr 4071248858], length 0
13:12:00.666482 IP 172.28.5.1.6379 > 172.28.5.4.55144: Flags [P.], seq 1:8, ack 7, win 227, options [nop,nop,TS val 3587843452 ecr 4071248858], length 7: RESP "PONG"
13:12:00.666636 IP 172.28.5.4.55144 > 172.28.5.1.6379: Flags [P.], seq 7:25, ack 8, win 229, options [nop,nop,TS val 4071248858 ecr 3587843452], length 18: RESP "info replication"
13:12:00.666877 IP 172.28.5.1.6379 > 172.28.5.4.55144: Flags [P.], seq 8:526, ack 25, win 227, options [nop,nop,TS val 3587843452 ecr 4071248858], length 518: RESP "# Replication^M^Jrole:slave^M^Jmaster_host:172.28.5.0^M^Jmaster_port:6379^M^Jmaster_link_status:up^M^Jmaster_last_io_seconds_ago:0^M^Jmaster_sync_in_progress:0^M^Jslave_repl_offset:815984^M^Jslave_priority:100^M^Jslave_read_only:1^M^Jconnected_slaves:0^M^Jmaster_replid:f8eac6c8a17a641b11523474ffa3dbd0af88977a^M^Jmaster_replid2:0000000000000000000000000000000000000000^M^Jmaster_repl_offset:815984^M^Jsecond_repl_offset:-1^M^Jrepl_backlog_active:1^M^Jrepl_backlog_size:1048576^M^Jrepl_backlog_first_byte_offset:1^M^Jrepl_backlog_histlen:815984^M^J"
13:12:00.708023 IP 172.28.5.4.55144 > 172.28.5.1.6379: Flags [.], ack 526, win 237, options [nop,nop,TS val 4071248900 ecr 3587843452], length 0
13:12:01.004514 IP 172.28.5.4.59882 > 172.28.5.2.6379: Flags [S], seq 19367918, win 29200, options [mss 1460,sackOK,TS val 3594476478 ecr 0,nop,wscale 7], length 0
13:12:01.004576 IP 172.28.5.2.6379 > 172.28.5.4.59882: Flags [S.], seq 3797078298, ack 19367919, win 28960, options [mss 1460,sackOK,TS val 373939782 ecr 3594476478,nop,wscale 7], length 0
13:12:01.004606 IP 172.28.5.4.59882 > 172.28.5.2.6379: Flags [P.], seq 1:7, ack 1, win 229, options [nop,nop,TS val 3594476478 ecr 373939782], length 6: RESP "PING"
13:12:01.004630 IP 172.28.5.2.6379 > 172.28.5.4.59882: Flags [.], ack 7, win 227, options [nop,nop,TS val 373939782 ecr 3594476478], length 0
13:12:01.004718 IP 172.28.5.2.6379 > 172.28.5.4.59882: Flags [P.], seq 1:8, ack 7, win 227, options [nop,nop,TS val 373939782 ecr 3594476478], length 7: RESP "PONG"
