13:13:05.174188 IP 172.28.5.4.55880 > 172.28.5.1.6379: Flags [S], seq 1135245675, win 29200, options [mss 1460,sackOK,TS val 4071313366 ecr 0,nop,wscale 7], length 0
13:13:05.174363 IP 172.28.5.1.6379 > 172.28.5.4.55880: Flags [S.], seq 331944697, ack 1135245676, win 28960, options [mss 1460,sackOK,TS val 3587907960 ecr 4071313366,nop,wscale 7], length 0
13:13:05.174465 IP 172.28.5.4.55880 > 172.28.5.1.6379: Flags [P.], seq 1:7, ack 1, win 229, options [nop,nop,TS val 4071313366 ecr 3587907960], length 6: RESP "PING"
13:13:05.174635 IP 172.28.5.1.6379 > 172.28.5.4.55880: Flags [.], ack 7, win 227, options [nop,nop,TS val 3587907960 ecr 4071313366], length 0
13:13:05.174900 IP 172.28.5.1.6379 > 172.28.5.4.55880: Flags [P.], seq 1:8, ack 7, win 227, options [nop,nop,TS val 3587907961 ecr 4071313366], length 7: RESP "PONG"
13:13:05.175019 IP 172.28.5.4.55880 > 172.28.5.1.6379: Flags [P.], seq 7:25, ack 8, win 229, options [nop,nop,TS val 4071313367 ecr 3587907961], length 18: RESP "info replication"
13:13:05.175199 IP 172.28.5.1.6379 > 172.28.5.4.55880: Flags [P.], seq 8:526, ack 25, win 227, options [nop,nop,TS val 3587907961 ecr 4071313367], length 518: RESP "# Replication^M^Jrole:slave^M^Jmaster_host:172.28.5.0^M^Jmaster_port:6379^M^Jmaster_link_status:up^M^Jmaster_last_io_seconds_ago:0^M^Jmaster_sync_in_progress:0^M^Jslave_repl_offset:830142^M^Jslave_priority:100^M^Jslave_read_only:1^M^Jconnected_slaves:0^M^Jmaster_replid:f8eac6c8a17a641b11523474ffa3dbd0af88977a^M^Jmaster_replid2:0000000000000000000000000000000000000000^M^Jmaster_repl_offset:830142^M^Jsecond_repl_offset:-1^M^Jrepl_backlog_active:1^M^Jrepl_backlog_size:1048576^M^Jrepl_backlog_first_byte_offset:1^M^Jrepl_backlog_histlen:830142^M^J"
13:13:05.216031 IP 172.28.5.4.55880 > 172.28.5.1.6379: Flags [.], ack 526, win 237, options [nop,nop,TS val 4071313408 ecr 3587907961], length 0
13:13:05.509847 IP 172.28.5.4.60618 > 172.28.5.2.6379: Flags [S], seq 2124609752, win 29200, options [mss 1460,sackOK,TS val 3594540984 ecr 0,nop,wscale 7], length 0
13:13:05.510036 IP 172.28.5.2.6379 > 172.28.5.4.60618: Flags [S.], seq 3185538466, ack 2124609753, win 28960, options [mss 1460,sackOK,TS val 374004288 ecr 3594540984,nop,wscale 7], length 0
13:13:05.510232 IP 172.28.5.4.60618 > 172.28.5.2.6379: Flags [P.], seq 1:7, ack 1, win 229, options [nop,nop,TS val 3594540984 ecr 374004288], length 6: RESP "PING"
13:13:05.510361 IP 172.28.5.2.6379 > 172.28.5.4.60618: Flags [.], ack 7, win 227, options [nop,nop,TS val 374004288 ecr 3594540984], length 0
13:13:05.510649 IP 172.28.5.2.6379 > 172.28.5.4.60618: Flags [P.], seq 1:8, ack 7, win 227, options [nop,nop,TS val 374004288 ecr 3594540984], length 7: RESP "PONG"
13:13:05.510805 IP 172.28.5.4.60618 > 172.28.5.2.6379: Flags [P.], seq 7:25, ack 8, win 229, options [nop,nop,TS val 3594540984 ecr 374004288], length 18: RESP "info replication"
13:13:05.511021 IP 172.28.5.2.6379 > 172.28.5.4.60618: Flags [P.], seq 8:528, ack 25, win 227, options [nop,nop,TS val 374004289 ecr 3594540984], length 520: RESP "# Replication^M^Jrole:slave^M^Jmaster_host:172.28.5.0^M^Jmaster_port:6379^M^Jmaster_link_status:up^M^Jmaster_last_io_seconds_ago:0^M^Jmaster_sync_in_progress:0^M^Jslave_repl_offset:830142^M^Jslave_priority:100^M^Jslave_read_only:1^M^Jconnected_slaves:0^M^Jmaster_replid:f8eac6c8a17a641b11523474ffa3dbd0af88977a^M^Jmaster_replid2:0000000000000000000000000000000000000000^M^Jmaster_repl_offset:830142^M^Jsecond_repl_offset:-1^M^Jrepl_backlog_active:1^M^Jrepl_backlog_size:1048576^M^Jrepl_backlog_first_byte_offset:186^M^Jrepl_backlog_histlen:829957^M^J"
13:13:05.552440 IP 172.28.5.4.60618 > 172.28.5.2.6379: Flags [.], ack 528, win 237, options [nop,nop,TS val 3594541026 ecr 374004289], length 0
13:13:05.850760 IP 172.28.5.4.34414 > 172.28.5.0.6379: Flags [S], seq 3896209438, win 29200, options [mss 1460,sackOK,TS val 1873534616 ecr 0,nop,wscale 7], length 0
13:13:05.850815 IP 172.28.5.0.6379 > 172.28.5.4.34414: Flags [S.], seq 3374323957, ack 3896209439, win 28960, options [mss 1460,sackOK,TS val 232889551 ecr 1873534616,nop,wscale 7], length 0
13:13:05.850847 IP 172.28.5.4.34414 > 172.28.5.0.6379: Flags [P.], seq 1:7, ack 1, win 229, options [nop,nop,TS val 1873534617 ecr 232889551], length 6: RESP "PING"
13:13:05.850874 IP 172.28.5.0.6379 > 172.28.5.4.34414: Flags [.], ack 7, win 227, options [nop,nop,TS val 232889551 ecr 1873534617], length 0
13:13:05.850973 IP 172.28.5.0.6379 > 172.28.5.4.34414: Flags [P.], seq 1:8, ack 7, win 227, options [nop,nop,TS val 232889551 ecr 1873534617], length 7: RESP "PONG"
13:13:05.851006 IP 172.28.5.4.34414 > 172.28.5.0.6379: Flags [P.], seq 7:25, ack 8, win 229, options [nop,nop,TS val 1873534617 ecr 232889551], length 18: RESP "info replication"
13:13:05.851081 IP 172.28.5.0.6379 > 172.28.5.4.34414: Flags [P.], seq 8:470, ack 25, win 227, options [nop,nop,TS val 232889551 ecr 1873534617], length 462: RESP "# Replication^M^Jrole:master^M^Jconnected_slaves:2^M^Jslave0:ip=172.28.5.1,port=6379,state=online,offset=830142,lag=0^M^Jslave1:ip=172.28.5.2,port=6379,state=online,offset=829994,lag=1^M^Jmaster_replid:f8eac6c8a17a641b11523474ffa3dbd0af88977a^M^Jmaster_replid2:0000000000000000000000000000000000000000^M^Jmaster_repl_offset:830142^M^Jsecond_repl_offset:-1^M^Jrepl_backlog_active:1^M^Jrepl_backlog_size:1048576^M^Jrepl_backlog_first_byte_offset:1^M^Jrepl_backlog_histlen:830142^M^J"
13:13:05.851107 IP 172.28.5.4.34414 > 172.28.5.0.6379: Flags [P.], seq 25:31, ack 470, win 237, options [nop,nop,TS val 1873534617 ecr 232889551], length 6: RESP "QUIT"
13:13:05.851140 IP 172.28.5.0.6379 > 172.28.5.4.34414: Flags [P.], seq 470:475, ack 31, win 227, options [nop,nop,TS val 232889551 ecr 1873534617], length 5: RESP "OK"
13:13:05.851162 IP 172.28.5.4.34414 > 172.28.5.0.6379: Flags [R.], seq 31, ack 475, win 237, options [nop,nop,TS val 1873534617 ecr 232889551], length 0
13:13:05.851162 IP 172.28.5.0.6379 > 172.28.5.4.34414: Flags [F.], seq 475, ack 31, win 227, options [nop,nop,TS val 232889551 ecr 1873534617], length 0
13:13:05.851180 IP 172.28.5.4.34414 > 172.28.5.0.6379: Flags [R], seq 3896209469, win 0, length 0
13:13:06.176128 IP 172.28.5.4.55880 > 172.28.5.1.6379: Flags [R.], seq 25, ack 526, win 237, options [nop,nop,TS val 4071314368 ecr 3587907961], length 0
13:13:06.510748 IP 172.28.5.4.60618 > 172.28.5.2.6379: Flags [R.], seq 25, ack 528, win 237, options [nop,nop,TS val 3594541984 ecr 374004289], length 0
13:13:06.852489 IP 172.28.5.4.34418 > 172.28.5.0.6379: Flags [S], seq 2179947286, win 29200, options [mss 1460,sackOK,TS val 1873535618 ecr 0,nop,wscale 7], length 0
13:13:06.852648 IP 172.28.5.0.6379 > 172.28.5.4.34418: Flags [S.], seq 4091291938, ack 2179947287, win 28960, options [mss 1460,sackOK,TS val 232890552 ecr 1873535618,nop,wscale 7], length 0
13:13:06.852747 IP 172.28.5.4.34418 > 172.28.5.0.6379: Flags [P.], seq 1:7, ack 1, win 229, options [nop,nop,TS val 1873535618 ecr 232890552], length 6: RESP "PING"
13:13:06.852848 IP 172.28.5.0.6379 > 172.28.5.4.34418: Flags [.], ack 7, win 227, options [nop,nop,TS val 232890553 ecr 1873535618], length 0
13:13:06.853101 IP 172.28.5.0.6379 > 172.28.5.4.34418: Flags [P.], seq 1:8, ack 7, win 227, options [nop,nop,TS val 232890553 ecr 1873535618], length 7: RESP "PONG"
13:13:06.853237 IP 172.28.5.4.34418 > 172.28.5.0.6379: Flags [P.], seq 7:25, ack 8, win 229, options [nop,nop,TS val 1873535619 ecr 232890553], length 18: RESP "info replication"
13:13:06.853543 IP 172.28.5.0.6379 > 172.28.5.4.34418: Flags [P.], seq 8:470, ack 25, win 227, options [nop,nop,TS val 232890553 ecr 1873535619], length 462: RESP "# Replication^M^Jrole:master^M^Jconnected_slaves:2^M^Jslave0:ip=172.28.5.1,port=6379,state=online,offset=830290,lag=0^M^Jslave1:ip=172.28.5.2,port=6379,state=online,offset=830290,lag=1^M^Jmaster_replid:f8eac6c8a17a641b11523474ffa3dbd0af88977a^M^Jmaster_replid2:0000000000000000000000000000000000000000^M^Jmaster_repl_offset:830438^M^Jsecond_repl_offset:-1^M^Jrepl_backlog_active:1^M^Jrepl_backlog_size:1048576^M^Jrepl_backlog_first_byte_offset:1^M^Jrepl_backlog_histlen:830438^M^J"
13:13:06.853682 IP 172.28.5.4.34418 > 172.28.5.0.6379: Flags [P.], seq 25:31, ack 470, win 237, options [nop,nop,TS val 1873535619 ecr 232890553], length 6: RESP "QUIT"
13:13:06.853887 IP 172.28.5.0.6379 > 172.28.5.4.34418: Flags [P.], seq 470:475, ack 31, win 227, options [nop,nop,TS val 232890554 ecr 1873535619], length 5: RESP "OK"
13:13:06.854018 IP 172.28.5.0.6379 > 172.28.5.4.34418: Flags [F.], seq 475, ack 31, win 227, options [nop,nop,TS val 232890554 ecr 1873535619], length 0
13:13:06.854035 IP 172.28.5.4.34418 > 172.28.5.0.6379: Flags [R.], seq 31, ack 475, win 237, options [nop,nop,TS val 1873535620 ecr 232890554], length 0
13:13:06.854066 IP 172.28.5.4.34418 > 172.28.5.0.6379: Flags [R], seq 2179947317, win 0, length 0
13:13:07.179074 IP 172.28.5.4.55896 > 172.28.5.1.6379: Flags [S], seq 3567483846, win 29200, options [mss 1460,sackOK,TS val 4071315371 ecr 0,nop,wscale 7], length 0
13:13:07.179306 IP 172.28.5.1.6379 > 172.28.5.4.55896: Flags [S.], seq 2390624297, ack 3567483847, win 28960, options [mss 1460,sackOK,TS val 3587909965 ecr 4071315371,nop,wscale 7], length 0
13:13:07.179452 IP 172.28.5.4.55896 > 172.28.5.1.6379: Flags [P.], seq 1:7, ack 1, win 229, options [nop,nop,TS val 4071315371 ecr 3587909965], length 6: RESP "PING"
13:13:07.179588 IP 172.28.5.1.6379 > 172.28.5.4.55896: Flags [.], ack 7, win 227, options [nop,nop,TS val 3587909965 ecr 4071315371], length 0
13:13:07.179947 IP 172.28.5.1.6379 > 172.28.5.4.55896: Flags [P.], seq 1:8, ack 7, win 227, options [nop,nop,TS val 3587909966 ecr 4071315371], length 7: RESP "PONG"
13:13:07.180184 IP 172.28.5.4.55896 > 172.28.5.1.6379: Flags [P.], seq 7:25, ack 8, win 229, options [nop,nop,TS val 4071315372 ecr 3587909966], length 18: RESP "info replication"
13:13:07.180468 IP 172.28.5.1.6379 > 172.28.5.4.55896: Flags [P.], seq 8:526, ack 25, win 227, options [nop,nop,TS val 3587909966 ecr 4071315372], length 518: RESP "# Replication^M^Jrole:slave^M^Jmaster_host:172.28.5.0^M^Jmaster_port:6379^M^Jmaster_link_status:up^M^Jmaster_last_io_seconds_ago:0^M^Jmaster_sync_in_progress:0^M^Jslave_repl_offset:830586^M^Jslave_priority:100^M^Jslave_read_only:1^M^Jconnected_slaves:0^M^Jmaster_replid:f8eac6c8a17a641b11523474ffa3dbd0af88977a^M^Jmaster_replid2:0000000000000000000000000000000000000000^M^Jmaster_repl_offset:830586^M^Jsecond_repl_offset:-1^M^Jrepl_backlog_active:1^M^Jrepl_backlog_size:1048576^M^Jrepl_backlog_first_byte_offset:1^M^Jrepl_backlog_histlen:830586^M^J"
13:13:07.224057 IP 172.28.5.4.55896 > 172.28.5.1.6379: Flags [.], ack 526, win 237, options [nop,nop,TS val 4071315416 ecr 3587909966], length 0
13:13:07.512511 IP 172.28.5.4.60634 > 172.28.5.2.6379: Flags [S], seq 3554062610, win 29200, options [mss 1460,sackOK,TS val 3594542986 ecr 0,nop,wscale 7], length 0
13:13:07.512713 IP 172.28.5.2.6379 > 172.28.5.4.60634: Flags [S.], seq 2723983472, ack 3554062611, win 28960, options [mss 1460,sackOK,TS val 374006290 ecr 3594542986,nop,wscale 7], length 0
13:13:07.512835 IP 172.28.5.4.60634 > 172.28.5.2.6379: Flags [P.], seq 1:7, ack 1, win 229, options [nop,nop,TS val 3594542987 ecr 374006290], length 6: RESP "PING"
13:13:07.512965 IP 172.28.5.2.6379 > 172.28.5.4.60634: Flags [.], ack 7, win 227, options [nop,nop,TS val 374006291 ecr 3594542987], length 0
13:13:07.513336 IP 172.28.5.2.6379 > 172.28.5.4.60634: Flags [P.], seq 1:8, ack 7, win 227, options [nop,nop,TS val 374006291 ecr 3594542987], length 7: RESP "PONG"
13:13:07.513529 IP 172.28.5.4.60634 > 172.28.5.2.6379: Flags [P.], seq 7:25, ack 8, win 229, options [nop,nop,TS val 3594542987 ecr 374006291], length 18: RESP "info replication"
13:13:07.513778 IP 172.28.5.2.6379 > 172.28.5.4.60634: Flags [P.], seq 8:528, ack 25, win 227, options [nop,nop,TS val 374006291 ecr 3594542987], length 520: RESP "# Replication^M^Jrole:slave^M^Jmaster_host:172.28.5.0^M^Jmaster_port:6379^M^Jmaster_link_status:up^M^Jmaster_last_io_seconds_ago:0^M^Jmaster_sync_in_progress:0^M^Jslave_repl_offset:830586^M^Jslave_priority:100^M^Jslave_read_only:1^M^Jconnected_slaves:0^M^Jmaster_replid:f8eac6c8a17a641b11523474ffa3dbd0af88977a^M^Jmaster_replid2:0000000000000000000000000000000000000000^M^Jmaster_repl_offset:830586^M^Jsecond_repl_offset:-1^M^Jrepl_backlog_active:1^M^Jrepl_backlog_size:1048576^M^Jrepl_backlog_first_byte_offset:186^M^Jrepl_backlog_histlen:830401^M^J"
13:13:07.556333 IP 172.28.5.4.60634 > 172.28.5.2.6379: Flags [.], ack 528, win 237, options [nop,nop,TS val 3594543030 ecr 374006291], length 0
13:13:07.854302 IP 172.28.5.4.34430 > 172.28.5.0.6379: Flags [S], seq 2911619709, win 29200, options [mss 1460,sackOK,TS val 1873536620 ecr 0,nop,wscale 7], length 0
13:13:07.854371 IP 172.28.5.0.6379 > 172.28.5.4.34430: Flags [S.], seq 550101354, ack 2911619710, win 28960, options [mss 1460,sackOK,TS val 232891554 ecr 1873536620,nop,wscale 7], length 0
13:13:07.854408 IP 172.28.5.4.34430 > 172.28.5.0.6379: Flags [P.], seq 1:7, ack 1, win 229, options [nop,nop,TS val 1873536620 ecr 232891554], length 6: RESP "PING"
13:13:07.854436 IP 172.28.5.0.6379 > 172.28.5.4.34430: Flags [.], ack 7, win 227, options [nop,nop,TS val 232891554 ecr 1873536620], length 0
13:13:07.854522 IP 172.28.5.0.6379 > 172.28.5.4.34430: Flags [P.], seq 1:8, ack 7, win 227, options [nop,nop,TS val 232891554 ecr 1873536620], length 7: RESP "PONG"
13:13:07.854551 IP 172.28.5.4.34430 > 172.28.5.0.6379: Flags [P.], seq 7:25, ack 8, win 229, options [nop,nop,TS val 1873536620 ecr 232891554], length 18: RESP "info replication"
13:13:07.854612 IP 172.28.5.0.6379 > 172.28.5.4.34430: Flags [P.], seq 8:470, ack 25, win 227, options [nop,nop,TS val 232891554 ecr 1873536620], length 462: RESP "# Replication^M^Jrole:master^M^Jconnected_slaves:2^M^Jslave0:ip=172.28.5.1,port=6379,state=online,offset=830586,lag=0^M^Jslave1:ip=172.28.5.2,port=6379,state=online,offset=830438,lag=1^M^Jmaster_replid:f8eac6c8a17a641b11523474ffa3dbd0af88977a^M^Jmaster_replid2:0000000000000000000000000000000000000000^M^Jmaster_repl_offset:830586^M^Jsecond_repl_offset:-1^M^Jrepl_backlog_active:1^M^Jrepl_backlog_size:1048576^M^Jrepl_backlog_first_byte_offset:1^M^Jrepl_backlog_histlen:830586^M^J"
13:13:07.854636 IP 172.28.5.4.34430 > 172.28.5.0.6379: Flags [P.], seq 25:31, ack 470, win 237, options [nop,nop,TS val 1873536620 ecr 232891554], length 6: RESP "QUIT"
13:13:07.854671 IP 172.28.5.0.6379 > 172.28.5.4.34430: Flags [P.], seq 470:475, ack 31, win 227, options [nop,nop,TS val 232891554 ecr 1873536620], length 5: RESP "OK"
13:13:07.854696 IP 172.28.5.0.6379 > 172.28.5.4.34430: Flags [F.], seq 475, ack 31, win 227, options [nop,nop,TS val 232891554 ecr 1873536620], length 0
13:13:07.854697 IP 172.28.5.4.34430 > 172.28.5.0.6379: Flags [R.], seq 31, ack 475, win 237, options [nop,nop,TS val 1873536620 ecr 232891554], length 0
13:13:07.854707 IP 172.28.5.4.34430 > 172.28.5.0.6379: Flags [R], seq 2911619740, win 0, length 0
13:13:08.180204 IP 172.28.5.4.55896 > 172.28.5.1.6379: Flags [R.], seq 25, ack 526, win 237, options [nop,nop,TS val 4071316372 ecr 3587909966], length 0
13:13:08.514511 IP 172.28.5.4.60634 > 172.28.5.2.6379: Flags [R.], seq 25, ack 528, win 237, options [nop,nop,TS val 3594543988 ecr 374006291], length 0
13:13:08.856303 IP 172.28.5.4.34434 > 172.28.5.0.6379: Flags [S], seq 3744804091, win 29200, options [mss 1460,sackOK,TS val 1873537622 ecr 0,nop,wscale 7], length 0
13:13:08.856548 IP 172.28.5.0.6379 > 172.28.5.4.34434: Flags [S.], seq 1192979545, ack 3744804092, win 28960, options [mss 1460,sackOK,TS val 232892556 ecr 1873537622,nop,wscale 7], length 0
13:13:08.856915 IP 172.28.5.4.34434 > 172.28.5.0.6379: Flags [P.], seq 1:7, ack 1, win 229, options [nop,nop,TS val 1873537623 ecr 232892556], length 6: RESP "PING"
13:13:08.857047 IP 172.28.5.0.6379 > 172.28.5.4.34434: Flags [.], ack 7, win 227, options [nop,nop,TS val 232892557 ecr 1873537623], length 0
13:13:08.857330 IP 172.28.5.0.6379 > 172.28.5.4.34434: Flags [P.], seq 1:8, ack 7, win 227, options [nop,nop,TS val 232892557 ecr 1873537623], length 7: RESP "PONG"
13:13:08.857430 IP 172.28.5.4.34434 > 172.28.5.0.6379: Flags [P.], seq 7:25, ack 8, win 229, options [nop,nop,TS val 1873537623 ecr 232892557], length 18: RESP "info replication"
13:13:08.857619 IP 172.28.5.0.6379 > 172.28.5.4.34434: Flags [P.], seq 8:470, ack 25, win 227, options [nop,nop,TS val 232892557 ecr 1873537623], length 462: RESP "# Replication^M^Jrole:master^M^Jconnected_slaves:2^M^Jslave0:ip=172.28.5.1,port=6379,state=online,offset=830734,lag=0^M^Jslave1:ip=172.28.5.2,port=6379,state=online,offset=830734,lag=1^M^Jmaster_replid:f8eac6c8a17a641b11523474ffa3dbd0af88977a^M^Jmaster_replid2:0000000000000000000000000000000000000000^M^Jmaster_repl_offset:830882^M^Jsecond_repl_offset:-1^M^Jrepl_backlog_active:1^M^Jrepl_backlog_size:1048576^M^Jrepl_backlog_first_byte_offset:1^M^Jrepl_backlog_histlen:830882^M^J"
13:13:08.857700 IP 172.28.5.4.34434 > 172.28.5.0.6379: Flags [P.], seq 25:31, ack 470, win 237, options [nop,nop,TS val 1873537623 ecr 232892557], length 6: RESP "QUIT"
13:13:08.857958 IP 172.28.5.0.6379 > 172.28.5.4.34434: Flags [P.], seq 470:475, ack 31, win 227, options [nop,nop,TS val 232892558 ecr 1873537623], length 5: RESP "OK"
13:13:08.858061 IP 172.28.5.0.6379 > 172.28.5.4.34434: Flags [F.], seq 475, ack 31, win 227, options [nop,nop,TS val 232892558 ecr 1873537623], length 0
13:13:08.858188 IP 172.28.5.4.34434 > 172.28.5.0.6379: Flags [R.], seq 31, ack 476, win 237, options [nop,nop,TS val 1873537624 ecr 232892558], length 0
13:13:09.182147 IP 172.28.5.4.55912 > 172.28.5.1.6379: Flags [S], seq 4153532837, win 29200, options [mss 1460,sackOK,TS val 4071317374 ecr 0,nop,wscale 7], length 0
13:13:09.182385 IP 172.28.5.1.6379 > 172.28.5.4.55912: Flags [S.], seq 1933415539, ack 4153532838, win 28960, options [mss 1460,sackOK,TS val 3587911968 ecr 4071317374,nop,wscale 7], length 0
13:13:09.182531 IP 172.28.5.4.55912 > 172.28.5.1.6379: Flags [P.], seq 1:7, ack 1, win 229, options [nop,nop,TS val 4071317374 ecr 3587911968], length 6: RESP "PING"
13:13:09.182674 IP 172.28.5.1.6379 > 172.28.5.4.55912: Flags [.], ack 7, win 227, options [nop,nop,TS val 3587911968 ecr 4071317374], length 0
13:13:09.183038 IP 172.28.5.1.6379 > 172.28.5.4.55912: Flags [P.], seq 1:8, ack 7, win 227, options [nop,nop,TS val 3587911969 ecr 4071317374], length 7: RESP "PONG"
13:13:09.183210 IP 172.28.5.4.55912 > 172.28.5.1.6379: Flags [P.], seq 7:25, ack 8, win 229, options [nop,nop,TS val 4071317375 ecr 3587911969], length 18: RESP "info replication"
13:13:09.183547 IP 172.28.5.1.6379 > 172.28.5.4.55912: Flags [P.], seq 8:526, ack 25, win 227, options [nop,nop,TS val 3587911969 ecr 4071317375], length 518: RESP "# Replication^M^Jrole:slave^M^Jmaster_host:172.28.5.0^M^Jmaster_port:6379^M^Jmaster_link_status:up^M^Jmaster_last_io_seconds_ago:0^M^Jmaster_sync_in_progress:0^M^Jslave_repl_offset:831030^M^Jslave_priority:100^M^Jslave_read_only:1^M^Jconnected_slaves:0^M^Jmaster_replid:f8eac6c8a17a641b11523474ffa3dbd0af88977a^M^Jmaster_replid2:0000000000000000000000000000000000000000^M^Jmaster_repl_offset:831030^M^Jsecond_repl_offset:-1^M^Jrepl_backlog_active:1^M^Jrepl_backlog_size:1048576^M^Jrepl_backlog_first_byte_offset:1^M^Jrepl_backlog_histlen:831030^M^J"
13:13:09.224080 IP 172.28.5.4.55912 > 172.28.5.1.6379: Flags [.], ack 526, win 237, options [nop,nop,TS val 4071317416 ecr 3587911969], length 0
13:13:09.516673 IP 172.28.5.4.60650 > 172.28.5.2.6379: Flags [S], seq 194929981, win 29200, options [mss 1460,sackOK,TS val 3594544990 ecr 0,nop,wscale 7], length 0
13:13:09.516906 IP 172.28.5.2.6379 > 172.28.5.4.60650: Flags [S.], seq 3368790157, ack 194929982, win 28960, options [mss 1460,sackOK,TS val 374008295 ecr 3594544990,nop,wscale 7], length 0
13:13:09.517055 IP 172.28.5.4.60650 > 172.28.5.2.6379: Flags [P.], seq 1:7, ack 1, win 229, options [nop,nop,TS val 3594544991 ecr 374008295], length 6: RESP "PING"
13:13:09.517196 IP 172.28.5.2.6379 > 172.28.5.4.60650: Flags [.], ack 7, win 227, options [nop,nop,TS val 374008295 ecr 3594544991], length 0
13:13:09.517558 IP 172.28.5.2.6379 > 172.28.5.4.60650: Flags [P.], seq 1:8, ack 7, win 227, options [nop,nop,TS val 374008295 ecr 3594544991], length 7: RESP "PONG"
13:13:09.517726 IP 172.28.5.4.60650 > 172.28.5.2.6379: Flags [P.], seq 7:25, ack 8, win 229, options [nop,nop,TS val 3594544991 ecr 374008295], length 18: RESP "info replication"
13:13:09.517973 IP 172.28.5.2.6379 > 172.28.5.4.60650: Flags [P.], seq 8:528, ack 25, win 227, options [nop,nop,TS val 374008296 ecr 3594544991], length 520: RESP "# Replication^M^Jrole:slave^M^Jmaster_host:172.28.5.0^M^Jmaster_port:6379^M^Jmaster_link_status:up^M^Jmaster_last_io_seconds_ago:0^M^Jmaster_sync_in_progress:0^M^Jslave_repl_offset:831030^M^Jslave_priority:100^M^Jslave_read_only:1^M^Jconnected_slaves:0^M^Jmaster_replid:f8eac6c8a17a641b11523474ffa3dbd0af88977a^M^Jmaster_replid2:0000000000000000000000000000000000000000^M^Jmaster_repl_offset:831030^M^Jsecond_repl_offset:-1^M^Jrepl_backlog_active:1^M^Jrepl_backlog_size:1048576^M^Jrepl_backlog_first_byte_offset:186^M^Jrepl_backlog_histlen:830845^M^J"
13:13:09.560075 IP 172.28.5.4.60650 > 172.28.5.2.6379: Flags [.], ack 528, win 237, options [nop,nop,TS val 3594545034 ecr 374008296], length 0
13:13:09.860176 IP 172.28.5.4.34446 > 172.28.5.0.6379: Flags [S], seq 1498411638, win 29200, options [mss 1460,sackOK,TS val 1873538626 ecr 0,nop,wscale 7], length 0
13:13:09.860322 IP 172.28.5.0.6379 > 172.28.5.4.34446: Flags [S.], seq 804986540, ack 1498411639, win 28960, options [mss 1460,sackOK,TS val 232893560 ecr 1873538626,nop,wscale 7], length 0
13:13:09.860433 IP 172.28.5.4.34446 > 172.28.5.0.6379: Flags [P.], seq 1:7, ack 1, win 229, options [nop,nop,TS val 1873538626 ecr 232893560], length 6: RESP "PING"
13:13:09.860567 IP 172.28.5.0.6379 > 172.28.5.4.34446: Flags [.], ack 7, win 227, options [nop,nop,TS val 232893560 ecr 1873538626], length 0
13:13:09.860867 IP 172.28.5.0.6379 > 172.28.5.4.34446: Flags [P.], seq 1:8, ack 7, win 227, options [nop,nop,TS val 232893561 ecr 1873538626], length 7: RESP "PONG"
13:13:09.861078 IP 172.28.5.4.34446 > 172.28.5.0.6379: Flags [P.], seq 7:25, ack 8, win 229, options [nop,nop,TS val 1873538627 ecr 232893561], length 18: RESP "info replication"
13:13:09.861560 IP 172.28.5.0.6379 > 172.28.5.4.34446: Flags [P.], seq 8:470, ack 25, win 227, options [nop,nop,TS val 232893561 ecr 1873538627], length 462: RESP "# Replication^M^Jrole:master^M^Jconnected_slaves:2^M^Jslave0:ip=172.28.5.1,port=6379,state=online,offset=831030,lag=0^M^Jslave1:ip=172.28.5.2,port=6379,state=online,offset=830882,lag=1^M^Jmaster_replid:f8eac6c8a17a641b11523474ffa3dbd0af88977a^M^Jmaster_replid2:0000000000000000000000000000000000000000^M^Jmaster_repl_offset:831030^M^Jsecond_repl_offset:-1^M^Jrepl_backlog_active:1^M^Jrepl_backlog_size:1048576^M^Jrepl_backlog_first_byte_offset:1^M^Jrepl_backlog_histlen:831030^M^J"
13:13:09.861747 IP 172.28.5.4.34446 > 172.28.5.0.6379: Flags [P.], seq 25:31, ack 470, win 237, options [nop,nop,TS val 1873538627 ecr 232893561], length 6: RESP "QUIT"
13:13:09.862024 IP 172.28.5.0.6379 > 172.28.5.4.34446: Flags [P.], seq 470:475, ack 31, win 227, options [nop,nop,TS val 232893562 ecr 1873538627], length 5: RESP "OK"
13:13:09.862148 IP 172.28.5.0.6379 > 172.28.5.4.34446: Flags [F.], seq 475, ack 31, win 227, options [nop,nop,TS val 232893562 ecr 1873538627], length 0
13:13:09.862179 IP 172.28.5.4.34446 > 172.28.5.0.6379: Flags [R.], seq 31, ack 475, win 237, options [nop,nop,TS val 1873538628 ecr 232893562], length 0
13:13:09.862196 IP 172.28.5.4.34446 > 172.28.5.0.6379: Flags [R], seq 1498411669, win 0, length 0
13:13:10.182924 IP 172.28.5.4.55912 > 172.28.5.1.6379: Flags [R.], seq 25, ack 526, win 237, options [nop,nop,TS val 4071318375 ecr 3587911969], length 0
13:13:10.519074 IP 172.28.5.4.60650 > 172.28.5.2.6379: Flags [R.], seq 25, ack 528, win 237, options [nop,nop,TS val 3594545993 ecr 374008296], length 0
13:13:10.862799 IP 172.28.5.4.34450 > 172.28.5.0.6379: Flags [S], seq 3062397694, win 29200, options [mss 1460,sackOK,TS val 1873539628 ecr 0,nop,wscale 7], length 0
13:13:10.862917 IP 172.28.5.0.6379 > 172.28.5.4.34450: Flags [S.], seq 4195109290, ack 3062397695, win 28960, options [mss 1460,sackOK,TS val 232894563 ecr 1873539628,nop,wscale 7], length 0
13:13:10.862991 IP 172.28.5.4.34450 > 172.28.5.0.6379: Flags [P.], seq 1:7, ack 1, win 229, options [nop,nop,TS val 1873539629 ecr 232894563], length 6: RESP "PING"
13:13:10.863056 IP 172.28.5.0.6379 > 172.28.5.4.34450: Flags [.], ack 7, win 227, options [nop,nop,TS val 232894563 ecr 1873539629], length 0
13:13:10.863252 IP 172.28.5.0.6379 > 172.28.5.4.34450: Flags [P.], seq 1:8, ack 7, win 227, options [nop,nop,TS val 232894563 ecr 1873539629], length 7: RESP "PONG"
13:13:10.863353 IP 172.28.5.4.34450 > 172.28.5.0.6379: Flags [P.], seq 7:25, ack 8, win 229, options [nop,nop,TS val 1873539629 ecr 232894563], length 18: RESP "info replication"
13:13:10.863548 IP 172.28.5.0.6379 > 172.28.5.4.34450: Flags [P.], seq 8:470, ack 25, win 227, options [nop,nop,TS val 232894563 ecr 1873539629], length 462: RESP "# Replication^M^Jrole:master^M^Jconnected_slaves:2^M^Jslave0:ip=172.28.5.1,port=6379,state=online,offset=831178,lag=0^M^Jslave1:ip=172.28.5.2,port=6379,state=online,offset=831030,lag=1^M^Jmaster_replid:f8eac6c8a17a641b11523474ffa3dbd0af88977a^M^Jmaster_replid2:0000000000000000000000000000000000000000^M^Jmaster_repl_offset:831178^M^Jsecond_repl_offset:-1^M^Jrepl_backlog_active:1^M^Jrepl_backlog_size:1048576^M^Jrepl_backlog_first_byte_offset:1^M^Jrepl_backlog_histlen:831178^M^J"
13:13:10.863809 IP 172.28.5.4.34450 > 172.28.5.0.6379: Flags [P.], seq 25:31, ack 470, win 237, options [nop,nop,TS val 1873539630 ecr 232894563], length 6: RESP "QUIT"
13:13:10.863934 IP 172.28.5.0.6379 > 172.28.5.4.34450: Flags [P.], seq 470:475, ack 31, win 227, options [nop,nop,TS val 232894564 ecr 1873539630], length 5: RESP "OK"
13:13:10.864093 IP 172.28.5.4.34450 > 172.28.5.0.6379: Flags [R.], seq 31, ack 475, win 237, options [nop,nop,TS val 1873539630 ecr 232894564], length 0
13:13:10.864161 IP 172.28.5.0.6379 > 172.28.5.4.34450: Flags [F.], seq 475, ack 31, win 227, options [nop,nop,TS val 232894564 ecr 1873539630], length 0
13:13:10.864194 IP 172.28.5.4.34450 > 172.28.5.0.6379: Flags [R], seq 3062397725, win 0, length 0
13:13:11.183830 IP 172.28.5.4.55928 > 172.28.5.1.6379: Flags [S], seq 1380291105, win 29200, options [mss 1460,sackOK,TS val 4071319375 ecr 0,nop,wscale 7], length 0
13:13:11.184080 IP 172.28.5.1.6379 > 172.28.5.4.55928: Flags [S.], seq 4286582801, ack 1380291106, win 28960, options [mss 1460,sackOK,TS val 3587913970 ecr 4071319375,nop,wscale 7], length 0
13:13:11.184280 IP 172.28.5.4.55928 > 172.28.5.1.6379: Flags [P.], seq 1:7, ack 1, win 229, options [nop,nop,TS val 4071319376 ecr 3587913970], length 6: RESP "PING"
13:13:11.184625 IP 172.28.5.1.6379 > 172.28.5.4.55928: Flags [.], ack 7, win 227, options [nop,nop,TS val 3587913970 ecr 4071319376], length 0
13:13:11.184924 IP 172.28.5.1.6379 > 172.28.5.4.55928: Flags [P.], seq 1:8, ack 7, win 227, options [nop,nop,TS val 3587913971 ecr 4071319376], length 7: RESP "PONG"
13:13:11.185094 IP 172.28.5.4.55928 > 172.28.5.1.6379: Flags [P.], seq 7:25, ack 8, win 229, options [nop,nop,TS val 4071319377 ecr 3587913971], length 18: RESP "info replication"
13:13:11.185393 IP 172.28.5.1.6379 > 172.28.5.4.55928: Flags [P.], seq 8:526, ack 25, win 227, options [nop,nop,TS val 3587913971 ecr 4071319377], length 518: RESP "# Replication^M^Jrole:slave^M^Jmaster_host:172.28.5.0^M^Jmaster_port:6379^M^Jmaster_link_status:up^M^Jmaster_last_io_seconds_ago:1^M^Jmaster_sync_in_progress:0^M^Jslave_repl_offset:831326^M^Jslave_priority:100^M^Jslave_read_only:1^M^Jconnected_slaves:0^M^Jmaster_replid:f8eac6c8a17a641b11523474ffa3dbd0af88977a^M^Jmaster_replid2:0000000000000000000000000000000000000000^M^Jmaster_repl_offset:831326^M^Jsecond_repl_offset:-1^M^Jrepl_backlog_active:1^M^Jrepl_backlog_size:1048576^M^Jrepl_backlog_first_byte_offset:1^M^Jrepl_backlog_histlen:831326^M^J"
13:13:11.228028 IP 172.28.5.4.55928 > 172.28.5.1.6379: Flags [.], ack 526, win 237, options [nop,nop,TS val 4071319420 ecr 3587913971], length 0
13:13:11.520203 IP 172.28.5.4.60666 > 172.28.5.2.6379: Flags [S], seq 41262762, win 29200, options [mss 1460,sackOK,TS val 3594546994 ecr 0,nop,wscale 7], length 0
13:13:11.520382 IP 172.28.5.2.6379 > 172.28.5.4.60666: Flags [S.], seq 2454233222, ack 41262763, win 28960, options [mss 1460,sackOK,TS val 374010298 ecr 3594546994,nop,wscale 7], length 0
13:13:11.520505 IP 172.28.5.4.60666 > 172.28.5.2.6379: Flags [P.], seq 1:7, ack 1, win 229, options [nop,nop,TS val 3594546994 ecr 374010298], length 6: RESP "PING"
13:13:11.520618 IP 172.28.5.2.6379 > 172.28.5.4.60666: Flags [.], ack 7, win 227, options [nop,nop,TS val 374010298 ecr 3594546994], length 0
13:13:11.520925 IP 172.28.5.2.6379 > 172.28.5.4.60666: Flags [P.], seq 1:8, ack 7, win 227, options [nop,nop,TS val 374010299 ecr 3594546994], length 7: RESP "PONG"
13:13:11.521067 IP 172.28.5.4.60666 > 172.28.5.2.6379: Flags [P.], seq 7:25, ack 8, win 229, options [nop,nop,TS val 3594546995 ecr 374010299], length 18: RESP "info replication"
13:13:11.521322 IP 172.28.5.2.6379 > 172.28.5.4.60666: Flags [P.], seq 8:528, ack 25, win 227, options [nop,nop,TS val 374010299 ecr 3594546995], length 520: RESP "# Replication^M^Jrole:slave^M^Jmaster_host:172.28.5.0^M^Jmaster_port:6379^M^Jmaster_link_status:up^M^Jmaster_last_io_seconds_ago:0^M^Jmaster_sync_in_progress:0^M^Jslave_repl_offset:831474^M^Jslave_priority:100^M^Jslave_read_only:1^M^Jconnected_slaves:0^M^Jmaster_replid:f8eac6c8a17a641b11523474ffa3dbd0af88977a^M^Jmaster_replid2:0000000000000000000000000000000000000000^M^Jmaster_repl_offset:831474^M^Jsecond_repl_offset:-1^M^Jrepl_backlog_active:1^M^Jrepl_backlog_size:1048576^M^Jrepl_backlog_first_byte_offset:186^M^Jrepl_backlog_histlen:831289^M^J"
13:13:11.564092 IP 172.28.5.4.60666 > 172.28.5.2.6379: Flags [.], ack 528, win 237, options [nop,nop,TS val 3594547038 ecr 374010299], length 0
13:13:11.865002 IP 172.28.5.4.34462 > 172.28.5.0.6379: Flags [S], seq 4275358300, win 29200, options [mss 1460,sackOK,TS val 1873540631 ecr 0,nop,wscale 7], length 0
13:13:11.865153 IP 172.28.5.0.6379 > 172.28.5.4.34462: Flags [S.], seq 1196900695, ack 4275358301, win 28960, options [mss 1460,sackOK,TS val 232895565 ecr 1873540631,nop,wscale 7], length 0
13:13:11.865262 IP 172.28.5.4.34462 > 172.28.5.0.6379: Flags [P.], seq 1:7, ack 1, win 229, options [nop,nop,TS val 1873540631 ecr 232895565], length 6: RESP "PING"
13:13:11.865350 IP 172.28.5.0.6379 > 172.28.5.4.34462: Flags [.], ack 7, win 227, options [nop,nop,TS val 232895565 ecr 1873540631], length 0
13:13:11.865537 IP 172.28.5.0.6379 > 172.28.5.4.34462: Flags [P.], seq 1:8, ack 7, win 227, options [nop,nop,TS val 232895565 ecr 1873540631], length 7: RESP "PONG"
13:13:11.865631 IP 172.28.5.4.34462 > 172.28.5.0.6379: Flags [P.], seq 7:25, ack 8, win 229, options [nop,nop,TS val 1873540631 ecr 232895565], length 18: RESP "info replication"
13:13:11.865844 IP 172.28.5.0.6379 > 172.28.5.4.34462: Flags [P.], seq 8:470, ack 25, win 227, options [nop,nop,TS val 232895566 ecr 1873540631], length 462: RESP "# Replication^M^Jrole:master^M^Jconnected_slaves:2^M^Jslave0:ip=172.28.5.1,port=6379,state=online,offset=831474,lag=0^M^Jslave1:ip=172.28.5.2,port=6379,state=online,offset=831326,lag=1^M^Jmaster_replid:f8eac6c8a17a641b11523474ffa3dbd0af88977a^M^Jmaster_replid2:0000000000000000000000000000000000000000^M^Jmaster_repl_offset:831474^M^Jsecond_repl_offset:-1^M^Jrepl_backlog_active:1^M^Jrepl_backlog_size:1048576^M^Jrepl_backlog_first_byte_offset:1^M^Jrepl_backlog_histlen:831474^M^J"
13:13:11.865948 IP 172.28.5.4.34462 > 172.28.5.0.6379: Flags [P.], seq 25:31, ack 470, win 237, options [nop,nop,TS val 1873540632 ecr 232895566], length 6: RESP "QUIT"
13:13:11.866085 IP 172.28.5.0.6379 > 172.28.5.4.34462: Flags [P.], seq 470:475, ack 31, win 227, options [nop,nop,TS val 232895566 ecr 1873540632], length 5: RESP "OK"
13:13:11.866176 IP 172.28.5.0.6379 > 172.28.5.4.34462: Flags [F.], seq 475, ack 31, win 227, options [nop,nop,TS val 232895566 ecr 1873540632], length 0
13:13:11.866327 IP 172.28.5.4.34462 > 172.28.5.0.6379: Flags [F.], seq 31, ack 476, win 237, options [nop,nop,TS val 1873540632 ecr 232895566], length 0
13:13:11.866412 IP 172.28.5.0.6379 > 172.28.5.4.34462: Flags [.], ack 32, win 227, options [nop,nop,TS val 232895566 ecr 1873540632], length 0
13:13:12.184929 IP 172.28.5.4.55928 > 172.28.5.1.6379: Flags [R.], seq 25, ack 526, win 237, options [nop,nop,TS val 4071320377 ecr 3587913971], length 0
13:13:12.522621 IP 172.28.5.4.60666 > 172.28.5.2.6379: Flags [R.], seq 25, ack 528, win 237, options [nop,nop,TS val 3594547996 ecr 374010299], length 0
13:13:12.866369 IP 172.28.5.4.34468 > 172.28.5.0.6379: Flags [S], seq 2815054125, win 29200, options [mss 1460,sackOK,TS val 1873541632 ecr 0,nop,wscale 7], length 0
13:13:12.866525 IP 172.28.5.0.6379 > 172.28.5.4.34468: Flags [S.], seq 3861115934, ack 2815054126, win 28960, options [mss 1460,sackOK,TS val 232896566 ecr 1873541632,nop,wscale 7], length 0
13:13:12.866649 IP 172.28.5.4.34468 > 172.28.5.0.6379: Flags [P.], seq 1:7, ack 1, win 229, options [nop,nop,TS val 1873541632 ecr 232896566], length 6: RESP "PING"
13:13:12.866777 IP 172.28.5.0.6379 > 172.28.5.4.34468: Flags [.], ack 7, win 227, options [nop,nop,TS val 232896566 ecr 1873541632], length 0
13:13:12.867008 IP 172.28.5.0.6379 > 172.28.5.4.34468: Flags [P.], seq 1:8, ack 7, win 227, options [nop,nop,TS val 232896567 ecr 1873541632], length 7: RESP "PONG"
13:13:12.867109 IP 172.28.5.4.34468 > 172.28.5.0.6379: Flags [P.], seq 7:25, ack 8, win 229, options [nop,nop,TS val 1873541633 ecr 232896567], length 18: RESP "info replication"
13:13:12.867299 IP 172.28.5.0.6379 > 172.28.5.4.34468: Flags [P.], seq 8:470, ack 25, win 227, options [nop,nop,TS val 232896567 ecr 1873541633], length 462: RESP "# Replication^M^Jrole:master^M^Jconnected_slaves:2^M^Jslave0:ip=172.28.5.1,port=6379,state=online,offset=831622,lag=0^M^Jslave1:ip=172.28.5.2,port=6379,state=online,offset=831474,lag=1^M^Jmaster_replid:f8eac6c8a17a641b11523474ffa3dbd0af88977a^M^Jmaster_replid2:0000000000000000000000000000000000000000^M^Jmaster_repl_offset:831636^M^Jsecond_repl_offset:-1^M^Jrepl_backlog_active:1^M^Jrepl_backlog_size:1048576^M^Jrepl_backlog_first_byte_offset:1^M^Jrepl_backlog_histlen:831636^M^J"
13:13:12.867376 IP 172.28.5.4.34468 > 172.28.5.0.6379: Flags [P.], seq 25:31, ack 470, win 237, options [nop,nop,TS val 1873541633 ecr 232896567], length 6: RESP "QUIT"
13:13:12.867477 IP 172.28.5.0.6379 > 172.28.5.4.34468: Flags [P.], seq 470:475, ack 31, win 227, options [nop,nop,TS val 232896567 ecr 1873541633], length 5: RESP "OK"
13:13:12.867551 IP 172.28.5.0.6379 > 172.28.5.4.34468: Flags [F.], seq 475, ack 31, win 227, options [nop,nop,TS val 232896567 ecr 1873541633], length 0
13:13:12.867551 IP 172.28.5.4.34468 > 172.28.5.0.6379: Flags [R.], seq 31, ack 475, win 237, options [nop,nop,TS val 1873541633 ecr 232896567], length 0
13:13:12.867581 IP 172.28.5.4.34468 > 172.28.5.0.6379: Flags [R], seq 2815054156, win 0, length 0
13:13:13.186462 IP 172.28.5.4.55946 > 172.28.5.1.6379: Flags [S], seq 2765504689, win 29200, options [mss 1460,sackOK,TS val 4071321378 ecr 0,nop,wscale 7], length 0
13:13:13.186637 IP 172.28.5.1.6379 > 172.28.5.4.55946: Flags [S.], seq 4251548515, ack 2765504690, win 28960, options [mss 1460,sackOK,TS val 3587915972 ecr 4071321378,nop,wscale 7], length 0
13:13:13.186742 IP 172.28.5.4.55946 > 172.28.5.1.6379: Flags [P.], seq 1:7, ack 1, win 229, options [nop,nop,TS val 4071321378 ecr 3587915972], length 6: RESP "PING"
13:13:13.186861 IP 172.28.5.1.6379 > 172.28.5.4.55946: Flags [.], ack 7, win 227, options [nop,nop,TS val 3587915973 ecr 4071321378], length 0
13:13:13.187172 IP 172.28.5.1.6379 > 172.28.5.4.55946: Flags [P.], seq 1:8, ack 7, win 227, options [nop,nop,TS val 3587915973 ecr 4071321378], length 7: RESP "PONG"
13:13:13.187305 IP 172.28.5.4.55946 > 172.28.5.1.6379: Flags [P.], seq 7:25, ack 8, win 229, options [nop,nop,TS val 4071321379 ecr 3587915973], length 18: RESP "info replication"
13:13:13.187532 IP 172.28.5.1.6379 > 172.28.5.4.55946: Flags [P.], seq 8:526, ack 25, win 227, options [nop,nop,TS val 3587915973 ecr 4071321379], length 518: RESP "# Replication^M^Jrole:slave^M^Jmaster_host:172.28.5.0^M^Jmaster_port:6379^M^Jmaster_link_status:up^M^Jmaster_last_io_seconds_ago:1^M^Jmaster_sync_in_progress:0^M^Jslave_repl_offset:831784^M^Jslave_priority:100^M^Jslave_read_only:1^M^Jconnected_slaves:0^M^Jmaster_replid:f8eac6c8a17a641b11523474ffa3dbd0af88977a^M^Jmaster_replid2:0000000000000000000000000000000000000000^M^Jmaster_repl_offset:831784^M^Jsecond_repl_offset:-1^M^Jrepl_backlog_active:1^M^Jrepl_backlog_size:1048576^M^Jrepl_backlog_first_byte_offset:1^M^Jrepl_backlog_histlen:831784^M^J"
13:13:13.228033 IP 172.28.5.4.55946 > 172.28.5.1.6379: Flags [.], ack 526, win 237, options [nop,nop,TS val 4071321420 ecr 3587915973], length 0
13:13:13.524061 IP 172.28.5.4.60684 > 172.28.5.2.6379: Flags [S], seq 3309871934, win 29200, options [mss 1460,sackOK,TS val 3594548998 ecr 0,nop,wscale 7], length 0
13:13:13.524136 IP 172.28.5.2.6379 > 172.28.5.4.60684: Flags [S.], seq 1912301726, ack 3309871935, win 28960, options [mss 1460,sackOK,TS val 374012302 ecr 3594548998,nop,wscale 7], length 0
13:13:13.524182 IP 172.28.5.4.60684 > 172.28.5.2.6379: Flags [P.], seq 1:7, ack 1, win 229, options [nop,nop,TS val 3594548998 ecr 374012302], length 6: RESP "PING"
13:13:13.524221 IP 172.28.5.2.6379 > 172.28.5.4.60684: Flags [.], ack 7, win 227, options [nop,nop,TS val 374012302 ecr 3594548998], length 0
13:13:13.524321 IP 172.28.5.2.6379 > 172.28.5.4.60684: Flags [P.], seq 1:8, ack 7, win 227, options [nop,nop,TS val 374012302 ecr 3594548998], length 7: RESP "PONG"
13:13:13.524375 IP 172.28.5.4.60684 > 172.28.5.2.6379: Flags [P.], seq 7:25, ack 8, win 229, options [nop,nop,TS val 3594548998 ecr 374012302], length 18: RESP "info replication"
13:13:13.524467 IP 172.28.5.2.6379 > 172.28.5.4.60684: Flags [P.], seq 8:528, ack 25, win 227, options [nop,nop,TS val 374012302 ecr 3594548998], length 520: RESP "# Replication^M^Jrole:slave^M^Jmaster_host:172.28.5.0^M^Jmaster_port:6379^M^Jmaster_link_status:up^M^Jmaster_last_io_seconds_ago:0^M^Jmaster_sync_in_progress:0^M^Jslave_repl_offset:831932^M^Jslave_priority:100^M^Jslave_read_only:1^M^Jconnected_slaves:0^M^Jmaster_replid:f8eac6c8a17a641b11523474ffa3dbd0af88977a^M^Jmaster_replid2:0000000000000000000000000000000000000000^M^Jmaster_repl_offset:831932^M^Jsecond_repl_offset:-1^M^Jrepl_backlog_active:1^M^Jrepl_backlog_size:1048576^M^Jrepl_backlog_first_byte_offset:186^M^Jrepl_backlog_histlen:831747^M^J"
13:13:13.568444 IP 172.28.5.4.60684 > 172.28.5.2.6379: Flags [.], ack 528, win 237, options [nop,nop,TS val 3594549042 ecr 374012302], length 0
13:13:13.868097 IP 172.28.5.4.34480 > 172.28.5.0.6379: Flags [S], seq 293868252, win 29200, options [mss 1460,sackOK,TS val 1873542634 ecr 0,nop,wscale 7], length 0
13:13:13.868225 IP 172.28.5.0.6379 > 172.28.5.4.34480: Flags [S.], seq 1485752086, ack 293868253, win 28960, options [mss 1460,sackOK,TS val 232897568 ecr 1873542634,nop,wscale 7], length 0
13:13:13.868303 IP 172.28.5.4.34480 > 172.28.5.0.6379: Flags [P.], seq 1:7, ack 1, win 229, options [nop,nop,TS val 1873542634 ecr 232897568], length 6: RESP "PING"
13:13:13.868372 IP 172.28.5.0.6379 > 172.28.5.4.34480: Flags [.], ack 7, win 227, options [nop,nop,TS val 232897568 ecr 1873542634], length 0
13:13:13.868547 IP 172.28.5.0.6379 > 172.28.5.4.34480: Flags [P.], seq 1:8, ack 7, win 227, options [nop,nop,TS val 232897568 ecr 1873542634], length 7: RESP "PONG"
