13:12:28.904653 IP 172.28.5.4.55438 > 172.28.5.1.6379: Flags [S], seq 1989987422, win 29200, options [mss 1460,sackOK,TS val 4071277096 ecr 0,nop,wscale 7], length 0
13:12:28.904884 IP 172.28.5.1.6379 > 172.28.5.4.55438: Flags [S.], seq 662744074, ack 1989987423, win 28960, options [mss 1460,sackOK,TS val 3587871691 ecr 4071277096,nop,wscale 7], length 0
13:12:28.905011 IP 172.28.5.4.55438 > 172.28.5.1.6379: Flags [P.], seq 1:7, ack 1, win 229, options [nop,nop,TS val 4071277097 ecr 3587871691], length 6: RESP "PING"
13:12:28.905144 IP 172.28.5.1.6379 > 172.28.5.4.55438: Flags [.], ack 7, win 227, options [nop,nop,TS val 3587871691 ecr 4071277097], length 0
13:12:28.905509 IP 172.28.5.1.6379 > 172.28.5.4.55438: Flags [P.], seq 1:8, ack 7, win 227, options [nop,nop,TS val 3587871691 ecr 4071277097], length 7: RESP "PONG"
13:12:28.905674 IP 172.28.5.4.55438 > 172.28.5.1.6379: Flags [P.], seq 7:25, ack 8, win 229, options [nop,nop,TS val 4071277097 ecr 3587871691], length 18: RESP "info replication"
13:12:28.905981 IP 172.28.5.1.6379 > 172.28.5.4.55438: Flags [P.], seq 8:526, ack 25, win 227, options [nop,nop,TS val 3587871692 ecr 4071277097], length 518: RESP "# Replication^M^Jrole:slave^M^Jmaster_host:172.28.5.0^M^Jmaster_port:6379^M^Jmaster_link_status:up^M^Jmaster_last_io_seconds_ago:0^M^Jmaster_sync_in_progress:0^M^Jslave_repl_offset:822094^M^Jslave_priority:100^M^Jslave_read_only:1^M^Jconnected_slaves:0^M^Jmaster_replid:f8eac6c8a17a641b11523474ffa3dbd0af88977a^M^Jmaster_replid2:0000000000000000000000000000000000000000^M^Jmaster_repl_offset:822094^M^Jsecond_repl_offset:-1^M^Jrepl_backlog_active:1^M^Jrepl_backlog_size:1048576^M^Jrepl_backlog_first_byte_offset:1^M^Jrepl_backlog_histlen:822094^M^J"
13:12:28.948118 IP 172.28.5.4.55438 > 172.28.5.1.6379: Flags [.], ack 526, win 237, options [nop,nop,TS val 4071277140 ecr 3587871692], length 0
13:12:29.239812 IP 172.28.5.4.60176 > 172.28.5.2.6379: Flags [S], seq 3913630323, win 29200, options [mss 1460,sackOK,TS val 3594504713 ecr 0,nop,wscale 7], length 0
13:12:29.240028 IP 172.28.5.2.6379 > 172.28.5.4.60176: Flags [S.], seq 1177548938, ack 3913630324, win 28960, options [mss 1460,sackOK,TS val 373968018 ecr 3594504713,nop,wscale 7], length 0
13:12:29.240152 IP 172.28.5.4.60176 > 172.28.5.2.6379: Flags [P.], seq 1:7, ack 1, win 229, options [nop,nop,TS val 3594504714 ecr 373968018], length 6: RESP "PING"
13:12:29.240425 IP 172.28.5.2.6379 > 172.28.5.4.60176: Flags [.], ack 7, win 227, options [nop,nop,TS val 373968018 ecr 3594504714], length 0
13:12:29.240852 IP 172.28.5.2.6379 > 172.28.5.4.60176: Flags [P.], seq 1:8, ack 7, win 227, options [nop,nop,TS val 373968018 ecr 3594504714], length 7: RESP "PONG"
13:12:29.241040 IP 172.28.5.4.60176 > 172.28.5.2.6379: Flags [P.], seq 7:25, ack 8, win 229, options [nop,nop,TS val 3594504715 ecr 373968018], length 18: RESP "info replication"
13:12:29.241350 IP 172.28.5.2.6379 > 172.28.5.4.60176: Flags [P.], seq 8:528, ack 25, win 227, options [nop,nop,TS val 373968019 ecr 3594504715], length 520: RESP "# Replication^M^Jrole:slave^M^Jmaster_host:172.28.5.0^M^Jmaster_port:6379^M^Jmaster_link_status:up^M^Jmaster_last_io_seconds_ago:0^M^Jmaster_sync_in_progress:0^M^Jslave_repl_offset:822242^M^Jslave_priority:100^M^Jslave_read_only:1^M^Jconnected_slaves:0^M^Jmaster_replid:f8eac6c8a17a641b11523474ffa3dbd0af88977a^M^Jmaster_replid2:0000000000000000000000000000000000000000^M^Jmaster_repl_offset:822242^M^Jsecond_repl_offset:-1^M^Jrepl_backlog_active:1^M^Jrepl_backlog_size:1048576^M^Jrepl_backlog_first_byte_offset:186^M^Jrepl_backlog_histlen:822057^M^J"
13:12:29.284465 IP 172.28.5.4.60176 > 172.28.5.2.6379: Flags [.], ack 528, win 237, options [nop,nop,TS val 3594504758 ecr 373968019], length 0
13:12:29.576627 IP 172.28.5.4.33972 > 172.28.5.0.6379: Flags [S], seq 274389056, win 29200, options [mss 1460,sackOK,TS val 1873498342 ecr 0,nop,wscale 7], length 0
13:12:29.576800 IP 172.28.5.0.6379 > 172.28.5.4.33972: Flags [S.], seq 2882368722, ack 274389057, win 28960, options [mss 1460,sackOK,TS val 232853276 ecr 1873498342,nop,wscale 7], length 0
13:12:29.576942 IP 172.28.5.4.33972 > 172.28.5.0.6379: Flags [P.], seq 1:7, ack 1, win 229, options [nop,nop,TS val 1873498343 ecr 232853276], length 6: RESP "PING"
13:12:29.577064 IP 172.28.5.0.6379 > 172.28.5.4.33972: Flags [.], ack 7, win 227, options [nop,nop,TS val 232853277 ecr 1873498343], length 0
13:12:29.577464 IP 172.28.5.0.6379 > 172.28.5.4.33972: Flags [P.], seq 1:8, ack 7, win 227, options [nop,nop,TS val 232853277 ecr 1873498343], length 7: RESP "PONG"
13:12:29.577682 IP 172.28.5.4.33972 > 172.28.5.0.6379: Flags [P.], seq 7:25, ack 8, win 229, options [nop,nop,TS val 1873498343 ecr 232853277], length 18: RESP "info replication"
13:12:29.578000 IP 172.28.5.0.6379 > 172.28.5.4.33972: Flags [P.], seq 8:470, ack 25, win 227, options [nop,nop,TS val 232853278 ecr 1873498343], length 462: RESP "# Replication^M^Jrole:master^M^Jconnected_slaves:2^M^Jslave0:ip=172.28.5.1,port=6379,state=online,offset=822094,lag=0^M^Jslave1:ip=172.28.5.2,port=6379,state=online,offset=822094,lag=1^M^Jmaster_replid:f8eac6c8a17a641b11523474ffa3dbd0af88977a^M^Jmaster_replid2:0000000000000000000000000000000000000000^M^Jmaster_repl_offset:822242^M^Jsecond_repl_offset:-1^M^Jrepl_backlog_active:1^M^Jrepl_backlog_size:1048576^M^Jrepl_backlog_first_byte_offset:1^M^Jrepl_backlog_histlen:822242^M^J"
13:12:29.578130 IP 172.28.5.4.33972 > 172.28.5.0.6379: Flags [P.], seq 25:31, ack 470, win 237, options [nop,nop,TS val 1873498344 ecr 232853278], length 6: RESP "QUIT"
13:12:29.578316 IP 172.28.5.0.6379 > 172.28.5.4.33972: Flags [P.], seq 470:475, ack 31, win 227, options [nop,nop,TS val 232853278 ecr 1873498344], length 5: RESP "OK"
13:12:29.578429 IP 172.28.5.0.6379 > 172.28.5.4.33972: Flags [F.], seq 475, ack 31, win 227, options [nop,nop,TS val 232853278 ecr 1873498344], length 0
13:12:29.578429 IP 172.28.5.4.33972 > 172.28.5.0.6379: Flags [R.], seq 31, ack 475, win 237, options [nop,nop,TS val 1873498344 ecr 232853278], length 0
13:12:29.578497 IP 172.28.5.4.33972 > 172.28.5.0.6379: Flags [R], seq 274389087, win 0, length 0
13:12:29.906077 IP 172.28.5.4.55438 > 172.28.5.1.6379: Flags [R.], seq 25, ack 526, win 237, options [nop,nop,TS val 4071278098 ecr 3587871692], length 0
13:12:30.241827 IP 172.28.5.4.60176 > 172.28.5.2.6379: Flags [R.], seq 25, ack 528, win 237, options [nop,nop,TS val 3594505715 ecr 373968019], length 0
13:12:30.579154 IP 172.28.5.4.33976 > 172.28.5.0.6379: Flags [S], seq 1339785178, win 29200, options [mss 1460,sackOK,TS val 1873499345 ecr 0,nop,wscale 7], length 0
13:12:30.579374 IP 172.28.5.0.6379 > 172.28.5.4.33976: Flags [S.], seq 2104063690, ack 1339785179, win 28960, options [mss 1460,sackOK,TS val 232854279 ecr 1873499345,nop,wscale 7], length 0
13:12:30.579503 IP 172.28.5.4.33976 > 172.28.5.0.6379: Flags [P.], seq 1:7, ack 1, win 229, options [nop,nop,TS val 1873499345 ecr 232854279], length 6: RESP "PING"
13:12:30.579632 IP 172.28.5.0.6379 > 172.28.5.4.33976: Flags [.], ack 7, win 227, options [nop,nop,TS val 232854279 ecr 1873499345], length 0
13:12:30.580101 IP 172.28.5.0.6379 > 172.28.5.4.33976: Flags [P.], seq 1:8, ack 7, win 227, options [nop,nop,TS val 232854280 ecr 1873499345], length 7: RESP "PONG"
13:12:30.580275 IP 172.28.5.4.33976 > 172.28.5.0.6379: Flags [P.], seq 7:25, ack 8, win 229, options [nop,nop,TS val 1873499346 ecr 232854280], length 18: RESP "info replication"
13:12:30.580613 IP 172.28.5.0.6379 > 172.28.5.4.33976: Flags [P.], seq 8:470, ack 25, win 227, options [nop,nop,TS val 232854280 ecr 1873499346], length 462: RESP "# Replication^M^Jrole:master^M^Jconnected_slaves:2^M^Jslave0:ip=172.28.5.1,port=6379,state=online,offset=822390,lag=0^M^Jslave1:ip=172.28.5.2,port=6379,state=online,offset=822242,lag=1^M^Jmaster_replid:f8eac6c8a17a641b11523474ffa3dbd0af88977a^M^Jmaster_replid2:0000000000000000000000000000000000000000^M^Jmaster_repl_offset:822538^M^Jsecond_repl_offset:-1^M^Jrepl_backlog_active:1^M^Jrepl_backlog_size:1048576^M^Jrepl_backlog_first_byte_offset:1^M^Jrepl_backlog_histlen:822538^M^J"
13:12:30.580779 IP 172.28.5.4.33976 > 172.28.5.0.6379: Flags [P.], seq 25:31, ack 470, win 237, options [nop,nop,TS val 1873499346 ecr 232854280], length 6: RESP "QUIT"
13:12:30.580983 IP 172.28.5.0.6379 > 172.28.5.4.33976: Flags [P.], seq 470:475, ack 31, win 227, options [nop,nop,TS val 232854281 ecr 1873499346], length 5: RESP "OK"
13:12:30.581126 IP 172.28.5.0.6379 > 172.28.5.4.33976: Flags [F.], seq 475, ack 31, win 227, options [nop,nop,TS val 232854281 ecr 1873499346], length 0
13:12:30.581275 IP 172.28.5.4.33976 > 172.28.5.0.6379: Flags [F.], seq 31, ack 476, win 237, options [nop,nop,TS val 1873499347 ecr 232854281], length 0
13:12:30.581398 IP 172.28.5.0.6379 > 172.28.5.4.33976: Flags [.], ack 32, win 227, options [nop,nop,TS val 232854281 ecr 1873499347], length 0
13:12:30.907050 IP 172.28.5.4.55454 > 172.28.5.1.6379: Flags [S], seq 409444044, win 29200, options [mss 1460,sackOK,TS val 4071279099 ecr 0,nop,wscale 7], length 0
13:12:30.907259 IP 172.28.5.1.6379 > 172.28.5.4.55454: Flags [S.], seq 3534852671, ack 409444045, win 28960, options [mss 1460,sackOK,TS val 3587873693 ecr 4071279099,nop,wscale 7], length 0
13:12:30.907370 IP 172.28.5.4.55454 > 172.28.5.1.6379: Flags [P.], seq 1:7, ack 1, win 229, options [nop,nop,TS val 4071279099 ecr 3587873693], length 6: RESP "PING"
13:12:30.907476 IP 172.28.5.1.6379 > 172.28.5.4.55454: Flags [.], ack 7, win 227, options [nop,nop,TS val 3587873693 ecr 4071279099], length 0
13:12:30.907846 IP 172.28.5.1.6379 > 172.28.5.4.55454: Flags [P.], seq 1:8, ack 7, win 227, options [nop,nop,TS val 3587873693 ecr 4071279099], length 7: RESP "PONG"
13:12:30.908088 IP 172.28.5.4.55454 > 172.28.5.1.6379: Flags [P.], seq 7:25, ack 8, win 229, options [nop,nop,TS val 4071279100 ecr 3587873693], length 18: RESP "info replication"
13:12:30.908370 IP 172.28.5.1.6379 > 172.28.5.4.55454: Flags [P.], seq 8:526, ack 25, win 227, options [nop,nop,TS val 3587873694 ecr 4071279100], length 518: RESP "# Replication^M^Jrole:slave^M^Jmaster_host:172.28.5.0^M^Jmaster_port:6379^M^Jmaster_link_status:up^M^Jmaster_last_io_seconds_ago:0^M^Jmaster_sync_in_progress:0^M^Jslave_repl_offset:822538^M^Jslave_priority:100^M^Jslave_read_only:1^M^Jconnected_slaves:0^M^Jmaster_replid:f8eac6c8a17a641b11523474ffa3dbd0af88977a^M^Jmaster_replid2:0000000000000000000000000000000000000000^M^Jmaster_repl_offset:822538^M^Jsecond_repl_offset:-1^M^Jrepl_backlog_active:1^M^Jrepl_backlog_size:1048576^M^Jrepl_backlog_first_byte_offset:1^M^Jrepl_backlog_histlen:822538^M^J"
13:12:30.952400 IP 172.28.5.4.55454 > 172.28.5.1.6379: Flags [.], ack 526, win 237, options [nop,nop,TS val 4071279144 ecr 3587873694], length 0
13:12:31.243487 IP 172.28.5.4.60192 > 172.28.5.2.6379: Flags [S], seq 192440209, win 29200, options [mss 1460,sackOK,TS val 3594506717 ecr 0,nop,wscale 7], length 0
13:12:31.243714 IP 172.28.5.2.6379 > 172.28.5.4.60192: Flags [S.], seq 4100234629, ack 192440210, win 28960, options [mss 1460,sackOK,TS val 373970021 ecr 3594506717,nop,wscale 7], length 0
13:12:31.243847 IP 172.28.5.4.60192 > 172.28.5.2.6379: Flags [P.], seq 1:7, ack 1, win 229, options [nop,nop,TS val 3594506717 ecr 373970021], length 6: RESP "PING"
13:12:31.243998 IP 172.28.5.2.6379 > 172.28.5.4.60192: Flags [.], ack 7, win 227, options [nop,nop,TS val 373970022 ecr 3594506717], length 0
13:12:31.244370 IP 172.28.5.2.6379 > 172.28.5.4.60192: Flags [P.], seq 1:8, ack 7, win 227, options [nop,nop,TS val 373970022 ecr 3594506717], length 7: RESP "PONG"
13:12:31.244499 IP 172.28.5.4.60192 > 172.28.5.2.6379: Flags [P.], seq 7:25, ack 8, win 229, options [nop,nop,TS val 3594506718 ecr 373970022], length 18: RESP "info replication"
13:12:31.244714 IP 172.28.5.2.6379 > 172.28.5.4.60192: Flags [P.], seq 8:528, ack 25, win 227, options [nop,nop,TS val 373970022 ecr 3594506718], length 520: RESP "# Replication^M^Jrole:slave^M^Jmaster_host:172.28.5.0^M^Jmaster_port:6379^M^Jmaster_link_status:up^M^Jmaster_last_io_seconds_ago:1^M^Jmaster_sync_in_progress:0^M^Jslave_repl_offset:822538^M^Jslave_priority:100^M^Jslave_read_only:1^M^Jconnected_slaves:0^M^Jmaster_replid:f8eac6c8a17a641b11523474ffa3dbd0af88977a^M^Jmaster_replid2:0000000000000000000000000000000000000000^M^Jmaster_repl_offset:822538^M^Jsecond_repl_offset:-1^M^Jrepl_backlog_active:1^M^Jrepl_backlog_size:1048576^M^Jrepl_backlog_first_byte_offset:186^M^Jrepl_backlog_histlen:822353^M^J"
13:12:31.288032 IP 172.28.5.4.60192 > 172.28.5.2.6379: Flags [.], ack 528, win 237, options [nop,nop,TS val 3594506762 ecr 373970022], length 0
13:12:31.583194 IP 172.28.5.4.33988 > 172.28.5.0.6379: Flags [S], seq 724845204, win 29200, options [mss 1460,sackOK,TS val 1873500349 ecr 0,nop,wscale 7], length 0
13:12:31.583364 IP 172.28.5.0.6379 > 172.28.5.4.33988: Flags [S.], seq 2653858576, ack 724845205, win 28960, options [mss 1460,sackOK,TS val 232855283 ecr 1873500349,nop,wscale 7], length 0
13:12:31.583453 IP 172.28.5.4.33988 > 172.28.5.0.6379: Flags [P.], seq 1:7, ack 1, win 229, options [nop,nop,TS val 1873500349 ecr 232855283], length 6: RESP "PING"
13:12:31.583567 IP 172.28.5.0.6379 > 172.28.5.4.33988: Flags [.], ack 7, win 227, options [nop,nop,TS val 232855283 ecr 1873500349], length 0
13:12:31.583950 IP 172.28.5.0.6379 > 172.28.5.4.33988: Flags [P.], seq 1:8, ack 7, win 227, options [nop,nop,TS val 232855284 ecr 1873500349], length 7: RESP "PONG"
13:12:31.584230 IP 172.28.5.4.33988 > 172.28.5.0.6379: Flags [P.], seq 7:25, ack 8, win 229, options [nop,nop,TS val 1873500350 ecr 232855284], length 18: RESP "info replication"
13:12:31.584553 IP 172.28.5.0.6379 > 172.28.5.4.33988: Flags [P.], seq 8:470, ack 25, win 227, options [nop,nop,TS val 232855284 ecr 1873500350], length 462: RESP "# Replication^M^Jrole:master^M^Jconnected_slaves:2^M^Jslave0:ip=172.28.5.1,port=6379,state=online,offset=822538,lag=0^M^Jslave1:ip=172.28.5.2,port=6379,state=online,offset=822538,lag=1^M^Jmaster_replid:f8eac6c8a17a641b11523474ffa3dbd0af88977a^M^Jmaster_replid2:0000000000000000000000000000000000000000^M^Jmaster_repl_offset:822686^M^Jsecond_repl_offset:-1^M^Jrepl_backlog_active:1^M^Jrepl_backlog_size:1048576^M^Jrepl_backlog_first_byte_offset:1^M^Jrepl_backlog_histlen:822686^M^J"
13:12:31.584717 IP 172.28.5.4.33988 > 172.28.5.0.6379: Flags [P.], seq 25:31, ack 470, win 237, options [nop,nop,TS val 1873500350 ecr 232855284], length 6: RESP "QUIT"
13:12:31.584946 IP 172.28.5.0.6379 > 172.28.5.4.33988: Flags [P.], seq 470:475, ack 31, win 227, options [nop,nop,TS val 232855285 ecr 1873500350], length 5: RESP "OK"
13:12:31.585076 IP 172.28.5.0.6379 > 172.28.5.4.33988: Flags [F.], seq 475, ack 31, win 227, options [nop,nop,TS val 232855285 ecr 1873500350], length 0
13:12:31.585142 IP 172.28.5.4.33988 > 172.28.5.0.6379: Flags [R.], seq 31, ack 476, win 237, options [nop,nop,TS val 1873500351 ecr 232855285], length 0
13:12:31.907903 IP 172.28.5.4.55454 > 172.28.5.1.6379: Flags [R.], seq 25, ack 526, win 237, options [nop,nop,TS val 4071280100 ecr 3587873694], length 0
13:12:32.245503 IP 172.28.5.4.60192 > 172.28.5.2.6379: Flags [R.], seq 25, ack 528, win 237, options [nop,nop,TS val 3594507719 ecr 373970022], length 0
13:12:32.585254 IP 172.28.5.4.33992 > 172.28.5.0.6379: Flags [S], seq 3451111960, win 29200, options [mss 1460,sackOK,TS val 1873501351 ecr 0,nop,wscale 7], length 0
13:12:32.585447 IP 172.28.5.0.6379 > 172.28.5.4.33992: Flags [S.], seq 4237690278, ack 3451111961, win 28960, options [mss 1460,sackOK,TS val 232856285 ecr 1873501351,nop,wscale 7], length 0
13:12:32.585615 IP 172.28.5.4.33992 > 172.28.5.0.6379: Flags [P.], seq 1:7, ack 1, win 229, options [nop,nop,TS val 1873501351 ecr 232856285], length 6: RESP "PING"
13:12:32.585732 IP 172.28.5.0.6379 > 172.28.5.4.33992: Flags [.], ack 7, win 227, options [nop,nop,TS val 232856285 ecr 1873501351], length 0
13:12:32.586036 IP 172.28.5.0.6379 > 172.28.5.4.33992: Flags [P.], seq 1:8, ack 7, win 227, options [nop,nop,TS val 232856286 ecr 1873501351], length 7: RESP "PONG"
13:12:32.586200 IP 172.28.5.4.33992 > 172.28.5.0.6379: Flags [P.], seq 7:25, ack 8, win 229, options [nop,nop,TS val 1873501352 ecr 232856286], length 18: RESP "info replication"
13:12:32.586556 IP 172.28.5.0.6379 > 172.28.5.4.33992: Flags [P.], seq 8:470, ack 25, win 227, options [nop,nop,TS val 232856286 ecr 1873501352], length 462: RESP "# Replication^M^Jrole:master^M^Jconnected_slaves:2^M^Jslave0:ip=172.28.5.1,port=6379,state=online,offset=822686,lag=0^M^Jslave1:ip=172.28.5.2,port=6379,state=online,offset=822686,lag=1^M^Jmaster_replid:f8eac6c8a17a641b11523474ffa3dbd0af88977a^M^Jmaster_replid2:0000000000000000000000000000000000000000^M^Jmaster_repl_offset:822996^M^Jsecond_repl_offset:-1^M^Jrepl_backlog_active:1^M^Jrepl_backlog_size:1048576^M^Jrepl_backlog_first_byte_offset:1^M^Jrepl_backlog_histlen:822996^M^J"
13:12:32.586908 IP 172.28.5.4.33992 > 172.28.5.0.6379: Flags [P.], seq 25:31, ack 470, win 237, options [nop,nop,TS val 1873501353 ecr 232856286], length 6: RESP "QUIT"
13:12:32.587250 IP 172.28.5.0.6379 > 172.28.5.4.33992: Flags [P.], seq 470:475, ack 31, win 227, options [nop,nop,TS val 232856287 ecr 1873501353], length 5: RESP "OK"
13:12:32.587393 IP 172.28.5.0.6379 > 172.28.5.4.33992: Flags [F.], seq 475, ack 31, win 227, options [nop,nop,TS val 232856287 ecr 1873501353], length 0
13:12:32.587467 IP 172.28.5.4.33992 > 172.28.5.0.6379: Flags [R.], seq 31, ack 476, win 237, options [nop,nop,TS val 1873501353 ecr 232856287], length 0
13:12:32.909104 IP 172.28.5.4.55470 > 172.28.5.1.6379: Flags [S], seq 487399379, win 29200, options [mss 1460,sackOK,TS val 4071281101 ecr 0,nop,wscale 7], length 0
13:12:32.909166 IP 172.28.5.1.6379 > 172.28.5.4.55470: Flags [S.], seq 252579727, ack 487399380, win 28960, options [mss 1460,sackOK,TS val 3587875695 ecr 4071281101,nop,wscale 7], length 0
13:12:32.909197 IP 172.28.5.4.55470 > 172.28.5.1.6379: Flags [P.], seq 1:7, ack 1, win 229, options [nop,nop,TS val 4071281101 ecr 3587875695], length 6: RESP "PING"
13:12:32.909230 IP 172.28.5.1.6379 > 172.28.5.4.55470: Flags [.], ack 7, win 227, options [nop,nop,TS val 3587875695 ecr 4071281101], length 0
13:12:32.909344 IP 172.28.5.1.6379 > 172.28.5.4.55470: Flags [P.], seq 1:8, ack 7, win 227, options [nop,nop,TS val 3587875695 ecr 4071281101], length 7: RESP "PONG"
13:12:32.909419 IP 172.28.5.4.55470 > 172.28.5.1.6379: Flags [P.], seq 7:25, ack 8, win 229, options [nop,nop,TS val 4071281101 ecr 3587875695], length 18: RESP "info replication"
13:12:32.909537 IP 172.28.5.1.6379 > 172.28.5.4.55470: Flags [P.], seq 8:526, ack 25, win 227, options [nop,nop,TS val 3587875695 ecr 4071281101], length 518: RESP "# Replication^M^Jrole:slave^M^Jmaster_host:172.28.5.0^M^Jmaster_port:6379^M^Jmaster_link_status:up^M^Jmaster_last_io_seconds_ago:0^M^Jmaster_sync_in_progress:0^M^Jslave_repl_offset:822996^M^Jslave_priority:100^M^Jslave_read_only:1^M^Jconnected_slaves:0^M^Jmaster_replid:f8eac6c8a17a641b11523474ffa3dbd0af88977a^M^Jmaster_replid2:0000000000000000000000000000000000000000^M^Jmaster_repl_offset:822996^M^Jsecond_repl_offset:-1^M^Jrepl_backlog_active:1^M^Jrepl_backlog_size:1048576^M^Jrepl_backlog_first_byte_offset:1^M^Jrepl_backlog_histlen:822996^M^J"
13:12:32.952025 IP 172.28.5.4.55470 > 172.28.5.1.6379: Flags [.], ack 526, win 237, options [nop,nop,TS val 4071281144 ecr 3587875695], length 0
13:12:33.247102 IP 172.28.5.4.60208 > 172.28.5.2.6379: Flags [S], seq 212556023, win 29200, options [mss 1460,sackOK,TS val 3594508721 ecr 0,nop,wscale 7], length 0
13:12:33.247197 IP 172.28.5.2.6379 > 172.28.5.4.60208: Flags [S.], seq 1866325195, ack 212556024, win 28960, options [mss 1460,sackOK,TS val 373972025 ecr 3594508721,nop,wscale 7], length 0
13:12:33.247244 IP 172.28.5.4.60208 > 172.28.5.2.6379: Flags [P.], seq 1:7, ack 1, win 229, options [nop,nop,TS val 3594508721 ecr 373972025], length 6: RESP "PING"
13:12:33.247291 IP 172.28.5.2.6379 > 172.28.5.4.60208: Flags [.], ack 7, win 227, options [nop,nop,TS val 373972025 ecr 3594508721], length 0
13:12:33.247434 IP 172.28.5.2.6379 > 172.28.5.4.60208: Flags [P.], seq 1:8, ack 7, win 227, options [nop,nop,TS val 373972025 ecr 3594508721], length 7: RESP "PONG"
13:12:33.247514 IP 172.28.5.4.60208 > 172.28.5.2.6379: Flags [P.], seq 7:25, ack 8, win 229, options [nop,nop,TS val 3594508721 ecr 373972025], length 18: RESP "info replication"
13:12:33.247649 IP 172.28.5.2.6379 > 172.28.5.4.60208: Flags [P.], seq 8:528, ack 25, win 227, options [nop,nop,TS val 373972025 ecr 3594508721], length 520: RESP "# Replication^M^Jrole:slave^M^Jmaster_host:172.28.5.0^M^Jmaster_port:6379^M^Jmaster_link_status:up^M^Jmaster_last_io_seconds_ago:1^M^Jmaster_sync_in_progress:0^M^Jslave_repl_offset:822996^M^Jslave_priority:100^M^Jslave_read_only:1^M^Jconnected_slaves:0^M^Jmaster_replid:f8eac6c8a17a641b11523474ffa3dbd0af88977a^M^Jmaster_replid2:0000000000000000000000000000000000000000^M^Jmaster_repl_offset:822996^M^Jsecond_repl_offset:-1^M^Jrepl_backlog_active:1^M^Jrepl_backlog_size:1048576^M^Jrepl_backlog_first_byte_offset:186^M^Jrepl_backlog_histlen:822811^M^J"
13:12:33.288441 IP 172.28.5.4.60208 > 172.28.5.2.6379: Flags [.], ack 528, win 237, options [nop,nop,TS val 3594508762 ecr 373972025], length 0
13:12:33.587841 IP 172.28.5.4.34004 > 172.28.5.0.6379: Flags [S], seq 1865902254, win 29200, options [mss 1460,sackOK,TS val 1873502353 ecr 0,nop,wscale 7], length 0
13:12:33.588113 IP 172.28.5.0.6379 > 172.28.5.4.34004: Flags [S.], seq 4082460606, ack 1865902255, win 28960, options [mss 1460,sackOK,TS val 232857288 ecr 1873502353,nop,wscale 7], length 0
13:12:33.588253 IP 172.28.5.4.34004 > 172.28.5.0.6379: Flags [P.], seq 1:7, ack 1, win 229, options [nop,nop,TS val 1873502354 ecr 232857288], length 6: RESP "PING"
13:12:33.588472 IP 172.28.5.0.6379 > 172.28.5.4.34004: Flags [.], ack 7, win 227, options [nop,nop,TS val 232857288 ecr 1873502354], length 0
13:12:33.588844 IP 172.28.5.0.6379 > 172.28.5.4.34004: Flags [P.], seq 1:8, ack 7, win 227, options [nop,nop,TS val 232857288 ecr 1873502354], length 7: RESP "PONG"
13:12:33.589009 IP 172.28.5.4.34004 > 172.28.5.0.6379: Flags [P.], seq 7:25, ack 8, win 229, options [nop,nop,TS val 1873502355 ecr 232857288], length 18: RESP "info replication"
13:12:33.589334 IP 172.28.5.0.6379 > 172.28.5.4.34004: Flags [P.], seq 8:470, ack 25, win 227, options [nop,nop,TS val 232857289 ecr 1873502355], length 462: RESP "# Replication^M^Jrole:master^M^Jconnected_slaves:2^M^Jslave0:ip=172.28.5.1,port=6379,state=online,offset=822996,lag=0^M^Jslave1:ip=172.28.5.2,port=6379,state=online,offset=822996,lag=1^M^Jmaster_replid:f8eac6c8a17a641b11523474ffa3dbd0af88977a^M^Jmaster_replid2:0000000000000000000000000000000000000000^M^Jmaster_repl_offset:823144^M^Jsecond_repl_offset:-1^M^Jrepl_backlog_active:1^M^Jrepl_backlog_size:1048576^M^Jrepl_backlog_first_byte_offset:1^M^Jrepl_backlog_histlen:823144^M^J"
13:12:33.589492 IP 172.28.5.4.34004 > 172.28.5.0.6379: Flags [P.], seq 25:31, ack 470, win 237, options [nop,nop,TS val 1873502355 ecr 232857289], length 6: RESP "QUIT"
13:12:33.589675 IP 172.28.5.0.6379 > 172.28.5.4.34004: Flags [P.], seq 470:475, ack 31, win 227, options [nop,nop,TS val 232857289 ecr 1873502355], length 5: RESP "OK"
13:12:33.589796 IP 172.28.5.4.34004 > 172.28.5.0.6379: Flags [R.], seq 31, ack 475, win 237, options [nop,nop,TS val 1873502355 ecr 232857289], length 0
13:12:33.589798 IP 172.28.5.0.6379 > 172.28.5.4.34004: Flags [F.], seq 475, ack 31, win 227, options [nop,nop,TS val 232857289 ecr 1873502355], length 0
13:12:33.589858 IP 172.28.5.4.34004 > 172.28.5.0.6379: Flags [R], seq 1865902285, win 0, length 0
13:12:33.911334 IP 172.28.5.4.55470 > 172.28.5.1.6379: Flags [R.], seq 25, ack 526, win 237, options [nop,nop,TS val 4071282103 ecr 3587875695], length 0
13:12:34.248966 IP 172.28.5.4.60208 > 172.28.5.2.6379: Flags [R.], seq 25, ack 528, win 237, options [nop,nop,TS val 3594509723 ecr 373972025], length 0
13:12:34.589550 IP 172.28.5.4.34008 > 172.28.5.0.6379: Flags [S], seq 1096747961, win 29200, options [mss 1460,sackOK,TS val 1873503355 ecr 0,nop,wscale 7], length 0
13:12:34.589636 IP 172.28.5.0.6379 > 172.28.5.4.34008: Flags [S.], seq 619659860, ack 1096747962, win 28960, options [mss 1460,sackOK,TS val 232858289 ecr 1873503355,nop,wscale 7], length 0
13:12:34.589675 IP 172.28.5.4.34008 > 172.28.5.0.6379: Flags [P.], seq 1:7, ack 1, win 229, options [nop,nop,TS val 1873503355 ecr 232858289], length 6: RESP "PING"
13:12:34.589717 IP 172.28.5.0.6379 > 172.28.5.4.34008: Flags [.], ack 7, win 227, options [nop,nop,TS val 232858289 ecr 1873503355], length 0
13:12:34.590051 IP 172.28.5.0.6379 > 172.28.5.4.34008: Flags [P.], seq 1:8, ack 7, win 227, options [nop,nop,TS val 232858290 ecr 1873503355], length 7: RESP "PONG"
13:12:34.590169 IP 172.28.5.4.34008 > 172.28.5.0.6379: Flags [P.], seq 7:25, ack 8, win 229, options [nop,nop,TS val 1873503356 ecr 232858290], length 18: RESP "info replication"
13:12:34.590344 IP 172.28.5.0.6379 > 172.28.5.4.34008: Flags [P.], seq 8:470, ack 25, win 227, options [nop,nop,TS val 232858290 ecr 1873503356], length 462: RESP "# Replication^M^Jrole:master^M^Jconnected_slaves:2^M^Jslave0:ip=172.28.5.1,port=6379,state=online,offset=823144,lag=0^M^Jslave1:ip=172.28.5.2,port=6379,state=online,offset=823144,lag=1^M^Jmaster_replid:f8eac6c8a17a641b11523474ffa3dbd0af88977a^M^Jmaster_replid2:0000000000000000000000000000000000000000^M^Jmaster_repl_offset:823440^M^Jsecond_repl_offset:-1^M^Jrepl_backlog_active:1^M^Jrepl_backlog_size:1048576^M^Jrepl_backlog_first_byte_offset:1^M^Jrepl_backlog_histlen:823440^M^J"
13:12:34.590580 IP 172.28.5.4.34008 > 172.28.5.0.6379: Flags [P.], seq 25:31, ack 470, win 237, options [nop,nop,TS val 1873503356 ecr 232858290], length 6: RESP "QUIT"
13:12:34.590714 IP 172.28.5.0.6379 > 172.28.5.4.34008: Flags [P.], seq 470:475, ack 31, win 227, options [nop,nop,TS val 232858290 ecr 1873503356], length 5: RESP "OK"
13:12:34.590825 IP 172.28.5.4.34008 > 172.28.5.0.6379: Flags [R.], seq 31, ack 475, win 237, options [nop,nop,TS val 1873503356 ecr 232858290], length 0
13:12:34.913446 IP 172.28.5.4.55488 > 172.28.5.1.6379: Flags [S], seq 2220448589, win 29200, options [mss 1460,sackOK,TS val 4071283105 ecr 0,nop,wscale 7], length 0
13:12:34.913680 IP 172.28.5.1.6379 > 172.28.5.4.55488: Flags [S.], seq 3414164210, ack 2220448590, win 28960, options [mss 1460,sackOK,TS val 3587877699 ecr 4071283105,nop,wscale 7], length 0
13:12:34.913805 IP 172.28.5.4.55488 > 172.28.5.1.6379: Flags [P.], seq 1:7, ack 1, win 229, options [nop,nop,TS val 4071283105 ecr 3587877699], length 6: RESP "PING"
13:12:34.913936 IP 172.28.5.1.6379 > 172.28.5.4.55488: Flags [.], ack 7, win 227, options [nop,nop,TS val 3587877700 ecr 4071283105], length 0
13:12:34.914305 IP 172.28.5.1.6379 > 172.28.5.4.55488: Flags [P.], seq 1:8, ack 7, win 227, options [nop,nop,TS val 3587877700 ecr 4071283105], length 7: RESP "PONG"
13:12:34.914475 IP 172.28.5.4.55488 > 172.28.5.1.6379: Flags [P.], seq 7:25, ack 8, win 229, options [nop,nop,TS val 4071283106 ecr 3587877700], length 18: RESP "info replication"
13:12:34.914786 IP 172.28.5.1.6379 > 172.28.5.4.55488: Flags [P.], seq 8:526, ack 25, win 227, options [nop,nop,TS val 3587877700 ecr 4071283106], length 518: RESP "# Replication^M^Jrole:slave^M^Jmaster_host:172.28.5.0^M^Jmaster_port:6379^M^Jmaster_link_status:up^M^Jmaster_last_io_seconds_ago:0^M^Jmaster_sync_in_progress:0^M^Jslave_repl_offset:823440^M^Jslave_priority:100^M^Jslave_read_only:1^M^Jconnected_slaves:0^M^Jmaster_replid:f8eac6c8a17a641b11523474ffa3dbd0af88977a^M^Jmaster_replid2:0000000000000000000000000000000000000000^M^Jmaster_repl_offset:823440^M^Jsecond_repl_offset:-1^M^Jrepl_backlog_active:1^M^Jrepl_backlog_size:1048576^M^Jrepl_backlog_first_byte_offset:1^M^Jrepl_backlog_histlen:823440^M^J"
13:12:34.956054 IP 172.28.5.4.55488 > 172.28.5.1.6379: Flags [.], ack 526, win 237, options [nop,nop,TS val 4071283148 ecr 3587877700], length 0
13:12:35.250297 IP 172.28.5.4.60228 > 172.28.5.2.6379: Flags [S], seq 3151936597, win 29200, options [mss 1460,sackOK,TS val 3594510724 ecr 0,nop,wscale 7], length 0
13:12:35.250353 IP 172.28.5.2.6379 > 172.28.5.4.60228: Flags [S.], seq 2459829612, ack 3151936598, win 28960, options [mss 1460,sackOK,TS val 373974028 ecr 3594510724,nop,wscale 7], length 0
13:12:35.250379 IP 172.28.5.4.60228 > 172.28.5.2.6379: Flags [P.], seq 1:7, ack 1, win 229, options [nop,nop,TS val 3594510724 ecr 373974028], length 6: RESP "PING"
13:12:35.250403 IP 172.28.5.2.6379 > 172.28.5.4.60228: Flags [.], ack 7, win 227, options [nop,nop,TS val 373974028 ecr 3594510724], length 0
13:12:35.250479 IP 172.28.5.2.6379 > 172.28.5.4.60228: Flags [P.], seq 1:8, ack 7, win 227, options [nop,nop,TS val 373974028 ecr 3594510724], length 7: RESP "PONG"
13:12:35.250507 IP 172.28.5.4.60228 > 172.28.5.2.6379: Flags [P.], seq 7:25, ack 8, win 229, options [nop,nop,TS val 3594510724 ecr 373974028], length 18: RESP "info replication"
13:12:35.250570 IP 172.28.5.2.6379 > 172.28.5.4.60228: Flags [P.], seq 8:528, ack 25, win 227, options [nop,nop,TS val 373974028 ecr 3594510724], length 520: RESP "# Replication^M^Jrole:slave^M^Jmaster_host:172.28.5.0^M^Jmaster_port:6379^M^Jmaster_link_status:up^M^Jmaster_last_io_seconds_ago:1^M^Jmaster_sync_in_progress:0^M^Jslave_repl_offset:823440^M^Jslave_priority:100^M^Jslave_read_only:1^M^Jconnected_slaves:0^M^Jmaster_replid:f8eac6c8a17a641b11523474ffa3dbd0af88977a^M^Jmaster_replid2:0000000000000000000000000000000000000000^M^Jmaster_repl_offset:823440^M^Jsecond_repl_offset:-1^M^Jrepl_backlog_active:1^M^Jrepl_backlog_size:1048576^M^Jrepl_backlog_first_byte_offset:186^M^Jrepl_backlog_histlen:823255^M^J"
13:12:35.292017 IP 172.28.5.4.60228 > 172.28.5.2.6379: Flags [.], ack 528, win 237, options [nop,nop,TS val 3594510766 ecr 373974028], length 0
13:12:35.591073 IP 172.28.5.4.34026 > 172.28.5.0.6379: Flags [S], seq 1398987525, win 29200, options [mss 1460,sackOK,TS val 1873504357 ecr 0,nop,wscale 7], length 0
13:12:35.591206 IP 172.28.5.0.6379 > 172.28.5.4.34026: Flags [S.], seq 2870656172, ack 1398987526, win 28960, options [mss 1460,sackOK,TS val 232859291 ecr 1873504357,nop,wscale 7], length 0
13:12:35.591276 IP 172.28.5.4.34026 > 172.28.5.0.6379: Flags [P.], seq 1:7, ack 1, win 229, options [nop,nop,TS val 1873504357 ecr 232859291], length 6: RESP "PING"
13:12:35.591357 IP 172.28.5.0.6379 > 172.28.5.4.34026: Flags [.], ack 7, win 227, options [nop,nop,TS val 232859291 ecr 1873504357], length 0
13:12:35.591544 IP 172.28.5.0.6379 > 172.28.5.4.34026: Flags [P.], seq 1:8, ack 7, win 227, options [nop,nop,TS val 232859291 ecr 1873504357], length 7: RESP "PONG"
13:12:35.591679 IP 172.28.5.4.34026 > 172.28.5.0.6379: Flags [P.], seq 7:25, ack 8, win 229, options [nop,nop,TS val 1873504357 ecr 232859291], length 18: RESP "info replication"
13:12:35.591917 IP 172.28.5.0.6379 > 172.28.5.4.34026: Flags [P.], seq 8:470, ack 25, win 227, options [nop,nop,TS val 232859292 ecr 1873504357], length 462: RESP "# Replication^M^Jrole:master^M^Jconnected_slaves:2^M^Jslave0:ip=172.28.5.1,port=6379,state=online,offset=823440,lag=0^M^Jslave1:ip=172.28.5.2,port=6379,state=online,offset=823440,lag=1^M^Jmaster_replid:f8eac6c8a17a641b11523474ffa3dbd0af88977a^M^Jmaster_replid2:0000000000000000000000000000000000000000^M^Jmaster_repl_offset:823588^M^Jsecond_repl_offset:-1^M^Jrepl_backlog_active:1^M^Jrepl_backlog_size:1048576^M^Jrepl_backlog_first_byte_offset:1^M^Jrepl_backlog_histlen:823588^M^J"
13:12:35.592198 IP 172.28.5.4.34026 > 172.28.5.0.6379: Flags [P.], seq 25:31, ack 470, win 237, options [nop,nop,TS val 1873504358 ecr 232859292], length 6: RESP "QUIT"
13:12:35.592373 IP 172.28.5.0.6379 > 172.28.5.4.34026: Flags [P.], seq 470:475, ack 31, win 227, options [nop,nop,TS val 232859292 ecr 1873504358], length 5: RESP "OK"
13:12:35.592510 IP 172.28.5.4.34026 > 172.28.5.0.6379: Flags [R.], seq 31, ack 475, win 237, options [nop,nop,TS val 1873504358 ecr 232859292], length 0
13:12:35.914990 IP 172.28.5.4.55488 > 172.28.5.1.6379: Flags [R.], seq 25, ack 526, win 237, options [nop,nop,TS val 4071284107 ecr 3587877700], length 0
13:12:36.253088 IP 172.28.5.4.60228 > 172.28.5.2.6379: Flags [R.], seq 25, ack 528, win 237, options [nop,nop,TS val 3594511727 ecr 373974028], length 0
13:12:36.592928 IP 172.28.5.4.34058 > 172.28.5.0.6379: Flags [S], seq 3699371037, win 29200, options [mss 1460,sackOK,TS val 1873505359 ecr 0,nop,wscale 7], length 0
13:12:36.592998 IP 172.28.5.0.6379 > 172.28.5.4.34058: Flags [S.], seq 1384807193, ack 3699371038, win 28960, options [mss 1460,sackOK,TS val 232860293 ecr 1873505359,nop,wscale 7], length 0
13:12:36.593026 IP 172.28.5.4.34058 > 172.28.5.0.6379: Flags [P.], seq 1:7, ack 1, win 229, options [nop,nop,TS val 1873505359 ecr 232860293], length 6: RESP "PING"
13:12:36.593055 IP 172.28.5.0.6379 > 172.28.5.4.34058: Flags [.], ack 7, win 227, options [nop,nop,TS val 232860293 ecr 1873505359], length 0
13:12:36.593328 IP 172.28.5.0.6379 > 172.28.5.4.34058: Flags [P.], seq 1:8, ack 7, win 227, options [nop,nop,TS val 232860293 ecr 1873505359], length 7: RESP "PONG"
13:12:36.593413 IP 172.28.5.4.34058 > 172.28.5.0.6379: Flags [P.], seq 7:25, ack 8, win 229, options [nop,nop,TS val 1873505359 ecr 232860293], length 18: RESP "info replication"
13:12:36.593918 IP 172.28.5.0.6379 > 172.28.5.4.34058: Flags [P.], seq 8:470, ack 25, win 227, options [nop,nop,TS val 232860294 ecr 1873505359], length 462: RESP "# Replication^M^Jrole:master^M^Jconnected_slaves:2^M^Jslave0:ip=172.28.5.1,port=6379,state=online,offset=823588,lag=0^M^Jslave1:ip=172.28.5.2,port=6379,state=online,offset=823588,lag=1^M^Jmaster_replid:f8eac6c8a17a641b11523474ffa3dbd0af88977a^M^Jmaster_replid2:0000000000000000000000000000000000000000^M^Jmaster_repl_offset:823884^M^Jsecond_repl_offset:-1^M^Jrepl_backlog_active:1^M^Jrepl_backlog_size:1048576^M^Jrepl_backlog_first_byte_offset:1^M^Jrepl_backlog_histlen:823884^M^J"
13:12:36.594093 IP 172.28.5.4.34058 > 172.28.5.0.6379: Flags [P.], seq 25:31, ack 470, win 237, options [nop,nop,TS val 1873505360 ecr 232860294], length 6: RESP "QUIT"
13:12:36.594200 IP 172.28.5.0.6379 > 172.28.5.4.34058: Flags [P.], seq 470:475, ack 31, win 227, options [nop,nop,TS val 232860294 ecr 1873505360], length 5: RESP "OK"
13:12:36.594271 IP 172.28.5.4.34058 > 172.28.5.0.6379: Flags [R.], seq 31, ack 475, win 237, options [nop,nop,TS val 1873505360 ecr 232860294], length 0
13:12:36.916187 IP 172.28.5.4.55544 > 172.28.5.1.6379: Flags [S], seq 2277323631, win 29200, options [mss 1460,sackOK,TS val 4071285108 ecr 0,nop,wscale 7], length 0
13:12:36.916600 IP 172.28.5.1.6379 > 172.28.5.4.55544: Flags [S.], seq 661473623, ack 2277323632, win 28960, options [mss 1460,sackOK,TS val 3587879702 ecr 4071285108,nop,wscale 7], length 0
13:12:36.916926 IP 172.28.5.4.55544 > 172.28.5.1.6379: Flags [P.], seq 1:7, ack 1, win 229, options [nop,nop,TS val 4071285109 ecr 3587879702], length 6: RESP "PING"
13:12:36.917187 IP 172.28.5.1.6379 > 172.28.5.4.55544: Flags [.], ack 7, win 227, options [nop,nop,TS val 3587879703 ecr 4071285109], length 0
13:12:36.917749 IP 172.28.5.1.6379 > 172.28.5.4.55544: Flags [P.], seq 1:8, ack 7, win 227, options [nop,nop,TS val 3587879703 ecr 4071285109], length 7: RESP "PONG"
13:12:36.918063 IP 172.28.5.4.55544 > 172.28.5.1.6379: Flags [P.], seq 7:25, ack 8, win 229, options [nop,nop,TS val 4071285110 ecr 3587879703], length 18: RESP "info replication"
13:12:36.918588 IP 172.28.5.1.6379 > 172.28.5.4.55544: Flags [P.], seq 8:526, ack 25, win 227, options [nop,nop,TS val 3587879704 ecr 4071285110], length 518: RESP "# Replication^M^Jrole:slave^M^Jmaster_host:172.28.5.0^M^Jmaster_port:6379^M^Jmaster_link_status:up^M^Jmaster_last_io_seconds_ago:0^M^Jmaster_sync_in_progress:0^M^Jslave_repl_offset:823884^M^Jslave_priority:100^M^Jslave_read_only:1^M^Jconnected_slaves:0^M^Jmaster_replid:f8eac6c8a17a641b11523474ffa3dbd0af88977a^M^Jmaster_replid2:0000000000000000000000000000000000000000^M^Jmaster_repl_offset:823884^M^Jsecond_repl_offset:-1^M^Jrepl_backlog_active:1^M^Jrepl_backlog_size:1048576^M^Jrepl_backlog_first_byte_offset:1^M^Jrepl_backlog_histlen:823884^M^J"
13:12:36.963975 IP 172.28.5.4.55544 > 172.28.5.1.6379: Flags [.], ack 526, win 237, options [nop,nop,TS val 4071285156 ecr 3587879704], length 0
13:12:37.254340 IP 172.28.5.4.60284 > 172.28.5.2.6379: Flags [S], seq 1807325811, win 29200, options [mss 1460,sackOK,TS val 3594512728 ecr 0,nop,wscale 7], length 0
13:12:37.254406 IP 172.28.5.2.6379 > 172.28.5.4.60284: Flags [S.], seq 3288146792, ack 1807325812, win 28960, options [mss 1460,sackOK,TS val 373976032 ecr 3594512728,nop,wscale 7], length 0
13:12:37.254434 IP 172.28.5.4.60284 > 172.28.5.2.6379: Flags [P.], seq 1:7, ack 1, win 229, options [nop,nop,TS val 3594512728 ecr 373976032], length 6: RESP "PING"
13:12:37.254470 IP 172.28.5.2.6379 > 172.28.5.4.60284: Flags [.], ack 7, win 227, options [nop,nop,TS val 373976032 ecr 3594512728], length 0
13:12:37.254562 IP 172.28.5.2.6379 > 172.28.5.4.60284: Flags [P.], seq 1:8, ack 7, win 227, options [nop,nop,TS val 373976032 ecr 3594512728], length 7: RESP "PONG"
13:12:37.254633 IP 172.28.5.4.60284 > 172.28.5.2.6379: Flags [P.], seq 7:25, ack 8, win 229, options [nop,nop,TS val 3594512728 ecr 373976032], length 18: RESP "info replication"
13:12:37.254711 IP 172.28.5.2.6379 > 172.28.5.4.60284: Flags [P.], seq 8:528, ack 25, win 227, options [nop,nop,TS val 373976032 ecr 3594512728], length 520: RESP "# Replication^M^Jrole:slave^M^Jmaster_host:172.28.5.0^M^Jmaster_port:6379^M^Jmaster_link_status:up^M^Jmaster_last_io_seconds_ago:1^M^Jmaster_sync_in_progress:0^M^Jslave_repl_offset:823884^M^Jslave_priority:100^M^Jslave_read_only:1^M^Jconnected_slaves:0^M^Jmaster_replid:f8eac6c8a17a641b11523474ffa3dbd0af88977a^M^Jmaster_replid2:0000000000000000000000000000000000000000^M^Jmaster_repl_offset:823884^M^Jsecond_repl_offset:-1^M^Jrepl_backlog_active:1^M^Jrepl_backlog_size:1048576^M^Jrepl_backlog_first_byte_offset:186^M^Jrepl_backlog_histlen:823699^M^J"
13:12:37.296010 IP 172.28.5.4.60284 > 172.28.5.2.6379: Flags [.], ack 528, win 237, options [nop,nop,TS val 3594512770 ecr 373976032], length 0
13:12:37.594220 IP 172.28.5.4.34086 > 172.28.5.0.6379: Flags [S], seq 466609249, win 29200, options [mss 1460,sackOK,TS val 1873506360 ecr 0,nop,wscale 7], length 0
13:12:37.594289 IP 172.28.5.0.6379 > 172.28.5.4.34086: Flags [S.], seq 2536085390, ack 466609250, win 28960, options [mss 1460,sackOK,TS val 232861294 ecr 1873506360,nop,wscale 7], length 0
13:12:37.594316 IP 172.28.5.4.34086 > 172.28.5.0.6379: Flags [P.], seq 1:7, ack 1, win 229, options [nop,nop,TS val 1873506360 ecr 232861294], length 6: RESP "PING"
13:12:37.594342 IP 172.28.5.0.6379 > 172.28.5.4.34086: Flags [.], ack 7, win 227, options [nop,nop,TS val 232861294 ecr 1873506360], length 0
13:12:37.594428 IP 172.28.5.0.6379 > 172.28.5.4.34086: Flags [P.], seq 1:8, ack 7, win 227, options [nop,nop,TS val 232861294 ecr 1873506360], length 7: RESP "PONG"
13:12:37.594463 IP 172.28.5.4.34086 > 172.28.5.0.6379: Flags [P.], seq 7:25, ack 8, win 229, options [nop,nop,TS val 1873506360 ecr 232861294], length 18: RESP "info replication"
13:12:37.594523 IP 172.28.5.0.6379 > 172.28.5.4.34086: Flags [P.], seq 8:470, ack 25, win 227, options [nop,nop,TS val 232861294 ecr 1873506360], length 462: RESP "# Replication^M^Jrole:master^M^Jconnected_slaves:2^M^Jslave0:ip=172.28.5.1,port=6379,state=online,offset=823884,lag=0^M^Jslave1:ip=172.28.5.2,port=6379,state=online,offset=823884,lag=1^M^Jmaster_replid:f8eac6c8a17a641b11523474ffa3dbd0af88977a^M^Jmaster_replid2:0000000000000000000000000000000000000000^M^Jmaster_repl_offset:824032^M^Jsecond_repl_offset:-1^M^Jrepl_backlog_active:1^M^Jrepl_backlog_size:1048576^M^Jrepl_backlog_first_byte_offset:1^M^Jrepl_backlog_histlen:824032^M^J"
13:12:37.594606 IP 172.28.5.4.34086 > 172.28.5.0.6379: Flags [P.], seq 25:31, ack 470, win 237, options [nop,nop,TS val 1873506360 ecr 232861294], length 6: RESP "QUIT"
