13:13:05.082687 IP 172.28.5.5.54382 > 172.28.5.0.6379: Flags [S], seq 3504775834, win 29200, options [mss 1460,sackOK,TS val 3500361786 ecr 0,nop,wscale 7], length 0
13:13:05.083083 IP 172.28.5.0.6379 > 172.28.5.5.54382: Flags [S.], seq 3344004372, ack 3504775835, win 28960, options [mss 1460,sackOK,TS val 2883206077 ecr 3500361786,nop,wscale 7], length 0
13:13:05.083406 IP 172.28.5.5.54382 > 172.28.5.0.6379: Flags [P.], seq 1:7, ack 1, win 229, options [nop,nop,TS val 3500361787 ecr 2883206077], length 6: RESP "PING"
13:13:05.083757 IP 172.28.5.0.6379 > 172.28.5.5.54382: Flags [.], ack 7, win 227, options [nop,nop,TS val 2883206077 ecr 3500361787], length 0
13:13:05.084735 IP 172.28.5.0.6379 > 172.28.5.5.54382: Flags [P.], seq 1:8, ack 7, win 227, options [nop,nop,TS val 2883206078 ecr 3500361787], length 7: RESP "PONG"
13:13:05.084911 IP 172.28.5.5.54382 > 172.28.5.0.6379: Flags [P.], seq 7:25, ack 8, win 229, options [nop,nop,TS val 3500361789 ecr 2883206078], length 18: RESP "info replication"
13:13:05.085601 IP 172.28.5.0.6379 > 172.28.5.5.54382: Flags [P.], seq 8:470, ack 25, win 227, options [nop,nop,TS val 2883206079 ecr 3500361789], length 462: RESP "# Replication^M^Jrole:master^M^Jconnected_slaves:2^M^Jslave0:ip=172.28.5.1,port=6379,state=online,offset=829846,lag=1^M^Jslave1:ip=172.28.5.2,port=6379,state=online,offset=829994,lag=1^M^Jmaster_replid:f8eac6c8a17a641b11523474ffa3dbd0af88977a^M^Jmaster_replid2:0000000000000000000000000000000000000000^M^Jmaster_repl_offset:829994^M^Jsecond_repl_offset:-1^M^Jrepl_backlog_active:1^M^Jrepl_backlog_size:1048576^M^Jrepl_backlog_first_byte_offset:1^M^Jrepl_backlog_histlen:829994^M^J"
13:13:05.085989 IP 172.28.5.5.54382 > 172.28.5.0.6379: Flags [P.], seq 25:31, ack 470, win 237, options [nop,nop,TS val 3500361790 ecr 2883206079], length 6: RESP "QUIT"
13:13:05.086471 IP 172.28.5.0.6379 > 172.28.5.5.54382: Flags [P.], seq 470:475, ack 31, win 227, options [nop,nop,TS val 2883206080 ecr 3500361790], length 5: RESP "OK"
13:13:05.086846 IP 172.28.5.0.6379 > 172.28.5.5.54382: Flags [F.], seq 475, ack 31, win 227, options [nop,nop,TS val 2883206080 ecr 3500361790], length 0
13:13:05.087371 IP 172.28.5.5.54382 > 172.28.5.0.6379: Flags [F.], seq 31, ack 476, win 237, options [nop,nop,TS val 3500361791 ecr 2883206080], length 0
13:13:05.087659 IP 172.28.5.0.6379 > 172.28.5.5.54382: Flags [.], ack 32, win 227, options [nop,nop,TS val 2883206081 ecr 3500361791], length 0
13:13:05.413347 IP 172.28.5.5.58666 > 172.28.5.1.6379: Flags [S], seq 450688521, win 29200, options [mss 1460,sackOK,TS val 3392272888 ecr 0,nop,wscale 7], length 0
13:13:05.413495 IP 172.28.5.1.6379 > 172.28.5.5.58666: Flags [S.], seq 178213339, ack 450688522, win 28960, options [mss 1460,sackOK,TS val 9483913 ecr 3392272888,nop,wscale 7], length 0
13:13:05.413600 IP 172.28.5.5.58666 > 172.28.5.1.6379: Flags [P.], seq 1:7, ack 1, win 229, options [nop,nop,TS val 3392272888 ecr 9483913], length 6: RESP "PING"
13:13:05.413703 IP 172.28.5.1.6379 > 172.28.5.5.58666: Flags [.], ack 7, win 227, options [nop,nop,TS val 9483913 ecr 3392272888], length 0
13:13:05.414023 IP 172.28.5.1.6379 > 172.28.5.5.58666: Flags [P.], seq 1:8, ack 7, win 227, options [nop,nop,TS val 9483914 ecr 3392272888], length 7: RESP "PONG"
13:13:05.414125 IP 172.28.5.5.58666 > 172.28.5.1.6379: Flags [P.], seq 7:25, ack 8, win 229, options [nop,nop,TS val 3392272889 ecr 9483914], length 18: RESP "info replication"
13:13:05.414359 IP 172.28.5.1.6379 > 172.28.5.5.58666: Flags [P.], seq 8:526, ack 25, win 227, options [nop,nop,TS val 9483914 ecr 3392272889], length 518: RESP "# Replication^M^Jrole:slave^M^Jmaster_host:172.28.5.0^M^Jmaster_port:6379^M^Jmaster_link_status:up^M^Jmaster_last_io_seconds_ago:0^M^Jmaster_sync_in_progress:0^M^Jslave_repl_offset:830142^M^Jslave_priority:100^M^Jslave_read_only:1^M^Jconnected_slaves:0^M^Jmaster_replid:f8eac6c8a17a641b11523474ffa3dbd0af88977a^M^Jmaster_replid2:0000000000000000000000000000000000000000^M^Jmaster_repl_offset:830142^M^Jsecond_repl_offset:-1^M^Jrepl_backlog_active:1^M^Jrepl_backlog_size:1048576^M^Jrepl_backlog_first_byte_offset:1^M^Jrepl_backlog_histlen:830142^M^J"
13:13:05.456003 IP 172.28.5.5.58666 > 172.28.5.1.6379: Flags [.], ack 526, win 237, options [nop,nop,TS val 3392272931 ecr 9483914], length 0
13:13:05.747260 IP 172.28.5.5.53370 > 172.28.5.2.6379: Flags [S], seq 20792588, win 29200, options [mss 1460,sackOK,TS val 1868903441 ecr 0,nop,wscale 7], length 0
13:13:05.747380 IP 172.28.5.2.6379 > 172.28.5.5.53370: Flags [S.], seq 3429062400, ack 20792589, win 28960, options [mss 1460,sackOK,TS val 1402782457 ecr 1868903441,nop,wscale 7], length 0
13:13:05.747459 IP 172.28.5.5.53370 > 172.28.5.2.6379: Flags [P.], seq 1:7, ack 1, win 229, options [nop,nop,TS val 1868903441 ecr 1402782457], length 6: RESP "PING"
13:13:05.747537 IP 172.28.5.2.6379 > 172.28.5.5.53370: Flags [.], ack 7, win 227, options [nop,nop,TS val 1402782457 ecr 1868903441], length 0
13:13:05.747793 IP 172.28.5.2.6379 > 172.28.5.5.53370: Flags [P.], seq 1:8, ack 7, win 227, options [nop,nop,TS val 1402782457 ecr 1868903441], length 7: RESP "PONG"
13:13:05.747900 IP 172.28.5.5.53370 > 172.28.5.2.6379: Flags [P.], seq 7:25, ack 8, win 229, options [nop,nop,TS val 1868903442 ecr 1402782457], length 18: RESP "info replication"
13:13:05.748176 IP 172.28.5.2.6379 > 172.28.5.5.53370: Flags [P.], seq 8:528, ack 25, win 227, options [nop,nop,TS val 1402782458 ecr 1868903442], length 520: RESP "# Replication^M^Jrole:slave^M^Jmaster_host:172.28.5.0^M^Jmaster_port:6379^M^Jmaster_link_status:up^M^Jmaster_last_io_seconds_ago:0^M^Jmaster_sync_in_progress:0^M^Jslave_repl_offset:830142^M^Jslave_priority:100^M^Jslave_read_only:1^M^Jconnected_slaves:0^M^Jmaster_replid:f8eac6c8a17a641b11523474ffa3dbd0af88977a^M^Jmaster_replid2:0000000000000000000000000000000000000000^M^Jmaster_repl_offset:830142^M^Jsecond_repl_offset:-1^M^Jrepl_backlog_active:1^M^Jrepl_backlog_size:1048576^M^Jrepl_backlog_first_byte_offset:186^M^Jrepl_backlog_histlen:829957^M^J"
13:13:05.792051 IP 172.28.5.5.53370 > 172.28.5.2.6379: Flags [.], ack 528, win 237, options [nop,nop,TS val 1868903486 ecr 1402782458], length 0
13:13:06.088957 IP 172.28.5.5.54394 > 172.28.5.0.6379: Flags [S], seq 2996097980, win 29200, options [mss 1460,sackOK,TS val 3500362793 ecr 0,nop,wscale 7], length 0
13:13:06.089072 IP 172.28.5.0.6379 > 172.28.5.5.54394: Flags [S.], seq 3371903346, ack 2996097981, win 28960, options [mss 1460,sackOK,TS val 2883207083 ecr 3500362793,nop,wscale 7], length 0
13:13:06.089147 IP 172.28.5.5.54394 > 172.28.5.0.6379: Flags [P.], seq 1:7, ack 1, win 229, options [nop,nop,TS val 3500362793 ecr 2883207083], length 6: RESP "PING"
13:13:06.089214 IP 172.28.5.0.6379 > 172.28.5.5.54394: Flags [.], ack 7, win 227, options [nop,nop,TS val 2883207083 ecr 3500362793], length 0
13:13:06.089526 IP 172.28.5.0.6379 > 172.28.5.5.54394: Flags [P.], seq 1:8, ack 7, win 227, options [nop,nop,TS val 2883207083 ecr 3500362793], length 7: RESP "PONG"
13:13:06.089677 IP 172.28.5.5.54394 > 172.28.5.0.6379: Flags [P.], seq 7:25, ack 8, win 229, options [nop,nop,TS val 3500362793 ecr 2883207083], length 18: RESP "info replication"
13:13:06.089931 IP 172.28.5.0.6379 > 172.28.5.5.54394: Flags [P.], seq 8:470, ack 25, win 227, options [nop,nop,TS val 2883207084 ecr 3500362793], length 462: RESP "# Replication^M^Jrole:master^M^Jconnected_slaves:2^M^Jslave0:ip=172.28.5.1,port=6379,state=online,offset=830142,lag=1^M^Jslave1:ip=172.28.5.2,port=6379,state=online,offset=830290,lag=1^M^Jmaster_replid:f8eac6c8a17a641b11523474ffa3dbd0af88977a^M^Jmaster_replid2:0000000000000000000000000000000000000000^M^Jmaster_repl_offset:830290^M^Jsecond_repl_offset:-1^M^Jrepl_backlog_active:1^M^Jrepl_backlog_size:1048576^M^Jrepl_backlog_first_byte_offset:1^M^Jrepl_backlog_histlen:830290^M^J"
13:13:06.090044 IP 172.28.5.5.54394 > 172.28.5.0.6379: Flags [P.], seq 25:31, ack 470, win 237, options [nop,nop,TS val 3500362794 ecr 2883207084], length 6: RESP "QUIT"
13:13:06.090200 IP 172.28.5.0.6379 > 172.28.5.5.54394: Flags [P.], seq 470:475, ack 31, win 227, options [nop,nop,TS val 2883207084 ecr 3500362794], length 5: RESP "OK"
13:13:06.090287 IP 172.28.5.0.6379 > 172.28.5.5.54394: Flags [F.], seq 475, ack 31, win 227, options [nop,nop,TS val 2883207084 ecr 3500362794], length 0
13:13:06.090356 IP 172.28.5.5.54394 > 172.28.5.0.6379: Flags [R.], seq 31, ack 476, win 237, options [nop,nop,TS val 3500362794 ecr 2883207084], length 0
13:13:06.414943 IP 172.28.5.5.58666 > 172.28.5.1.6379: Flags [R.], seq 25, ack 526, win 237, options [nop,nop,TS val 3392273890 ecr 9483914], length 0
13:13:06.749625 IP 172.28.5.5.53370 > 172.28.5.2.6379: Flags [R.], seq 25, ack 528, win 237, options [nop,nop,TS val 1868904443 ecr 1402782458], length 0
13:13:07.092179 IP 172.28.5.5.54398 > 172.28.5.0.6379: Flags [S], seq 1778553480, win 29200, options [mss 1460,sackOK,TS val 3500363796 ecr 0,nop,wscale 7], length 0
13:13:07.092293 IP 172.28.5.0.6379 > 172.28.5.5.54398: Flags [S.], seq 3065195796, ack 1778553481, win 28960, options [mss 1460,sackOK,TS val 2883208086 ecr 3500363796,nop,wscale 7], length 0
13:13:07.092395 IP 172.28.5.5.54398 > 172.28.5.0.6379: Flags [P.], seq 1:7, ack 1, win 229, options [nop,nop,TS val 3500363796 ecr 2883208086], length 6: RESP "PING"
13:13:07.092467 IP 172.28.5.0.6379 > 172.28.5.5.54398: Flags [.], ack 7, win 227, options [nop,nop,TS val 2883208086 ecr 3500363796], length 0
13:13:07.092681 IP 172.28.5.0.6379 > 172.28.5.5.54398: Flags [P.], seq 1:8, ack 7, win 227, options [nop,nop,TS val 2883208086 ecr 3500363796], length 7: RESP "PONG"
13:13:07.092764 IP 172.28.5.5.54398 > 172.28.5.0.6379: Flags [P.], seq 7:25, ack 8, win 229, options [nop,nop,TS val 3500363796 ecr 2883208086], length 18: RESP "info replication"
13:13:07.092946 IP 172.28.5.0.6379 > 172.28.5.5.54398: Flags [P.], seq 8:470, ack 25, win 227, options [nop,nop,TS val 2883208087 ecr 3500363796], length 462: RESP "# Replication^M^Jrole:master^M^Jconnected_slaves:2^M^Jslave0:ip=172.28.5.1,port=6379,state=online,offset=830290,lag=1^M^Jslave1:ip=172.28.5.2,port=6379,state=online,offset=830438,lag=1^M^Jmaster_replid:f8eac6c8a17a641b11523474ffa3dbd0af88977a^M^Jmaster_replid2:0000000000000000000000000000000000000000^M^Jmaster_repl_offset:830438^M^Jsecond_repl_offset:-1^M^Jrepl_backlog_active:1^M^Jrepl_backlog_size:1048576^M^Jrepl_backlog_first_byte_offset:1^M^Jrepl_backlog_histlen:830438^M^J"
13:13:07.093028 IP 172.28.5.5.54398 > 172.28.5.0.6379: Flags [P.], seq 25:31, ack 470, win 237, options [nop,nop,TS val 3500363797 ecr 2883208087], length 6: RESP "QUIT"
13:13:07.093147 IP 172.28.5.0.6379 > 172.28.5.5.54398: Flags [P.], seq 470:475, ack 31, win 227, options [nop,nop,TS val 2883208087 ecr 3500363797], length 5: RESP "OK"
13:13:07.093240 IP 172.28.5.0.6379 > 172.28.5.5.54398: Flags [F.], seq 475, ack 31, win 227, options [nop,nop,TS val 2883208087 ecr 3500363797], length 0
13:13:07.093368 IP 172.28.5.5.54398 > 172.28.5.0.6379: Flags [F.], seq 31, ack 476, win 237, options [nop,nop,TS val 3500363797 ecr 2883208087], length 0
13:13:07.093482 IP 172.28.5.0.6379 > 172.28.5.5.54398: Flags [.], ack 32, win 227, options [nop,nop,TS val 2883208087 ecr 3500363797], length 0
13:13:07.416205 IP 172.28.5.5.58682 > 172.28.5.1.6379: Flags [S], seq 136694347, win 29200, options [mss 1460,sackOK,TS val 3392274891 ecr 0,nop,wscale 7], length 0
13:13:07.416367 IP 172.28.5.1.6379 > 172.28.5.5.58682: Flags [S.], seq 2430016720, ack 136694348, win 28960, options [mss 1460,sackOK,TS val 9485916 ecr 3392274891,nop,wscale 7], length 0
13:13:07.416497 IP 172.28.5.5.58682 > 172.28.5.1.6379: Flags [P.], seq 1:7, ack 1, win 229, options [nop,nop,TS val 3392274891 ecr 9485916], length 6: RESP "PING"
13:13:07.416607 IP 172.28.5.1.6379 > 172.28.5.5.58682: Flags [.], ack 7, win 227, options [nop,nop,TS val 9485916 ecr 3392274891], length 0
13:13:07.416917 IP 172.28.5.1.6379 > 172.28.5.5.58682: Flags [P.], seq 1:8, ack 7, win 227, options [nop,nop,TS val 9485917 ecr 3392274891], length 7: RESP "PONG"
13:13:07.417039 IP 172.28.5.5.58682 > 172.28.5.1.6379: Flags [P.], seq 7:25, ack 8, win 229, options [nop,nop,TS val 3392274892 ecr 9485917], length 18: RESP "info replication"
13:13:07.417281 IP 172.28.5.1.6379 > 172.28.5.5.58682: Flags [P.], seq 8:526, ack 25, win 227, options [nop,nop,TS val 9485917 ecr 3392274892], length 518: RESP "# Replication^M^Jrole:slave^M^Jmaster_host:172.28.5.0^M^Jmaster_port:6379^M^Jmaster_link_status:up^M^Jmaster_last_io_seconds_ago:0^M^Jmaster_sync_in_progress:0^M^Jslave_repl_offset:830586^M^Jslave_priority:100^M^Jslave_read_only:1^M^Jconnected_slaves:0^M^Jmaster_replid:f8eac6c8a17a641b11523474ffa3dbd0af88977a^M^Jmaster_replid2:0000000000000000000000000000000000000000^M^Jmaster_repl_offset:830586^M^Jsecond_repl_offset:-1^M^Jrepl_backlog_active:1^M^Jrepl_backlog_size:1048576^M^Jrepl_backlog_first_byte_offset:1^M^Jrepl_backlog_histlen:830586^M^J"
13:13:07.460448 IP 172.28.5.5.58682 > 172.28.5.1.6379: Flags [.], ack 526, win 237, options [nop,nop,TS val 3392274935 ecr 9485917], length 0
13:13:07.751165 IP 172.28.5.5.53386 > 172.28.5.2.6379: Flags [S], seq 3609035706, win 29200, options [mss 1460,sackOK,TS val 1868905445 ecr 0,nop,wscale 7], length 0
13:13:07.751270 IP 172.28.5.2.6379 > 172.28.5.5.53386: Flags [S.], seq 2047243423, ack 3609035707, win 28960, options [mss 1460,sackOK,TS val 1402784461 ecr 1868905445,nop,wscale 7], length 0
13:13:07.751340 IP 172.28.5.5.53386 > 172.28.5.2.6379: Flags [P.], seq 1:7, ack 1, win 229, options [nop,nop,TS val 1868905445 ecr 1402784461], length 6: RESP "PING"
13:13:07.751412 IP 172.28.5.2.6379 > 172.28.5.5.53386: Flags [.], ack 7, win 227, options [nop,nop,TS val 1402784461 ecr 1868905445], length 0
13:13:07.751679 IP 172.28.5.2.6379 > 172.28.5.5.53386: Flags [P.], seq 1:8, ack 7, win 227, options [nop,nop,TS val 1402784461 ecr 1868905445], length 7: RESP "PONG"
13:13:07.751822 IP 172.28.5.5.53386 > 172.28.5.2.6379: Flags [P.], seq 7:25, ack 8, win 229, options [nop,nop,TS val 1868905446 ecr 1402784461], length 18: RESP "info replication"
13:13:07.752091 IP 172.28.5.2.6379 > 172.28.5.5.53386: Flags [P.], seq 8:528, ack 25, win 227, options [nop,nop,TS val 1402784462 ecr 1868905446], length 520: RESP "# Replication^M^Jrole:slave^M^Jmaster_host:172.28.5.0^M^Jmaster_port:6379^M^Jmaster_link_status:up^M^Jmaster_last_io_seconds_ago:0^M^Jmaster_sync_in_progress:0^M^Jslave_repl_offset:830586^M^Jslave_priority:100^M^Jslave_read_only:1^M^Jconnected_slaves:0^M^Jmaster_replid:f8eac6c8a17a641b11523474ffa3dbd0af88977a^M^Jmaster_replid2:0000000000000000000000000000000000000000^M^Jmaster_repl_offset:830586^M^Jsecond_repl_offset:-1^M^Jrepl_backlog_active:1^M^Jrepl_backlog_size:1048576^M^Jrepl_backlog_first_byte_offset:186^M^Jrepl_backlog_histlen:830401^M^J"
13:13:07.796029 IP 172.28.5.5.53386 > 172.28.5.2.6379: Flags [.], ack 528, win 237, options [nop,nop,TS val 1868905490 ecr 1402784462], length 0
13:13:08.093656 IP 172.28.5.5.54410 > 172.28.5.0.6379: Flags [S], seq 3901441736, win 29200, options [mss 1460,sackOK,TS val 3500364797 ecr 0,nop,wscale 7], length 0
13:13:08.093734 IP 172.28.5.0.6379 > 172.28.5.5.54410: Flags [S.], seq 4005537675, ack 3901441737, win 28960, options [mss 1460,sackOK,TS val 2883209087 ecr 3500364797,nop,wscale 7], length 0
13:13:08.093810 IP 172.28.5.5.54410 > 172.28.5.0.6379: Flags [P.], seq 1:7, ack 1, win 229, options [nop,nop,TS val 3500364798 ecr 2883209087], length 6: RESP "PING"
13:13:08.093868 IP 172.28.5.0.6379 > 172.28.5.5.54410: Flags [.], ack 7, win 227, options [nop,nop,TS val 2883209088 ecr 3500364798], length 0
13:13:08.094020 IP 172.28.5.0.6379 > 172.28.5.5.54410: Flags [P.], seq 1:8, ack 7, win 227, options [nop,nop,TS val 2883209088 ecr 3500364798], length 7: RESP "PONG"
13:13:08.094066 IP 172.28.5.5.54410 > 172.28.5.0.6379: Flags [P.], seq 7:25, ack 8, win 229, options [nop,nop,TS val 3500364798 ecr 2883209088], length 18: RESP "info replication"
13:13:08.094143 IP 172.28.5.0.6379 > 172.28.5.5.54410: Flags [P.], seq 8:470, ack 25, win 227, options [nop,nop,TS val 2883209088 ecr 3500364798], length 462: RESP "# Replication^M^Jrole:master^M^Jconnected_slaves:2^M^Jslave0:ip=172.28.5.1,port=6379,state=online,offset=830586,lag=1^M^Jslave1:ip=172.28.5.2,port=6379,state=online,offset=830734,lag=1^M^Jmaster_replid:f8eac6c8a17a641b11523474ffa3dbd0af88977a^M^Jmaster_replid2:0000000000000000000000000000000000000000^M^Jmaster_repl_offset:830734^M^Jsecond_repl_offset:-1^M^Jrepl_backlog_active:1^M^Jrepl_backlog_size:1048576^M^Jrepl_backlog_first_byte_offset:1^M^Jrepl_backlog_histlen:830734^M^J"
13:13:08.094164 IP 172.28.5.5.54410 > 172.28.5.0.6379: Flags [P.], seq 25:31, ack 470, win 237, options [nop,nop,TS val 3500364798 ecr 2883209088], length 6: RESP "QUIT"
13:13:08.094193 IP 172.28.5.0.6379 > 172.28.5.5.54410: Flags [P.], seq 470:475, ack 31, win 227, options [nop,nop,TS val 2883209088 ecr 3500364798], length 5: RESP "OK"
13:13:08.094214 IP 172.28.5.5.54410 > 172.28.5.0.6379: Flags [R.], seq 31, ack 475, win 237, options [nop,nop,TS val 3500364798 ecr 2883209088], length 0
13:13:08.094216 IP 172.28.5.0.6379 > 172.28.5.5.54410: Flags [F.], seq 475, ack 31, win 227, options [nop,nop,TS val 2883209088 ecr 3500364798], length 0
13:13:08.094228 IP 172.28.5.5.54410 > 172.28.5.0.6379: Flags [R], seq 3901441767, win 0, length 0
13:13:08.416587 IP 172.28.5.5.58682 > 172.28.5.1.6379: Flags [R.], seq 25, ack 526, win 237, options [nop,nop,TS val 3392275891 ecr 9485917], length 0
13:13:08.753281 IP 172.28.5.5.53386 > 172.28.5.2.6379: Flags [R.], seq 25, ack 528, win 237, options [nop,nop,TS val 1868906447 ecr 1402784462], length 0
13:13:09.095430 IP 172.28.5.5.54414 > 172.28.5.0.6379: Flags [S], seq 1609899723, win 29200, options [mss 1460,sackOK,TS val 3500365799 ecr 0,nop,wscale 7], length 0
13:13:09.095565 IP 172.28.5.0.6379 > 172.28.5.5.54414: Flags [S.], seq 97520780, ack 1609899724, win 28960, options [mss 1460,sackOK,TS val 2883210089 ecr 3500365799,nop,wscale 7], length 0
13:13:09.095657 IP 172.28.5.5.54414 > 172.28.5.0.6379: Flags [P.], seq 1:7, ack 1, win 229, options [nop,nop,TS val 3500365799 ecr 2883210089], length 6: RESP "PING"
13:13:09.095746 IP 172.28.5.0.6379 > 172.28.5.5.54414: Flags [.], ack 7, win 227, options [nop,nop,TS val 2883210089 ecr 3500365799], length 0
13:13:09.096366 IP 172.28.5.0.6379 > 172.28.5.5.54414: Flags [P.], seq 1:8, ack 7, win 227, options [nop,nop,TS val 2883210090 ecr 3500365799], length 7: RESP "PONG"
13:13:09.096523 IP 172.28.5.5.54414 > 172.28.5.0.6379: Flags [P.], seq 7:25, ack 8, win 229, options [nop,nop,TS val 3500365800 ecr 2883210090], length 18: RESP "info replication"
13:13:09.096865 IP 172.28.5.0.6379 > 172.28.5.5.54414: Flags [P.], seq 8:470, ack 25, win 227, options [nop,nop,TS val 2883210091 ecr 3500365800], length 462: RESP "# Replication^M^Jrole:master^M^Jconnected_slaves:2^M^Jslave0:ip=172.28.5.1,port=6379,state=online,offset=830734,lag=1^M^Jslave1:ip=172.28.5.2,port=6379,state=online,offset=830882,lag=1^M^Jmaster_replid:f8eac6c8a17a641b11523474ffa3dbd0af88977a^M^Jmaster_replid2:0000000000000000000000000000000000000000^M^Jmaster_repl_offset:830882^M^Jsecond_repl_offset:-1^M^Jrepl_backlog_active:1^M^Jrepl_backlog_size:1048576^M^Jrepl_backlog_first_byte_offset:1^M^Jrepl_backlog_histlen:830882^M^J"
13:13:09.097026 IP 172.28.5.5.54414 > 172.28.5.0.6379: Flags [P.], seq 25:31, ack 470, win 237, options [nop,nop,TS val 3500365801 ecr 2883210091], length 6: RESP "QUIT"
13:13:09.097259 IP 172.28.5.0.6379 > 172.28.5.5.54414: Flags [P.], seq 470:475, ack 31, win 227, options [nop,nop,TS val 2883210091 ecr 3500365801], length 5: RESP "OK"
13:13:09.097363 IP 172.28.5.0.6379 > 172.28.5.5.54414: Flags [F.], seq 475, ack 31, win 227, options [nop,nop,TS val 2883210091 ecr 3500365801], length 0
13:13:09.097446 IP 172.28.5.5.54414 > 172.28.5.0.6379: Flags [R.], seq 31, ack 476, win 237, options [nop,nop,TS val 3500365801 ecr 2883210091], length 0
13:13:09.418469 IP 172.28.5.5.58698 > 172.28.5.1.6379: Flags [S], seq 623149547, win 29200, options [mss 1460,sackOK,TS val 3392276893 ecr 0,nop,wscale 7], length 0
13:13:09.418609 IP 172.28.5.1.6379 > 172.28.5.5.58698: Flags [S.], seq 2535656002, ack 623149548, win 28960, options [mss 1460,sackOK,TS val 9487918 ecr 3392276893,nop,wscale 7], length 0
13:13:09.418708 IP 172.28.5.5.58698 > 172.28.5.1.6379: Flags [P.], seq 1:7, ack 1, win 229, options [nop,nop,TS val 3392276893 ecr 9487918], length 6: RESP "PING"
13:13:09.418808 IP 172.28.5.1.6379 > 172.28.5.5.58698: Flags [.], ack 7, win 227, options [nop,nop,TS val 9487918 ecr 3392276893], length 0
13:13:09.419137 IP 172.28.5.1.6379 > 172.28.5.5.58698: Flags [P.], seq 1:8, ack 7, win 227, options [nop,nop,TS val 9487919 ecr 3392276893], length 7: RESP "PONG"
13:13:09.419313 IP 172.28.5.5.58698 > 172.28.5.1.6379: Flags [P.], seq 7:25, ack 8, win 229, options [nop,nop,TS val 3392276894 ecr 9487919], length 18: RESP "info replication"
13:13:09.419638 IP 172.28.5.1.6379 > 172.28.5.5.58698: Flags [P.], seq 8:526, ack 25, win 227, options [nop,nop,TS val 9487919 ecr 3392276894], length 518: RESP "# Replication^M^Jrole:slave^M^Jmaster_host:172.28.5.0^M^Jmaster_port:6379^M^Jmaster_link_status:up^M^Jmaster_last_io_seconds_ago:0^M^Jmaster_sync_in_progress:0^M^Jslave_repl_offset:831030^M^Jslave_priority:100^M^Jslave_read_only:1^M^Jconnected_slaves:0^M^Jmaster_replid:f8eac6c8a17a641b11523474ffa3dbd0af88977a^M^Jmaster_replid2:0000000000000000000000000000000000000000^M^Jmaster_repl_offset:831030^M^Jsecond_repl_offset:-1^M^Jrepl_backlog_active:1^M^Jrepl_backlog_size:1048576^M^Jrepl_backlog_first_byte_offset:1^M^Jrepl_backlog_histlen:831030^M^J"
13:13:09.460024 IP 172.28.5.5.58698 > 172.28.5.1.6379: Flags [.], ack 526, win 237, options [nop,nop,TS val 3392276935 ecr 9487919], length 0
13:13:09.755629 IP 172.28.5.5.53402 > 172.28.5.2.6379: Flags [S], seq 3769010088, win 29200, options [mss 1460,sackOK,TS val 1868907449 ecr 0,nop,wscale 7], length 0
13:13:09.755768 IP 172.28.5.2.6379 > 172.28.5.5.53402: Flags [S.], seq 828658794, ack 3769010089, win 28960, options [mss 1460,sackOK,TS val 1402786465 ecr 1868907449,nop,wscale 7], length 0
13:13:09.755861 IP 172.28.5.5.53402 > 172.28.5.2.6379: Flags [P.], seq 1:7, ack 1, win 229, options [nop,nop,TS val 1868907450 ecr 1402786465], length 6: RESP "PING"
13:13:09.755948 IP 172.28.5.2.6379 > 172.28.5.5.53402: Flags [.], ack 7, win 227, options [nop,nop,TS val 1402786466 ecr 1868907450], length 0
13:13:09.756315 IP 172.28.5.2.6379 > 172.28.5.5.53402: Flags [P.], seq 1:8, ack 7, win 227, options [nop,nop,TS val 1402786466 ecr 1868907450], length 7: RESP "PONG"
13:13:09.756495 IP 172.28.5.5.53402 > 172.28.5.2.6379: Flags [P.], seq 7:25, ack 8, win 229, options [nop,nop,TS val 1868907450 ecr 1402786466], length 18: RESP "info replication"
13:13:09.756804 IP 172.28.5.2.6379 > 172.28.5.5.53402: Flags [P.], seq 8:528, ack 25, win 227, options [nop,nop,TS val 1402786466 ecr 1868907450], length 520: RESP "# Replication^M^Jrole:slave^M^Jmaster_host:172.28.5.0^M^Jmaster_port:6379^M^Jmaster_link_status:up^M^Jmaster_last_io_seconds_ago:0^M^Jmaster_sync_in_progress:0^M^Jslave_repl_offset:831030^M^Jslave_priority:100^M^Jslave_read_only:1^M^Jconnected_slaves:0^M^Jmaster_replid:f8eac6c8a17a641b11523474ffa3dbd0af88977a^M^Jmaster_replid2:0000000000000000000000000000000000000000^M^Jmaster_repl_offset:831030^M^Jsecond_repl_offset:-1^M^Jrepl_backlog_active:1^M^Jrepl_backlog_size:1048576^M^Jrepl_backlog_first_byte_offset:186^M^Jrepl_backlog_histlen:830845^M^J"
13:13:09.800310 IP 172.28.5.5.53402 > 172.28.5.2.6379: Flags [.], ack 528, win 237, options [nop,nop,TS val 1868907494 ecr 1402786466], length 0
13:13:10.097541 IP 172.28.5.5.54426 > 172.28.5.0.6379: Flags [S], seq 2523020505, win 29200, options [mss 1460,sackOK,TS val 3500366801 ecr 0,nop,wscale 7], length 0
13:13:10.097689 IP 172.28.5.0.6379 > 172.28.5.5.54426: Flags [S.], seq 1704626873, ack 2523020506, win 28960, options [mss 1460,sackOK,TS val 2883211091 ecr 3500366801,nop,wscale 7], length 0
13:13:10.097793 IP 172.28.5.5.54426 > 172.28.5.0.6379: Flags [P.], seq 1:7, ack 1, win 229, options [nop,nop,TS val 3500366801 ecr 2883211091], length 6: RESP "PING"
13:13:10.097889 IP 172.28.5.0.6379 > 172.28.5.5.54426: Flags [.], ack 7, win 227, options [nop,nop,TS val 2883211092 ecr 3500366801], length 0
13:13:10.098238 IP 172.28.5.0.6379 > 172.28.5.5.54426: Flags [P.], seq 1:8, ack 7, win 227, options [nop,nop,TS val 2883211092 ecr 3500366801], length 7: RESP "PONG"
13:13:10.098419 IP 172.28.5.5.54426 > 172.28.5.0.6379: Flags [P.], seq 7:25, ack 8, win 229, options [nop,nop,TS val 3500366802 ecr 2883211092], length 18: RESP "info replication"
13:13:10.098748 IP 172.28.5.0.6379 > 172.28.5.5.54426: Flags [P.], seq 8:470, ack 25, win 227, options [nop,nop,TS val 2883211092 ecr 3500366802], length 462: RESP "# Replication^M^Jrole:master^M^Jconnected_slaves:2^M^Jslave0:ip=172.28.5.1,port=6379,state=online,offset=831030,lag=1^M^Jslave1:ip=172.28.5.2,port=6379,state=online,offset=831030,lag=1^M^Jmaster_replid:f8eac6c8a17a641b11523474ffa3dbd0af88977a^M^Jmaster_replid2:0000000000000000000000000000000000000000^M^Jmaster_repl_offset:831178^M^Jsecond_repl_offset:-1^M^Jrepl_backlog_active:1^M^Jrepl_backlog_size:1048576^M^Jrepl_backlog_first_byte_offset:1^M^Jrepl_backlog_histlen:831178^M^J"
13:13:10.098938 IP 172.28.5.5.54426 > 172.28.5.0.6379: Flags [P.], seq 25:31, ack 470, win 237, options [nop,nop,TS val 3500366803 ecr 2883211092], length 6: RESP "QUIT"
13:13:10.099209 IP 172.28.5.0.6379 > 172.28.5.5.54426: Flags [P.], seq 470:475, ack 31, win 227, options [nop,nop,TS val 2883211093 ecr 3500366803], length 5: RESP "OK"
13:13:10.099350 IP 172.28.5.0.6379 > 172.28.5.5.54426: Flags [F.], seq 475, ack 31, win 227, options [nop,nop,TS val 2883211093 ecr 3500366803], length 0
13:13:10.099372 IP 172.28.5.5.54426 > 172.28.5.0.6379: Flags [R.], seq 31, ack 475, win 237, options [nop,nop,TS val 3500366803 ecr 2883211093], length 0
13:13:10.099398 IP 172.28.5.5.54426 > 172.28.5.0.6379: Flags [R], seq 2523020536, win 0, length 0
13:13:10.420047 IP 172.28.5.5.58698 > 172.28.5.1.6379: Flags [R.], seq 25, ack 526, win 237, options [nop,nop,TS val 3392277895 ecr 9487919], length 0
13:13:10.757746 IP 172.28.5.5.53402 > 172.28.5.2.6379: Flags [R.], seq 25, ack 528, win 237, options [nop,nop,TS val 1868908451 ecr 1402786466], length 0
13:13:11.099392 IP 172.28.5.5.54430 > 172.28.5.0.6379: Flags [S], seq 325341037, win 29200, options [mss 1460,sackOK,TS val 3500367803 ecr 0,nop,wscale 7], length 0
13:13:11.099469 IP 172.28.5.0.6379 > 172.28.5.5.54430: Flags [S.], seq 3091318697, ack 325341038, win 28960, options [mss 1460,sackOK,TS val 2883212093 ecr 3500367803,nop,wscale 7], length 0
13:13:11.099517 IP 172.28.5.5.54430 > 172.28.5.0.6379: Flags [P.], seq 1:7, ack 1, win 229, options [nop,nop,TS val 3500367803 ecr 2883212093], length 6: RESP "PING"
13:13:11.099565 IP 172.28.5.0.6379 > 172.28.5.5.54430: Flags [.], ack 7, win 227, options [nop,nop,TS val 2883212093 ecr 3500367803], length 0
13:13:11.099717 IP 172.28.5.0.6379 > 172.28.5.5.54430: Flags [P.], seq 1:8, ack 7, win 227, options [nop,nop,TS val 2883212093 ecr 3500367803], length 7: RESP "PONG"
13:13:11.099769 IP 172.28.5.5.54430 > 172.28.5.0.6379: Flags [P.], seq 7:25, ack 8, win 229, options [nop,nop,TS val 3500367803 ecr 2883212093], length 18: RESP "info replication"
13:13:11.099886 IP 172.28.5.0.6379 > 172.28.5.5.54430: Flags [P.], seq 8:470, ack 25, win 227, options [nop,nop,TS val 2883212094 ecr 3500367803], length 462: RESP "# Replication^M^Jrole:master^M^Jconnected_slaves:2^M^Jslave0:ip=172.28.5.1,port=6379,state=online,offset=831178,lag=1^M^Jslave1:ip=172.28.5.2,port=6379,state=online,offset=831326,lag=1^M^Jmaster_replid:f8eac6c8a17a641b11523474ffa3dbd0af88977a^M^Jmaster_replid2:0000000000000000000000000000000000000000^M^Jmaster_repl_offset:831326^M^Jsecond_repl_offset:-1^M^Jrepl_backlog_active:1^M^Jrepl_backlog_size:1048576^M^Jrepl_backlog_first_byte_offset:1^M^Jrepl_backlog_histlen:831326^M^J"
13:13:11.099926 IP 172.28.5.5.54430 > 172.28.5.0.6379: Flags [P.], seq 25:31, ack 470, win 237, options [nop,nop,TS val 3500367804 ecr 2883212094], length 6: RESP "QUIT"
13:13:11.100032 IP 172.28.5.0.6379 > 172.28.5.5.54430: Flags [P.], seq 470:475, ack 31, win 227, options [nop,nop,TS val 2883212094 ecr 3500367804], length 5: RESP "OK"
13:13:11.100089 IP 172.28.5.5.54430 > 172.28.5.0.6379: Flags [R.], seq 31, ack 475, win 237, options [nop,nop,TS val 3500367804 ecr 2883212094], length 0
13:13:11.100093 IP 172.28.5.0.6379 > 172.28.5.5.54430: Flags [F.], seq 475, ack 31, win 227, options [nop,nop,TS val 2883212094 ecr 3500367804], length 0
13:13:11.100114 IP 172.28.5.5.54430 > 172.28.5.0.6379: Flags [R], seq 325341068, win 0, length 0
13:13:11.420574 IP 172.28.5.5.58714 > 172.28.5.1.6379: Flags [S], seq 854436773, win 29200, options [mss 1460,sackOK,TS val 3392278895 ecr 0,nop,wscale 7], length 0
13:13:11.420739 IP 172.28.5.1.6379 > 172.28.5.5.58714: Flags [S.], seq 263210435, ack 854436774, win 28960, options [mss 1460,sackOK,TS val 9489920 ecr 3392278895,nop,wscale 7], length 0
13:13:11.420854 IP 172.28.5.5.58714 > 172.28.5.1.6379: Flags [P.], seq 1:7, ack 1, win 229, options [nop,nop,TS val 3392278896 ecr 9489920], length 6: RESP "PING"
13:13:11.420967 IP 172.28.5.1.6379 > 172.28.5.5.58714: Flags [.], ack 7, win 227, options [nop,nop,TS val 9489921 ecr 3392278896], length 0
13:13:11.421348 IP 172.28.5.1.6379 > 172.28.5.5.58714: Flags [P.], seq 1:8, ack 7, win 227, options [nop,nop,TS val 9489921 ecr 3392278896], length 7: RESP "PONG"
13:13:11.421467 IP 172.28.5.5.58714 > 172.28.5.1.6379: Flags [P.], seq 7:25, ack 8, win 229, options [nop,nop,TS val 3392278896 ecr 9489921], length 18: RESP "info replication"
13:13:11.421749 IP 172.28.5.1.6379 > 172.28.5.5.58714: Flags [P.], seq 8:526, ack 25, win 227, options [nop,nop,TS val 9489921 ecr 3392278896], length 518: RESP "# Replication^M^Jrole:slave^M^Jmaster_host:172.28.5.0^M^Jmaster_port:6379^M^Jmaster_link_status:up^M^Jmaster_last_io_seconds_ago:0^M^Jmaster_sync_in_progress:0^M^Jslave_repl_offset:831474^M^Jslave_priority:100^M^Jslave_read_only:1^M^Jconnected_slaves:0^M^Jmaster_replid:f8eac6c8a17a641b11523474ffa3dbd0af88977a^M^Jmaster_replid2:0000000000000000000000000000000000000000^M^Jmaster_repl_offset:831474^M^Jsecond_repl_offset:-1^M^Jrepl_backlog_active:1^M^Jrepl_backlog_size:1048576^M^Jrepl_backlog_first_byte_offset:1^M^Jrepl_backlog_histlen:831474^M^J"
13:13:11.464064 IP 172.28.5.5.58714 > 172.28.5.1.6379: Flags [.], ack 526, win 237, options [nop,nop,TS val 3392278939 ecr 9489921], length 0
13:13:11.759346 IP 172.28.5.5.53418 > 172.28.5.2.6379: Flags [S], seq 1747150465, win 29200, options [mss 1460,sackOK,TS val 1868909453 ecr 0,nop,wscale 7], length 0
13:13:11.759392 IP 172.28.5.2.6379 > 172.28.5.5.53418: Flags [S.], seq 2747306703, ack 1747150466, win 28960, options [mss 1460,sackOK,TS val 1402788469 ecr 1868909453,nop,wscale 7], length 0
13:13:11.759421 IP 172.28.5.5.53418 > 172.28.5.2.6379: Flags [P.], seq 1:7, ack 1, win 229, options [nop,nop,TS val 1868909453 ecr 1402788469], length 6: RESP "PING"
13:13:11.759446 IP 172.28.5.2.6379 > 172.28.5.5.53418: Flags [.], ack 7, win 227, options [nop,nop,TS val 1402788469 ecr 1868909453], length 0
13:13:11.759563 IP 172.28.5.2.6379 > 172.28.5.5.53418: Flags [P.], seq 1:8, ack 7, win 227, options [nop,nop,TS val 1402788469 ecr 1868909453], length 7: RESP "PONG"
13:13:11.759631 IP 172.28.5.5.53418 > 172.28.5.2.6379: Flags [P.], seq 7:25, ack 8, win 229, options [nop,nop,TS val 1868909453 ecr 1402788469], length 18: RESP "info replication"
13:13:11.759737 IP 172.28.5.2.6379 > 172.28.5.5.53418: Flags [P.], seq 8:528, ack 25, win 227, options [nop,nop,TS val 1402788469 ecr 1868909453], length 520: RESP "# Replication^M^Jrole:slave^M^Jmaster_host:172.28.5.0^M^Jmaster_port:6379^M^Jmaster_link_status:up^M^Jmaster_last_io_seconds_ago:0^M^Jmaster_sync_in_progress:0^M^Jslave_repl_offset:831474^M^Jslave_priority:100^M^Jslave_read_only:1^M^Jconnected_slaves:0^M^Jmaster_replid:f8eac6c8a17a641b11523474ffa3dbd0af88977a^M^Jmaster_replid2:0000000000000000000000000000000000000000^M^Jmaster_repl_offset:831474^M^Jsecond_repl_offset:-1^M^Jrepl_backlog_active:1^M^Jrepl_backlog_size:1048576^M^Jrepl_backlog_first_byte_offset:186^M^Jrepl_backlog_histlen:831289^M^J"
13:13:11.800049 IP 172.28.5.5.53418 > 172.28.5.2.6379: Flags [.], ack 528, win 237, options [nop,nop,TS val 1868909494 ecr 1402788469], length 0
13:13:12.101094 IP 172.28.5.5.54442 > 172.28.5.0.6379: Flags [S], seq 2350747925, win 29200, options [mss 1460,sackOK,TS val 3500368805 ecr 0,nop,wscale 7], length 0
13:13:12.101284 IP 172.28.5.0.6379 > 172.28.5.5.54442: Flags [S.], seq 3974472236, ack 2350747926, win 28960, options [mss 1460,sackOK,TS val 2883213095 ecr 3500368805,nop,wscale 7], length 0
13:13:12.101453 IP 172.28.5.5.54442 > 172.28.5.0.6379: Flags [P.], seq 1:7, ack 1, win 229, options [nop,nop,TS val 3500368805 ecr 2883213095], length 6: RESP "PING"
13:13:12.101579 IP 172.28.5.0.6379 > 172.28.5.5.54442: Flags [.], ack 7, win 227, options [nop,nop,TS val 2883213095 ecr 3500368805], length 0
13:13:12.101919 IP 172.28.5.0.6379 > 172.28.5.5.54442: Flags [P.], seq 1:8, ack 7, win 227, options [nop,nop,TS val 2883213096 ecr 3500368805], length 7: RESP "PONG"
13:13:12.102062 IP 172.28.5.5.54442 > 172.28.5.0.6379: Flags [P.], seq 7:25, ack 8, win 229, options [nop,nop,TS val 3500368806 ecr 2883213096], length 18: RESP "info replication"
13:13:12.102417 IP 172.28.5.0.6379 > 172.28.5.5.54442: Flags [P.], seq 8:470, ack 25, win 227, options [nop,nop,TS val 2883213096 ecr 3500368806], length 462: RESP "# Replication^M^Jrole:master^M^Jconnected_slaves:2^M^Jslave0:ip=172.28.5.1,port=6379,state=online,offset=831474,lag=1^M^Jslave1:ip=172.28.5.2,port=6379,state=online,offset=831474,lag=1^M^Jmaster_replid:f8eac6c8a17a641b11523474ffa3dbd0af88977a^M^Jmaster_replid2:0000000000000000000000000000000000000000^M^Jmaster_repl_offset:831622^M^Jsecond_repl_offset:-1^M^Jrepl_backlog_active:1^M^Jrepl_backlog_size:1048576^M^Jrepl_backlog_first_byte_offset:1^M^Jrepl_backlog_histlen:831622^M^J"
13:13:12.102575 IP 172.28.5.5.54442 > 172.28.5.0.6379: Flags [P.], seq 25:31, ack 470, win 237, options [nop,nop,TS val 3500368806 ecr 2883213096], length 6: RESP "QUIT"
13:13:12.102790 IP 172.28.5.0.6379 > 172.28.5.5.54442: Flags [P.], seq 470:475, ack 31, win 227, options [nop,nop,TS val 2883213096 ecr 3500368806], length 5: RESP "OK"
13:13:12.102914 IP 172.28.5.0.6379 > 172.28.5.5.54442: Flags [F.], seq 475, ack 31, win 227, options [nop,nop,TS val 2883213097 ecr 3500368806], length 0
13:13:12.103084 IP 172.28.5.5.54442 > 172.28.5.0.6379: Flags [F.], seq 31, ack 476, win 237, options [nop,nop,TS val 3500368807 ecr 2883213096], length 0
13:13:12.103200 IP 172.28.5.0.6379 > 172.28.5.5.54442: Flags [.], ack 32, win 227, options [nop,nop,TS val 2883213097 ecr 3500368807], length 0
13:13:12.421755 IP 172.28.5.5.58714 > 172.28.5.1.6379: Flags [R.], seq 25, ack 526, win 237, options [nop,nop,TS val 3392279896 ecr 9489921], length 0
13:13:12.761381 IP 172.28.5.5.53418 > 172.28.5.2.6379: Flags [R.], seq 25, ack 528, win 237, options [nop,nop,TS val 1868910455 ecr 1402788469], length 0
13:13:13.105166 IP 172.28.5.5.54448 > 172.28.5.0.6379: Flags [S], seq 3222086036, win 29200, options [mss 1460,sackOK,TS val 3500369809 ecr 0,nop,wscale 7], length 0
13:13:13.105283 IP 172.28.5.0.6379 > 172.28.5.5.54448: Flags [S.], seq 1148479795, ack 3222086037, win 28960, options [mss 1460,sackOK,TS val 2883214099 ecr 3500369809,nop,wscale 7], length 0
13:13:13.105364 IP 172.28.5.5.54448 > 172.28.5.0.6379: Flags [P.], seq 1:7, ack 1, win 229, options [nop,nop,TS val 3500369809 ecr 2883214099], length 6: RESP "PING"
13:13:13.105434 IP 172.28.5.0.6379 > 172.28.5.5.54448: Flags [.], ack 7, win 227, options [nop,nop,TS val 2883214099 ecr 3500369809], length 0
13:13:13.105740 IP 172.28.5.0.6379 > 172.28.5.5.54448: Flags [P.], seq 1:8, ack 7, win 227, options [nop,nop,TS val 2883214099 ecr 3500369809], length 7: RESP "PONG"
13:13:13.105889 IP 172.28.5.5.54448 > 172.28.5.0.6379: Flags [P.], seq 7:25, ack 8, win 229, options [nop,nop,TS val 3500369810 ecr 2883214099], length 18: RESP "info replication"
13:13:13.106184 IP 172.28.5.0.6379 > 172.28.5.5.54448: Flags [P.], seq 8:470, ack 25, win 227, options [nop,nop,TS val 2883214100 ecr 3500369810], length 462: RESP "# Replication^M^Jrole:master^M^Jconnected_slaves:2^M^Jslave0:ip=172.28.5.1,port=6379,state=online,offset=831622,lag=1^M^Jslave1:ip=172.28.5.2,port=6379,state=online,offset=831784,lag=1^M^Jmaster_replid:f8eac6c8a17a641b11523474ffa3dbd0af88977a^M^Jmaster_replid2:0000000000000000000000000000000000000000^M^Jmaster_repl_offset:831784^M^Jsecond_repl_offset:-1^M^Jrepl_backlog_active:1^M^Jrepl_backlog_size:1048576^M^Jrepl_backlog_first_byte_offset:1^M^Jrepl_backlog_histlen:831784^M^J"
13:13:13.106325 IP 172.28.5.5.54448 > 172.28.5.0.6379: Flags [P.], seq 25:31, ack 470, win 237, options [nop,nop,TS val 3500369810 ecr 2883214100], length 6: RESP "QUIT"
13:13:13.106542 IP 172.28.5.0.6379 > 172.28.5.5.54448: Flags [P.], seq 470:475, ack 31, win 227, options [nop,nop,TS val 2883214100 ecr 3500369810], length 5: RESP "OK"
13:13:13.106646 IP 172.28.5.0.6379 > 172.28.5.5.54448: Flags [F.], seq 475, ack 31, win 227, options [nop,nop,TS val 2883214100 ecr 3500369810], length 0
13:13:13.106677 IP 172.28.5.5.54448 > 172.28.5.0.6379: Flags [R], seq 3222086067, win 0, length 0
13:13:13.106678 IP 172.28.5.5.54448 > 172.28.5.0.6379: Flags [R.], seq 31, ack 475, win 237, options [nop,nop,TS val 3500369810 ecr 2883214100], length 0
13:13:13.423300 IP 172.28.5.5.58732 > 172.28.5.1.6379: Flags [S], seq 3283587278, win 29200, options [mss 1460,sackOK,TS val 3392280898 ecr 0,nop,wscale 7], length 0
13:13:13.423345 IP 172.28.5.1.6379 > 172.28.5.5.58732: Flags [S.], seq 3517131069, ack 3283587279, win 28960, options [mss 1460,sackOK,TS val 9491923 ecr 3392280898,nop,wscale 7], length 0
13:13:13.423371 IP 172.28.5.5.58732 > 172.28.5.1.6379: Flags [P.], seq 1:7, ack 1, win 229, options [nop,nop,TS val 3392280898 ecr 9491923], length 6: RESP "PING"
13:13:13.423394 IP 172.28.5.1.6379 > 172.28.5.5.58732: Flags [.], ack 7, win 227, options [nop,nop,TS val 9491923 ecr 3392280898], length 0
13:13:13.423474 IP 172.28.5.1.6379 > 172.28.5.5.58732: Flags [P.], seq 1:8, ack 7, win 227, options [nop,nop,TS val 9491923 ecr 3392280898], length 7: RESP "PONG"
13:13:13.423537 IP 172.28.5.5.58732 > 172.28.5.1.6379: Flags [P.], seq 7:25, ack 8, win 229, options [nop,nop,TS val 3392280898 ecr 9491923], length 18: RESP "info replication"
13:13:13.423618 IP 172.28.5.1.6379 > 172.28.5.5.58732: Flags [P.], seq 8:526, ack 25, win 227, options [nop,nop,TS val 9491923 ecr 3392280898], length 518: RESP "# Replication^M^Jrole:slave^M^Jmaster_host:172.28.5.0^M^Jmaster_port:6379^M^Jmaster_link_status:up^M^Jmaster_last_io_seconds_ago:0^M^Jmaster_sync_in_progress:0^M^Jslave_repl_offset:831932^M^Jslave_priority:100^M^Jslave_read_only:1^M^Jconnected_slaves:0^M^Jmaster_replid:f8eac6c8a17a641b11523474ffa3dbd0af88977a^M^Jmaster_replid2:0000000000000000000000000000000000000000^M^Jmaster_repl_offset:831932^M^Jsecond_repl_offset:-1^M^Jrepl_backlog_active:1^M^Jrepl_backlog_size:1048576^M^Jrepl_backlog_first_byte_offset:1^M^Jrepl_backlog_histlen:831932^M^J"
13:13:13.463995 IP 172.28.5.5.58732 > 172.28.5.1.6379: Flags [.], ack 526, win 237, options [nop,nop,TS val 3392280939 ecr 9491923], length 0
13:13:13.763276 IP 172.28.5.5.53436 > 172.28.5.2.6379: Flags [S], seq 4058647244, win 29200, options [mss 1460,sackOK,TS val 1868911457 ecr 0,nop,wscale 7], length 0
13:13:13.763416 IP 172.28.5.2.6379 > 172.28.5.5.53436: Flags [S.], seq 2107959935, ack 4058647245, win 28960, options [mss 1460,sackOK,TS val 1402790473 ecr 1868911457,nop,wscale 7], length 0
