13:37:01.061774 IP 172.28.5.4.49200 > 172.28.5.2.6379: Flags [R.], seq 1556665137, ack 4071245931, win 237, options [nop,nop,TS val 3563727612 ecr 343189915], length 0
13:37:01.396716 IP 172.28.5.4.51232 > 172.28.5.0.6379: Flags [S], seq 2577326173, win 29200, options [mss 1460,sackOK,TS val 1842721239 ecr 0,nop,wscale 7], length 0
13:37:01.396869 IP 172.28.5.0.6379 > 172.28.5.4.51232: Flags [S.], seq 1070273847, ack 2577326174, win 28960, options [mss 1460,sackOK,TS val 202076173 ecr 1842721239,nop,wscale 7], length 0
13:37:01.396960 IP 172.28.5.4.51232 > 172.28.5.0.6379: Flags [P.], seq 1:7, ack 1, win 229, options [nop,nop,TS val 1842721239 ecr 202076173], length 6: RESP "PING"
13:37:01.397073 IP 172.28.5.0.6379 > 172.28.5.4.51232: Flags [.], ack 7, win 227, options [nop,nop,TS val 202076173 ecr 1842721239], length 0
13:37:01.397385 IP 172.28.5.0.6379 > 172.28.5.4.51232: Flags [P.], seq 1:8, ack 7, win 227, options [nop,nop,TS val 202076173 ecr 1842721239], length 7: RESP "PONG"
13:37:01.397510 IP 172.28.5.4.51232 > 172.28.5.0.6379: Flags [P.], seq 7:25, ack 8, win 229, options [nop,nop,TS val 1842721239 ecr 202076173], length 18: RESP "info replication"
13:37:01.397750 IP 172.28.5.0.6379 > 172.28.5.4.51232: Flags [P.], seq 8:480, ack 25, win 227, options [nop,nop,TS val 202076174 ecr 1842721239], length 472: RESP "# Replication^M^Jrole:master^M^Jconnected_slaves:2^M^Jslave0:ip=172.28.5.2,port=6379,state=online,offset=3419915,lag=0^M^Jslave1:ip=172.28.5.1,port=6379,state=online,offset=3419915,lag=0^M^Jmaster_replid:186487241cd9594a4921b48b510ea432fa9dc5d5^M^Jmaster_replid2:0000000000000000000000000000000000000000^M^Jmaster_repl_offset:3419915^M^Jsecond_repl_offset:-1^M^Jrepl_backlog_active:1^M^Jrepl_backlog_size:1048576^M^Jrepl_backlog_first_byte_offset:2371340^M^Jrepl_backlog_histlen:1048576^M^J"
13:37:01.397842 IP 172.28.5.4.51232 > 172.28.5.0.6379: Flags [P.], seq 25:31, ack 480, win 237, options [nop,nop,TS val 1842721240 ecr 202076174], length 6: RESP "QUIT"
13:37:01.398082 IP 172.28.5.0.6379 > 172.28.5.4.51232: Flags [P.], seq 480:485, ack 31, win 227, options [nop,nop,TS val 202076174 ecr 1842721240], length 5: RESP "OK"
13:37:01.398213 IP 172.28.5.4.51232 > 172.28.5.0.6379: Flags [R.], seq 31, ack 485, win 237, options [nop,nop,TS val 1842721240 ecr 202076174], length 0
13:37:01.398221 IP 172.28.5.0.6379 > 172.28.5.4.51232: Flags [F.], seq 485, ack 31, win 227, options [nop,nop,TS val 202076174 ecr 1842721240], length 0
13:37:01.398267 IP 172.28.5.4.51232 > 172.28.5.0.6379: Flags [R], seq 2577326204, win 0, length 0
13:37:01.731282 IP 172.28.5.4.44478 > 172.28.5.1.6379: Flags [S], seq 2644209124, win 29200, options [mss 1460,sackOK,TS val 4040500999 ecr 0,nop,wscale 7], length 0
13:37:01.731425 IP 172.28.5.1.6379 > 172.28.5.4.44478: Flags [S.], seq 1784010709, ack 2644209125, win 28960, options [mss 1460,sackOK,TS val 3557095593 ecr 4040500999,nop,wscale 7], length 0
13:37:01.731512 IP 172.28.5.4.44478 > 172.28.5.1.6379: Flags [P.], seq 1:7, ack 1, win 229, options [nop,nop,TS val 4040500999 ecr 3557095593], length 6: RESP "PING"
13:37:01.731609 IP 172.28.5.1.6379 > 172.28.5.4.44478: Flags [.], ack 7, win 227, options [nop,nop,TS val 3557095593 ecr 4040500999], length 0
13:37:01.731920 IP 172.28.5.1.6379 > 172.28.5.4.44478: Flags [P.], seq 1:8, ack 7, win 227, options [nop,nop,TS val 3557095594 ecr 4040500999], length 7: RESP "PONG"
13:37:01.732112 IP 172.28.5.4.44478 > 172.28.5.1.6379: Flags [P.], seq 7:25, ack 8, win 229, options [nop,nop,TS val 4040501000 ecr 3557095594], length 18: RESP "info replication"
13:37:01.732354 IP 172.28.5.1.6379 > 172.28.5.4.44478: Flags [P.], seq 8:535, ack 25, win 227, options [nop,nop,TS val 3557095594 ecr 4040501000], length 527: RESP "# Replication^M^Jrole:slave^M^Jmaster_host:172.28.5.0^M^Jmaster_port:6379^M^Jmaster_link_status:up^M^Jmaster_last_io_seconds_ago:1^M^Jmaster_sync_in_progress:0^M^Jslave_repl_offset:3419915^M^Jslave_priority:100^M^Jslave_read_only:1^M^Jconnected_slaves:0^M^Jmaster_replid:186487241cd9594a4921b48b510ea432fa9dc5d5^M^Jmaster_replid2:0000000000000000000000000000000000000000^M^Jmaster_repl_offset:3419915^M^Jsecond_repl_offset:-1^M^Jrepl_backlog_active:1^M^Jrepl_backlog_size:1048576^M^Jrepl_backlog_first_byte_offset:2371340^M^Jrepl_backlog_histlen:1048576^M^J"
13:37:01.776168 IP 172.28.5.4.44478 > 172.28.5.1.6379: Flags [.], ack 535, win 237, options [nop,nop,TS val 4040501044 ecr 3557095594], length 0
13:37:02.063388 IP 172.28.5.4.49216 > 172.28.5.2.6379: Flags [S], seq 1576088127, win 29200, options [mss 1460,sackOK,TS val 3563728613 ecr 0,nop,wscale 7], length 0
13:37:02.063536 IP 172.28.5.2.6379 > 172.28.5.4.49216: Flags [S.], seq 2699547981, ack 1576088128, win 28960, options [mss 1460,sackOK,TS val 343191917 ecr 3563728613,nop,wscale 7], length 0
13:37:02.063624 IP 172.28.5.4.49216 > 172.28.5.2.6379: Flags [P.], seq 1:7, ack 1, win 229, options [nop,nop,TS val 3563728613 ecr 343191917], length 6: RESP "PING"
13:37:02.063727 IP 172.28.5.2.6379 > 172.28.5.4.49216: Flags [.], ack 7, win 227, options [nop,nop,TS val 343191918 ecr 3563728613], length 0
13:37:02.064080 IP 172.28.5.2.6379 > 172.28.5.4.49216: Flags [P.], seq 1:8, ack 7, win 227, options [nop,nop,TS val 343191918 ecr 3563728613], length 7: RESP "PONG"
13:37:02.064231 IP 172.28.5.4.49216 > 172.28.5.2.6379: Flags [P.], seq 7:25, ack 8, win 229, options [nop,nop,TS val 3563728614 ecr 343191918], length 18: RESP "info replication"
13:37:02.064470 IP 172.28.5.2.6379 > 172.28.5.4.49216: Flags [P.], seq 8:535, ack 25, win 227, options [nop,nop,TS val 343191918 ecr 3563728614], length 527: RESP "# Replication^M^Jrole:slave^M^Jmaster_host:172.28.5.0^M^Jmaster_port:6379^M^Jmaster_link_status:up^M^Jmaster_last_io_seconds_ago:0^M^Jmaster_sync_in_progress:0^M^Jslave_repl_offset:3419929^M^Jslave_priority:100^M^Jslave_read_only:1^M^Jconnected_slaves:0^M^Jmaster_replid:186487241cd9594a4921b48b510ea432fa9dc5d5^M^Jmaster_replid2:0000000000000000000000000000000000000000^M^Jmaster_repl_offset:3419929^M^Jsecond_repl_offset:-1^M^Jrepl_backlog_active:1^M^Jrepl_backlog_size:1048576^M^Jrepl_backlog_first_byte_offset:2371354^M^Jrepl_backlog_histlen:1048576^M^J"
13:37:02.108547 IP 172.28.5.4.49216 > 172.28.5.2.6379: Flags [.], ack 535, win 237, options [nop,nop,TS val 3563728658 ecr 343191918], length 0
13:37:02.398439 IP 172.28.5.4.51244 > 172.28.5.0.6379: Flags [S], seq 777335251, win 29200, options [mss 1460,sackOK,TS val 1842722240 ecr 0,nop,wscale 7], length 0
13:37:02.398568 IP 172.28.5.0.6379 > 172.28.5.4.51244: Flags [S.], seq 2455294742, ack 777335252, win 28960, options [mss 1460,sackOK,TS val 202077174 ecr 1842722240,nop,wscale 7], length 0
13:37:02.398641 IP 172.28.5.4.51244 > 172.28.5.0.6379: Flags [P.], seq 1:7, ack 1, win 229, options [nop,nop,TS val 1842722240 ecr 202077174], length 6: RESP "PING"
13:37:02.398725 IP 172.28.5.0.6379 > 172.28.5.4.51244: Flags [.], ack 7, win 227, options [nop,nop,TS val 202077175 ecr 1842722240], length 0
13:37:02.398991 IP 172.28.5.0.6379 > 172.28.5.4.51244: Flags [P.], seq 1:8, ack 7, win 227, options [nop,nop,TS val 202077175 ecr 1842722240], length 7: RESP "PONG"
13:37:02.399158 IP 172.28.5.4.51244 > 172.28.5.0.6379: Flags [P.], seq 7:25, ack 8, win 229, options [nop,nop,TS val 1842722241 ecr 202077175], length 18: RESP "info replication"
13:37:02.399440 IP 172.28.5.0.6379 > 172.28.5.4.51244: Flags [P.], seq 8:480, ack 25, win 227, options [nop,nop,TS val 202077175 ecr 1842722241], length 472: RESP "# Replication^M^Jrole:master^M^Jconnected_slaves:2^M^Jslave0:ip=172.28.5.2,port=6379,state=online,offset=3420077,lag=0^M^Jslave1:ip=172.28.5.1,port=6379,state=online,offset=3419929,lag=0^M^Jmaster_replid:186487241cd9594a4921b48b510ea432fa9dc5d5^M^Jmaster_replid2:0000000000000000000000000000000000000000^M^Jmaster_repl_offset:3420077^M^Jsecond_repl_offset:-1^M^Jrepl_backlog_active:1^M^Jrepl_backlog_size:1048576^M^Jrepl_backlog_first_byte_offset:2371502^M^Jrepl_backlog_histlen:1048576^M^J"
13:37:02.399606 IP 172.28.5.4.51244 > 172.28.5.0.6379: Flags [P.], seq 25:31, ack 480, win 237, options [nop,nop,TS val 1842722241 ecr 202077175], length 6: RESP "QUIT"
13:37:02.399823 IP 172.28.5.0.6379 > 172.28.5.4.51244: Flags [P.], seq 480:485, ack 31, win 227, options [nop,nop,TS val 202077176 ecr 1842722241], length 5: RESP "OK"
13:37:02.399934 IP 172.28.5.0.6379 > 172.28.5.4.51244: Flags [F.], seq 485, ack 31, win 227, options [nop,nop,TS val 202077176 ecr 1842722241], length 0
13:37:02.400019 IP 172.28.5.4.51244 > 172.28.5.0.6379: Flags [R.], seq 31, ack 486, win 237, options [nop,nop,TS val 1842722242 ecr 202077176], length 0
13:37:02.733679 IP 172.28.5.4.44478 > 172.28.5.1.6379: Flags [R.], seq 25, ack 535, win 237, options [nop,nop,TS val 4040502001 ecr 3557095594], length 0
13:37:03.065338 IP 172.28.5.4.49216 > 172.28.5.2.6379: Flags [R.], seq 25, ack 535, win 237, options [nop,nop,TS val 3563729615 ecr 343191918], length 0
13:37:03.400438 IP 172.28.5.4.51248 > 172.28.5.0.6379: Flags [S], seq 3488330977, win 29200, options [mss 1460,sackOK,TS val 1842723242 ecr 0,nop,wscale 7], length 0
13:37:03.400561 IP 172.28.5.0.6379 > 172.28.5.4.51248: Flags [S.], seq 1890520488, ack 3488330978, win 28960, options [mss 1460,sackOK,TS val 202078176 ecr 1842723242,nop,wscale 7], length 0
13:37:03.400633 IP 172.28.5.4.51248 > 172.28.5.0.6379: Flags [P.], seq 1:7, ack 1, win 229, options [nop,nop,TS val 1842723242 ecr 202078176], length 6: RESP "PING"
13:37:03.400725 IP 172.28.5.0.6379 > 172.28.5.4.51248: Flags [.], ack 7, win 227, options [nop,nop,TS val 202078177 ecr 1842723242], length 0
13:37:03.400976 IP 172.28.5.0.6379 > 172.28.5.4.51248: Flags [P.], seq 1:8, ack 7, win 227, options [nop,nop,TS val 202078177 ecr 1842723242], length 7: RESP "PONG"
13:37:03.401081 IP 172.28.5.4.51248 > 172.28.5.0.6379: Flags [P.], seq 7:25, ack 8, win 229, options [nop,nop,TS val 1842723243 ecr 202078177], length 18: RESP "info replication"
13:37:03.401293 IP 172.28.5.0.6379 > 172.28.5.4.51248: Flags [P.], seq 8:480, ack 25, win 227, options [nop,nop,TS val 202078177 ecr 1842723243], length 472: RESP "# Replication^M^Jrole:master^M^Jconnected_slaves:2^M^Jslave0:ip=172.28.5.2,port=6379,state=online,offset=3420373,lag=0^M^Jslave1:ip=172.28.5.1,port=6379,state=online,offset=3420373,lag=0^M^Jmaster_replid:186487241cd9594a4921b48b510ea432fa9dc5d5^M^Jmaster_replid2:0000000000000000000000000000000000000000^M^Jmaster_repl_offset:3420373^M^Jsecond_repl_offset:-1^M^Jrepl_backlog_active:1^M^Jrepl_backlog_size:1048576^M^Jrepl_backlog_first_byte_offset:2371798^M^Jrepl_backlog_histlen:1048576^M^J"
13:37:03.401375 IP 172.28.5.4.51248 > 172.28.5.0.6379: Flags [P.], seq 25:31, ack 480, win 237, options [nop,nop,TS val 1842723243 ecr 202078177], length 6: RESP "QUIT"
13:37:03.401491 IP 172.28.5.0.6379 > 172.28.5.4.51248: Flags [P.], seq 480:485, ack 31, win 227, options [nop,nop,TS val 202078177 ecr 1842723243], length 5: RESP "OK"
13:37:03.401569 IP 172.28.5.4.51248 > 172.28.5.0.6379: Flags [R.], seq 31, ack 485, win 237, options [nop,nop,TS val 1842723243 ecr 202078177], length 0
13:37:03.401571 IP 172.28.5.0.6379 > 172.28.5.4.51248: Flags [F.], seq 485, ack 31, win 227, options [nop,nop,TS val 202078177 ecr 1842723243], length 0
13:37:03.401605 IP 172.28.5.4.51248 > 172.28.5.0.6379: Flags [R], seq 3488331008, win 0, length 0
13:37:03.735216 IP 172.28.5.4.44494 > 172.28.5.1.6379: Flags [S], seq 2122203691, win 29200, options [mss 1460,sackOK,TS val 4040503003 ecr 0,nop,wscale 7], length 0
13:37:03.735374 IP 172.28.5.1.6379 > 172.28.5.4.44494: Flags [S.], seq 375073910, ack 2122203692, win 28960, options [mss 1460,sackOK,TS val 3557097597 ecr 4040503003,nop,wscale 7], length 0
13:37:03.735459 IP 172.28.5.4.44494 > 172.28.5.1.6379: Flags [P.], seq 1:7, ack 1, win 229, options [nop,nop,TS val 4040503003 ecr 3557097597], length 6: RESP "PING"
13:37:03.735547 IP 172.28.5.1.6379 > 172.28.5.4.44494: Flags [.], ack 7, win 227, options [nop,nop,TS val 3557097597 ecr 4040503003], length 0
13:37:03.740255 IP 172.28.5.1.6379 > 172.28.5.4.44494: Flags [P.], seq 1:8, ack 7, win 227, options [nop,nop,TS val 3557097602 ecr 4040503003], length 7: RESP "PONG"
13:37:03.740371 IP 172.28.5.4.44494 > 172.28.5.1.6379: Flags [P.], seq 7:25, ack 8, win 229, options [nop,nop,TS val 4040503008 ecr 3557097602], length 18: RESP "info replication"
13:37:03.740585 IP 172.28.5.1.6379 > 172.28.5.4.44494: Flags [P.], seq 8:535, ack 25, win 227, options [nop,nop,TS val 3557097602 ecr 4040503008], length 527: RESP "# Replication^M^Jrole:slave^M^Jmaster_host:172.28.5.0^M^Jmaster_port:6379^M^Jmaster_link_status:up^M^Jmaster_last_io_seconds_ago:1^M^Jmaster_sync_in_progress:0^M^Jslave_repl_offset:3420373^M^Jslave_priority:100^M^Jslave_read_only:1^M^Jconnected_slaves:0^M^Jmaster_replid:186487241cd9594a4921b48b510ea432fa9dc5d5^M^Jmaster_replid2:0000000000000000000000000000000000000000^M^Jmaster_repl_offset:3420373^M^Jsecond_repl_offset:-1^M^Jrepl_backlog_active:1^M^Jrepl_backlog_size:1048576^M^Jrepl_backlog_first_byte_offset:2371798^M^Jrepl_backlog_histlen:1048576^M^J"
13:37:03.784524 IP 172.28.5.4.44494 > 172.28.5.1.6379: Flags [.], ack 535, win 237, options [nop,nop,TS val 4040503052 ecr 3557097602], length 0
13:37:04.067591 IP 172.28.5.4.49232 > 172.28.5.2.6379: Flags [S], seq 699834806, win 29200, options [mss 1460,sackOK,TS val 3563730617 ecr 0,nop,wscale 7], length 0
13:37:04.067791 IP 172.28.5.2.6379 > 172.28.5.4.49232: Flags [S.], seq 4056863639, ack 699834807, win 28960, options [mss 1460,sackOK,TS val 343193922 ecr 3563730617,nop,wscale 7], length 0
13:37:04.067906 IP 172.28.5.4.49232 > 172.28.5.2.6379: Flags [P.], seq 1:7, ack 1, win 229, options [nop,nop,TS val 3563730618 ecr 343193922], length 6: RESP "PING"
13:37:04.068027 IP 172.28.5.2.6379 > 172.28.5.4.49232: Flags [.], ack 7, win 227, options [nop,nop,TS val 343193922 ecr 3563730618], length 0
13:37:04.068438 IP 172.28.5.2.6379 > 172.28.5.4.49232: Flags [P.], seq 1:8, ack 7, win 227, options [nop,nop,TS val 343193922 ecr 3563730618], length 7: RESP "PONG"
13:37:04.068609 IP 172.28.5.4.49232 > 172.28.5.2.6379: Flags [P.], seq 7:25, ack 8, win 229, options [nop,nop,TS val 3563730618 ecr 343193922], length 18: RESP "info replication"
13:37:04.068945 IP 172.28.5.2.6379 > 172.28.5.4.49232: Flags [P.], seq 8:535, ack 25, win 227, options [nop,nop,TS val 343193923 ecr 3563730618], length 527: RESP "# Replication^M^Jrole:slave^M^Jmaster_host:172.28.5.0^M^Jmaster_port:6379^M^Jmaster_link_status:up^M^Jmaster_last_io_seconds_ago:1^M^Jmaster_sync_in_progress:0^M^Jslave_repl_offset:3420373^M^Jslave_priority:100^M^Jslave_read_only:1^M^Jconnected_slaves:0^M^Jmaster_replid:186487241cd9594a4921b48b510ea432fa9dc5d5^M^Jmaster_replid2:0000000000000000000000000000000000000000^M^Jmaster_repl_offset:3420373^M^Jsecond_repl_offset:-1^M^Jrepl_backlog_active:1^M^Jrepl_backlog_size:1048576^M^Jrepl_backlog_first_byte_offset:2371798^M^Jrepl_backlog_histlen:1048576^M^J"
13:37:04.112508 IP 172.28.5.4.49232 > 172.28.5.2.6379: Flags [.], ack 535, win 237, options [nop,nop,TS val 3563730662 ecr 343193923], length 0
13:37:04.401586 IP 172.28.5.4.51260 > 172.28.5.0.6379: Flags [S], seq 2766451051, win 29200, options [mss 1460,sackOK,TS val 1842724243 ecr 0,nop,wscale 7], length 0
13:37:04.401681 IP 172.28.5.0.6379 > 172.28.5.4.51260: Flags [S.], seq 1532901577, ack 2766451052, win 28960, options [mss 1460,sackOK,TS val 202079178 ecr 1842724243,nop,wscale 7], length 0
13:37:04.401742 IP 172.28.5.4.51260 > 172.28.5.0.6379: Flags [P.], seq 1:7, ack 1, win 229, options [nop,nop,TS val 1842724244 ecr 202079178], length 6: RESP "PING"
13:37:04.401807 IP 172.28.5.0.6379 > 172.28.5.4.51260: Flags [.], ack 7, win 227, options [nop,nop,TS val 202079178 ecr 1842724244], length 0
13:37:04.402004 IP 172.28.5.0.6379 > 172.28.5.4.51260: Flags [P.], seq 1:8, ack 7, win 227, options [nop,nop,TS val 202079178 ecr 1842724244], length 7: RESP "PONG"
13:37:04.402084 IP 172.28.5.4.51260 > 172.28.5.0.6379: Flags [P.], seq 7:25, ack 8, win 229, options [nop,nop,TS val 1842724244 ecr 202079178], length 18: RESP "info replication"
13:37:04.402255 IP 172.28.5.0.6379 > 172.28.5.4.51260: Flags [P.], seq 8:480, ack 25, win 227, options [nop,nop,TS val 202079178 ecr 1842724244], length 472: RESP "# Replication^M^Jrole:master^M^Jconnected_slaves:2^M^Jslave0:ip=172.28.5.2,port=6379,state=online,offset=3420521,lag=0^M^Jslave1:ip=172.28.5.1,port=6379,state=online,offset=3420373,lag=0^M^Jmaster_replid:186487241cd9594a4921b48b510ea432fa9dc5d5^M^Jmaster_replid2:0000000000000000000000000000000000000000^M^Jmaster_repl_offset:3420521^M^Jsecond_repl_offset:-1^M^Jrepl_backlog_active:1^M^Jrepl_backlog_size:1048576^M^Jrepl_backlog_first_byte_offset:2371946^M^Jrepl_backlog_histlen:1048576^M^J"
13:37:04.402318 IP 172.28.5.4.51260 > 172.28.5.0.6379: Flags [P.], seq 25:31, ack 480, win 237, options [nop,nop,TS val 1842724244 ecr 202079178], length 6: RESP "QUIT"
13:37:04.402417 IP 172.28.5.0.6379 > 172.28.5.4.51260: Flags [P.], seq 480:485, ack 31, win 227, options [nop,nop,TS val 202079178 ecr 1842724244], length 5: RESP "OK"
13:37:04.402489 IP 172.28.5.0.6379 > 172.28.5.4.51260: Flags [F.], seq 485, ack 31, win 227, options [nop,nop,TS val 202079178 ecr 1842724244], length 0
13:37:04.402772 IP 172.28.5.4.51260 > 172.28.5.0.6379: Flags [F.], seq 31, ack 486, win 237, options [nop,nop,TS val 1842724245 ecr 202079178], length 0
13:37:04.402880 IP 172.28.5.0.6379 > 172.28.5.4.51260: Flags [.], ack 32, win 227, options [nop,nop,TS val 202079179 ecr 1842724245], length 0
13:37:04.737766 IP 172.28.5.4.44494 > 172.28.5.1.6379: Flags [R.], seq 25, ack 535, win 237, options [nop,nop,TS val 4040504006 ecr 3557097602], length 0
13:37:05.069465 IP 172.28.5.4.49232 > 172.28.5.2.6379: Flags [R.], seq 25, ack 535, win 237, options [nop,nop,TS val 3563731619 ecr 343193923], length 0
13:37:05.403520 IP 172.28.5.4.51264 > 172.28.5.0.6379: Flags [S], seq 2064500017, win 29200, options [mss 1460,sackOK,TS val 1842725245 ecr 0,nop,wscale 7], length 0
13:37:05.403635 IP 172.28.5.0.6379 > 172.28.5.4.51264: Flags [S.], seq 2244920752, ack 2064500018, win 28960, options [mss 1460,sackOK,TS val 202080179 ecr 1842725245,nop,wscale 7], length 0
13:37:05.403699 IP 172.28.5.4.51264 > 172.28.5.0.6379: Flags [P.], seq 1:7, ack 1, win 229, options [nop,nop,TS val 1842725246 ecr 202080179], length 6: RESP "PING"
13:37:05.403775 IP 172.28.5.0.6379 > 172.28.5.4.51264: Flags [.], ack 7, win 227, options [nop,nop,TS val 202080180 ecr 1842725246], length 0
13:37:05.403999 IP 172.28.5.0.6379 > 172.28.5.4.51264: Flags [P.], seq 1:8, ack 7, win 227, options [nop,nop,TS val 202080180 ecr 1842725246], length 7: RESP "PONG"
13:37:05.404128 IP 172.28.5.4.51264 > 172.28.5.0.6379: Flags [P.], seq 7:25, ack 8, win 229, options [nop,nop,TS val 1842725246 ecr 202080180], length 18: RESP "info replication"
13:37:05.404329 IP 172.28.5.0.6379 > 172.28.5.4.51264: Flags [P.], seq 8:480, ack 25, win 227, options [nop,nop,TS val 202080180 ecr 1842725246], length 472: RESP "# Replication^M^Jrole:master^M^Jconnected_slaves:2^M^Jslave0:ip=172.28.5.2,port=6379,state=online,offset=3420817,lag=0^M^Jslave1:ip=172.28.5.1,port=6379,state=online,offset=3420817,lag=0^M^Jmaster_replid:186487241cd9594a4921b48b510ea432fa9dc5d5^M^Jmaster_replid2:0000000000000000000000000000000000000000^M^Jmaster_repl_offset:3420817^M^Jsecond_repl_offset:-1^M^Jrepl_backlog_active:1^M^Jrepl_backlog_size:1048576^M^Jrepl_backlog_first_byte_offset:2372242^M^Jrepl_backlog_histlen:1048576^M^J"
13:37:05.404404 IP 172.28.5.4.51264 > 172.28.5.0.6379: Flags [P.], seq 25:31, ack 480, win 237, options [nop,nop,TS val 1842725246 ecr 202080180], length 6: RESP "QUIT"
13:37:05.404512 IP 172.28.5.0.6379 > 172.28.5.4.51264: Flags [P.], seq 480:485, ack 31, win 227, options [nop,nop,TS val 202080180 ecr 1842725246], length 5: RESP "OK"
13:37:05.404584 IP 172.28.5.4.51264 > 172.28.5.0.6379: Flags [R.], seq 31, ack 485, win 237, options [nop,nop,TS val 1842725246 ecr 202080180], length 0
13:37:05.404585 IP 172.28.5.0.6379 > 172.28.5.4.51264: Flags [F.], seq 485, ack 31, win 227, options [nop,nop,TS val 202080180 ecr 1842725246], length 0
13:37:05.404621 IP 172.28.5.4.51264 > 172.28.5.0.6379: Flags [R], seq 2064500048, win 0, length 0
13:37:05.739593 IP 172.28.5.4.44510 > 172.28.5.1.6379: Flags [S], seq 429369117, win 29200, options [mss 1460,sackOK,TS val 4040505007 ecr 0,nop,wscale 7], length 0
13:37:05.739722 IP 172.28.5.1.6379 > 172.28.5.4.44510: Flags [S.], seq 2466053966, ack 429369118, win 28960, options [mss 1460,sackOK,TS val 3557099602 ecr 4040505007,nop,wscale 7], length 0
13:37:05.739796 IP 172.28.5.4.44510 > 172.28.5.1.6379: Flags [P.], seq 1:7, ack 1, win 229, options [nop,nop,TS val 4040505008 ecr 3557099602], length 6: RESP "PING"
13:37:05.739913 IP 172.28.5.1.6379 > 172.28.5.4.44510: Flags [.], ack 7, win 227, options [nop,nop,TS val 3557099602 ecr 4040505008], length 0
13:37:05.740334 IP 172.28.5.1.6379 > 172.28.5.4.44510: Flags [P.], seq 1:8, ack 7, win 227, options [nop,nop,TS val 3557099602 ecr 4040505008], length 7: RESP "PONG"
13:37:05.740491 IP 172.28.5.4.44510 > 172.28.5.1.6379: Flags [P.], seq 7:25, ack 8, win 229, options [nop,nop,TS val 4040505008 ecr 3557099602], length 18: RESP "info replication"
13:37:05.740749 IP 172.28.5.1.6379 > 172.28.5.4.44510: Flags [P.], seq 8:535, ack 25, win 227, options [nop,nop,TS val 3557099603 ecr 4040505008], length 527: RESP "# Replication^M^Jrole:slave^M^Jmaster_host:172.28.5.0^M^Jmaster_port:6379^M^Jmaster_link_status:up^M^Jmaster_last_io_seconds_ago:1^M^Jmaster_sync_in_progress:0^M^Jslave_repl_offset:3420817^M^Jslave_priority:100^M^Jslave_read_only:1^M^Jconnected_slaves:0^M^Jmaster_replid:186487241cd9594a4921b48b510ea432fa9dc5d5^M^Jmaster_replid2:0000000000000000000000000000000000000000^M^Jmaster_repl_offset:3420817^M^Jsecond_repl_offset:-1^M^Jrepl_backlog_active:1^M^Jrepl_backlog_size:1048576^M^Jrepl_backlog_first_byte_offset:2372242^M^Jrepl_backlog_histlen:1048576^M^J"
13:37:05.784524 IP 172.28.5.4.44510 > 172.28.5.1.6379: Flags [.], ack 535, win 237, options [nop,nop,TS val 4040505052 ecr 3557099603], length 0
13:37:06.071831 IP 172.28.5.4.49248 > 172.28.5.2.6379: Flags [S], seq 3933097552, win 29200, options [mss 1460,sackOK,TS val 3563732622 ecr 0,nop,wscale 7], length 0
13:37:06.072053 IP 172.28.5.2.6379 > 172.28.5.4.49248: Flags [S.], seq 3186787169, ack 3933097553, win 28960, options [mss 1460,sackOK,TS val 343195926 ecr 3563732622,nop,wscale 7], length 0
13:37:06.072210 IP 172.28.5.4.49248 > 172.28.5.2.6379: Flags [P.], seq 1:7, ack 1, win 229, options [nop,nop,TS val 3563732622 ecr 343195926], length 6: RESP "PING"
13:37:06.072340 IP 172.28.5.2.6379 > 172.28.5.4.49248: Flags [.], ack 7, win 227, options [nop,nop,TS val 343195926 ecr 3563732622], length 0
13:37:06.072925 IP 172.28.5.2.6379 > 172.28.5.4.49248: Flags [P.], seq 1:8, ack 7, win 227, options [nop,nop,TS val 343195927 ecr 3563732622], length 7: RESP "PONG"
13:37:06.073083 IP 172.28.5.4.49248 > 172.28.5.2.6379: Flags [P.], seq 7:25, ack 8, win 229, options [nop,nop,TS val 3563732623 ecr 343195927], length 18: RESP "info replication"
13:37:06.073400 IP 172.28.5.2.6379 > 172.28.5.4.49248: Flags [P.], seq 8:535, ack 25, win 227, options [nop,nop,TS val 343195927 ecr 3563732623], length 527: RESP "# Replication^M^Jrole:slave^M^Jmaster_host:172.28.5.0^M^Jmaster_port:6379^M^Jmaster_link_status:up^M^Jmaster_last_io_seconds_ago:1^M^Jmaster_sync_in_progress:0^M^Jslave_repl_offset:3420817^M^Jslave_priority:100^M^Jslave_read_only:1^M^Jconnected_slaves:0^M^Jmaster_replid:186487241cd9594a4921b48b510ea432fa9dc5d5^M^Jmaster_replid2:0000000000000000000000000000000000000000^M^Jmaster_repl_offset:3420817^M^Jsecond_repl_offset:-1^M^Jrepl_backlog_active:1^M^Jrepl_backlog_size:1048576^M^Jrepl_backlog_first_byte_offset:2372242^M^Jrepl_backlog_histlen:1048576^M^J"
13:37:06.116148 IP 172.28.5.4.49248 > 172.28.5.2.6379: Flags [.], ack 535, win 237, options [nop,nop,TS val 3563732666 ecr 343195927], length 0
13:37:06.405098 IP 172.28.5.4.51276 > 172.28.5.0.6379: Flags [S], seq 1319272377, win 29200, options [mss 1460,sackOK,TS val 1842726247 ecr 0,nop,wscale 7], length 0
13:37:06.405251 IP 172.28.5.0.6379 > 172.28.5.4.51276: Flags [S.], seq 2400520135, ack 1319272378, win 28960, options [mss 1460,sackOK,TS val 202081181 ecr 1842726247,nop,wscale 7], length 0
13:37:06.405337 IP 172.28.5.4.51276 > 172.28.5.0.6379: Flags [P.], seq 1:7, ack 1, win 229, options [nop,nop,TS val 1842726247 ecr 202081181], length 6: RESP "PING"
13:37:06.405437 IP 172.28.5.0.6379 > 172.28.5.4.51276: Flags [.], ack 7, win 227, options [nop,nop,TS val 202081181 ecr 1842726247], length 0
13:37:06.405801 IP 172.28.5.0.6379 > 172.28.5.4.51276: Flags [P.], seq 1:8, ack 7, win 227, options [nop,nop,TS val 202081182 ecr 1842726247], length 7: RESP "PONG"
13:37:06.406068 IP 172.28.5.4.51276 > 172.28.5.0.6379: Flags [P.], seq 7:25, ack 8, win 229, options [nop,nop,TS val 1842726248 ecr 202081182], length 18: RESP "info replication"
13:37:06.406400 IP 172.28.5.0.6379 > 172.28.5.4.51276: Flags [P.], seq 8:480, ack 25, win 227, options [nop,nop,TS val 202081182 ecr 1842726248], length 472: RESP "# Replication^M^Jrole:master^M^Jconnected_slaves:2^M^Jslave0:ip=172.28.5.2,port=6379,state=online,offset=3420965,lag=0^M^Jslave1:ip=172.28.5.1,port=6379,state=online,offset=3420817,lag=0^M^Jmaster_replid:186487241cd9594a4921b48b510ea432fa9dc5d5^M^Jmaster_replid2:0000000000000000000000000000000000000000^M^Jmaster_repl_offset:3420965^M^Jsecond_repl_offset:-1^M^Jrepl_backlog_active:1^M^Jrepl_backlog_size:1048576^M^Jrepl_backlog_first_byte_offset:2372390^M^Jrepl_backlog_histlen:1048576^M^J"
13:37:06.406502 IP 172.28.5.4.51276 > 172.28.5.0.6379: Flags [P.], seq 25:31, ack 480, win 237, options [nop,nop,TS val 1842726248 ecr 202081182], length 6: RESP "QUIT"
13:37:06.406639 IP 172.28.5.0.6379 > 172.28.5.4.51276: Flags [P.], seq 480:485, ack 31, win 227, options [nop,nop,TS val 202081182 ecr 1842726248], length 5: RESP "OK"
13:37:06.406732 IP 172.28.5.4.51276 > 172.28.5.0.6379: Flags [R.], seq 31, ack 485, win 237, options [nop,nop,TS val 1842726249 ecr 202081182], length 0
13:37:06.406741 IP 172.28.5.0.6379 > 172.28.5.4.51276: Flags [F.], seq 485, ack 31, win 227, options [nop,nop,TS val 202081183 ecr 1842726248], length 0
13:37:06.406786 IP 172.28.5.4.51276 > 172.28.5.0.6379: Flags [R], seq 1319272408, win 0, length 0
13:37:06.741506 IP 172.28.5.4.44510 > 172.28.5.1.6379: Flags [R.], seq 25, ack 535, win 237, options [nop,nop,TS val 4040506009 ecr 3557099603], length 0
13:37:07.073248 IP 172.28.5.4.49248 > 172.28.5.2.6379: Flags [R.], seq 25, ack 535, win 237, options [nop,nop,TS val 3563733623 ecr 343195927], length 0
13:37:07.408529 IP 172.28.5.4.51280 > 172.28.5.0.6379: Flags [S], seq 3112969175, win 29200, options [mss 1460,sackOK,TS val 1842727250 ecr 0,nop,wscale 7], length 0
13:37:07.408696 IP 172.28.5.0.6379 > 172.28.5.4.51280: Flags [S.], seq 243467527, ack 3112969176, win 28960, options [mss 1460,sackOK,TS val 202082185 ecr 1842727250,nop,wscale 7], length 0
13:37:07.408792 IP 172.28.5.4.51280 > 172.28.5.0.6379: Flags [P.], seq 1:7, ack 1, win 229, options [nop,nop,TS val 1842727251 ecr 202082185], length 6: RESP "PING"
13:37:07.408894 IP 172.28.5.0.6379 > 172.28.5.4.51280: Flags [.], ack 7, win 227, options [nop,nop,TS val 202082185 ecr 1842727251], length 0
13:37:07.409155 IP 172.28.5.0.6379 > 172.28.5.4.51280: Flags [P.], seq 1:8, ack 7, win 227, options [nop,nop,TS val 202082185 ecr 1842727251], length 7: RESP "PONG"
13:37:07.409258 IP 172.28.5.4.51280 > 172.28.5.0.6379: Flags [P.], seq 7:25, ack 8, win 229, options [nop,nop,TS val 1842727251 ecr 202082185], length 18: RESP "info replication"
13:37:07.409466 IP 172.28.5.0.6379 > 172.28.5.4.51280: Flags [P.], seq 8:480, ack 25, win 227, options [nop,nop,TS val 202082185 ecr 1842727251], length 472: RESP "# Replication^M^Jrole:master^M^Jconnected_slaves:2^M^Jslave0:ip=172.28.5.2,port=6379,state=online,offset=3421261,lag=0^M^Jslave1:ip=172.28.5.1,port=6379,state=online,offset=3421261,lag=0^M^Jmaster_replid:186487241cd9594a4921b48b510ea432fa9dc5d5^M^Jmaster_replid2:0000000000000000000000000000000000000000^M^Jmaster_repl_offset:3421261^M^Jsecond_repl_offset:-1^M^Jrepl_backlog_active:1^M^Jrepl_backlog_size:1048576^M^Jrepl_backlog_first_byte_offset:2372686^M^Jrepl_backlog_histlen:1048576^M^J"
13:37:07.409544 IP 172.28.5.4.51280 > 172.28.5.0.6379: Flags [P.], seq 25:31, ack 480, win 237, options [nop,nop,TS val 1842727251 ecr 202082185], length 6: RESP "QUIT"
13:37:07.409653 IP 172.28.5.0.6379 > 172.28.5.4.51280: Flags [P.], seq 480:485, ack 31, win 227, options [nop,nop,TS val 202082185 ecr 1842727251], length 5: RESP "OK"
13:37:07.409730 IP 172.28.5.4.51280 > 172.28.5.0.6379: Flags [R.], seq 31, ack 485, win 237, options [nop,nop,TS val 1842727252 ecr 202082185], length 0
13:37:07.409731 IP 172.28.5.0.6379 > 172.28.5.4.51280: Flags [F.], seq 485, ack 31, win 227, options [nop,nop,TS val 202082186 ecr 1842727251], length 0
13:37:07.409765 IP 172.28.5.4.51280 > 172.28.5.0.6379: Flags [R], seq 3112969206, win 0, length 0
13:37:07.743383 IP 172.28.5.4.44526 > 172.28.5.1.6379: Flags [S], seq 1391210725, win 29200, options [mss 1460,sackOK,TS val 4040507011 ecr 0,nop,wscale 7], length 0
13:37:07.743529 IP 172.28.5.1.6379 > 172.28.5.4.44526: Flags [S.], seq 3652555365, ack 1391210726, win 28960, options [mss 1460,sackOK,TS val 3557101605 ecr 4040507011,nop,wscale 7], length 0
13:37:07.743614 IP 172.28.5.4.44526 > 172.28.5.1.6379: Flags [P.], seq 1:7, ack 1, win 229, options [nop,nop,TS val 4040507011 ecr 3557101605], length 6: RESP "PING"
13:37:07.743714 IP 172.28.5.1.6379 > 172.28.5.4.44526: Flags [.], ack 7, win 227, options [nop,nop,TS val 3557101606 ecr 4040507011], length 0
13:37:07.744075 IP 172.28.5.1.6379 > 172.28.5.4.44526: Flags [P.], seq 1:8, ack 7, win 227, options [nop,nop,TS val 3557101606 ecr 4040507011], length 7: RESP "PONG"
13:37:07.744288 IP 172.28.5.4.44526 > 172.28.5.1.6379: Flags [P.], seq 7:25, ack 8, win 229, options [nop,nop,TS val 4040507012 ecr 3557101606], length 18: RESP "info replication"
13:37:07.744588 IP 172.28.5.1.6379 > 172.28.5.4.44526: Flags [P.], seq 8:535, ack 25, win 227, options [nop,nop,TS val 3557101606 ecr 4040507012], length 527: RESP "# Replication^M^Jrole:slave^M^Jmaster_host:172.28.5.0^M^Jmaster_port:6379^M^Jmaster_link_status:up^M^Jmaster_last_io_seconds_ago:1^M^Jmaster_sync_in_progress:0^M^Jslave_repl_offset:3421261^M^Jslave_priority:100^M^Jslave_read_only:1^M^Jconnected_slaves:0^M^Jmaster_replid:186487241cd9594a4921b48b510ea432fa9dc5d5^M^Jmaster_replid2:0000000000000000000000000000000000000000^M^Jmaster_repl_offset:3421261^M^Jsecond_repl_offset:-1^M^Jrepl_backlog_active:1^M^Jrepl_backlog_size:1048576^M^Jrepl_backlog_first_byte_offset:2372686^M^Jrepl_backlog_histlen:1048576^M^J"
13:37:07.788547 IP 172.28.5.4.44526 > 172.28.5.1.6379: Flags [.], ack 535, win 237, options [nop,nop,TS val 4040507056 ecr 3557101606], length 0
13:37:08.075726 IP 172.28.5.4.49264 > 172.28.5.2.6379: Flags [S], seq 183059894, win 29200, options [mss 1460,sackOK,TS val 3563734626 ecr 0,nop,wscale 7], length 0
13:37:08.075873 IP 172.28.5.2.6379 > 172.28.5.4.49264: Flags [S.], seq 1228354730, ack 183059895, win 28960, options [mss 1460,sackOK,TS val 343197930 ecr 3563734626,nop,wscale 7], length 0
13:37:08.075957 IP 172.28.5.4.49264 > 172.28.5.2.6379: Flags [P.], seq 1:7, ack 1, win 229, options [nop,nop,TS val 3563734626 ecr 343197930], length 6: RESP "PING"
13:37:08.076102 IP 172.28.5.2.6379 > 172.28.5.4.49264: Flags [.], ack 7, win 227, options [nop,nop,TS val 343197930 ecr 3563734626], length 0
13:37:08.076415 IP 172.28.5.2.6379 > 172.28.5.4.49264: Flags [P.], seq 1:8, ack 7, win 227, options [nop,nop,TS val 343197930 ecr 3563734626], length 7: RESP "PONG"
13:37:08.076604 IP 172.28.5.4.49264 > 172.28.5.2.6379: Flags [P.], seq 7:25, ack 8, win 229, options [nop,nop,TS val 3563734626 ecr 343197930], length 18: RESP "info replication"
13:37:08.076886 IP 172.28.5.2.6379 > 172.28.5.4.49264: Flags [P.], seq 8:535, ack 25, win 227, options [nop,nop,TS val 343197931 ecr 3563734626], length 527: RESP "# Replication^M^Jrole:slave^M^Jmaster_host:172.28.5.0^M^Jmaster_port:6379^M^Jmaster_link_status:up^M^Jmaster_last_io_seconds_ago:2^M^Jmaster_sync_in_progress:0^M^Jslave_repl_offset:3421261^M^Jslave_priority:100^M^Jslave_read_only:1^M^Jconnected_slaves:0^M^Jmaster_replid:186487241cd9594a4921b48b510ea432fa9dc5d5^M^Jmaster_replid2:0000000000000000000000000000000000000000^M^Jmaster_repl_offset:3421261^M^Jsecond_repl_offset:-1^M^Jrepl_backlog_active:1^M^Jrepl_backlog_size:1048576^M^Jrepl_backlog_first_byte_offset:2372686^M^Jrepl_backlog_histlen:1048576^M^J"
13:37:08.120542 IP 172.28.5.4.49264 > 172.28.5.2.6379: Flags [.], ack 535, win 237, options [nop,nop,TS val 3563734670 ecr 343197931], length 0
13:37:08.410966 IP 172.28.5.4.51292 > 172.28.5.0.6379: Flags [S], seq 2480899493, win 29200, options [mss 1460,sackOK,TS val 1842728253 ecr 0,nop,wscale 7], length 0
13:37:08.411170 IP 172.28.5.0.6379 > 172.28.5.4.51292: Flags [S.], seq 2913495258, ack 2480899494, win 28960, options [mss 1460,sackOK,TS val 202083187 ecr 1842728253,nop,wscale 7], length 0
13:37:08.411287 IP 172.28.5.4.51292 > 172.28.5.0.6379: Flags [P.], seq 1:7, ack 1, win 229, options [nop,nop,TS val 1842728253 ecr 202083187], length 6: RESP "PING"
13:37:08.411409 IP 172.28.5.0.6379 > 172.28.5.4.51292: Flags [.], ack 7, win 227, options [nop,nop,TS val 202083187 ecr 1842728253], length 0
13:37:08.411709 IP 172.28.5.0.6379 > 172.28.5.4.51292: Flags [P.], seq 1:8, ack 7, win 227, options [nop,nop,TS val 202083188 ecr 1842728253], length 7: RESP "PONG"
13:37:08.411829 IP 172.28.5.4.51292 > 172.28.5.0.6379: Flags [P.], seq 7:25, ack 8, win 229, options [nop,nop,TS val 1842728254 ecr 202083188], length 18: RESP "info replication"
13:37:08.412115 IP 172.28.5.0.6379 > 172.28.5.4.51292: Flags [P.], seq 8:480, ack 25, win 227, options [nop,nop,TS val 202083188 ecr 1842728254], length 472: RESP "# Replication^M^Jrole:master^M^Jconnected_slaves:2^M^Jslave0:ip=172.28.5.2,port=6379,state=online,offset=3421409,lag=0^M^Jslave1:ip=172.28.5.1,port=6379,state=online,offset=3421261,lag=0^M^Jmaster_replid:186487241cd9594a4921b48b510ea432fa9dc5d5^M^Jmaster_replid2:0000000000000000000000000000000000000000^M^Jmaster_repl_offset:3421409^M^Jsecond_repl_offset:-1^M^Jrepl_backlog_active:1^M^Jrepl_backlog_size:1048576^M^Jrepl_backlog_first_byte_offset:2372834^M^Jrepl_backlog_histlen:1048576^M^J"
13:37:08.412215 IP 172.28.5.4.51292 > 172.28.5.0.6379: Flags [P.], seq 25:31, ack 480, win 237, options [nop,nop,TS val 1842728254 ecr 202083188], length 6: RESP "QUIT"
13:37:08.412349 IP 172.28.5.0.6379 > 172.28.5.4.51292: Flags [P.], seq 480:485, ack 31, win 227, options [nop,nop,TS val 202083188 ecr 1842728254], length 5: RESP "OK"
13:37:08.412450 IP 172.28.5.0.6379 > 172.28.5.4.51292: Flags [F.], seq 485, ack 31, win 227, options [nop,nop,TS val 202083188 ecr 1842728254], length 0
13:37:08.412451 IP 172.28.5.4.51292 > 172.28.5.0.6379: Flags [R.], seq 31, ack 485, win 237, options [nop,nop,TS val 1842728254 ecr 202083188], length 0
13:37:08.412489 IP 172.28.5.4.51292 > 172.28.5.0.6379: Flags [R], seq 2480899524, win 0, length 0
13:37:08.745001 IP 172.28.5.4.44526 > 172.28.5.1.6379: Flags [R.], seq 25, ack 535, win 237, options [nop,nop,TS val 4040508013 ecr 3557101606], length 0
13:37:09.077637 IP 172.28.5.4.49264 > 172.28.5.2.6379: Flags [R.], seq 25, ack 535, win 237, options [nop,nop,TS val 3563735627 ecr 343197931], length 0
13:37:09.412665 IP 172.28.5.4.51296 > 172.28.5.0.6379: Flags [S], seq 4069461986, win 29200, options [mss 1460,sackOK,TS val 1842729254 ecr 0,nop,wscale 7], length 0
13:37:09.412836 IP 172.28.5.0.6379 > 172.28.5.4.51296: Flags [S.], seq 1253969619, ack 4069461987, win 28960, options [mss 1460,sackOK,TS val 202084189 ecr 1842729254,nop,wscale 7], length 0
13:37:09.412937 IP 172.28.5.4.51296 > 172.28.5.0.6379: Flags [P.], seq 1:7, ack 1, win 229, options [nop,nop,TS val 1842729255 ecr 202084189], length 6: RESP "PING"
13:37:09.413036 IP 172.28.5.0.6379 > 172.28.5.4.51296: Flags [.], ack 7, win 227, options [nop,nop,TS val 202084189 ecr 1842729255], length 0
13:37:09.413324 IP 172.28.5.0.6379 > 172.28.5.4.51296: Flags [P.], seq 1:8, ack 7, win 227, options [nop,nop,TS val 202084189 ecr 1842729255], length 7: RESP "PONG"
13:37:09.413479 IP 172.28.5.4.51296 > 172.28.5.0.6379: Flags [P.], seq 7:25, ack 8, win 229, options [nop,nop,TS val 1842729255 ecr 202084189], length 18: RESP "info replication"
13:37:09.413797 IP 172.28.5.0.6379 > 172.28.5.4.51296: Flags [P.], seq 8:480, ack 25, win 227, options [nop,nop,TS val 202084190 ecr 1842729255], length 472: RESP "# Replication^M^Jrole:master^M^Jconnected_slaves:2^M^Jslave0:ip=172.28.5.2,port=6379,state=online,offset=3421705,lag=0^M^Jslave1:ip=172.28.5.1,port=6379,state=online,offset=3421705,lag=0^M^Jmaster_replid:186487241cd9594a4921b48b510ea432fa9dc5d5^M^Jmaster_replid2:0000000000000000000000000000000000000000^M^Jmaster_repl_offset:3421705^M^Jsecond_repl_offset:-1^M^Jrepl_backlog_active:1^M^Jrepl_backlog_size:1048576^M^Jrepl_backlog_first_byte_offset:2373130^M^Jrepl_backlog_histlen:1048576^M^J"
13:37:09.413933 IP 172.28.5.4.51296 > 172.28.5.0.6379: Flags [P.], seq 25:31, ack 480, win 237, options [nop,nop,TS val 1842729256 ecr 202084190], length 6: RESP "QUIT"
13:37:09.414161 IP 172.28.5.0.6379 > 172.28.5.4.51296: Flags [P.], seq 480:485, ack 31, win 227, options [nop,nop,TS val 202084190 ecr 1842729256], length 5: RESP "OK"
13:37:09.414295 IP 172.28.5.0.6379 > 172.28.5.4.51296: Flags [F.], seq 485, ack 31, win 227, options [nop,nop,TS val 202084190 ecr 1842729256], length 0
13:37:09.414308 IP 172.28.5.4.51296 > 172.28.5.0.6379: Flags [R.], seq 31, ack 485, win 237, options [nop,nop,TS val 1842729256 ecr 202084190], length 0
13:37:09.414347 IP 172.28.5.4.51296 > 172.28.5.0.6379: Flags [R], seq 4069462017, win 0, length 0
13:37:09.746232 IP 172.28.5.4.44542 > 172.28.5.1.6379: Flags [S], seq 3517564433, win 29200, options [mss 1460,sackOK,TS val 4040509014 ecr 0,nop,wscale 7], length 0
13:37:09.746383 IP 172.28.5.1.6379 > 172.28.5.4.44542: Flags [S.], seq 3278447812, ack 3517564434, win 28960, options [mss 1460,sackOK,TS val 3557103608 ecr 4040509014,nop,wscale 7], length 0
13:37:09.746471 IP 172.28.5.4.44542 > 172.28.5.1.6379: Flags [P.], seq 1:7, ack 1, win 229, options [nop,nop,TS val 4040509014 ecr 3557103608], length 6: RESP "PING"
13:37:09.746572 IP 172.28.5.1.6379 > 172.28.5.4.44542: Flags [.], ack 7, win 227, options [nop,nop,TS val 3557103608 ecr 4040509014], length 0
13:37:09.746873 IP 172.28.5.1.6379 > 172.28.5.4.44542: Flags [P.], seq 1:8, ack 7, win 227, options [nop,nop,TS val 3557103609 ecr 4040509014], length 7: RESP "PONG"
13:37:09.747048 IP 172.28.5.4.44542 > 172.28.5.1.6379: Flags [P.], seq 7:25, ack 8, win 229, options [nop,nop,TS val 4040509015 ecr 3557103609], length 18: RESP "info replication"
13:37:09.747407 IP 172.28.5.1.6379 > 172.28.5.4.44542: Flags [P.], seq 8:535, ack 25, win 227, options [nop,nop,TS val 3557103609 ecr 4040509015], length 527: RESP "# Replication^M^Jrole:slave^M^Jmaster_host:172.28.5.0^M^Jmaster_port:6379^M^Jmaster_link_status:up^M^Jmaster_last_io_seconds_ago:1^M^Jmaster_sync_in_progress:0^M^Jslave_repl_offset:3421705^M^Jslave_priority:100^M^Jslave_read_only:1^M^Jconnected_slaves:0^M^Jmaster_replid:186487241cd9594a4921b48b510ea432fa9dc5d5^M^Jmaster_replid2:0000000000000000000000000000000000000000^M^Jmaster_repl_offset:3421705^M^Jsecond_repl_offset:-1^M^Jrepl_backlog_active:1^M^Jrepl_backlog_size:1048576^M^Jrepl_backlog_first_byte_offset:2373130^M^Jrepl_backlog_histlen:1048576^M^J"
13:37:09.788456 IP 172.28.5.4.44542 > 172.28.5.1.6379: Flags [.], ack 535, win 237, options [nop,nop,TS val 4040509056 ecr 3557103609], length 0
