12:25:49.240048 IP 172.28.5.4.39190 > 172.28.5.0.6379: Flags [S], seq 31900565, win 29200, options [mss 1460,sackOK,TS val 1870698000 ecr 0,nop,wscale 7], length 0
12:25:49.240163 IP 172.28.5.0.6379 > 172.28.5.4.39190: Flags [S.], seq 2120315681, ack 31900566, win 28960, options [mss 1460,sackOK,TS val 230052934 ecr 1870698000,nop,wscale 7], length 0
12:25:49.240240 IP 172.28.5.4.39190 > 172.28.5.0.6379: Flags [P.], seq 1:7, ack 1, win 229, options [nop,nop,TS val 1870698000 ecr 230052934], length 6: RESP "PING"
12:25:49.240346 IP 172.28.5.0.6379 > 172.28.5.4.39190: Flags [.], ack 7, win 227, options [nop,nop,TS val 230052934 ecr 1870698000], length 0
12:25:49.240603 IP 172.28.5.0.6379 > 172.28.5.4.39190: Flags [P.], seq 1:8, ack 7, win 227, options [nop,nop,TS val 230052934 ecr 1870698000], length 7: RESP "PONG"
12:25:49.240805 IP 172.28.5.4.39190 > 172.28.5.0.6379: Flags [P.], seq 7:25, ack 8, win 229, options [nop,nop,TS val 1870698000 ecr 230052934], length 18: RESP "info replication"
12:25:49.241020 IP 172.28.5.0.6379 > 172.28.5.4.39190: Flags [P.], seq 8:470, ack 25, win 227, options [nop,nop,TS val 230052935 ecr 1870698000], length 462: RESP "# Replication^M^Jrole:master^M^Jconnected_slaves:2^M^Jslave0:ip=172.28.5.1,port=6379,state=online,offset=208576,lag=1^M^Jslave1:ip=172.28.5.2,port=6379,state=online,offset=208576,lag=1^M^Jmaster_replid:f8eac6c8a17a641b11523474ffa3dbd0af88977a^M^Jmaster_replid2:0000000000000000000000000000000000000000^M^Jmaster_repl_offset:208724^M^Jsecond_repl_offset:-1^M^Jrepl_backlog_active:1^M^Jrepl_backlog_size:1048576^M^Jrepl_backlog_first_byte_offset:1^M^Jrepl_backlog_histlen:208724^M^J"
12:25:49.241114 IP 172.28.5.4.39190 > 172.28.5.0.6379: Flags [P.], seq 25:31, ack 470, win 237, options [nop,nop,TS val 1870698001 ecr 230052935], length 6: RESP "QUIT"
12:25:49.241242 IP 172.28.5.0.6379 > 172.28.5.4.39190: Flags [P.], seq 470:475, ack 31, win 227, options [nop,nop,TS val 230052935 ecr 1870698001], length 5: RESP "OK"
12:25:49.241318 IP 172.28.5.0.6379 > 172.28.5.4.39190: Flags [F.], seq 475, ack 31, win 227, options [nop,nop,TS val 230052935 ecr 1870698001], length 0
12:25:49.241408 IP 172.28.5.4.39190 > 172.28.5.0.6379: Flags [F.], seq 31, ack 476, win 237, options [nop,nop,TS val 1870698001 ecr 230052935], length 0
12:25:49.241468 IP 172.28.5.0.6379 > 172.28.5.4.39190: Flags [.], ack 32, win 227, options [nop,nop,TS val 230052935 ecr 1870698001], length 0
12:25:49.569996 IP 172.28.5.4.60668 > 172.28.5.1.6379: Flags [S], seq 2889671695, win 29200, options [mss 1460,sackOK,TS val 4068477756 ecr 0,nop,wscale 7], length 0
12:25:49.570125 IP 172.28.5.1.6379 > 172.28.5.4.60668: Flags [S.], seq 3970550519, ack 2889671696, win 28960, options [mss 1460,sackOK,TS val 3585072350 ecr 4068477756,nop,wscale 7], length 0
12:25:49.570192 IP 172.28.5.4.60668 > 172.28.5.1.6379: Flags [P.], seq 1:7, ack 1, win 229, options [nop,nop,TS val 4068477756 ecr 3585072350], length 6: RESP "PING"
12:25:49.570279 IP 172.28.5.1.6379 > 172.28.5.4.60668: Flags [.], ack 7, win 227, options [nop,nop,TS val 3585072350 ecr 4068477756], length 0
12:25:49.570526 IP 172.28.5.1.6379 > 172.28.5.4.60668: Flags [P.], seq 1:8, ack 7, win 227, options [nop,nop,TS val 3585072350 ecr 4068477756], length 7: RESP "PONG"
12:25:49.570674 IP 172.28.5.4.60668 > 172.28.5.1.6379: Flags [P.], seq 7:25, ack 8, win 229, options [nop,nop,TS val 4068477756 ecr 3585072350], length 18: RESP "info replication"
12:25:49.570928 IP 172.28.5.1.6379 > 172.28.5.4.60668: Flags [P.], seq 8:526, ack 25, win 227, options [nop,nop,TS val 3585072350 ecr 4068477756], length 518: RESP "# Replication^M^Jrole:slave^M^Jmaster_host:172.28.5.0^M^Jmaster_port:6379^M^Jmaster_link_status:up^M^Jmaster_last_io_seconds_ago:0^M^Jmaster_sync_in_progress:0^M^Jslave_repl_offset:208872^M^Jslave_priority:100^M^Jslave_read_only:1^M^Jconnected_slaves:0^M^Jmaster_replid:f8eac6c8a17a641b11523474ffa3dbd0af88977a^M^Jmaster_replid2:0000000000000000000000000000000000000000^M^Jmaster_repl_offset:208872^M^Jsecond_repl_offset:-1^M^Jrepl_backlog_active:1^M^Jrepl_backlog_size:1048576^M^Jrepl_backlog_first_byte_offset:1^M^Jrepl_backlog_histlen:208872^M^J"
12:25:49.612052 IP 172.28.5.4.60668 > 172.28.5.1.6379: Flags [.], ack 526, win 237, options [nop,nop,TS val 4068477798 ecr 3585072350], length 0
12:25:49.902934 IP 172.28.5.4.37174 > 172.28.5.2.6379: Flags [S], seq 1644870850, win 29200, options [mss 1460,sackOK,TS val 3591705370 ecr 0,nop,wscale 7], length 0
12:25:49.903128 IP 172.28.5.2.6379 > 172.28.5.4.37174: Flags [S.], seq 3184037728, ack 1644870851, win 28960, options [mss 1460,sackOK,TS val 371168675 ecr 3591705370,nop,wscale 7], length 0
12:25:49.903233 IP 172.28.5.4.37174 > 172.28.5.2.6379: Flags [P.], seq 1:7, ack 1, win 229, options [nop,nop,TS val 3591705371 ecr 371168675], length 6: RESP "PING"
12:25:49.903353 IP 172.28.5.2.6379 > 172.28.5.4.37174: Flags [.], ack 7, win 227, options [nop,nop,TS val 371168675 ecr 3591705371], length 0
12:25:49.903612 IP 172.28.5.2.6379 > 172.28.5.4.37174: Flags [P.], seq 1:8, ack 7, win 227, options [nop,nop,TS val 371168675 ecr 3591705371], length 7: RESP "PONG"
12:25:49.903725 IP 172.28.5.4.37174 > 172.28.5.2.6379: Flags [P.], seq 7:25, ack 8, win 229, options [nop,nop,TS val 3591705371 ecr 371168675], length 18: RESP "info replication"
12:25:49.903928 IP 172.28.5.2.6379 > 172.28.5.4.37174: Flags [P.], seq 8:528, ack 25, win 227, options [nop,nop,TS val 371168675 ecr 3591705371], length 520: RESP "# Replication^M^Jrole:slave^M^Jmaster_host:172.28.5.0^M^Jmaster_port:6379^M^Jmaster_link_status:up^M^Jmaster_last_io_seconds_ago:0^M^Jmaster_sync_in_progress:0^M^Jslave_repl_offset:208872^M^Jslave_priority:100^M^Jslave_read_only:1^M^Jconnected_slaves:0^M^Jmaster_replid:f8eac6c8a17a641b11523474ffa3dbd0af88977a^M^Jmaster_replid2:0000000000000000000000000000000000000000^M^Jmaster_repl_offset:208872^M^Jsecond_repl_offset:-1^M^Jrepl_backlog_active:1^M^Jrepl_backlog_size:1048576^M^Jrepl_backlog_first_byte_offset:186^M^Jrepl_backlog_histlen:208687^M^J"
12:25:49.948442 IP 172.28.5.4.37174 > 172.28.5.2.6379: Flags [.], ack 528, win 237, options [nop,nop,TS val 3591705416 ecr 371168675], length 0
12:25:50.243204 IP 172.28.5.4.39202 > 172.28.5.0.6379: Flags [S], seq 2052360894, win 29200, options [mss 1460,sackOK,TS val 1870699003 ecr 0,nop,wscale 7], length 0
12:25:50.243396 IP 172.28.5.0.6379 > 172.28.5.4.39202: Flags [S.], seq 3417827271, ack 2052360895, win 28960, options [mss 1460,sackOK,TS val 230053937 ecr 1870699003,nop,wscale 7], length 0
12:25:50.243503 IP 172.28.5.4.39202 > 172.28.5.0.6379: Flags [P.], seq 1:7, ack 1, win 229, options [nop,nop,TS val 1870699003 ecr 230053937], length 6: RESP "PING"
12:25:50.243613 IP 172.28.5.0.6379 > 172.28.5.4.39202: Flags [.], ack 7, win 227, options [nop,nop,TS val 230053937 ecr 1870699003], length 0
12:25:50.243876 IP 172.28.5.0.6379 > 172.28.5.4.39202: Flags [P.], seq 1:8, ack 7, win 227, options [nop,nop,TS val 230053937 ecr 1870699003], length 7: RESP "PONG"
12:25:50.244068 IP 172.28.5.4.39202 > 172.28.5.0.6379: Flags [P.], seq 7:25, ack 8, win 229, options [nop,nop,TS val 1870699004 ecr 230053937], length 18: RESP "info replication"
12:25:50.244334 IP 172.28.5.0.6379 > 172.28.5.4.39202: Flags [P.], seq 8:470, ack 25, win 227, options [nop,nop,TS val 230053938 ecr 1870699004], length 462: RESP "# Replication^M^Jrole:master^M^Jconnected_slaves:2^M^Jslave0:ip=172.28.5.1,port=6379,state=online,offset=208872,lag=1^M^Jslave1:ip=172.28.5.2,port=6379,state=online,offset=208872,lag=1^M^Jmaster_replid:f8eac6c8a17a641b11523474ffa3dbd0af88977a^M^Jmaster_replid2:0000000000000000000000000000000000000000^M^Jmaster_repl_offset:209020^M^Jsecond_repl_offset:-1^M^Jrepl_backlog_active:1^M^Jrepl_backlog_size:1048576^M^Jrepl_backlog_first_byte_offset:1^M^Jrepl_backlog_histlen:209020^M^J"
12:25:50.244474 IP 172.28.5.4.39202 > 172.28.5.0.6379: Flags [P.], seq 25:31, ack 470, win 237, options [nop,nop,TS val 1870699004 ecr 230053938], length 6: RESP "QUIT"
12:25:50.244626 IP 172.28.5.0.6379 > 172.28.5.4.39202: Flags [P.], seq 470:475, ack 31, win 227, options [nop,nop,TS val 230053938 ecr 1870699004], length 5: RESP "OK"
12:25:50.244752 IP 172.28.5.4.39202 > 172.28.5.0.6379: Flags [R.], seq 31, ack 475, win 237, options [nop,nop,TS val 1870699004 ecr 230053938], length 0
12:25:50.244755 IP 172.28.5.0.6379 > 172.28.5.4.39202: Flags [F.], seq 475, ack 31, win 227, options [nop,nop,TS val 230053938 ecr 1870699004], length 0
12:25:50.244804 IP 172.28.5.4.39202 > 172.28.5.0.6379: Flags [R], seq 2052360925, win 0, length 0
12:25:50.571336 IP 172.28.5.4.60668 > 172.28.5.1.6379: Flags [R.], seq 25, ack 526, win 237, options [nop,nop,TS val 4068478757 ecr 3585072350], length 0
12:25:50.904029 IP 172.28.5.4.37174 > 172.28.5.2.6379: Flags [R.], seq 25, ack 528, win 237, options [nop,nop,TS val 3591706372 ecr 371168675], length 0
12:25:51.245826 IP 172.28.5.4.39206 > 172.28.5.0.6379: Flags [S], seq 239865732, win 29200, options [mss 1460,sackOK,TS val 1870700005 ecr 0,nop,wscale 7], length 0
12:25:51.245942 IP 172.28.5.0.6379 > 172.28.5.4.39206: Flags [S.], seq 2399980039, ack 239865733, win 28960, options [mss 1460,sackOK,TS val 230054940 ecr 1870700005,nop,wscale 7], length 0
12:25:51.246002 IP 172.28.5.4.39206 > 172.28.5.0.6379: Flags [P.], seq 1:7, ack 1, win 229, options [nop,nop,TS val 1870700006 ecr 230054940], length 6: RESP "PING"
12:25:51.246085 IP 172.28.5.0.6379 > 172.28.5.4.39206: Flags [.], ack 7, win 227, options [nop,nop,TS val 230054940 ecr 1870700006], length 0
12:25:51.246286 IP 172.28.5.0.6379 > 172.28.5.4.39206: Flags [P.], seq 1:8, ack 7, win 227, options [nop,nop,TS val 230054940 ecr 1870700006], length 7: RESP "PONG"
12:25:51.246371 IP 172.28.5.4.39206 > 172.28.5.0.6379: Flags [P.], seq 7:25, ack 8, win 229, options [nop,nop,TS val 1870700006 ecr 230054940], length 18: RESP "info replication"
12:25:51.246537 IP 172.28.5.0.6379 > 172.28.5.4.39206: Flags [P.], seq 8:470, ack 25, win 227, options [nop,nop,TS val 230054940 ecr 1870700006], length 462: RESP "# Replication^M^Jrole:master^M^Jconnected_slaves:2^M^Jslave0:ip=172.28.5.1,port=6379,state=online,offset=209020,lag=1^M^Jslave1:ip=172.28.5.2,port=6379,state=online,offset=209020,lag=1^M^Jmaster_replid:f8eac6c8a17a641b11523474ffa3dbd0af88977a^M^Jmaster_replid2:0000000000000000000000000000000000000000^M^Jmaster_repl_offset:209168^M^Jsecond_repl_offset:-1^M^Jrepl_backlog_active:1^M^Jrepl_backlog_size:1048576^M^Jrepl_backlog_first_byte_offset:1^M^Jrepl_backlog_histlen:209168^M^J"
12:25:51.246607 IP 172.28.5.4.39206 > 172.28.5.0.6379: Flags [P.], seq 25:31, ack 470, win 237, options [nop,nop,TS val 1870700006 ecr 230054940], length 6: RESP "QUIT"
12:25:51.246706 IP 172.28.5.0.6379 > 172.28.5.4.39206: Flags [P.], seq 470:475, ack 31, win 227, options [nop,nop,TS val 230054940 ecr 1870700006], length 5: RESP "OK"
12:25:51.246777 IP 172.28.5.4.39206 > 172.28.5.0.6379: Flags [R.], seq 31, ack 475, win 237, options [nop,nop,TS val 1870700006 ecr 230054940], length 0
12:25:51.246777 IP 172.28.5.0.6379 > 172.28.5.4.39206: Flags [F.], seq 475, ack 31, win 227, options [nop,nop,TS val 230054940 ecr 1870700006], length 0
12:25:51.246805 IP 172.28.5.4.39206 > 172.28.5.0.6379: Flags [R], seq 239865763, win 0, length 0
12:25:51.573351 IP 172.28.5.4.60684 > 172.28.5.1.6379: Flags [S], seq 2594712413, win 29200, options [mss 1460,sackOK,TS val 4068479759 ecr 0,nop,wscale 7], length 0
12:25:51.573501 IP 172.28.5.1.6379 > 172.28.5.4.60684: Flags [S.], seq 3471469100, ack 2594712414, win 28960, options [mss 1460,sackOK,TS val 3585074353 ecr 4068479759,nop,wscale 7], length 0
12:25:51.573586 IP 172.28.5.4.60684 > 172.28.5.1.6379: Flags [P.], seq 1:7, ack 1, win 229, options [nop,nop,TS val 4068479759 ecr 3585074353], length 6: RESP "PING"
12:25:51.573674 IP 172.28.5.1.6379 > 172.28.5.4.60684: Flags [.], ack 7, win 227, options [nop,nop,TS val 3585074353 ecr 4068479759], length 0
12:25:51.573890 IP 172.28.5.1.6379 > 172.28.5.4.60684: Flags [P.], seq 1:8, ack 7, win 227, options [nop,nop,TS val 3585074353 ecr 4068479759], length 7: RESP "PONG"
12:25:51.574019 IP 172.28.5.4.60684 > 172.28.5.1.6379: Flags [P.], seq 7:25, ack 8, win 229, options [nop,nop,TS val 4068479760 ecr 3585074353], length 18: RESP "info replication"
12:25:51.574275 IP 172.28.5.1.6379 > 172.28.5.4.60684: Flags [P.], seq 8:526, ack 25, win 227, options [nop,nop,TS val 3585074354 ecr 4068479760], length 518: RESP "# Replication^M^Jrole:slave^M^Jmaster_host:172.28.5.0^M^Jmaster_port:6379^M^Jmaster_link_status:up^M^Jmaster_last_io_seconds_ago:0^M^Jmaster_sync_in_progress:0^M^Jslave_repl_offset:209330^M^Jslave_priority:100^M^Jslave_read_only:1^M^Jconnected_slaves:0^M^Jmaster_replid:f8eac6c8a17a641b11523474ffa3dbd0af88977a^M^Jmaster_replid2:0000000000000000000000000000000000000000^M^Jmaster_repl_offset:209330^M^Jsecond_repl_offset:-1^M^Jrepl_backlog_active:1^M^Jrepl_backlog_size:1048576^M^Jrepl_backlog_first_byte_offset:1^M^Jrepl_backlog_histlen:209330^M^J"
12:25:51.616142 IP 172.28.5.4.60684 > 172.28.5.1.6379: Flags [.], ack 526, win 237, options [nop,nop,TS val 4068479802 ecr 3585074354], length 0
12:25:51.904904 IP 172.28.5.4.37190 > 172.28.5.2.6379: Flags [S], seq 2936826938, win 29200, options [mss 1460,sackOK,TS val 3591707372 ecr 0,nop,wscale 7], length 0
12:25:51.905065 IP 172.28.5.2.6379 > 172.28.5.4.37190: Flags [S.], seq 3103487411, ack 2936826939, win 28960, options [mss 1460,sackOK,TS val 371170677 ecr 3591707372,nop,wscale 7], length 0
12:25:51.905149 IP 172.28.5.4.37190 > 172.28.5.2.6379: Flags [P.], seq 1:7, ack 1, win 229, options [nop,nop,TS val 3591707373 ecr 371170677], length 6: RESP "PING"
12:25:51.905239 IP 172.28.5.2.6379 > 172.28.5.4.37190: Flags [.], ack 7, win 227, options [nop,nop,TS val 371170677 ecr 3591707373], length 0
12:25:51.905464 IP 172.28.5.2.6379 > 172.28.5.4.37190: Flags [P.], seq 1:8, ack 7, win 227, options [nop,nop,TS val 371170677 ecr 3591707373], length 7: RESP "PONG"
12:25:51.905592 IP 172.28.5.4.37190 > 172.28.5.2.6379: Flags [P.], seq 7:25, ack 8, win 229, options [nop,nop,TS val 3591707373 ecr 371170677], length 18: RESP "info replication"
12:25:51.905842 IP 172.28.5.2.6379 > 172.28.5.4.37190: Flags [P.], seq 8:528, ack 25, win 227, options [nop,nop,TS val 371170677 ecr 3591707373], length 520: RESP "# Replication^M^Jrole:slave^M^Jmaster_host:172.28.5.0^M^Jmaster_port:6379^M^Jmaster_link_status:up^M^Jmaster_last_io_seconds_ago:0^M^Jmaster_sync_in_progress:0^M^Jslave_repl_offset:209330^M^Jslave_priority:100^M^Jslave_read_only:1^M^Jconnected_slaves:0^M^Jmaster_replid:f8eac6c8a17a641b11523474ffa3dbd0af88977a^M^Jmaster_replid2:0000000000000000000000000000000000000000^M^Jmaster_repl_offset:209330^M^Jsecond_repl_offset:-1^M^Jrepl_backlog_active:1^M^Jrepl_backlog_size:1048576^M^Jrepl_backlog_first_byte_offset:186^M^Jrepl_backlog_histlen:209145^M^J"
12:25:51.948029 IP 172.28.5.4.37190 > 172.28.5.2.6379: Flags [.], ack 528, win 237, options [nop,nop,TS val 3591707416 ecr 371170677], length 0
12:25:52.247943 IP 172.28.5.4.39218 > 172.28.5.0.6379: Flags [S], seq 1607110239, win 29200, options [mss 1460,sackOK,TS val 1870701007 ecr 0,nop,wscale 7], length 0
12:25:52.248297 IP 172.28.5.0.6379 > 172.28.5.4.39218: Flags [S.], seq 272132879, ack 1607110240, win 28960, options [mss 1460,sackOK,TS val 230055942 ecr 1870701007,nop,wscale 7], length 0
12:25:52.248473 IP 172.28.5.4.39218 > 172.28.5.0.6379: Flags [P.], seq 1:7, ack 1, win 229, options [nop,nop,TS val 1870701008 ecr 230055942], length 6: RESP "PING"
12:25:52.248614 IP 172.28.5.0.6379 > 172.28.5.4.39218: Flags [.], ack 7, win 227, options [nop,nop,TS val 230055942 ecr 1870701008], length 0
12:25:52.248917 IP 172.28.5.0.6379 > 172.28.5.4.39218: Flags [P.], seq 1:8, ack 7, win 227, options [nop,nop,TS val 230055942 ecr 1870701008], length 7: RESP "PONG"
12:25:52.249038 IP 172.28.5.4.39218 > 172.28.5.0.6379: Flags [P.], seq 7:25, ack 8, win 229, options [nop,nop,TS val 1870701009 ecr 230055942], length 18: RESP "info replication"
12:25:52.249268 IP 172.28.5.0.6379 > 172.28.5.4.39218: Flags [P.], seq 8:470, ack 25, win 227, options [nop,nop,TS val 230055943 ecr 1870701009], length 462: RESP "# Replication^M^Jrole:master^M^Jconnected_slaves:2^M^Jslave0:ip=172.28.5.1,port=6379,state=online,offset=209330,lag=1^M^Jslave1:ip=172.28.5.2,port=6379,state=online,offset=209330,lag=1^M^Jmaster_replid:f8eac6c8a17a641b11523474ffa3dbd0af88977a^M^Jmaster_replid2:0000000000000000000000000000000000000000^M^Jmaster_repl_offset:209478^M^Jsecond_repl_offset:-1^M^Jrepl_backlog_active:1^M^Jrepl_backlog_size:1048576^M^Jrepl_backlog_first_byte_offset:1^M^Jrepl_backlog_histlen:209478^M^J"
12:25:52.249362 IP 172.28.5.4.39218 > 172.28.5.0.6379: Flags [P.], seq 25:31, ack 470, win 237, options [nop,nop,TS val 1870701009 ecr 230055943], length 6: RESP "QUIT"
12:25:52.249496 IP 172.28.5.0.6379 > 172.28.5.4.39218: Flags [P.], seq 470:475, ack 31, win 227, options [nop,nop,TS val 230055943 ecr 1870701009], length 5: RESP "OK"
12:25:52.249662 IP 172.28.5.0.6379 > 172.28.5.4.39218: Flags [F.], seq 475, ack 31, win 227, options [nop,nop,TS val 230055943 ecr 1870701009], length 0
12:25:52.249812 IP 172.28.5.4.39218 > 172.28.5.0.6379: Flags [F.], seq 31, ack 476, win 237, options [nop,nop,TS val 1870701009 ecr 230055943], length 0
12:25:52.249962 IP 172.28.5.0.6379 > 172.28.5.4.39218: Flags [.], ack 32, win 227, options [nop,nop,TS val 230055943 ecr 1870701009], length 0
12:25:52.575506 IP 172.28.5.4.60684 > 172.28.5.1.6379: Flags [R.], seq 25, ack 526, win 237, options [nop,nop,TS val 4068480761 ecr 3585074354], length 0
12:25:52.906511 IP 172.28.5.4.37190 > 172.28.5.2.6379: Flags [R.], seq 25, ack 528, win 237, options [nop,nop,TS val 3591708374 ecr 371170677], length 0
12:25:53.249528 IP 172.28.5.4.39222 > 172.28.5.0.6379: Flags [S], seq 247436939, win 29200, options [mss 1460,sackOK,TS val 1870702009 ecr 0,nop,wscale 7], length 0
12:25:53.249970 IP 172.28.5.0.6379 > 172.28.5.4.39222: Flags [S.], seq 4154128262, ack 247436940, win 28960, options [mss 1460,sackOK,TS val 230056943 ecr 1870702009,nop,wscale 7], length 0
12:25:53.250333 IP 172.28.5.4.39222 > 172.28.5.0.6379: Flags [P.], seq 1:7, ack 1, win 229, options [nop,nop,TS val 1870702010 ecr 230056943], length 6: RESP "PING"
12:25:53.250751 IP 172.28.5.0.6379 > 172.28.5.4.39222: Flags [.], ack 7, win 227, options [nop,nop,TS val 230056944 ecr 1870702010], length 0
12:25:53.251415 IP 172.28.5.0.6379 > 172.28.5.4.39222: Flags [P.], seq 1:8, ack 7, win 227, options [nop,nop,TS val 230056945 ecr 1870702010], length 7: RESP "PONG"
12:25:53.251954 IP 172.28.5.4.39222 > 172.28.5.0.6379: Flags [P.], seq 7:25, ack 8, win 229, options [nop,nop,TS val 1870702011 ecr 230056945], length 18: RESP "info replication"
12:25:53.252697 IP 172.28.5.0.6379 > 172.28.5.4.39222: Flags [P.], seq 8:470, ack 25, win 227, options [nop,nop,TS val 230056946 ecr 1870702011], length 462: RESP "# Replication^M^Jrole:master^M^Jconnected_slaves:2^M^Jslave0:ip=172.28.5.1,port=6379,state=online,offset=209478,lag=1^M^Jslave1:ip=172.28.5.2,port=6379,state=online,offset=209478,lag=1^M^Jmaster_replid:f8eac6c8a17a641b11523474ffa3dbd0af88977a^M^Jmaster_replid2:0000000000000000000000000000000000000000^M^Jmaster_repl_offset:209626^M^Jsecond_repl_offset:-1^M^Jrepl_backlog_active:1^M^Jrepl_backlog_size:1048576^M^Jrepl_backlog_first_byte_offset:1^M^Jrepl_backlog_histlen:209626^M^J"
12:25:53.253020 IP 172.28.5.4.39222 > 172.28.5.0.6379: Flags [P.], seq 25:31, ack 470, win 237, options [nop,nop,TS val 1870702013 ecr 230056946], length 6: RESP "QUIT"
12:25:53.253449 IP 172.28.5.0.6379 > 172.28.5.4.39222: Flags [P.], seq 470:475, ack 31, win 227, options [nop,nop,TS val 230056947 ecr 1870702013], length 5: RESP "OK"
12:25:53.253784 IP 172.28.5.4.39222 > 172.28.5.0.6379: Flags [R.], seq 31, ack 475, win 237, options [nop,nop,TS val 1870702013 ecr 230056947], length 0
12:25:53.253797 IP 172.28.5.0.6379 > 172.28.5.4.39222: Flags [F.], seq 475, ack 31, win 227, options [nop,nop,TS val 230056947 ecr 1870702013], length 0
12:25:53.253900 IP 172.28.5.4.39222 > 172.28.5.0.6379: Flags [R], seq 247436970, win 0, length 0
12:25:53.577744 IP 172.28.5.4.60700 > 172.28.5.1.6379: Flags [S], seq 1289755091, win 29200, options [mss 1460,sackOK,TS val 4068481763 ecr 0,nop,wscale 7], length 0
12:25:53.577887 IP 172.28.5.1.6379 > 172.28.5.4.60700: Flags [S.], seq 1864457665, ack 1289755092, win 28960, options [mss 1460,sackOK,TS val 3585076357 ecr 4068481763,nop,wscale 7], length 0
12:25:53.577964 IP 172.28.5.4.60700 > 172.28.5.1.6379: Flags [P.], seq 1:7, ack 1, win 229, options [nop,nop,TS val 4068481764 ecr 3585076357], length 6: RESP "PING"
12:25:53.578090 IP 172.28.5.1.6379 > 172.28.5.4.60700: Flags [.], ack 7, win 227, options [nop,nop,TS val 3585076358 ecr 4068481764], length 0
12:25:53.578448 IP 172.28.5.1.6379 > 172.28.5.4.60700: Flags [P.], seq 1:8, ack 7, win 227, options [nop,nop,TS val 3585076358 ecr 4068481764], length 7: RESP "PONG"
12:25:53.578659 IP 172.28.5.4.60700 > 172.28.5.1.6379: Flags [P.], seq 7:25, ack 8, win 229, options [nop,nop,TS val 4068481764 ecr 3585076358], length 18: RESP "info replication"
12:25:53.578921 IP 172.28.5.1.6379 > 172.28.5.4.60700: Flags [P.], seq 8:526, ack 25, win 227, options [nop,nop,TS val 3585076358 ecr 4068481764], length 518: RESP "# Replication^M^Jrole:slave^M^Jmaster_host:172.28.5.0^M^Jmaster_port:6379^M^Jmaster_link_status:up^M^Jmaster_last_io_seconds_ago:0^M^Jmaster_sync_in_progress:0^M^Jslave_repl_offset:209774^M^Jslave_priority:100^M^Jslave_read_only:1^M^Jconnected_slaves:0^M^Jmaster_replid:f8eac6c8a17a641b11523474ffa3dbd0af88977a^M^Jmaster_replid2:0000000000000000000000000000000000000000^M^Jmaster_repl_offset:209774^M^Jsecond_repl_offset:-1^M^Jrepl_backlog_active:1^M^Jrepl_backlog_size:1048576^M^Jrepl_backlog_first_byte_offset:1^M^Jrepl_backlog_histlen:209774^M^J"
12:25:53.620466 IP 172.28.5.4.60700 > 172.28.5.1.6379: Flags [.], ack 526, win 237, options [nop,nop,TS val 4068481806 ecr 3585076358], length 0
12:25:53.908544 IP 172.28.5.4.37206 > 172.28.5.2.6379: Flags [S], seq 1629461609, win 29200, options [mss 1460,sackOK,TS val 3591709376 ecr 0,nop,wscale 7], length 0
12:25:53.908779 IP 172.28.5.2.6379 > 172.28.5.4.37206: Flags [S.], seq 524125628, ack 1629461610, win 28960, options [mss 1460,sackOK,TS val 371172680 ecr 3591709376,nop,wscale 7], length 0
12:25:53.908906 IP 172.28.5.4.37206 > 172.28.5.2.6379: Flags [P.], seq 1:7, ack 1, win 229, options [nop,nop,TS val 3591709376 ecr 371172680], length 6: RESP "PING"
12:25:53.909043 IP 172.28.5.2.6379 > 172.28.5.4.37206: Flags [.], ack 7, win 227, options [nop,nop,TS val 371172681 ecr 3591709376], length 0
12:25:53.909429 IP 172.28.5.2.6379 > 172.28.5.4.37206: Flags [P.], seq 1:8, ack 7, win 227, options [nop,nop,TS val 371172681 ecr 3591709376], length 7: RESP "PONG"
12:25:53.909614 IP 172.28.5.4.37206 > 172.28.5.2.6379: Flags [P.], seq 7:25, ack 8, win 229, options [nop,nop,TS val 3591709377 ecr 371172681], length 18: RESP "info replication"
12:25:53.909921 IP 172.28.5.2.6379 > 172.28.5.4.37206: Flags [P.], seq 8:528, ack 25, win 227, options [nop,nop,TS val 371172681 ecr 3591709377], length 520: RESP "# Replication^M^Jrole:slave^M^Jmaster_host:172.28.5.0^M^Jmaster_port:6379^M^Jmaster_link_status:up^M^Jmaster_last_io_seconds_ago:0^M^Jmaster_sync_in_progress:0^M^Jslave_repl_offset:209774^M^Jslave_priority:100^M^Jslave_read_only:1^M^Jconnected_slaves:0^M^Jmaster_replid:f8eac6c8a17a641b11523474ffa3dbd0af88977a^M^Jmaster_replid2:0000000000000000000000000000000000000000^M^Jmaster_repl_offset:209774^M^Jsecond_repl_offset:-1^M^Jrepl_backlog_active:1^M^Jrepl_backlog_size:1048576^M^Jrepl_backlog_first_byte_offset:186^M^Jrepl_backlog_histlen:209589^M^J"
12:25:53.952073 IP 172.28.5.4.37206 > 172.28.5.2.6379: Flags [.], ack 528, win 237, options [nop,nop,TS val 3591709420 ecr 371172681], length 0
12:25:54.255004 IP 172.28.5.4.39234 > 172.28.5.0.6379: Flags [S], seq 4231622871, win 29200, options [mss 1460,sackOK,TS val 1870703014 ecr 0,nop,wscale 7], length 0
12:25:54.255510 IP 172.28.5.0.6379 > 172.28.5.4.39234: Flags [S.], seq 66340632, ack 4231622872, win 28960, options [mss 1460,sackOK,TS val 230057949 ecr 1870703014,nop,wscale 7], length 0
12:25:54.255841 IP 172.28.5.4.39234 > 172.28.5.0.6379: Flags [P.], seq 1:7, ack 1, win 229, options [nop,nop,TS val 1870703015 ecr 230057949], length 6: RESP "PING"
12:25:54.256296 IP 172.28.5.0.6379 > 172.28.5.4.39234: Flags [.], ack 7, win 227, options [nop,nop,TS val 230057950 ecr 1870703015], length 0
12:25:54.256974 IP 172.28.5.0.6379 > 172.28.5.4.39234: Flags [P.], seq 1:8, ack 7, win 227, options [nop,nop,TS val 230057950 ecr 1870703015], length 7: RESP "PONG"
12:25:54.257372 IP 172.28.5.4.39234 > 172.28.5.0.6379: Flags [P.], seq 7:25, ack 8, win 229, options [nop,nop,TS val 1870703017 ecr 230057950], length 18: RESP "info replication"
12:25:54.258248 IP 172.28.5.0.6379 > 172.28.5.4.39234: Flags [P.], seq 8:470, ack 25, win 227, options [nop,nop,TS val 230057952 ecr 1870703017], length 462: RESP "# Replication^M^Jrole:master^M^Jconnected_slaves:2^M^Jslave0:ip=172.28.5.1,port=6379,state=online,offset=209774,lag=1^M^Jslave1:ip=172.28.5.2,port=6379,state=online,offset=209774,lag=1^M^Jmaster_replid:f8eac6c8a17a641b11523474ffa3dbd0af88977a^M^Jmaster_replid2:0000000000000000000000000000000000000000^M^Jmaster_repl_offset:209922^M^Jsecond_repl_offset:-1^M^Jrepl_backlog_active:1^M^Jrepl_backlog_size:1048576^M^Jrepl_backlog_first_byte_offset:1^M^Jrepl_backlog_histlen:209922^M^J"
12:25:54.258663 IP 172.28.5.4.39234 > 172.28.5.0.6379: Flags [P.], seq 25:31, ack 470, win 237, options [nop,nop,TS val 1870703018 ecr 230057952], length 6: RESP "QUIT"
12:25:54.259193 IP 172.28.5.0.6379 > 172.28.5.4.39234: Flags [P.], seq 470:475, ack 31, win 227, options [nop,nop,TS val 230057953 ecr 1870703018], length 5: RESP "OK"
12:25:54.259840 IP 172.28.5.0.6379 > 172.28.5.4.39234: Flags [F.], seq 475, ack 31, win 227, options [nop,nop,TS val 230057953 ecr 1870703018], length 0
12:25:54.260258 IP 172.28.5.4.39234 > 172.28.5.0.6379: Flags [R.], seq 31, ack 476, win 237, options [nop,nop,TS val 1870703020 ecr 230057953], length 0
12:25:54.580119 IP 172.28.5.4.60700 > 172.28.5.1.6379: Flags [R.], seq 25, ack 526, win 237, options [nop,nop,TS val 4068482766 ecr 3585076358], length 0
12:25:54.910227 IP 172.28.5.4.37206 > 172.28.5.2.6379: Flags [R.], seq 25, ack 528, win 237, options [nop,nop,TS val 3591710378 ecr 371172681], length 0
12:25:55.260800 IP 172.28.5.4.39238 > 172.28.5.0.6379: Flags [S], seq 1444937476, win 29200, options [mss 1460,sackOK,TS val 1870704020 ecr 0,nop,wscale 7], length 0
12:25:55.260858 IP 172.28.5.0.6379 > 172.28.5.4.39238: Flags [S.], seq 3319236056, ack 1444937477, win 28960, options [mss 1460,sackOK,TS val 230058954 ecr 1870704020,nop,wscale 7], length 0
12:25:55.260883 IP 172.28.5.4.39238 > 172.28.5.0.6379: Flags [P.], seq 1:7, ack 1, win 229, options [nop,nop,TS val 1870704020 ecr 230058954], length 6: RESP "PING"
12:25:55.260908 IP 172.28.5.0.6379 > 172.28.5.4.39238: Flags [.], ack 7, win 227, options [nop,nop,TS val 230058954 ecr 1870704020], length 0
12:25:55.260989 IP 172.28.5.0.6379 > 172.28.5.4.39238: Flags [P.], seq 1:8, ack 7, win 227, options [nop,nop,TS val 230058955 ecr 1870704020], length 7: RESP "PONG"
12:25:55.261027 IP 172.28.5.4.39238 > 172.28.5.0.6379: Flags [P.], seq 7:25, ack 8, win 229, options [nop,nop,TS val 1870704021 ecr 230058955], length 18: RESP "info replication"
12:25:55.261088 IP 172.28.5.0.6379 > 172.28.5.4.39238: Flags [P.], seq 8:470, ack 25, win 227, options [nop,nop,TS val 230058955 ecr 1870704021], length 462: RESP "# Replication^M^Jrole:master^M^Jconnected_slaves:2^M^Jslave0:ip=172.28.5.1,port=6379,state=online,offset=209922,lag=1^M^Jslave1:ip=172.28.5.2,port=6379,state=online,offset=209922,lag=1^M^Jmaster_replid:f8eac6c8a17a641b11523474ffa3dbd0af88977a^M^Jmaster_replid2:0000000000000000000000000000000000000000^M^Jmaster_repl_offset:210070^M^Jsecond_repl_offset:-1^M^Jrepl_backlog_active:1^M^Jrepl_backlog_size:1048576^M^Jrepl_backlog_first_byte_offset:1^M^Jrepl_backlog_histlen:210070^M^J"
12:25:55.261116 IP 172.28.5.4.39238 > 172.28.5.0.6379: Flags [P.], seq 25:31, ack 470, win 237, options [nop,nop,TS val 1870704021 ecr 230058955], length 6: RESP "QUIT"
12:25:55.261153 IP 172.28.5.0.6379 > 172.28.5.4.39238: Flags [P.], seq 470:475, ack 31, win 227, options [nop,nop,TS val 230058955 ecr 1870704021], length 5: RESP "OK"
12:25:55.261173 IP 172.28.5.0.6379 > 172.28.5.4.39238: Flags [F.], seq 475, ack 31, win 227, options [nop,nop,TS val 230058955 ecr 1870704021], length 0
12:25:55.261206 IP 172.28.5.4.39238 > 172.28.5.0.6379: Flags [F.], seq 31, ack 476, win 237, options [nop,nop,TS val 1870704021 ecr 230058955], length 0
12:25:55.261233 IP 172.28.5.0.6379 > 172.28.5.4.39238: Flags [.], ack 32, win 227, options [nop,nop,TS val 230058955 ecr 1870704021], length 0
12:25:55.581649 IP 172.28.5.4.60716 > 172.28.5.1.6379: Flags [S], seq 3912862525, win 29200, options [mss 1460,sackOK,TS val 4068483767 ecr 0,nop,wscale 7], length 0
12:25:55.581732 IP 172.28.5.1.6379 > 172.28.5.4.60716: Flags [S.], seq 1221115826, ack 3912862526, win 28960, options [mss 1460,sackOK,TS val 3585078361 ecr 4068483767,nop,wscale 7], length 0
12:25:55.581775 IP 172.28.5.4.60716 > 172.28.5.1.6379: Flags [P.], seq 1:7, ack 1, win 229, options [nop,nop,TS val 4068483767 ecr 3585078361], length 6: RESP "PING"
12:25:55.581822 IP 172.28.5.1.6379 > 172.28.5.4.60716: Flags [.], ack 7, win 227, options [nop,nop,TS val 3585078361 ecr 4068483767], length 0
12:25:55.581931 IP 172.28.5.1.6379 > 172.28.5.4.60716: Flags [P.], seq 1:8, ack 7, win 227, options [nop,nop,TS val 3585078361 ecr 4068483767], length 7: RESP "PONG"
12:25:55.581981 IP 172.28.5.4.60716 > 172.28.5.1.6379: Flags [P.], seq 7:25, ack 8, win 229, options [nop,nop,TS val 4068483768 ecr 3585078361], length 18: RESP "info replication"
12:25:55.582061 IP 172.28.5.1.6379 > 172.28.5.4.60716: Flags [P.], seq 8:526, ack 25, win 227, options [nop,nop,TS val 3585078362 ecr 4068483768], length 518: RESP "# Replication^M^Jrole:slave^M^Jmaster_host:172.28.5.0^M^Jmaster_port:6379^M^Jmaster_link_status:up^M^Jmaster_last_io_seconds_ago:0^M^Jmaster_sync_in_progress:0^M^Jslave_repl_offset:210218^M^Jslave_priority:100^M^Jslave_read_only:1^M^Jconnected_slaves:0^M^Jmaster_replid:f8eac6c8a17a641b11523474ffa3dbd0af88977a^M^Jmaster_replid2:0000000000000000000000000000000000000000^M^Jmaster_repl_offset:210218^M^Jsecond_repl_offset:-1^M^Jrepl_backlog_active:1^M^Jrepl_backlog_size:1048576^M^Jrepl_backlog_first_byte_offset:1^M^Jrepl_backlog_histlen:210218^M^J"
12:25:55.624035 IP 172.28.5.4.60716 > 172.28.5.1.6379: Flags [.], ack 526, win 237, options [nop,nop,TS val 4068483810 ecr 3585078362], length 0
12:25:55.911477 IP 172.28.5.4.37222 > 172.28.5.2.6379: Flags [S], seq 1794895303, win 29200, options [mss 1460,sackOK,TS val 3591711379 ecr 0,nop,wscale 7], length 0
12:25:55.911533 IP 172.28.5.2.6379 > 172.28.5.4.37222: Flags [S.], seq 2679506430, ack 1794895304, win 28960, options [mss 1460,sackOK,TS val 371174683 ecr 3591711379,nop,wscale 7], length 0
12:25:55.911558 IP 172.28.5.4.37222 > 172.28.5.2.6379: Flags [P.], seq 1:7, ack 1, win 229, options [nop,nop,TS val 3591711379 ecr 371174683], length 6: RESP "PING"
12:25:55.911583 IP 172.28.5.2.6379 > 172.28.5.4.37222: Flags [.], ack 7, win 227, options [nop,nop,TS val 371174683 ecr 3591711379], length 0
12:25:55.911651 IP 172.28.5.2.6379 > 172.28.5.4.37222: Flags [P.], seq 1:8, ack 7, win 227, options [nop,nop,TS val 371174683 ecr 3591711379], length 7: RESP "PONG"
12:25:55.911675 IP 172.28.5.4.37222 > 172.28.5.2.6379: Flags [P.], seq 7:25, ack 8, win 229, options [nop,nop,TS val 3591711379 ecr 371174683], length 18: RESP "info replication"
12:25:55.911719 IP 172.28.5.2.6379 > 172.28.5.4.37222: Flags [P.], seq 8:528, ack 25, win 227, options [nop,nop,TS val 371174683 ecr 3591711379], length 520: RESP "# Replication^M^Jrole:slave^M^Jmaster_host:172.28.5.0^M^Jmaster_port:6379^M^Jmaster_link_status:up^M^Jmaster_last_io_seconds_ago:0^M^Jmaster_sync_in_progress:0^M^Jslave_repl_offset:210218^M^Jslave_priority:100^M^Jslave_read_only:1^M^Jconnected_slaves:0^M^Jmaster_replid:f8eac6c8a17a641b11523474ffa3dbd0af88977a^M^Jmaster_replid2:0000000000000000000000000000000000000000^M^Jmaster_repl_offset:210218^M^Jsecond_repl_offset:-1^M^Jrepl_backlog_active:1^M^Jrepl_backlog_size:1048576^M^Jrepl_backlog_first_byte_offset:186^M^Jrepl_backlog_histlen:210033^M^J"
12:25:55.952133 IP 172.28.5.4.37222 > 172.28.5.2.6379: Flags [.], ack 528, win 237, options [nop,nop,TS val 3591711420 ecr 371174683], length 0
12:25:56.262131 IP 172.28.5.4.39250 > 172.28.5.0.6379: Flags [S], seq 1419601332, win 29200, options [mss 1460,sackOK,TS val 1870705022 ecr 0,nop,wscale 7], length 0
12:25:56.262257 IP 172.28.5.0.6379 > 172.28.5.4.39250: Flags [S.], seq 3494274748, ack 1419601333, win 28960, options [mss 1460,sackOK,TS val 230059956 ecr 1870705022,nop,wscale 7], length 0
12:25:56.262326 IP 172.28.5.4.39250 > 172.28.5.0.6379: Flags [P.], seq 1:7, ack 1, win 229, options [nop,nop,TS val 1870705022 ecr 230059956], length 6: RESP "PING"
12:25:56.262426 IP 172.28.5.0.6379 > 172.28.5.4.39250: Flags [.], ack 7, win 227, options [nop,nop,TS val 230059956 ecr 1870705022], length 0
12:25:56.262711 IP 172.28.5.0.6379 > 172.28.5.4.39250: Flags [P.], seq 1:8, ack 7, win 227, options [nop,nop,TS val 230059956 ecr 1870705022], length 7: RESP "PONG"
12:25:56.262846 IP 172.28.5.4.39250 > 172.28.5.0.6379: Flags [P.], seq 7:25, ack 8, win 229, options [nop,nop,TS val 1870705022 ecr 230059956], length 18: RESP "info replication"
12:25:56.263352 IP 172.28.5.0.6379 > 172.28.5.4.39250: Flags [P.], seq 8:470, ack 25, win 227, options [nop,nop,TS val 230059957 ecr 1870705022], length 462: RESP "# Replication^M^Jrole:master^M^Jconnected_slaves:2^M^Jslave0:ip=172.28.5.1,port=6379,state=online,offset=210218,lag=1^M^Jslave1:ip=172.28.5.2,port=6379,state=online,offset=210218,lag=1^M^Jmaster_replid:f8eac6c8a17a641b11523474ffa3dbd0af88977a^M^Jmaster_replid2:0000000000000000000000000000000000000000^M^Jmaster_repl_offset:210366^M^Jsecond_repl_offset:-1^M^Jrepl_backlog_active:1^M^Jrepl_backlog_size:1048576^M^Jrepl_backlog_first_byte_offset:1^M^Jrepl_backlog_histlen:210366^M^J"
12:25:56.263459 IP 172.28.5.4.39250 > 172.28.5.0.6379: Flags [P.], seq 25:31, ack 470, win 237, options [nop,nop,TS val 1870705023 ecr 230059957], length 6: RESP "QUIT"
12:25:56.263617 IP 172.28.5.0.6379 > 172.28.5.4.39250: Flags [P.], seq 470:475, ack 31, win 227, options [nop,nop,TS val 230059957 ecr 1870705023], length 5: RESP "OK"
12:25:56.263687 IP 172.28.5.0.6379 > 172.28.5.4.39250: Flags [F.], seq 475, ack 31, win 227, options [nop,nop,TS val 230059957 ecr 1870705023], length 0
12:25:56.263778 IP 172.28.5.4.39250 > 172.28.5.0.6379: Flags [F.], seq 31, ack 476, win 237, options [nop,nop,TS val 1870705023 ecr 230059957], length 0
12:25:56.263871 IP 172.28.5.0.6379 > 172.28.5.4.39250: Flags [.], ack 32, win 227, options [nop,nop,TS val 230059957 ecr 1870705023], length 0
12:25:56.583416 IP 172.28.5.4.60716 > 172.28.5.1.6379: Flags [R.], seq 25, ack 526, win 237, options [nop,nop,TS val 4068484769 ecr 3585078362], length 0
12:25:56.913467 IP 172.28.5.4.37222 > 172.28.5.2.6379: Flags [R.], seq 25, ack 528, win 237, options [nop,nop,TS val 3591712381 ecr 371174683], length 0
12:25:57.264654 IP 172.28.5.4.39254 > 172.28.5.0.6379: Flags [S], seq 408389838, win 29200, options [mss 1460,sackOK,TS val 1870706024 ecr 0,nop,wscale 7], length 0
12:25:57.264890 IP 172.28.5.0.6379 > 172.28.5.4.39254: Flags [S.], seq 3953791302, ack 408389839, win 28960, options [mss 1460,sackOK,TS val 230060958 ecr 1870706024,nop,wscale 7], length 0
12:25:57.265032 IP 172.28.5.4.39254 > 172.28.5.0.6379: Flags [P.], seq 1:7, ack 1, win 229, options [nop,nop,TS val 1870706025 ecr 230060958], length 6: RESP "PING"
12:25:57.265175 IP 172.28.5.0.6379 > 172.28.5.4.39254: Flags [.], ack 7, win 227, options [nop,nop,TS val 230060959 ecr 1870706025], length 0
12:25:57.265603 IP 172.28.5.0.6379 > 172.28.5.4.39254: Flags [P.], seq 1:8, ack 7, win 227, options [nop,nop,TS val 230060959 ecr 1870706025], length 7: RESP "PONG"
12:25:57.265802 IP 172.28.5.4.39254 > 172.28.5.0.6379: Flags [P.], seq 7:25, ack 8, win 229, options [nop,nop,TS val 1870706025 ecr 230060959], length 18: RESP "info replication"
12:25:57.266136 IP 172.28.5.0.6379 > 172.28.5.4.39254: Flags [P.], seq 8:470, ack 25, win 227, options [nop,nop,TS val 230060960 ecr 1870706025], length 462: RESP "# Replication^M^Jrole:master^M^Jconnected_slaves:2^M^Jslave0:ip=172.28.5.1,port=6379,state=online,offset=210366,lag=1^M^Jslave1:ip=172.28.5.2,port=6379,state=online,offset=210366,lag=1^M^Jmaster_replid:f8eac6c8a17a641b11523474ffa3dbd0af88977a^M^Jmaster_replid2:0000000000000000000000000000000000000000^M^Jmaster_repl_offset:210514^M^Jsecond_repl_offset:-1^M^Jrepl_backlog_active:1^M^Jrepl_backlog_size:1048576^M^Jrepl_backlog_first_byte_offset:1^M^Jrepl_backlog_histlen:210514^M^J"
12:25:57.266347 IP 172.28.5.4.39254 > 172.28.5.0.6379: Flags [P.], seq 25:31, ack 470, win 237, options [nop,nop,TS val 1870706026 ecr 230060960], length 6: RESP "QUIT"
12:25:57.266547 IP 172.28.5.0.6379 > 172.28.5.4.39254: Flags [P.], seq 470:475, ack 31, win 227, options [nop,nop,TS val 230060960 ecr 1870706026], length 5: RESP "OK"
12:25:57.266675 IP 172.28.5.0.6379 > 172.28.5.4.39254: Flags [F.], seq 475, ack 31, win 227, options [nop,nop,TS val 230060960 ecr 1870706026], length 0
12:25:57.266677 IP 172.28.5.4.39254 > 172.28.5.0.6379: Flags [R.], seq 31, ack 475, win 237, options [nop,nop,TS val 1870706026 ecr 230060960], length 0
12:25:57.266748 IP 172.28.5.4.39254 > 172.28.5.0.6379: Flags [R], seq 408389869, win 0, length 0
12:25:57.585596 IP 172.28.5.4.60732 > 172.28.5.1.6379: Flags [S], seq 2678503085, win 29200, options [mss 1460,sackOK,TS val 4068485771 ecr 0,nop,wscale 7], length 0
12:25:57.585793 IP 172.28.5.1.6379 > 172.28.5.4.60732: Flags [S.], seq 3629099780, ack 2678503086, win 28960, options [mss 1460,sackOK,TS val 3585080365 ecr 4068485771,nop,wscale 7], length 0
12:25:57.585898 IP 172.28.5.4.60732 > 172.28.5.1.6379: Flags [P.], seq 1:7, ack 1, win 229, options [nop,nop,TS val 4068485771 ecr 3585080365], length 6: RESP "PING"
12:25:57.586010 IP 172.28.5.1.6379 > 172.28.5.4.60732: Flags [.], ack 7, win 227, options [nop,nop,TS val 3585080366 ecr 4068485771], length 0
12:25:57.586322 IP 172.28.5.1.6379 > 172.28.5.4.60732: Flags [P.], seq 1:8, ack 7, win 227, options [nop,nop,TS val 3585080366 ecr 4068485771], length 7: RESP "PONG"
12:25:57.586493 IP 172.28.5.4.60732 > 172.28.5.1.6379: Flags [P.], seq 7:25, ack 8, win 229, options [nop,nop,TS val 4068485772 ecr 3585080366], length 18: RESP "info replication"
12:25:57.586766 IP 172.28.5.1.6379 > 172.28.5.4.60732: Flags [P.], seq 8:526, ack 25, win 227, options [nop,nop,TS val 3585080366 ecr 4068485772], length 518: RESP "# Replication^M^Jrole:slave^M^Jmaster_host:172.28.5.0^M^Jmaster_port:6379^M^Jmaster_link_status:up^M^Jmaster_last_io_seconds_ago:0^M^Jmaster_sync_in_progress:0^M^Jslave_repl_offset:210662^M^Jslave_priority:100^M^Jslave_read_only:1^M^Jconnected_slaves:0^M^Jmaster_replid:f8eac6c8a17a641b11523474ffa3dbd0af88977a^M^Jmaster_replid2:0000000000000000000000000000000000000000^M^Jmaster_repl_offset:210662^M^Jsecond_repl_offset:-1^M^Jrepl_backlog_active:1^M^Jrepl_backlog_size:1048576^M^Jrepl_backlog_first_byte_offset:1^M^Jrepl_backlog_histlen:210662^M^J"
12:25:57.628464 IP 172.28.5.4.60732 > 172.28.5.1.6379: Flags [.], ack 526, win 237, options [nop,nop,TS val 4068485814 ecr 3585080366], length 0
12:25:57.915877 IP 172.28.5.4.37238 > 172.28.5.2.6379: Flags [S], seq 387040017, win 29200, options [mss 1460,sackOK,TS val 3591713383 ecr 0,nop,wscale 7], length 0
