13:37:01.177553 IP 172.28.5.5.41952 > 172.28.5.2.6379: Flags [R.], seq 3517547429, ack 2387584608, win 237, options [nop,nop,TS val 1838089947 ecr 1371967961], length 0
13:37:01.517277 IP 172.28.5.5.42980 > 172.28.5.0.6379: Flags [S], seq 1110360002, win 29200, options [mss 1460,sackOK,TS val 3469549297 ecr 0,nop,wscale 7], length 0
13:37:01.517404 IP 172.28.5.0.6379 > 172.28.5.5.42980: Flags [S.], seq 1250892228, ack 1110360003, win 28960, options [mss 1460,sackOK,TS val 2852393587 ecr 3469549297,nop,wscale 7], length 0
13:37:01.517480 IP 172.28.5.5.42980 > 172.28.5.0.6379: Flags [P.], seq 1:7, ack 1, win 229, options [nop,nop,TS val 3469549297 ecr 2852393587], length 6: RESP "PING"
13:37:01.517563 IP 172.28.5.0.6379 > 172.28.5.5.42980: Flags [.], ack 7, win 227, options [nop,nop,TS val 2852393587 ecr 3469549297], length 0
13:37:01.517903 IP 172.28.5.0.6379 > 172.28.5.5.42980: Flags [P.], seq 1:8, ack 7, win 227, options [nop,nop,TS val 2852393588 ecr 3469549297], length 7: RESP "PONG"
13:37:01.518081 IP 172.28.5.5.42980 > 172.28.5.0.6379: Flags [P.], seq 7:25, ack 8, win 229, options [nop,nop,TS val 3469549298 ecr 2852393588], length 18: RESP "info replication"
13:37:01.518408 IP 172.28.5.0.6379 > 172.28.5.5.42980: Flags [P.], seq 8:480, ack 25, win 227, options [nop,nop,TS val 2852393588 ecr 3469549298], length 472: RESP "# Replication^M^Jrole:master^M^Jconnected_slaves:2^M^Jslave0:ip=172.28.5.2,port=6379,state=online,offset=3419915,lag=0^M^Jslave1:ip=172.28.5.1,port=6379,state=online,offset=3419915,lag=0^M^Jmaster_replid:186487241cd9594a4921b48b510ea432fa9dc5d5^M^Jmaster_replid2:0000000000000000000000000000000000000000^M^Jmaster_repl_offset:3419915^M^Jsecond_repl_offset:-1^M^Jrepl_backlog_active:1^M^Jrepl_backlog_size:1048576^M^Jrepl_backlog_first_byte_offset:2371340^M^Jrepl_backlog_histlen:1048576^M^J"
13:37:01.518571 IP 172.28.5.5.42980 > 172.28.5.0.6379: Flags [P.], seq 25:31, ack 480, win 237, options [nop,nop,TS val 3469549298 ecr 2852393588], length 6: RESP "QUIT"
13:37:01.518798 IP 172.28.5.0.6379 > 172.28.5.5.42980: Flags [P.], seq 480:485, ack 31, win 227, options [nop,nop,TS val 2852393589 ecr 3469549298], length 5: RESP "OK"
13:37:01.518901 IP 172.28.5.0.6379 > 172.28.5.5.42980: Flags [F.], seq 485, ack 31, win 227, options [nop,nop,TS val 2852393589 ecr 3469549298], length 0
13:37:01.518984 IP 172.28.5.5.42980 > 172.28.5.0.6379: Flags [F.], seq 31, ack 486, win 237, options [nop,nop,TS val 3469549299 ecr 2852393589], length 0
13:37:01.519077 IP 172.28.5.0.6379 > 172.28.5.5.42980: Flags [.], ack 32, win 227, options [nop,nop,TS val 2852393589 ecr 3469549299], length 0
13:37:01.846725 IP 172.28.5.5.47264 > 172.28.5.1.6379: Flags [S], seq 1994117340, win 29200, options [mss 1460,sackOK,TS val 3361460398 ecr 0,nop,wscale 7], length 0
13:37:01.846829 IP 172.28.5.1.6379 > 172.28.5.5.47264: Flags [S.], seq 2694366840, ack 1994117341, win 28960, options [mss 1460,sackOK,TS val 4273638719 ecr 3361460398,nop,wscale 7], length 0
13:37:01.846891 IP 172.28.5.5.47264 > 172.28.5.1.6379: Flags [P.], seq 1:7, ack 1, win 229, options [nop,nop,TS val 3361460398 ecr 4273638719], length 6: RESP "PING"
13:37:01.846960 IP 172.28.5.1.6379 > 172.28.5.5.47264: Flags [.], ack 7, win 227, options [nop,nop,TS val 4273638719 ecr 3361460398], length 0
13:37:01.847184 IP 172.28.5.1.6379 > 172.28.5.5.47264: Flags [P.], seq 1:8, ack 7, win 227, options [nop,nop,TS val 4273638719 ecr 3361460398], length 7: RESP "PONG"
13:37:01.847268 IP 172.28.5.5.47264 > 172.28.5.1.6379: Flags [P.], seq 7:25, ack 8, win 229, options [nop,nop,TS val 3361460398 ecr 4273638719], length 18: RESP "info replication"
13:37:01.847435 IP 172.28.5.1.6379 > 172.28.5.5.47264: Flags [P.], seq 8:535, ack 25, win 227, options [nop,nop,TS val 4273638719 ecr 3361460398], length 527: RESP "# Replication^M^Jrole:slave^M^Jmaster_host:172.28.5.0^M^Jmaster_port:6379^M^Jmaster_link_status:up^M^Jmaster_last_io_seconds_ago:0^M^Jmaster_sync_in_progress:0^M^Jslave_repl_offset:3419929^M^Jslave_priority:100^M^Jslave_read_only:1^M^Jconnected_slaves:0^M^Jmaster_replid:186487241cd9594a4921b48b510ea432fa9dc5d5^M^Jmaster_replid2:0000000000000000000000000000000000000000^M^Jmaster_repl_offset:3419929^M^Jsecond_repl_offset:-1^M^Jrepl_backlog_active:1^M^Jrepl_backlog_size:1048576^M^Jrepl_backlog_first_byte_offset:2371354^M^Jrepl_backlog_histlen:1048576^M^J"
13:37:01.888521 IP 172.28.5.5.47264 > 172.28.5.1.6379: Flags [.], ack 535, win 237, options [nop,nop,TS val 3361460439 ecr 4273638719], length 0
13:37:02.179485 IP 172.28.5.5.41968 > 172.28.5.2.6379: Flags [S], seq 1512481199, win 29200, options [mss 1460,sackOK,TS val 1838090949 ecr 0,nop,wscale 7], length 0
13:37:02.179619 IP 172.28.5.2.6379 > 172.28.5.5.41968: Flags [S.], seq 2453029908, ack 1512481200, win 28960, options [mss 1460,sackOK,TS val 1371969965 ecr 1838090949,nop,wscale 7], length 0
13:37:02.179703 IP 172.28.5.5.41968 > 172.28.5.2.6379: Flags [P.], seq 1:7, ack 1, win 229, options [nop,nop,TS val 1838090950 ecr 1371969965], length 6: RESP "PING"
13:37:02.179821 IP 172.28.5.2.6379 > 172.28.5.5.41968: Flags [.], ack 7, win 227, options [nop,nop,TS val 1371969966 ecr 1838090950], length 0
13:37:02.180245 IP 172.28.5.2.6379 > 172.28.5.5.41968: Flags [P.], seq 1:8, ack 7, win 227, options [nop,nop,TS val 1371969966 ecr 1838090950], length 7: RESP "PONG"
13:37:02.180397 IP 172.28.5.5.41968 > 172.28.5.2.6379: Flags [P.], seq 7:25, ack 8, win 229, options [nop,nop,TS val 1838090950 ecr 1371969966], length 18: RESP "info replication"
13:37:02.180740 IP 172.28.5.2.6379 > 172.28.5.5.41968: Flags [P.], seq 8:535, ack 25, win 227, options [nop,nop,TS val 1371969967 ecr 1838090950], length 527: RESP "# Replication^M^Jrole:slave^M^Jmaster_host:172.28.5.0^M^Jmaster_port:6379^M^Jmaster_link_status:up^M^Jmaster_last_io_seconds_ago:0^M^Jmaster_sync_in_progress:0^M^Jslave_repl_offset:3420077^M^Jslave_priority:100^M^Jslave_read_only:1^M^Jconnected_slaves:0^M^Jmaster_replid:186487241cd9594a4921b48b510ea432fa9dc5d5^M^Jmaster_replid2:0000000000000000000000000000000000000000^M^Jmaster_repl_offset:3420077^M^Jsecond_repl_offset:-1^M^Jrepl_backlog_active:1^M^Jrepl_backlog_size:1048576^M^Jrepl_backlog_first_byte_offset:2371502^M^Jrepl_backlog_histlen:1048576^M^J"
13:37:02.224544 IP 172.28.5.5.41968 > 172.28.5.2.6379: Flags [.], ack 535, win 237, options [nop,nop,TS val 1838090994 ecr 1371969967], length 0
13:37:02.519507 IP 172.28.5.5.42992 > 172.28.5.0.6379: Flags [S], seq 2352362341, win 29200, options [mss 1460,sackOK,TS val 3469550299 ecr 0,nop,wscale 7], length 0
13:37:02.519635 IP 172.28.5.0.6379 > 172.28.5.5.42992: Flags [S.], seq 2592701534, ack 2352362342, win 28960, options [mss 1460,sackOK,TS val 2852394589 ecr 3469550299,nop,wscale 7], length 0
13:37:02.519712 IP 172.28.5.5.42992 > 172.28.5.0.6379: Flags [P.], seq 1:7, ack 1, win 229, options [nop,nop,TS val 3469550300 ecr 2852394589], length 6: RESP "PING"
13:37:02.519795 IP 172.28.5.0.6379 > 172.28.5.5.42992: Flags [.], ack 7, win 227, options [nop,nop,TS val 2852394590 ecr 3469550300], length 0
13:37:02.520234 IP 172.28.5.0.6379 > 172.28.5.5.42992: Flags [P.], seq 1:8, ack 7, win 227, options [nop,nop,TS val 2852394590 ecr 3469550300], length 7: RESP "PONG"
13:37:02.520364 IP 172.28.5.5.42992 > 172.28.5.0.6379: Flags [P.], seq 7:25, ack 8, win 229, options [nop,nop,TS val 3469550300 ecr 2852394590], length 18: RESP "info replication"
13:37:02.520681 IP 172.28.5.0.6379 > 172.28.5.5.42992: Flags [P.], seq 8:480, ack 25, win 227, options [nop,nop,TS val 2852394590 ecr 3469550300], length 472: RESP "# Replication^M^Jrole:master^M^Jconnected_slaves:2^M^Jslave0:ip=172.28.5.2,port=6379,state=online,offset=3420077,lag=0^M^Jslave1:ip=172.28.5.1,port=6379,state=online,offset=3419929,lag=0^M^Jmaster_replid:186487241cd9594a4921b48b510ea432fa9dc5d5^M^Jmaster_replid2:0000000000000000000000000000000000000000^M^Jmaster_repl_offset:3420077^M^Jsecond_repl_offset:-1^M^Jrepl_backlog_active:1^M^Jrepl_backlog_size:1048576^M^Jrepl_backlog_first_byte_offset:2371502^M^Jrepl_backlog_histlen:1048576^M^J"
13:37:02.520840 IP 172.28.5.5.42992 > 172.28.5.0.6379: Flags [P.], seq 25:31, ack 480, win 237, options [nop,nop,TS val 3469550301 ecr 2852394590], length 6: RESP "QUIT"
13:37:02.521070 IP 172.28.5.0.6379 > 172.28.5.5.42992: Flags [P.], seq 480:485, ack 31, win 227, options [nop,nop,TS val 2852394591 ecr 3469550301], length 5: RESP "OK"
13:37:02.521175 IP 172.28.5.0.6379 > 172.28.5.5.42992: Flags [F.], seq 485, ack 31, win 227, options [nop,nop,TS val 2852394591 ecr 3469550301], length 0
13:37:02.521255 IP 172.28.5.5.42992 > 172.28.5.0.6379: Flags [F.], seq 31, ack 486, win 237, options [nop,nop,TS val 3469550301 ecr 2852394591], length 0
13:37:02.521347 IP 172.28.5.0.6379 > 172.28.5.5.42992: Flags [.], ack 32, win 227, options [nop,nop,TS val 2852394591 ecr 3469550301], length 0
13:37:02.847954 IP 172.28.5.5.47264 > 172.28.5.1.6379: Flags [R.], seq 25, ack 535, win 237, options [nop,nop,TS val 3361461399 ecr 4273638719], length 0
13:37:03.181875 IP 172.28.5.5.41968 > 172.28.5.2.6379: Flags [R.], seq 25, ack 535, win 237, options [nop,nop,TS val 1838091952 ecr 1371969967], length 0
13:37:03.521760 IP 172.28.5.5.42996 > 172.28.5.0.6379: Flags [S], seq 88905650, win 29200, options [mss 1460,sackOK,TS val 3469551302 ecr 0,nop,wscale 7], length 0
13:37:03.521856 IP 172.28.5.0.6379 > 172.28.5.5.42996: Flags [S.], seq 3081804326, ack 88905651, win 28960, options [mss 1460,sackOK,TS val 2852395592 ecr 3469551302,nop,wscale 7], length 0
13:37:03.521914 IP 172.28.5.5.42996 > 172.28.5.0.6379: Flags [P.], seq 1:7, ack 1, win 229, options [nop,nop,TS val 3469551302 ecr 2852395592], length 6: RESP "PING"
13:37:03.521977 IP 172.28.5.0.6379 > 172.28.5.5.42996: Flags [.], ack 7, win 227, options [nop,nop,TS val 2852395592 ecr 3469551302], length 0
13:37:03.522275 IP 172.28.5.0.6379 > 172.28.5.5.42996: Flags [P.], seq 1:8, ack 7, win 227, options [nop,nop,TS val 2852395592 ecr 3469551302], length 7: RESP "PONG"
13:37:03.522436 IP 172.28.5.5.42996 > 172.28.5.0.6379: Flags [P.], seq 7:25, ack 8, win 229, options [nop,nop,TS val 3469551302 ecr 2852395592], length 18: RESP "info replication"
13:37:03.522738 IP 172.28.5.0.6379 > 172.28.5.5.42996: Flags [P.], seq 8:480, ack 25, win 227, options [nop,nop,TS val 2852395593 ecr 3469551302], length 472: RESP "# Replication^M^Jrole:master^M^Jconnected_slaves:2^M^Jslave0:ip=172.28.5.2,port=6379,state=online,offset=3420373,lag=0^M^Jslave1:ip=172.28.5.1,port=6379,state=online,offset=3420373,lag=0^M^Jmaster_replid:186487241cd9594a4921b48b510ea432fa9dc5d5^M^Jmaster_replid2:0000000000000000000000000000000000000000^M^Jmaster_repl_offset:3420373^M^Jsecond_repl_offset:-1^M^Jrepl_backlog_active:1^M^Jrepl_backlog_size:1048576^M^Jrepl_backlog_first_byte_offset:2371798^M^Jrepl_backlog_histlen:1048576^M^J"
13:37:03.522894 IP 172.28.5.5.42996 > 172.28.5.0.6379: Flags [P.], seq 25:31, ack 480, win 237, options [nop,nop,TS val 3469551303 ecr 2852395593], length 6: RESP "QUIT"
13:37:03.523099 IP 172.28.5.0.6379 > 172.28.5.5.42996: Flags [P.], seq 480:485, ack 31, win 227, options [nop,nop,TS val 2852395593 ecr 3469551303], length 5: RESP "OK"
13:37:03.523186 IP 172.28.5.0.6379 > 172.28.5.5.42996: Flags [F.], seq 485, ack 31, win 227, options [nop,nop,TS val 2852395593 ecr 3469551303], length 0
13:37:03.523264 IP 172.28.5.5.42996 > 172.28.5.0.6379: Flags [F.], seq 31, ack 486, win 237, options [nop,nop,TS val 3469551303 ecr 2852395593], length 0
13:37:03.523350 IP 172.28.5.0.6379 > 172.28.5.5.42996: Flags [.], ack 32, win 227, options [nop,nop,TS val 2852395593 ecr 3469551303], length 0
13:37:03.848950 IP 172.28.5.5.47280 > 172.28.5.1.6379: Flags [S], seq 801954472, win 29200, options [mss 1460,sackOK,TS val 3361462400 ecr 0,nop,wscale 7], length 0
13:37:03.849076 IP 172.28.5.1.6379 > 172.28.5.5.47280: Flags [S.], seq 3074402434, ack 801954473, win 28960, options [mss 1460,sackOK,TS val 4273640721 ecr 3361462400,nop,wscale 7], length 0
13:37:03.849153 IP 172.28.5.5.47280 > 172.28.5.1.6379: Flags [P.], seq 1:7, ack 1, win 229, options [nop,nop,TS val 3361462400 ecr 4273640721], length 6: RESP "PING"
13:37:03.849237 IP 172.28.5.1.6379 > 172.28.5.5.47280: Flags [.], ack 7, win 227, options [nop,nop,TS val 4273640721 ecr 3361462400], length 0
13:37:03.849493 IP 172.28.5.1.6379 > 172.28.5.5.47280: Flags [P.], seq 1:8, ack 7, win 227, options [nop,nop,TS val 4273640721 ecr 3361462400], length 7: RESP "PONG"
13:37:03.849592 IP 172.28.5.5.47280 > 172.28.5.1.6379: Flags [P.], seq 7:25, ack 8, win 229, options [nop,nop,TS val 3361462400 ecr 4273640721], length 18: RESP "info replication"
13:37:03.849785 IP 172.28.5.1.6379 > 172.28.5.5.47280: Flags [P.], seq 8:535, ack 25, win 227, options [nop,nop,TS val 4273640722 ecr 3361462400], length 527: RESP "# Replication^M^Jrole:slave^M^Jmaster_host:172.28.5.0^M^Jmaster_port:6379^M^Jmaster_link_status:up^M^Jmaster_last_io_seconds_ago:1^M^Jmaster_sync_in_progress:0^M^Jslave_repl_offset:3420373^M^Jslave_priority:100^M^Jslave_read_only:1^M^Jconnected_slaves:0^M^Jmaster_replid:186487241cd9594a4921b48b510ea432fa9dc5d5^M^Jmaster_replid2:0000000000000000000000000000000000000000^M^Jmaster_repl_offset:3420373^M^Jsecond_repl_offset:-1^M^Jrepl_backlog_active:1^M^Jrepl_backlog_size:1048576^M^Jrepl_backlog_first_byte_offset:2371798^M^Jrepl_backlog_histlen:1048576^M^J"
13:37:03.892128 IP 172.28.5.5.47280 > 172.28.5.1.6379: Flags [.], ack 535, win 237, options [nop,nop,TS val 3361462443 ecr 4273640722], length 0
13:37:04.183384 IP 172.28.5.5.41984 > 172.28.5.2.6379: Flags [S], seq 3032811910, win 29200, options [mss 1460,sackOK,TS val 1838092953 ecr 0,nop,wscale 7], length 0
13:37:04.183475 IP 172.28.5.2.6379 > 172.28.5.5.41984: Flags [S.], seq 1510423693, ack 3032811911, win 28960, options [mss 1460,sackOK,TS val 1371971969 ecr 1838092953,nop,wscale 7], length 0
13:37:04.183529 IP 172.28.5.5.41984 > 172.28.5.2.6379: Flags [P.], seq 1:7, ack 1, win 229, options [nop,nop,TS val 1838092953 ecr 1371971969], length 6: RESP "PING"
13:37:04.183589 IP 172.28.5.2.6379 > 172.28.5.5.41984: Flags [.], ack 7, win 227, options [nop,nop,TS val 1371971969 ecr 1838092953], length 0
13:37:04.183792 IP 172.28.5.2.6379 > 172.28.5.5.41984: Flags [P.], seq 1:8, ack 7, win 227, options [nop,nop,TS val 1371971970 ecr 1838092953], length 7: RESP "PONG"
13:37:04.183867 IP 172.28.5.5.41984 > 172.28.5.2.6379: Flags [P.], seq 7:25, ack 8, win 229, options [nop,nop,TS val 1838092954 ecr 1371971970], length 18: RESP "info replication"
13:37:04.184018 IP 172.28.5.2.6379 > 172.28.5.5.41984: Flags [P.], seq 8:535, ack 25, win 227, options [nop,nop,TS val 1371971970 ecr 1838092954], length 527: RESP "# Replication^M^Jrole:slave^M^Jmaster_host:172.28.5.0^M^Jmaster_port:6379^M^Jmaster_link_status:up^M^Jmaster_last_io_seconds_ago:0^M^Jmaster_sync_in_progress:0^M^Jslave_repl_offset:3420521^M^Jslave_priority:100^M^Jslave_read_only:1^M^Jconnected_slaves:0^M^Jmaster_replid:186487241cd9594a4921b48b510ea432fa9dc5d5^M^Jmaster_replid2:0000000000000000000000000000000000000000^M^Jmaster_repl_offset:3420521^M^Jsecond_repl_offset:-1^M^Jrepl_backlog_active:1^M^Jrepl_backlog_size:1048576^M^Jrepl_backlog_first_byte_offset:2371946^M^Jrepl_backlog_histlen:1048576^M^J"
13:37:04.228538 IP 172.28.5.5.41984 > 172.28.5.2.6379: Flags [.], ack 535, win 237, options [nop,nop,TS val 1838092998 ecr 1371971970], length 0
13:37:04.525361 IP 172.28.5.5.43008 > 172.28.5.0.6379: Flags [S], seq 1667831768, win 29200, options [mss 1460,sackOK,TS val 3469552305 ecr 0,nop,wscale 7], length 0
13:37:04.525506 IP 172.28.5.0.6379 > 172.28.5.5.43008: Flags [S.], seq 63633851, ack 1667831769, win 28960, options [mss 1460,sackOK,TS val 2852396595 ecr 3469552305,nop,wscale 7], length 0
13:37:04.525604 IP 172.28.5.5.43008 > 172.28.5.0.6379: Flags [P.], seq 1:7, ack 1, win 229, options [nop,nop,TS val 3469552305 ecr 2852396595], length 6: RESP "PING"
13:37:04.525717 IP 172.28.5.0.6379 > 172.28.5.5.43008: Flags [.], ack 7, win 227, options [nop,nop,TS val 2852396596 ecr 3469552305], length 0
13:37:04.526105 IP 172.28.5.0.6379 > 172.28.5.5.43008: Flags [P.], seq 1:8, ack 7, win 227, options [nop,nop,TS val 2852396596 ecr 3469552305], length 7: RESP "PONG"
13:37:04.526257 IP 172.28.5.5.43008 > 172.28.5.0.6379: Flags [P.], seq 7:25, ack 8, win 229, options [nop,nop,TS val 3469552306 ecr 2852396596], length 18: RESP "info replication"
13:37:04.526570 IP 172.28.5.0.6379 > 172.28.5.5.43008: Flags [P.], seq 8:480, ack 25, win 227, options [nop,nop,TS val 2852396596 ecr 3469552306], length 472: RESP "# Replication^M^Jrole:master^M^Jconnected_slaves:2^M^Jslave0:ip=172.28.5.2,port=6379,state=online,offset=3420521,lag=0^M^Jslave1:ip=172.28.5.1,port=6379,state=online,offset=3420373,lag=0^M^Jmaster_replid:186487241cd9594a4921b48b510ea432fa9dc5d5^M^Jmaster_replid2:0000000000000000000000000000000000000000^M^Jmaster_repl_offset:3420521^M^Jsecond_repl_offset:-1^M^Jrepl_backlog_active:1^M^Jrepl_backlog_size:1048576^M^Jrepl_backlog_first_byte_offset:2371946^M^Jrepl_backlog_histlen:1048576^M^J"
13:37:04.526712 IP 172.28.5.5.43008 > 172.28.5.0.6379: Flags [P.], seq 25:31, ack 480, win 237, options [nop,nop,TS val 3469552307 ecr 2852396596], length 6: RESP "QUIT"
13:37:04.526987 IP 172.28.5.0.6379 > 172.28.5.5.43008: Flags [P.], seq 480:485, ack 31, win 227, options [nop,nop,TS val 2852396597 ecr 3469552307], length 5: RESP "OK"
13:37:04.527103 IP 172.28.5.0.6379 > 172.28.5.5.43008: Flags [F.], seq 485, ack 31, win 227, options [nop,nop,TS val 2852396597 ecr 3469552307], length 0
13:37:04.528184 IP 172.28.5.5.43008 > 172.28.5.0.6379: Flags [F.], seq 31, ack 486, win 237, options [nop,nop,TS val 3469552308 ecr 2852396597], length 0
13:37:04.528280 IP 172.28.5.0.6379 > 172.28.5.5.43008: Flags [.], ack 32, win 227, options [nop,nop,TS val 2852396598 ecr 3469552308], length 0
13:37:04.849919 IP 172.28.5.5.47280 > 172.28.5.1.6379: Flags [R.], seq 25, ack 535, win 237, options [nop,nop,TS val 3361463401 ecr 4273640722], length 0
13:37:05.185610 IP 172.28.5.5.41984 > 172.28.5.2.6379: Flags [R.], seq 25, ack 535, win 237, options [nop,nop,TS val 1838093955 ecr 1371971970], length 0
13:37:05.529270 IP 172.28.5.5.43012 > 172.28.5.0.6379: Flags [S], seq 459315276, win 29200, options [mss 1460,sackOK,TS val 3469553309 ecr 0,nop,wscale 7], length 0
13:37:05.529387 IP 172.28.5.0.6379 > 172.28.5.5.43012: Flags [S.], seq 3786776233, ack 459315277, win 28960, options [mss 1460,sackOK,TS val 2852397599 ecr 3469553309,nop,wscale 7], length 0
13:37:05.529454 IP 172.28.5.5.43012 > 172.28.5.0.6379: Flags [P.], seq 1:7, ack 1, win 229, options [nop,nop,TS val 3469553309 ecr 2852397599], length 6: RESP "PING"
13:37:05.529524 IP 172.28.5.0.6379 > 172.28.5.5.43012: Flags [.], ack 7, win 227, options [nop,nop,TS val 2852397599 ecr 3469553309], length 0
13:37:05.529801 IP 172.28.5.0.6379 > 172.28.5.5.43012: Flags [P.], seq 1:8, ack 7, win 227, options [nop,nop,TS val 2852397600 ecr 3469553309], length 7: RESP "PONG"
13:37:05.529957 IP 172.28.5.5.43012 > 172.28.5.0.6379: Flags [P.], seq 7:25, ack 8, win 229, options [nop,nop,TS val 3469553310 ecr 2852397600], length 18: RESP "info replication"
13:37:05.530201 IP 172.28.5.0.6379 > 172.28.5.5.43012: Flags [P.], seq 8:480, ack 25, win 227, options [nop,nop,TS val 2852397600 ecr 3469553310], length 472: RESP "# Replication^M^Jrole:master^M^Jconnected_slaves:2^M^Jslave0:ip=172.28.5.2,port=6379,state=online,offset=3420817,lag=0^M^Jslave1:ip=172.28.5.1,port=6379,state=online,offset=3420817,lag=0^M^Jmaster_replid:186487241cd9594a4921b48b510ea432fa9dc5d5^M^Jmaster_replid2:0000000000000000000000000000000000000000^M^Jmaster_repl_offset:3420817^M^Jsecond_repl_offset:-1^M^Jrepl_backlog_active:1^M^Jrepl_backlog_size:1048576^M^Jrepl_backlog_first_byte_offset:2372242^M^Jrepl_backlog_histlen:1048576^M^J"
13:37:05.530355 IP 172.28.5.5.43012 > 172.28.5.0.6379: Flags [P.], seq 25:31, ack 480, win 237, options [nop,nop,TS val 3469553310 ecr 2852397600], length 6: RESP "QUIT"
13:37:05.530513 IP 172.28.5.0.6379 > 172.28.5.5.43012: Flags [P.], seq 480:485, ack 31, win 227, options [nop,nop,TS val 2852397600 ecr 3469553310], length 5: RESP "OK"
13:37:05.530605 IP 172.28.5.0.6379 > 172.28.5.5.43012: Flags [F.], seq 485, ack 31, win 227, options [nop,nop,TS val 2852397600 ecr 3469553310], length 0
13:37:05.530678 IP 172.28.5.5.43012 > 172.28.5.0.6379: Flags [R.], seq 31, ack 486, win 237, options [nop,nop,TS val 3469553311 ecr 2852397600], length 0
13:37:05.851278 IP 172.28.5.5.47296 > 172.28.5.1.6379: Flags [S], seq 1188306610, win 29200, options [mss 1460,sackOK,TS val 3361464402 ecr 0,nop,wscale 7], length 0
13:37:05.851384 IP 172.28.5.1.6379 > 172.28.5.5.47296: Flags [S.], seq 3380717953, ack 1188306611, win 28960, options [mss 1460,sackOK,TS val 4273642723 ecr 3361464402,nop,wscale 7], length 0
13:37:05.851446 IP 172.28.5.5.47296 > 172.28.5.1.6379: Flags [P.], seq 1:7, ack 1, win 229, options [nop,nop,TS val 3361464402 ecr 4273642723], length 6: RESP "PING"
13:37:05.851511 IP 172.28.5.1.6379 > 172.28.5.5.47296: Flags [.], ack 7, win 227, options [nop,nop,TS val 4273642723 ecr 3361464402], length 0
13:37:05.851793 IP 172.28.5.1.6379 > 172.28.5.5.47296: Flags [P.], seq 1:8, ack 7, win 227, options [nop,nop,TS val 4273642724 ecr 3361464402], length 7: RESP "PONG"
13:37:05.851873 IP 172.28.5.5.47296 > 172.28.5.1.6379: Flags [P.], seq 7:25, ack 8, win 229, options [nop,nop,TS val 3361464403 ecr 4273642724], length 18: RESP "info replication"
13:37:05.852113 IP 172.28.5.1.6379 > 172.28.5.5.47296: Flags [P.], seq 8:535, ack 25, win 227, options [nop,nop,TS val 4273642724 ecr 3361464403], length 527: RESP "# Replication^M^Jrole:slave^M^Jmaster_host:172.28.5.0^M^Jmaster_port:6379^M^Jmaster_link_status:up^M^Jmaster_last_io_seconds_ago:1^M^Jmaster_sync_in_progress:0^M^Jslave_repl_offset:3420817^M^Jslave_priority:100^M^Jslave_read_only:1^M^Jconnected_slaves:0^M^Jmaster_replid:186487241cd9594a4921b48b510ea432fa9dc5d5^M^Jmaster_replid2:0000000000000000000000000000000000000000^M^Jmaster_repl_offset:3420817^M^Jsecond_repl_offset:-1^M^Jrepl_backlog_active:1^M^Jrepl_backlog_size:1048576^M^Jrepl_backlog_first_byte_offset:2372242^M^Jrepl_backlog_histlen:1048576^M^J"
13:37:05.896523 IP 172.28.5.5.47296 > 172.28.5.1.6379: Flags [.], ack 535, win 237, options [nop,nop,TS val 3361464447 ecr 4273642724], length 0
13:37:06.187156 IP 172.28.5.5.42000 > 172.28.5.2.6379: Flags [S], seq 217107404, win 29200, options [mss 1460,sackOK,TS val 1838094957 ecr 0,nop,wscale 7], length 0
13:37:06.187287 IP 172.28.5.2.6379 > 172.28.5.5.42000: Flags [S.], seq 799030840, ack 217107405, win 28960, options [mss 1460,sackOK,TS val 1371973973 ecr 1838094957,nop,wscale 7], length 0
13:37:06.187362 IP 172.28.5.5.42000 > 172.28.5.2.6379: Flags [P.], seq 1:7, ack 1, win 229, options [nop,nop,TS val 1838094957 ecr 1371973973], length 6: RESP "PING"
13:37:06.187445 IP 172.28.5.2.6379 > 172.28.5.5.42000: Flags [.], ack 7, win 227, options [nop,nop,TS val 1371973973 ecr 1838094957], length 0
13:37:06.187792 IP 172.28.5.2.6379 > 172.28.5.5.42000: Flags [P.], seq 1:8, ack 7, win 227, options [nop,nop,TS val 1371973974 ecr 1838094957], length 7: RESP "PONG"
13:37:06.187985 IP 172.28.5.5.42000 > 172.28.5.2.6379: Flags [P.], seq 7:25, ack 8, win 229, options [nop,nop,TS val 1838094958 ecr 1371973974], length 18: RESP "info replication"
13:37:06.188260 IP 172.28.5.2.6379 > 172.28.5.5.42000: Flags [P.], seq 8:535, ack 25, win 227, options [nop,nop,TS val 1371973974 ecr 1838094958], length 527: RESP "# Replication^M^Jrole:slave^M^Jmaster_host:172.28.5.0^M^Jmaster_port:6379^M^Jmaster_link_status:up^M^Jmaster_last_io_seconds_ago:2^M^Jmaster_sync_in_progress:0^M^Jslave_repl_offset:3420817^M^Jslave_priority:100^M^Jslave_read_only:1^M^Jconnected_slaves:0^M^Jmaster_replid:186487241cd9594a4921b48b510ea432fa9dc5d5^M^Jmaster_replid2:0000000000000000000000000000000000000000^M^Jmaster_repl_offset:3420817^M^Jsecond_repl_offset:-1^M^Jrepl_backlog_active:1^M^Jrepl_backlog_size:1048576^M^Jrepl_backlog_first_byte_offset:2372242^M^Jrepl_backlog_histlen:1048576^M^J"
13:37:06.232107 IP 172.28.5.5.42000 > 172.28.5.2.6379: Flags [.], ack 535, win 237, options [nop,nop,TS val 1838095002 ecr 1371973974], length 0
13:37:06.530975 IP 172.28.5.5.43024 > 172.28.5.0.6379: Flags [S], seq 1575740420, win 29200, options [mss 1460,sackOK,TS val 3469554311 ecr 0,nop,wscale 7], length 0
13:37:06.531097 IP 172.28.5.0.6379 > 172.28.5.5.43024: Flags [S.], seq 2147482200, ack 1575740421, win 28960, options [mss 1460,sackOK,TS val 2852398601 ecr 3469554311,nop,wscale 7], length 0
13:37:06.531173 IP 172.28.5.5.43024 > 172.28.5.0.6379: Flags [P.], seq 1:7, ack 1, win 229, options [nop,nop,TS val 3469554311 ecr 2852398601], length 6: RESP "PING"
13:37:06.531255 IP 172.28.5.0.6379 > 172.28.5.5.43024: Flags [.], ack 7, win 227, options [nop,nop,TS val 2852398601 ecr 3469554311], length 0
13:37:06.531531 IP 172.28.5.0.6379 > 172.28.5.5.43024: Flags [P.], seq 1:8, ack 7, win 227, options [nop,nop,TS val 2852398601 ecr 3469554311], length 7: RESP "PONG"
13:37:06.531645 IP 172.28.5.5.43024 > 172.28.5.0.6379: Flags [P.], seq 7:25, ack 8, win 229, options [nop,nop,TS val 3469554311 ecr 2852398601], length 18: RESP "info replication"
13:37:06.531886 IP 172.28.5.0.6379 > 172.28.5.5.43024: Flags [P.], seq 8:480, ack 25, win 227, options [nop,nop,TS val 2852398602 ecr 3469554311], length 472: RESP "# Replication^M^Jrole:master^M^Jconnected_slaves:2^M^Jslave0:ip=172.28.5.2,port=6379,state=online,offset=3420965,lag=0^M^Jslave1:ip=172.28.5.1,port=6379,state=online,offset=3420817,lag=0^M^Jmaster_replid:186487241cd9594a4921b48b510ea432fa9dc5d5^M^Jmaster_replid2:0000000000000000000000000000000000000000^M^Jmaster_repl_offset:3420965^M^Jsecond_repl_offset:-1^M^Jrepl_backlog_active:1^M^Jrepl_backlog_size:1048576^M^Jrepl_backlog_first_byte_offset:2372390^M^Jrepl_backlog_histlen:1048576^M^J"
13:37:06.531975 IP 172.28.5.5.43024 > 172.28.5.0.6379: Flags [P.], seq 25:31, ack 480, win 237, options [nop,nop,TS val 3469554312 ecr 2852398602], length 6: RESP "QUIT"
13:37:06.532180 IP 172.28.5.0.6379 > 172.28.5.5.43024: Flags [P.], seq 480:485, ack 31, win 227, options [nop,nop,TS val 2852398602 ecr 3469554312], length 5: RESP "OK"
13:37:06.532278 IP 172.28.5.0.6379 > 172.28.5.5.43024: Flags [F.], seq 485, ack 31, win 227, options [nop,nop,TS val 2852398602 ecr 3469554312], length 0
13:37:06.532279 IP 172.28.5.5.43024 > 172.28.5.0.6379: Flags [R.], seq 31, ack 485, win 237, options [nop,nop,TS val 3469554312 ecr 2852398602], length 0
13:37:06.532314 IP 172.28.5.5.43024 > 172.28.5.0.6379: Flags [R], seq 1575740451, win 0, length 0
13:37:06.852899 IP 172.28.5.5.47296 > 172.28.5.1.6379: Flags [R.], seq 25, ack 535, win 237, options [nop,nop,TS val 3361465404 ecr 4273642724], length 0
13:37:07.189584 IP 172.28.5.5.42000 > 172.28.5.2.6379: Flags [R.], seq 25, ack 535, win 237, options [nop,nop,TS val 1838095959 ecr 1371973974], length 0
13:37:07.532374 IP 172.28.5.5.43028 > 172.28.5.0.6379: Flags [S], seq 3888022383, win 29200, options [mss 1460,sackOK,TS val 3469555312 ecr 0,nop,wscale 7], length 0
13:37:07.532498 IP 172.28.5.0.6379 > 172.28.5.5.43028: Flags [S.], seq 128150122, ack 3888022384, win 28960, options [mss 1460,sackOK,TS val 2852399602 ecr 3469555312,nop,wscale 7], length 0
13:37:07.532587 IP 172.28.5.5.43028 > 172.28.5.0.6379: Flags [P.], seq 1:7, ack 1, win 229, options [nop,nop,TS val 3469555312 ecr 2852399602], length 6: RESP "PING"
13:37:07.532694 IP 172.28.5.0.6379 > 172.28.5.5.43028: Flags [.], ack 7, win 227, options [nop,nop,TS val 2852399602 ecr 3469555312], length 0
13:37:07.533023 IP 172.28.5.0.6379 > 172.28.5.5.43028: Flags [P.], seq 1:8, ack 7, win 227, options [nop,nop,TS val 2852399603 ecr 3469555312], length 7: RESP "PONG"
13:37:07.533141 IP 172.28.5.5.43028 > 172.28.5.0.6379: Flags [P.], seq 7:25, ack 8, win 229, options [nop,nop,TS val 3469555313 ecr 2852399603], length 18: RESP "info replication"
13:37:07.533473 IP 172.28.5.0.6379 > 172.28.5.5.43028: Flags [P.], seq 8:480, ack 25, win 227, options [nop,nop,TS val 2852399603 ecr 3469555313], length 472: RESP "# Replication^M^Jrole:master^M^Jconnected_slaves:2^M^Jslave0:ip=172.28.5.2,port=6379,state=online,offset=3421261,lag=0^M^Jslave1:ip=172.28.5.1,port=6379,state=online,offset=3421261,lag=0^M^Jmaster_replid:186487241cd9594a4921b48b510ea432fa9dc5d5^M^Jmaster_replid2:0000000000000000000000000000000000000000^M^Jmaster_repl_offset:3421261^M^Jsecond_repl_offset:-1^M^Jrepl_backlog_active:1^M^Jrepl_backlog_size:1048576^M^Jrepl_backlog_first_byte_offset:2372686^M^Jrepl_backlog_histlen:1048576^M^J"
13:37:07.533582 IP 172.28.5.5.43028 > 172.28.5.0.6379: Flags [P.], seq 25:31, ack 480, win 237, options [nop,nop,TS val 3469555313 ecr 2852399603], length 6: RESP "QUIT"
13:37:07.533736 IP 172.28.5.0.6379 > 172.28.5.5.43028: Flags [P.], seq 480:485, ack 31, win 227, options [nop,nop,TS val 2852399604 ecr 3469555313], length 5: RESP "OK"
13:37:07.533856 IP 172.28.5.0.6379 > 172.28.5.5.43028: Flags [F.], seq 485, ack 31, win 227, options [nop,nop,TS val 2852399604 ecr 3469555313], length 0
13:37:07.534013 IP 172.28.5.5.43028 > 172.28.5.0.6379: Flags [F.], seq 31, ack 486, win 237, options [nop,nop,TS val 3469555314 ecr 2852399604], length 0
13:37:07.534122 IP 172.28.5.0.6379 > 172.28.5.5.43028: Flags [.], ack 32, win 227, options [nop,nop,TS val 2852399604 ecr 3469555314], length 0
13:37:07.854727 IP 172.28.5.5.47312 > 172.28.5.1.6379: Flags [S], seq 3103765633, win 29200, options [mss 1460,sackOK,TS val 3361466406 ecr 0,nop,wscale 7], length 0
13:37:07.854833 IP 172.28.5.1.6379 > 172.28.5.5.47312: Flags [S.], seq 2628462370, ack 3103765634, win 28960, options [mss 1460,sackOK,TS val 4273644727 ecr 3361466406,nop,wscale 7], length 0
13:37:07.854895 IP 172.28.5.5.47312 > 172.28.5.1.6379: Flags [P.], seq 1:7, ack 1, win 229, options [nop,nop,TS val 3361466406 ecr 4273644727], length 6: RESP "PING"
13:37:07.854962 IP 172.28.5.1.6379 > 172.28.5.5.47312: Flags [.], ack 7, win 227, options [nop,nop,TS val 4273644727 ecr 3361466406], length 0
13:37:07.855231 IP 172.28.5.1.6379 > 172.28.5.5.47312: Flags [P.], seq 1:8, ack 7, win 227, options [nop,nop,TS val 4273644727 ecr 3361466406], length 7: RESP "PONG"
13:37:07.855369 IP 172.28.5.5.47312 > 172.28.5.1.6379: Flags [P.], seq 7:25, ack 8, win 229, options [nop,nop,TS val 3361466406 ecr 4273644727], length 18: RESP "info replication"
13:37:07.855637 IP 172.28.5.1.6379 > 172.28.5.5.47312: Flags [P.], seq 8:535, ack 25, win 227, options [nop,nop,TS val 4273644727 ecr 3361466406], length 527: RESP "# Replication^M^Jrole:slave^M^Jmaster_host:172.28.5.0^M^Jmaster_port:6379^M^Jmaster_link_status:up^M^Jmaster_last_io_seconds_ago:1^M^Jmaster_sync_in_progress:0^M^Jslave_repl_offset:3421261^M^Jslave_priority:100^M^Jslave_read_only:1^M^Jconnected_slaves:0^M^Jmaster_replid:186487241cd9594a4921b48b510ea432fa9dc5d5^M^Jmaster_replid2:0000000000000000000000000000000000000000^M^Jmaster_repl_offset:3421261^M^Jsecond_repl_offset:-1^M^Jrepl_backlog_active:1^M^Jrepl_backlog_size:1048576^M^Jrepl_backlog_first_byte_offset:2372686^M^Jrepl_backlog_histlen:1048576^M^J"
13:37:07.896542 IP 172.28.5.5.47312 > 172.28.5.1.6379: Flags [.], ack 535, win 237, options [nop,nop,TS val 3361466447 ecr 4273644727], length 0
13:37:08.191530 IP 172.28.5.5.42016 > 172.28.5.2.6379: Flags [S], seq 2610781814, win 29200, options [mss 1460,sackOK,TS val 1838096961 ecr 0,nop,wscale 7], length 0
13:37:08.191647 IP 172.28.5.2.6379 > 172.28.5.5.42016: Flags [S.], seq 3124831738, ack 2610781815, win 28960, options [mss 1460,sackOK,TS val 1371975977 ecr 1838096961,nop,wscale 7], length 0
13:37:08.191716 IP 172.28.5.5.42016 > 172.28.5.2.6379: Flags [P.], seq 1:7, ack 1, win 229, options [nop,nop,TS val 1838096962 ecr 1371975977], length 6: RESP "PING"
13:37:08.191793 IP 172.28.5.2.6379 > 172.28.5.5.42016: Flags [.], ack 7, win 227, options [nop,nop,TS val 1371975978 ecr 1838096962], length 0
13:37:08.192076 IP 172.28.5.2.6379 > 172.28.5.5.42016: Flags [P.], seq 1:8, ack 7, win 227, options [nop,nop,TS val 1371975978 ecr 1838096962], length 7: RESP "PONG"
13:37:08.192190 IP 172.28.5.5.42016 > 172.28.5.2.6379: Flags [P.], seq 7:25, ack 8, win 229, options [nop,nop,TS val 1838096962 ecr 1371975978], length 18: RESP "info replication"
13:37:08.192411 IP 172.28.5.2.6379 > 172.28.5.5.42016: Flags [P.], seq 8:535, ack 25, win 227, options [nop,nop,TS val 1371975978 ecr 1838096962], length 527: RESP "# Replication^M^Jrole:slave^M^Jmaster_host:172.28.5.0^M^Jmaster_port:6379^M^Jmaster_link_status:up^M^Jmaster_last_io_seconds_ago:2^M^Jmaster_sync_in_progress:0^M^Jslave_repl_offset:3421261^M^Jslave_priority:100^M^Jslave_read_only:1^M^Jconnected_slaves:0^M^Jmaster_replid:186487241cd9594a4921b48b510ea432fa9dc5d5^M^Jmaster_replid2:0000000000000000000000000000000000000000^M^Jmaster_repl_offset:3421261^M^Jsecond_repl_offset:-1^M^Jrepl_backlog_active:1^M^Jrepl_backlog_size:1048576^M^Jrepl_backlog_first_byte_offset:2372686^M^Jrepl_backlog_histlen:1048576^M^J"
13:37:08.236535 IP 172.28.5.5.42016 > 172.28.5.2.6379: Flags [.], ack 535, win 237, options [nop,nop,TS val 1838097006 ecr 1371975978], length 0
13:37:08.534074 IP 172.28.5.5.43040 > 172.28.5.0.6379: Flags [S], seq 2899340911, win 29200, options [mss 1460,sackOK,TS val 3469556314 ecr 0,nop,wscale 7], length 0
13:37:08.534213 IP 172.28.5.0.6379 > 172.28.5.5.43040: Flags [S.], seq 2609177423, ack 2899340912, win 28960, options [mss 1460,sackOK,TS val 2852400604 ecr 3469556314,nop,wscale 7], length 0
13:37:08.534303 IP 172.28.5.5.43040 > 172.28.5.0.6379: Flags [P.], seq 1:7, ack 1, win 229, options [nop,nop,TS val 3469556314 ecr 2852400604], length 6: RESP "PING"
13:37:08.534413 IP 172.28.5.0.6379 > 172.28.5.5.43040: Flags [.], ack 7, win 227, options [nop,nop,TS val 2852400604 ecr 3469556314], length 0
13:37:08.534750 IP 172.28.5.0.6379 > 172.28.5.5.43040: Flags [P.], seq 1:8, ack 7, win 227, options [nop,nop,TS val 2852400605 ecr 3469556314], length 7: RESP "PONG"
13:37:08.534869 IP 172.28.5.5.43040 > 172.28.5.0.6379: Flags [P.], seq 7:25, ack 8, win 229, options [nop,nop,TS val 3469556315 ecr 2852400605], length 18: RESP "info replication"
13:37:08.535199 IP 172.28.5.0.6379 > 172.28.5.5.43040: Flags [P.], seq 8:480, ack 25, win 227, options [nop,nop,TS val 2852400605 ecr 3469556315], length 472: RESP "# Replication^M^Jrole:master^M^Jconnected_slaves:2^M^Jslave0:ip=172.28.5.2,port=6379,state=online,offset=3421409,lag=0^M^Jslave1:ip=172.28.5.1,port=6379,state=online,offset=3421261,lag=0^M^Jmaster_replid:186487241cd9594a4921b48b510ea432fa9dc5d5^M^Jmaster_replid2:0000000000000000000000000000000000000000^M^Jmaster_repl_offset:3421409^M^Jsecond_repl_offset:-1^M^Jrepl_backlog_active:1^M^Jrepl_backlog_size:1048576^M^Jrepl_backlog_first_byte_offset:2372834^M^Jrepl_backlog_histlen:1048576^M^J"
13:37:08.535314 IP 172.28.5.5.43040 > 172.28.5.0.6379: Flags [P.], seq 25:31, ack 480, win 237, options [nop,nop,TS val 3469556315 ecr 2852400605], length 6: RESP "QUIT"
13:37:08.535560 IP 172.28.5.0.6379 > 172.28.5.5.43040: Flags [P.], seq 480:485, ack 31, win 227, options [nop,nop,TS val 2852400605 ecr 3469556315], length 5: RESP "OK"
13:37:08.535664 IP 172.28.5.0.6379 > 172.28.5.5.43040: Flags [F.], seq 485, ack 31, win 227, options [nop,nop,TS val 2852400605 ecr 3469556315], length 0
13:37:08.535687 IP 172.28.5.5.43040 > 172.28.5.0.6379: Flags [R.], seq 31, ack 485, win 237, options [nop,nop,TS val 3469556316 ecr 2852400605], length 0
13:37:08.535699 IP 172.28.5.5.43040 > 172.28.5.0.6379: Flags [R], seq 2899340942, win 0, length 0
13:37:08.856260 IP 172.28.5.5.47312 > 172.28.5.1.6379: Flags [R.], seq 25, ack 535, win 237, options [nop,nop,TS val 3361467407 ecr 4273644727], length 0
13:37:09.192915 IP 172.28.5.5.42016 > 172.28.5.2.6379: Flags [R.], seq 25, ack 535, win 237, options [nop,nop,TS val 1838097963 ecr 1371975978], length 0
13:37:09.535571 IP 172.28.5.5.43044 > 172.28.5.0.6379: Flags [S], seq 1595469014, win 29200, options [mss 1460,sackOK,TS val 3469557315 ecr 0,nop,wscale 7], length 0
13:37:09.535698 IP 172.28.5.0.6379 > 172.28.5.5.43044: Flags [S.], seq 543174813, ack 1595469015, win 28960, options [mss 1460,sackOK,TS val 2852401606 ecr 3469557315,nop,wscale 7], length 0
13:37:09.535772 IP 172.28.5.5.43044 > 172.28.5.0.6379: Flags [P.], seq 1:7, ack 1, win 229, options [nop,nop,TS val 3469557316 ecr 2852401606], length 6: RESP "PING"
13:37:09.535862 IP 172.28.5.0.6379 > 172.28.5.5.43044: Flags [.], ack 7, win 227, options [nop,nop,TS val 2852401606 ecr 3469557316], length 0
13:37:09.536190 IP 172.28.5.0.6379 > 172.28.5.5.43044: Flags [P.], seq 1:8, ack 7, win 227, options [nop,nop,TS val 2852401606 ecr 3469557316], length 7: RESP "PONG"
13:37:09.536289 IP 172.28.5.5.43044 > 172.28.5.0.6379: Flags [P.], seq 7:25, ack 8, win 229, options [nop,nop,TS val 3469557316 ecr 2852401606], length 18: RESP "info replication"
13:37:09.536758 IP 172.28.5.0.6379 > 172.28.5.5.43044: Flags [P.], seq 8:480, ack 25, win 227, options [nop,nop,TS val 2852401607 ecr 3469557316], length 472: RESP "# Replication^M^Jrole:master^M^Jconnected_slaves:2^M^Jslave0:ip=172.28.5.2,port=6379,state=online,offset=3421705,lag=0^M^Jslave1:ip=172.28.5.1,port=6379,state=online,offset=3421705,lag=0^M^Jmaster_replid:186487241cd9594a4921b48b510ea432fa9dc5d5^M^Jmaster_replid2:0000000000000000000000000000000000000000^M^Jmaster_repl_offset:3421705^M^Jsecond_repl_offset:-1^M^Jrepl_backlog_active:1^M^Jrepl_backlog_size:1048576^M^Jrepl_backlog_first_byte_offset:2373130^M^Jrepl_backlog_histlen:1048576^M^J"
13:37:09.536854 IP 172.28.5.5.43044 > 172.28.5.0.6379: Flags [P.], seq 25:31, ack 480, win 237, options [nop,nop,TS val 3469557317 ecr 2852401607], length 6: RESP "QUIT"
13:37:09.536999 IP 172.28.5.0.6379 > 172.28.5.5.43044: Flags [P.], seq 480:485, ack 31, win 227, options [nop,nop,TS val 2852401607 ecr 3469557317], length 5: RESP "OK"
13:37:09.537093 IP 172.28.5.0.6379 > 172.28.5.5.43044: Flags [F.], seq 485, ack 31, win 227, options [nop,nop,TS val 2852401607 ecr 3469557317], length 0
13:37:09.537093 IP 172.28.5.5.43044 > 172.28.5.0.6379: Flags [R.], seq 31, ack 485, win 237, options [nop,nop,TS val 3469557317 ecr 2852401607], length 0
13:37:09.537128 IP 172.28.5.5.43044 > 172.28.5.0.6379: Flags [R], seq 1595469045, win 0, length 0
13:37:09.857746 IP 172.28.5.5.47328 > 172.28.5.1.6379: Flags [S], seq 673202076, win 29200, options [mss 1460,sackOK,TS val 3361468409 ecr 0,nop,wscale 7], length 0
13:37:09.857849 IP 172.28.5.1.6379 > 172.28.5.5.47328: Flags [S.], seq 528699894, ack 673202077, win 28960, options [mss 1460,sackOK,TS val 4273646730 ecr 3361468409,nop,wscale 7], length 0
13:37:09.857911 IP 172.28.5.5.47328 > 172.28.5.1.6379: Flags [P.], seq 1:7, ack 1, win 229, options [nop,nop,TS val 3361468409 ecr 4273646730], length 6: RESP "PING"
13:37:09.857978 IP 172.28.5.1.6379 > 172.28.5.5.47328: Flags [.], ack 7, win 227, options [nop,nop,TS val 4273646730 ecr 3361468409], length 0
13:37:09.858211 IP 172.28.5.1.6379 > 172.28.5.5.47328: Flags [P.], seq 1:8, ack 7, win 227, options [nop,nop,TS val 4273646730 ecr 3361468409], length 7: RESP "PONG"
13:37:09.858317 IP 172.28.5.5.47328 > 172.28.5.1.6379: Flags [P.], seq 7:25, ack 8, win 229, options [nop,nop,TS val 3361468409 ecr 4273646730], length 18: RESP "info replication"
