12:25:49.472735 IP 172.28.5.5.59170 > 172.28.5.0.6379: Flags [S], seq 1801899677, win 29200, options [mss 1460,sackOK,TS val 3497526170 ecr 0,nop,wscale 7], length 0
12:25:49.472837 IP 172.28.5.0.6379 > 172.28.5.5.59170: Flags [S.], seq 1652340380, ack 1801899678, win 28960, options [mss 1460,sackOK,TS val 2880370460 ecr 3497526170,nop,wscale 7], length 0
12:25:49.472893 IP 172.28.5.5.59170 > 172.28.5.0.6379: Flags [P.], seq 1:7, ack 1, win 229, options [nop,nop,TS val 3497526170 ecr 2880370460], length 6: RESP "PING"
12:25:49.472955 IP 172.28.5.0.6379 > 172.28.5.5.59170: Flags [.], ack 7, win 227, options [nop,nop,TS val 2880370461 ecr 3497526170], length 0
12:25:49.473158 IP 172.28.5.0.6379 > 172.28.5.5.59170: Flags [P.], seq 1:8, ack 7, win 227, options [nop,nop,TS val 2880370461 ecr 3497526170], length 7: RESP "PONG"
12:25:49.473225 IP 172.28.5.5.59170 > 172.28.5.0.6379: Flags [P.], seq 7:25, ack 8, win 229, options [nop,nop,TS val 3497526171 ecr 2880370461], length 18: RESP "info replication"
12:25:49.473383 IP 172.28.5.0.6379 > 172.28.5.5.59170: Flags [P.], seq 8:470, ack 25, win 227, options [nop,nop,TS val 2880370461 ecr 3497526171], length 462: RESP "# Replication^M^Jrole:master^M^Jconnected_slaves:2^M^Jslave0:ip=172.28.5.1,port=6379,state=online,offset=208576,lag=1^M^Jslave1:ip=172.28.5.2,port=6379,state=online,offset=208576,lag=1^M^Jmaster_replid:f8eac6c8a17a641b11523474ffa3dbd0af88977a^M^Jmaster_replid2:0000000000000000000000000000000000000000^M^Jmaster_repl_offset:208872^M^Jsecond_repl_offset:-1^M^Jrepl_backlog_active:1^M^Jrepl_backlog_size:1048576^M^Jrepl_backlog_first_byte_offset:1^M^Jrepl_backlog_histlen:208872^M^J"
12:25:49.473448 IP 172.28.5.5.59170 > 172.28.5.0.6379: Flags [P.], seq 25:31, ack 470, win 237, options [nop,nop,TS val 3497526171 ecr 2880370461], length 6: RESP "QUIT"
12:25:49.473545 IP 172.28.5.0.6379 > 172.28.5.5.59170: Flags [P.], seq 470:475, ack 31, win 227, options [nop,nop,TS val 2880370461 ecr 3497526171], length 5: RESP "OK"
12:25:49.473614 IP 172.28.5.0.6379 > 172.28.5.5.59170: Flags [F.], seq 475, ack 31, win 227, options [nop,nop,TS val 2880370461 ecr 3497526171], length 0
12:25:49.473616 IP 172.28.5.5.59170 > 172.28.5.0.6379: Flags [R.], seq 31, ack 475, win 237, options [nop,nop,TS val 3497526171 ecr 2880370461], length 0
12:25:49.473641 IP 172.28.5.5.59170 > 172.28.5.0.6379: Flags [R], seq 1801899708, win 0, length 0
12:25:49.798529 IP 172.28.5.5.35222 > 172.28.5.1.6379: Flags [S], seq 3663724444, win 29200, options [mss 1460,sackOK,TS val 3389437267 ecr 0,nop,wscale 7], length 0
12:25:49.798632 IP 172.28.5.1.6379 > 172.28.5.5.35222: Flags [S.], seq 127047629, ack 3663724445, win 28960, options [mss 1460,sackOK,TS val 6648292 ecr 3389437267,nop,wscale 7], length 0
12:25:49.798690 IP 172.28.5.5.35222 > 172.28.5.1.6379: Flags [P.], seq 1:7, ack 1, win 229, options [nop,nop,TS val 3389437267 ecr 6648292], length 6: RESP "PING"
12:25:49.798755 IP 172.28.5.1.6379 > 172.28.5.5.35222: Flags [.], ack 7, win 227, options [nop,nop,TS val 6648292 ecr 3389437267], length 0
12:25:49.799018 IP 172.28.5.1.6379 > 172.28.5.5.35222: Flags [P.], seq 1:8, ack 7, win 227, options [nop,nop,TS val 6648293 ecr 3389437267], length 7: RESP "PONG"
12:25:49.799159 IP 172.28.5.5.35222 > 172.28.5.1.6379: Flags [P.], seq 7:25, ack 8, win 229, options [nop,nop,TS val 3389437268 ecr 6648293], length 18: RESP "info replication"
12:25:49.799413 IP 172.28.5.1.6379 > 172.28.5.5.35222: Flags [P.], seq 8:526, ack 25, win 227, options [nop,nop,TS val 6648293 ecr 3389437268], length 518: RESP "# Replication^M^Jrole:slave^M^Jmaster_host:172.28.5.0^M^Jmaster_port:6379^M^Jmaster_link_status:up^M^Jmaster_last_io_seconds_ago:0^M^Jmaster_sync_in_progress:0^M^Jslave_repl_offset:208872^M^Jslave_priority:100^M^Jslave_read_only:1^M^Jconnected_slaves:0^M^Jmaster_replid:f8eac6c8a17a641b11523474ffa3dbd0af88977a^M^Jmaster_replid2:0000000000000000000000000000000000000000^M^Jmaster_repl_offset:208872^M^Jsecond_repl_offset:-1^M^Jrepl_backlog_active:1^M^Jrepl_backlog_size:1048576^M^Jrepl_backlog_first_byte_offset:1^M^Jrepl_backlog_histlen:208872^M^J"
12:25:49.840046 IP 172.28.5.5.35222 > 172.28.5.1.6379: Flags [.], ack 526, win 237, options [nop,nop,TS val 3389437309 ecr 6648293], length 0
12:25:50.133062 IP 172.28.5.5.58158 > 172.28.5.2.6379: Flags [S], seq 3475742291, win 29200, options [mss 1460,sackOK,TS val 1866067821 ecr 0,nop,wscale 7], length 0
12:25:50.133184 IP 172.28.5.2.6379 > 172.28.5.5.58158: Flags [S.], seq 2334107265, ack 3475742292, win 28960, options [mss 1460,sackOK,TS val 1399946837 ecr 1866067821,nop,wscale 7], length 0
12:25:50.133247 IP 172.28.5.5.58158 > 172.28.5.2.6379: Flags [P.], seq 1:7, ack 1, win 229, options [nop,nop,TS val 1866067821 ecr 1399946837], length 6: RESP "PING"
12:25:50.133321 IP 172.28.5.2.6379 > 172.28.5.5.58158: Flags [.], ack 7, win 227, options [nop,nop,TS val 1399946837 ecr 1866067821], length 0
12:25:50.133566 IP 172.28.5.2.6379 > 172.28.5.5.58158: Flags [P.], seq 1:8, ack 7, win 227, options [nop,nop,TS val 1399946837 ecr 1866067821], length 7: RESP "PONG"
12:25:50.133710 IP 172.28.5.5.58158 > 172.28.5.2.6379: Flags [P.], seq 7:25, ack 8, win 229, options [nop,nop,TS val 1866067821 ecr 1399946837], length 18: RESP "info replication"
12:25:50.133969 IP 172.28.5.2.6379 > 172.28.5.5.58158: Flags [P.], seq 8:528, ack 25, win 227, options [nop,nop,TS val 1399946838 ecr 1866067821], length 520: RESP "# Replication^M^Jrole:slave^M^Jmaster_host:172.28.5.0^M^Jmaster_port:6379^M^Jmaster_link_status:up^M^Jmaster_last_io_seconds_ago:1^M^Jmaster_sync_in_progress:0^M^Jslave_repl_offset:208872^M^Jslave_priority:100^M^Jslave_read_only:1^M^Jconnected_slaves:0^M^Jmaster_replid:f8eac6c8a17a641b11523474ffa3dbd0af88977a^M^Jmaster_replid2:0000000000000000000000000000000000000000^M^Jmaster_repl_offset:208872^M^Jsecond_repl_offset:-1^M^Jrepl_backlog_active:1^M^Jrepl_backlog_size:1048576^M^Jrepl_backlog_first_byte_offset:186^M^Jrepl_backlog_histlen:208687^M^J"
12:25:50.176366 IP 172.28.5.5.58158 > 172.28.5.2.6379: Flags [.], ack 528, win 237, options [nop,nop,TS val 1866067864 ecr 1399946838], length 0
12:25:50.473600 IP 172.28.5.5.59182 > 172.28.5.0.6379: Flags [S], seq 990572450, win 29200, options [mss 1460,sackOK,TS val 3497527171 ecr 0,nop,wscale 7], length 0
12:25:50.473703 IP 172.28.5.0.6379 > 172.28.5.5.59182: Flags [S.], seq 3676447786, ack 990572451, win 28960, options [mss 1460,sackOK,TS val 2880371461 ecr 3497527171,nop,wscale 7], length 0
12:25:50.473759 IP 172.28.5.5.59182 > 172.28.5.0.6379: Flags [P.], seq 1:7, ack 1, win 229, options [nop,nop,TS val 3497527171 ecr 2880371461], length 6: RESP "PING"
12:25:50.473818 IP 172.28.5.0.6379 > 172.28.5.5.59182: Flags [.], ack 7, win 227, options [nop,nop,TS val 2880371461 ecr 3497527171], length 0
12:25:50.474018 IP 172.28.5.0.6379 > 172.28.5.5.59182: Flags [P.], seq 1:8, ack 7, win 227, options [nop,nop,TS val 2880371462 ecr 3497527171], length 7: RESP "PONG"
12:25:50.474084 IP 172.28.5.5.59182 > 172.28.5.0.6379: Flags [P.], seq 7:25, ack 8, win 229, options [nop,nop,TS val 3497527172 ecr 2880371462], length 18: RESP "info replication"
12:25:50.474220 IP 172.28.5.0.6379 > 172.28.5.5.59182: Flags [P.], seq 8:470, ack 25, win 227, options [nop,nop,TS val 2880371462 ecr 3497527172], length 462: RESP "# Replication^M^Jrole:master^M^Jconnected_slaves:2^M^Jslave0:ip=172.28.5.1,port=6379,state=online,offset=208872,lag=1^M^Jslave1:ip=172.28.5.2,port=6379,state=online,offset=208872,lag=1^M^Jmaster_replid:f8eac6c8a17a641b11523474ffa3dbd0af88977a^M^Jmaster_replid2:0000000000000000000000000000000000000000^M^Jmaster_repl_offset:209020^M^Jsecond_repl_offset:-1^M^Jrepl_backlog_active:1^M^Jrepl_backlog_size:1048576^M^Jrepl_backlog_first_byte_offset:1^M^Jrepl_backlog_histlen:209020^M^J"
12:25:50.474268 IP 172.28.5.5.59182 > 172.28.5.0.6379: Flags [P.], seq 25:31, ack 470, win 237, options [nop,nop,TS val 3497527172 ecr 2880371462], length 6: RESP "QUIT"
12:25:50.474339 IP 172.28.5.0.6379 > 172.28.5.5.59182: Flags [P.], seq 470:475, ack 31, win 227, options [nop,nop,TS val 2880371462 ecr 3497527172], length 5: RESP "OK"
12:25:50.474394 IP 172.28.5.0.6379 > 172.28.5.5.59182: Flags [F.], seq 475, ack 31, win 227, options [nop,nop,TS val 2880371462 ecr 3497527172], length 0
12:25:50.474468 IP 172.28.5.5.59182 > 172.28.5.0.6379: Flags [F.], seq 31, ack 476, win 237, options [nop,nop,TS val 3497527172 ecr 2880371462], length 0
12:25:50.474543 IP 172.28.5.0.6379 > 172.28.5.5.59182: Flags [.], ack 32, win 227, options [nop,nop,TS val 2880371462 ecr 3497527172], length 0
12:25:50.800110 IP 172.28.5.5.35222 > 172.28.5.1.6379: Flags [R.], seq 25, ack 526, win 237, options [nop,nop,TS val 3389438269 ecr 6648293], length 0
12:25:51.133746 IP 172.28.5.5.58158 > 172.28.5.2.6379: Flags [R.], seq 25, ack 528, win 237, options [nop,nop,TS val 1866068821 ecr 1399946838], length 0
12:25:51.475357 IP 172.28.5.5.59186 > 172.28.5.0.6379: Flags [S], seq 3646123428, win 29200, options [mss 1460,sackOK,TS val 3497528173 ecr 0,nop,wscale 7], length 0
12:25:51.475460 IP 172.28.5.0.6379 > 172.28.5.5.59186: Flags [S.], seq 32649503, ack 3646123429, win 28960, options [mss 1460,sackOK,TS val 2880372463 ecr 3497528173,nop,wscale 7], length 0
12:25:51.475516 IP 172.28.5.5.59186 > 172.28.5.0.6379: Flags [P.], seq 1:7, ack 1, win 229, options [nop,nop,TS val 3497528173 ecr 2880372463], length 6: RESP "PING"
12:25:51.475584 IP 172.28.5.0.6379 > 172.28.5.5.59186: Flags [.], ack 7, win 227, options [nop,nop,TS val 2880372463 ecr 3497528173], length 0
12:25:51.475794 IP 172.28.5.0.6379 > 172.28.5.5.59186: Flags [P.], seq 1:8, ack 7, win 227, options [nop,nop,TS val 2880372463 ecr 3497528173], length 7: RESP "PONG"
12:25:51.475863 IP 172.28.5.5.59186 > 172.28.5.0.6379: Flags [P.], seq 7:25, ack 8, win 229, options [nop,nop,TS val 3497528173 ecr 2880372463], length 18: RESP "info replication"
12:25:51.476101 IP 172.28.5.0.6379 > 172.28.5.5.59186: Flags [P.], seq 8:470, ack 25, win 227, options [nop,nop,TS val 2880372464 ecr 3497528173], length 462: RESP "# Replication^M^Jrole:master^M^Jconnected_slaves:2^M^Jslave0:ip=172.28.5.1,port=6379,state=online,offset=209020,lag=1^M^Jslave1:ip=172.28.5.2,port=6379,state=online,offset=209020,lag=1^M^Jmaster_replid:f8eac6c8a17a641b11523474ffa3dbd0af88977a^M^Jmaster_replid2:0000000000000000000000000000000000000000^M^Jmaster_repl_offset:209330^M^Jsecond_repl_offset:-1^M^Jrepl_backlog_active:1^M^Jrepl_backlog_size:1048576^M^Jrepl_backlog_first_byte_offset:1^M^Jrepl_backlog_histlen:209330^M^J"
12:25:51.476167 IP 172.28.5.5.59186 > 172.28.5.0.6379: Flags [P.], seq 25:31, ack 470, win 237, options [nop,nop,TS val 3497528174 ecr 2880372464], length 6: RESP "QUIT"
12:25:51.476270 IP 172.28.5.0.6379 > 172.28.5.5.59186: Flags [P.], seq 470:475, ack 31, win 227, options [nop,nop,TS val 2880372464 ecr 3497528174], length 5: RESP "OK"
12:25:51.476341 IP 172.28.5.0.6379 > 172.28.5.5.59186: Flags [F.], seq 475, ack 31, win 227, options [nop,nop,TS val 2880372464 ecr 3497528174], length 0
12:25:51.476343 IP 172.28.5.5.59186 > 172.28.5.0.6379: Flags [R.], seq 31, ack 475, win 237, options [nop,nop,TS val 3497528174 ecr 2880372464], length 0
12:25:51.476369 IP 172.28.5.5.59186 > 172.28.5.0.6379: Flags [R], seq 3646123459, win 0, length 0
12:25:51.801637 IP 172.28.5.5.35238 > 172.28.5.1.6379: Flags [S], seq 2249841933, win 29200, options [mss 1460,sackOK,TS val 3389439270 ecr 0,nop,wscale 7], length 0
12:25:51.801693 IP 172.28.5.1.6379 > 172.28.5.5.35238: Flags [S.], seq 845407116, ack 2249841934, win 28960, options [mss 1460,sackOK,TS val 6650295 ecr 3389439270,nop,wscale 7], length 0
12:25:51.801722 IP 172.28.5.5.35238 > 172.28.5.1.6379: Flags [P.], seq 1:7, ack 1, win 229, options [nop,nop,TS val 3389439270 ecr 6650295], length 6: RESP "PING"
12:25:51.801752 IP 172.28.5.1.6379 > 172.28.5.5.35238: Flags [.], ack 7, win 227, options [nop,nop,TS val 6650295 ecr 3389439270], length 0
12:25:51.801895 IP 172.28.5.1.6379 > 172.28.5.5.35238: Flags [P.], seq 1:8, ack 7, win 227, options [nop,nop,TS val 6650295 ecr 3389439270], length 7: RESP "PONG"
12:25:51.801971 IP 172.28.5.5.35238 > 172.28.5.1.6379: Flags [P.], seq 7:25, ack 8, win 229, options [nop,nop,TS val 3389439271 ecr 6650295], length 18: RESP "info replication"
12:25:51.802099 IP 172.28.5.1.6379 > 172.28.5.5.35238: Flags [P.], seq 8:526, ack 25, win 227, options [nop,nop,TS val 6650296 ecr 3389439271], length 518: RESP "# Replication^M^Jrole:slave^M^Jmaster_host:172.28.5.0^M^Jmaster_port:6379^M^Jmaster_link_status:up^M^Jmaster_last_io_seconds_ago:0^M^Jmaster_sync_in_progress:0^M^Jslave_repl_offset:209330^M^Jslave_priority:100^M^Jslave_read_only:1^M^Jconnected_slaves:0^M^Jmaster_replid:f8eac6c8a17a641b11523474ffa3dbd0af88977a^M^Jmaster_replid2:0000000000000000000000000000000000000000^M^Jmaster_repl_offset:209330^M^Jsecond_repl_offset:-1^M^Jrepl_backlog_active:1^M^Jrepl_backlog_size:1048576^M^Jrepl_backlog_first_byte_offset:1^M^Jrepl_backlog_histlen:209330^M^J"
12:25:51.844076 IP 172.28.5.5.35238 > 172.28.5.1.6379: Flags [.], ack 526, win 237, options [nop,nop,TS val 3389439313 ecr 6650296], length 0
12:25:52.134715 IP 172.28.5.5.58174 > 172.28.5.2.6379: Flags [S], seq 2145888626, win 29200, options [mss 1460,sackOK,TS val 1866069822 ecr 0,nop,wscale 7], length 0
12:25:52.134845 IP 172.28.5.2.6379 > 172.28.5.5.58174: Flags [S.], seq 1364938198, ack 2145888627, win 28960, options [mss 1460,sackOK,TS val 1399948838 ecr 1866069822,nop,wscale 7], length 0
12:25:52.134926 IP 172.28.5.5.58174 > 172.28.5.2.6379: Flags [P.], seq 1:7, ack 1, win 229, options [nop,nop,TS val 1866069822 ecr 1399948838], length 6: RESP "PING"
12:25:52.135016 IP 172.28.5.2.6379 > 172.28.5.5.58174: Flags [.], ack 7, win 227, options [nop,nop,TS val 1399948839 ecr 1866069822], length 0
12:25:52.135385 IP 172.28.5.2.6379 > 172.28.5.5.58174: Flags [P.], seq 1:8, ack 7, win 227, options [nop,nop,TS val 1399948839 ecr 1866069822], length 7: RESP "PONG"
12:25:52.135573 IP 172.28.5.5.58174 > 172.28.5.2.6379: Flags [P.], seq 7:25, ack 8, win 229, options [nop,nop,TS val 1866069823 ecr 1399948839], length 18: RESP "info replication"
12:25:52.135832 IP 172.28.5.2.6379 > 172.28.5.5.58174: Flags [P.], seq 8:528, ack 25, win 227, options [nop,nop,TS val 1399948839 ecr 1866069823], length 520: RESP "# Replication^M^Jrole:slave^M^Jmaster_host:172.28.5.0^M^Jmaster_port:6379^M^Jmaster_link_status:up^M^Jmaster_last_io_seconds_ago:1^M^Jmaster_sync_in_progress:0^M^Jslave_repl_offset:209330^M^Jslave_priority:100^M^Jslave_read_only:1^M^Jconnected_slaves:0^M^Jmaster_replid:f8eac6c8a17a641b11523474ffa3dbd0af88977a^M^Jmaster_replid2:0000000000000000000000000000000000000000^M^Jmaster_repl_offset:209330^M^Jsecond_repl_offset:-1^M^Jrepl_backlog_active:1^M^Jrepl_backlog_size:1048576^M^Jrepl_backlog_first_byte_offset:186^M^Jrepl_backlog_histlen:209145^M^J"
12:25:52.180445 IP 172.28.5.5.58174 > 172.28.5.2.6379: Flags [.], ack 528, win 237, options [nop,nop,TS val 1866069868 ecr 1399948839], length 0
12:25:52.477442 IP 172.28.5.5.59198 > 172.28.5.0.6379: Flags [S], seq 1697696444, win 29200, options [mss 1460,sackOK,TS val 3497529175 ecr 0,nop,wscale 7], length 0
12:25:52.477554 IP 172.28.5.0.6379 > 172.28.5.5.59198: Flags [S.], seq 3862165072, ack 1697696445, win 28960, options [mss 1460,sackOK,TS val 2880373465 ecr 3497529175,nop,wscale 7], length 0
12:25:52.477619 IP 172.28.5.5.59198 > 172.28.5.0.6379: Flags [P.], seq 1:7, ack 1, win 229, options [nop,nop,TS val 3497529175 ecr 2880373465], length 6: RESP "PING"
12:25:52.477690 IP 172.28.5.0.6379 > 172.28.5.5.59198: Flags [.], ack 7, win 227, options [nop,nop,TS val 2880373465 ecr 3497529175], length 0
12:25:52.477926 IP 172.28.5.0.6379 > 172.28.5.5.59198: Flags [P.], seq 1:8, ack 7, win 227, options [nop,nop,TS val 2880373465 ecr 3497529175], length 7: RESP "PONG"
12:25:52.478013 IP 172.28.5.5.59198 > 172.28.5.0.6379: Flags [P.], seq 7:25, ack 8, win 229, options [nop,nop,TS val 3497529176 ecr 2880373465], length 18: RESP "info replication"
12:25:52.478201 IP 172.28.5.0.6379 > 172.28.5.5.59198: Flags [P.], seq 8:470, ack 25, win 227, options [nop,nop,TS val 2880373466 ecr 3497529176], length 462: RESP "# Replication^M^Jrole:master^M^Jconnected_slaves:2^M^Jslave0:ip=172.28.5.1,port=6379,state=online,offset=209330,lag=1^M^Jslave1:ip=172.28.5.2,port=6379,state=online,offset=209330,lag=1^M^Jmaster_replid:f8eac6c8a17a641b11523474ffa3dbd0af88977a^M^Jmaster_replid2:0000000000000000000000000000000000000000^M^Jmaster_repl_offset:209478^M^Jsecond_repl_offset:-1^M^Jrepl_backlog_active:1^M^Jrepl_backlog_size:1048576^M^Jrepl_backlog_first_byte_offset:1^M^Jrepl_backlog_histlen:209478^M^J"
12:25:52.478277 IP 172.28.5.5.59198 > 172.28.5.0.6379: Flags [P.], seq 25:31, ack 470, win 237, options [nop,nop,TS val 3497529176 ecr 2880373466], length 6: RESP "QUIT"
12:25:52.478389 IP 172.28.5.0.6379 > 172.28.5.5.59198: Flags [P.], seq 470:475, ack 31, win 227, options [nop,nop,TS val 2880373466 ecr 3497529176], length 5: RESP "OK"
12:25:52.478472 IP 172.28.5.5.59198 > 172.28.5.0.6379: Flags [R.], seq 31, ack 475, win 237, options [nop,nop,TS val 3497529176 ecr 2880373466], length 0
12:25:52.478472 IP 172.28.5.0.6379 > 172.28.5.5.59198: Flags [F.], seq 475, ack 31, win 227, options [nop,nop,TS val 2880373466 ecr 3497529176], length 0
12:25:52.478503 IP 172.28.5.5.59198 > 172.28.5.0.6379: Flags [R], seq 1697696475, win 0, length 0
12:25:52.803352 IP 172.28.5.5.35238 > 172.28.5.1.6379: Flags [R.], seq 25, ack 526, win 237, options [nop,nop,TS val 3389440272 ecr 6650296], length 0
12:25:53.136037 IP 172.28.5.5.58174 > 172.28.5.2.6379: Flags [R.], seq 25, ack 528, win 237, options [nop,nop,TS val 1866070823 ecr 1399948839], length 0
12:25:53.480457 IP 172.28.5.5.59202 > 172.28.5.0.6379: Flags [S], seq 108148403, win 29200, options [mss 1460,sackOK,TS val 3497530178 ecr 0,nop,wscale 7], length 0
12:25:53.480572 IP 172.28.5.0.6379 > 172.28.5.5.59202: Flags [S.], seq 238584502, ack 108148404, win 28960, options [mss 1460,sackOK,TS val 2880374468 ecr 3497530178,nop,wscale 7], length 0
12:25:53.480638 IP 172.28.5.5.59202 > 172.28.5.0.6379: Flags [P.], seq 1:7, ack 1, win 229, options [nop,nop,TS val 3497530178 ecr 2880374468], length 6: RESP "PING"
12:25:53.480708 IP 172.28.5.0.6379 > 172.28.5.5.59202: Flags [.], ack 7, win 227, options [nop,nop,TS val 2880374468 ecr 3497530178], length 0
12:25:53.481012 IP 172.28.5.0.6379 > 172.28.5.5.59202: Flags [P.], seq 1:8, ack 7, win 227, options [nop,nop,TS val 2880374469 ecr 3497530178], length 7: RESP "PONG"
12:25:53.481172 IP 172.28.5.5.59202 > 172.28.5.0.6379: Flags [P.], seq 7:25, ack 8, win 229, options [nop,nop,TS val 3497530179 ecr 2880374469], length 18: RESP "info replication"
12:25:53.481479 IP 172.28.5.0.6379 > 172.28.5.5.59202: Flags [P.], seq 8:470, ack 25, win 227, options [nop,nop,TS val 2880374469 ecr 3497530179], length 462: RESP "# Replication^M^Jrole:master^M^Jconnected_slaves:2^M^Jslave0:ip=172.28.5.1,port=6379,state=online,offset=209478,lag=1^M^Jslave1:ip=172.28.5.2,port=6379,state=online,offset=209478,lag=1^M^Jmaster_replid:f8eac6c8a17a641b11523474ffa3dbd0af88977a^M^Jmaster_replid2:0000000000000000000000000000000000000000^M^Jmaster_repl_offset:209774^M^Jsecond_repl_offset:-1^M^Jrepl_backlog_active:1^M^Jrepl_backlog_size:1048576^M^Jrepl_backlog_first_byte_offset:1^M^Jrepl_backlog_histlen:209774^M^J"
12:25:53.481626 IP 172.28.5.5.59202 > 172.28.5.0.6379: Flags [P.], seq 25:31, ack 470, win 237, options [nop,nop,TS val 3497530179 ecr 2880374469], length 6: RESP "QUIT"
12:25:53.481834 IP 172.28.5.0.6379 > 172.28.5.5.59202: Flags [P.], seq 470:475, ack 31, win 227, options [nop,nop,TS val 2880374469 ecr 3497530179], length 5: RESP "OK"
12:25:53.481926 IP 172.28.5.0.6379 > 172.28.5.5.59202: Flags [F.], seq 475, ack 31, win 227, options [nop,nop,TS val 2880374469 ecr 3497530179], length 0
12:25:53.482003 IP 172.28.5.5.59202 > 172.28.5.0.6379: Flags [R.], seq 31, ack 476, win 237, options [nop,nop,TS val 3497530180 ecr 2880374469], length 0
12:25:53.805611 IP 172.28.5.5.35254 > 172.28.5.1.6379: Flags [S], seq 423217851, win 29200, options [mss 1460,sackOK,TS val 3389441274 ecr 0,nop,wscale 7], length 0
12:25:53.805742 IP 172.28.5.1.6379 > 172.28.5.5.35254: Flags [S.], seq 114865987, ack 423217852, win 28960, options [mss 1460,sackOK,TS val 6652299 ecr 3389441274,nop,wscale 7], length 0
12:25:53.805813 IP 172.28.5.5.35254 > 172.28.5.1.6379: Flags [P.], seq 1:7, ack 1, win 229, options [nop,nop,TS val 3389441274 ecr 6652299], length 6: RESP "PING"
12:25:53.805907 IP 172.28.5.1.6379 > 172.28.5.5.35254: Flags [.], ack 7, win 227, options [nop,nop,TS val 6652299 ecr 3389441274], length 0
12:25:53.806220 IP 172.28.5.1.6379 > 172.28.5.5.35254: Flags [P.], seq 1:8, ack 7, win 227, options [nop,nop,TS val 6652300 ecr 3389441274], length 7: RESP "PONG"
12:25:53.806383 IP 172.28.5.5.35254 > 172.28.5.1.6379: Flags [P.], seq 7:25, ack 8, win 229, options [nop,nop,TS val 3389441275 ecr 6652300], length 18: RESP "info replication"
12:25:53.806686 IP 172.28.5.1.6379 > 172.28.5.5.35254: Flags [P.], seq 8:526, ack 25, win 227, options [nop,nop,TS val 6652300 ecr 3389441275], length 518: RESP "# Replication^M^Jrole:slave^M^Jmaster_host:172.28.5.0^M^Jmaster_port:6379^M^Jmaster_link_status:up^M^Jmaster_last_io_seconds_ago:0^M^Jmaster_sync_in_progress:0^M^Jslave_repl_offset:209774^M^Jslave_priority:100^M^Jslave_read_only:1^M^Jconnected_slaves:0^M^Jmaster_replid:f8eac6c8a17a641b11523474ffa3dbd0af88977a^M^Jmaster_replid2:0000000000000000000000000000000000000000^M^Jmaster_repl_offset:209774^M^Jsecond_repl_offset:-1^M^Jrepl_backlog_active:1^M^Jrepl_backlog_size:1048576^M^Jrepl_backlog_first_byte_offset:1^M^Jrepl_backlog_histlen:209774^M^J"
12:25:53.848198 IP 172.28.5.5.35254 > 172.28.5.1.6379: Flags [.], ack 526, win 237, options [nop,nop,TS val 3389441317 ecr 6652300], length 0
12:25:54.137420 IP 172.28.5.5.58190 > 172.28.5.2.6379: Flags [S], seq 2078266732, win 29200, options [mss 1460,sackOK,TS val 1866071825 ecr 0,nop,wscale 7], length 0
12:25:54.137571 IP 172.28.5.2.6379 > 172.28.5.5.58190: Flags [S.], seq 679488974, ack 2078266733, win 28960, options [mss 1460,sackOK,TS val 1399950841 ecr 1866071825,nop,wscale 7], length 0
12:25:54.137665 IP 172.28.5.5.58190 > 172.28.5.2.6379: Flags [P.], seq 1:7, ack 1, win 229, options [nop,nop,TS val 1866071825 ecr 1399950841], length 6: RESP "PING"
12:25:54.137762 IP 172.28.5.2.6379 > 172.28.5.5.58190: Flags [.], ack 7, win 227, options [nop,nop,TS val 1399950841 ecr 1866071825], length 0
12:25:54.138120 IP 172.28.5.2.6379 > 172.28.5.5.58190: Flags [P.], seq 1:8, ack 7, win 227, options [nop,nop,TS val 1399950842 ecr 1866071825], length 7: RESP "PONG"
12:25:54.138313 IP 172.28.5.5.58190 > 172.28.5.2.6379: Flags [P.], seq 7:25, ack 8, win 229, options [nop,nop,TS val 1866071826 ecr 1399950842], length 18: RESP "info replication"
12:25:54.138628 IP 172.28.5.2.6379 > 172.28.5.5.58190: Flags [P.], seq 8:528, ack 25, win 227, options [nop,nop,TS val 1399950842 ecr 1866071826], length 520: RESP "# Replication^M^Jrole:slave^M^Jmaster_host:172.28.5.0^M^Jmaster_port:6379^M^Jmaster_link_status:up^M^Jmaster_last_io_seconds_ago:1^M^Jmaster_sync_in_progress:0^M^Jslave_repl_offset:209774^M^Jslave_priority:100^M^Jslave_read_only:1^M^Jconnected_slaves:0^M^Jmaster_replid:f8eac6c8a17a641b11523474ffa3dbd0af88977a^M^Jmaster_replid2:0000000000000000000000000000000000000000^M^Jmaster_repl_offset:209774^M^Jsecond_repl_offset:-1^M^Jrepl_backlog_active:1^M^Jrepl_backlog_size:1048576^M^Jrepl_backlog_first_byte_offset:186^M^Jrepl_backlog_histlen:209589^M^J"
12:25:54.180304 IP 172.28.5.5.58190 > 172.28.5.2.6379: Flags [.], ack 528, win 237, options [nop,nop,TS val 1866071868 ecr 1399950842], length 0
12:25:54.482657 IP 172.28.5.5.59214 > 172.28.5.0.6379: Flags [S], seq 1777670672, win 29200, options [mss 1460,sackOK,TS val 3497531180 ecr 0,nop,wscale 7], length 0
12:25:54.482760 IP 172.28.5.0.6379 > 172.28.5.5.59214: Flags [S.], seq 3815239247, ack 1777670673, win 28960, options [mss 1460,sackOK,TS val 2880375470 ecr 3497531180,nop,wscale 7], length 0
12:25:54.482818 IP 172.28.5.5.59214 > 172.28.5.0.6379: Flags [P.], seq 1:7, ack 1, win 229, options [nop,nop,TS val 3497531180 ecr 2880375470], length 6: RESP "PING"
12:25:54.482881 IP 172.28.5.0.6379 > 172.28.5.5.59214: Flags [.], ack 7, win 227, options [nop,nop,TS val 2880375470 ecr 3497531180], length 0
12:25:54.483153 IP 172.28.5.0.6379 > 172.28.5.5.59214: Flags [P.], seq 1:8, ack 7, win 227, options [nop,nop,TS val 2880375471 ecr 3497531180], length 7: RESP "PONG"
12:25:54.483298 IP 172.28.5.5.59214 > 172.28.5.0.6379: Flags [P.], seq 7:25, ack 8, win 229, options [nop,nop,TS val 3497531181 ecr 2880375471], length 18: RESP "info replication"
12:25:54.483571 IP 172.28.5.0.6379 > 172.28.5.5.59214: Flags [P.], seq 8:470, ack 25, win 227, options [nop,nop,TS val 2880375471 ecr 3497531181], length 462: RESP "# Replication^M^Jrole:master^M^Jconnected_slaves:2^M^Jslave0:ip=172.28.5.1,port=6379,state=online,offset=209774,lag=1^M^Jslave1:ip=172.28.5.2,port=6379,state=online,offset=209774,lag=1^M^Jmaster_replid:f8eac6c8a17a641b11523474ffa3dbd0af88977a^M^Jmaster_replid2:0000000000000000000000000000000000000000^M^Jmaster_repl_offset:209922^M^Jsecond_repl_offset:-1^M^Jrepl_backlog_active:1^M^Jrepl_backlog_size:1048576^M^Jrepl_backlog_first_byte_offset:1^M^Jrepl_backlog_histlen:209922^M^J"
12:25:54.483713 IP 172.28.5.5.59214 > 172.28.5.0.6379: Flags [P.], seq 25:31, ack 470, win 237, options [nop,nop,TS val 3497531181 ecr 2880375471], length 6: RESP "QUIT"
12:25:54.483863 IP 172.28.5.0.6379 > 172.28.5.5.59214: Flags [P.], seq 470:475, ack 31, win 227, options [nop,nop,TS val 2880375471 ecr 3497531181], length 5: RESP "OK"
12:25:54.483928 IP 172.28.5.0.6379 > 172.28.5.5.59214: Flags [F.], seq 475, ack 31, win 227, options [nop,nop,TS val 2880375471 ecr 3497531181], length 0
12:25:54.484049 IP 172.28.5.5.59214 > 172.28.5.0.6379: Flags [F.], seq 31, ack 476, win 237, options [nop,nop,TS val 3497531182 ecr 2880375471], length 0
12:25:54.484123 IP 172.28.5.0.6379 > 172.28.5.5.59214: Flags [.], ack 32, win 227, options [nop,nop,TS val 2880375472 ecr 3497531182], length 0
12:25:54.808129 IP 172.28.5.5.35254 > 172.28.5.1.6379: Flags [R.], seq 25, ack 526, win 237, options [nop,nop,TS val 3389442277 ecr 6652300], length 0
12:25:55.139929 IP 172.28.5.5.58190 > 172.28.5.2.6379: Flags [R.], seq 25, ack 528, win 237, options [nop,nop,TS val 1866072827 ecr 1399950842], length 0
12:25:55.484795 IP 172.28.5.5.59218 > 172.28.5.0.6379: Flags [S], seq 685991364, win 29200, options [mss 1460,sackOK,TS val 3497532182 ecr 0,nop,wscale 7], length 0
12:25:55.484832 IP 172.28.5.0.6379 > 172.28.5.5.59218: Flags [S.], seq 1221885667, ack 685991365, win 28960, options [mss 1460,sackOK,TS val 2880376472 ecr 3497532182,nop,wscale 7], length 0
12:25:55.484849 IP 172.28.5.5.59218 > 172.28.5.0.6379: Flags [P.], seq 1:7, ack 1, win 229, options [nop,nop,TS val 3497532182 ecr 2880376472], length 6: RESP "PING"
12:25:55.484866 IP 172.28.5.0.6379 > 172.28.5.5.59218: Flags [.], ack 7, win 227, options [nop,nop,TS val 2880376472 ecr 3497532182], length 0
12:25:55.484969 IP 172.28.5.0.6379 > 172.28.5.5.59218: Flags [P.], seq 1:8, ack 7, win 227, options [nop,nop,TS val 2880376473 ecr 3497532182], length 7: RESP "PONG"
12:25:55.485029 IP 172.28.5.5.59218 > 172.28.5.0.6379: Flags [P.], seq 7:25, ack 8, win 229, options [nop,nop,TS val 3497532183 ecr 2880376473], length 18: RESP "info replication"
12:25:55.485120 IP 172.28.5.0.6379 > 172.28.5.5.59218: Flags [P.], seq 8:470, ack 25, win 227, options [nop,nop,TS val 2880376473 ecr 3497532183], length 462: RESP "# Replication^M^Jrole:master^M^Jconnected_slaves:2^M^Jslave0:ip=172.28.5.1,port=6379,state=online,offset=209922,lag=1^M^Jslave1:ip=172.28.5.2,port=6379,state=online,offset=209922,lag=1^M^Jmaster_replid:f8eac6c8a17a641b11523474ffa3dbd0af88977a^M^Jmaster_replid2:0000000000000000000000000000000000000000^M^Jmaster_repl_offset:210070^M^Jsecond_repl_offset:-1^M^Jrepl_backlog_active:1^M^Jrepl_backlog_size:1048576^M^Jrepl_backlog_first_byte_offset:1^M^Jrepl_backlog_histlen:210070^M^J"
12:25:55.485137 IP 172.28.5.5.59218 > 172.28.5.0.6379: Flags [P.], seq 25:31, ack 470, win 237, options [nop,nop,TS val 3497532183 ecr 2880376473], length 6: RESP "QUIT"
12:25:55.485207 IP 172.28.5.0.6379 > 172.28.5.5.59218: Flags [P.], seq 470:475, ack 31, win 227, options [nop,nop,TS val 2880376473 ecr 3497532183], length 5: RESP "OK"
12:25:55.485227 IP 172.28.5.0.6379 > 172.28.5.5.59218: Flags [F.], seq 475, ack 31, win 227, options [nop,nop,TS val 2880376473 ecr 3497532183], length 0
12:25:55.485269 IP 172.28.5.5.59218 > 172.28.5.0.6379: Flags [F.], seq 31, ack 476, win 237, options [nop,nop,TS val 3497532183 ecr 2880376473], length 0
12:25:55.485287 IP 172.28.5.0.6379 > 172.28.5.5.59218: Flags [.], ack 32, win 227, options [nop,nop,TS val 2880376473 ecr 3497532183], length 0
12:25:55.808844 IP 172.28.5.5.35270 > 172.28.5.1.6379: Flags [S], seq 3121075902, win 29200, options [mss 1460,sackOK,TS val 3389443277 ecr 0,nop,wscale 7], length 0
12:25:55.808982 IP 172.28.5.1.6379 > 172.28.5.5.35270: Flags [S.], seq 2624066881, ack 3121075903, win 28960, options [mss 1460,sackOK,TS val 6654303 ecr 3389443277,nop,wscale 7], length 0
12:25:55.809061 IP 172.28.5.5.35270 > 172.28.5.1.6379: Flags [P.], seq 1:7, ack 1, win 229, options [nop,nop,TS val 3389443278 ecr 6654303], length 6: RESP "PING"
12:25:55.809148 IP 172.28.5.1.6379 > 172.28.5.5.35270: Flags [.], ack 7, win 227, options [nop,nop,TS val 6654303 ecr 3389443278], length 0
12:25:55.809473 IP 172.28.5.1.6379 > 172.28.5.5.35270: Flags [P.], seq 1:8, ack 7, win 227, options [nop,nop,TS val 6654303 ecr 3389443278], length 7: RESP "PONG"
12:25:55.809636 IP 172.28.5.5.35270 > 172.28.5.1.6379: Flags [P.], seq 7:25, ack 8, win 229, options [nop,nop,TS val 3389443278 ecr 6654303], length 18: RESP "info replication"
12:25:55.809933 IP 172.28.5.1.6379 > 172.28.5.5.35270: Flags [P.], seq 8:526, ack 25, win 227, options [nop,nop,TS val 6654303 ecr 3389443278], length 518: RESP "# Replication^M^Jrole:slave^M^Jmaster_host:172.28.5.0^M^Jmaster_port:6379^M^Jmaster_link_status:up^M^Jmaster_last_io_seconds_ago:0^M^Jmaster_sync_in_progress:0^M^Jslave_repl_offset:210218^M^Jslave_priority:100^M^Jslave_read_only:1^M^Jconnected_slaves:0^M^Jmaster_replid:f8eac6c8a17a641b11523474ffa3dbd0af88977a^M^Jmaster_replid2:0000000000000000000000000000000000000000^M^Jmaster_repl_offset:210218^M^Jsecond_repl_offset:-1^M^Jrepl_backlog_active:1^M^Jrepl_backlog_size:1048576^M^Jrepl_backlog_first_byte_offset:1^M^Jrepl_backlog_histlen:210218^M^J"
12:25:55.852002 IP 172.28.5.5.35270 > 172.28.5.1.6379: Flags [.], ack 526, win 237, options [nop,nop,TS val 3389443321 ecr 6654303], length 0
12:25:56.140769 IP 172.28.5.5.58206 > 172.28.5.2.6379: Flags [S], seq 3989656503, win 29200, options [mss 1460,sackOK,TS val 1866073828 ecr 0,nop,wscale 7], length 0
12:25:56.140974 IP 172.28.5.2.6379 > 172.28.5.5.58206: Flags [S.], seq 758846424, ack 3989656504, win 28960, options [mss 1460,sackOK,TS val 1399952845 ecr 1866073828,nop,wscale 7], length 0
12:25:56.141111 IP 172.28.5.5.58206 > 172.28.5.2.6379: Flags [P.], seq 1:7, ack 1, win 229, options [nop,nop,TS val 1866073829 ecr 1399952845], length 6: RESP "PING"
12:25:56.141271 IP 172.28.5.2.6379 > 172.28.5.5.58206: Flags [.], ack 7, win 227, options [nop,nop,TS val 1399952845 ecr 1866073829], length 0
12:25:56.141878 IP 172.28.5.2.6379 > 172.28.5.5.58206: Flags [P.], seq 1:8, ack 7, win 227, options [nop,nop,TS val 1399952845 ecr 1866073829], length 7: RESP "PONG"
12:25:56.142096 IP 172.28.5.5.58206 > 172.28.5.2.6379: Flags [P.], seq 7:25, ack 8, win 229, options [nop,nop,TS val 1866073830 ecr 1399952845], length 18: RESP "info replication"
12:25:56.142503 IP 172.28.5.2.6379 > 172.28.5.5.58206: Flags [P.], seq 8:528, ack 25, win 227, options [nop,nop,TS val 1399952846 ecr 1866073830], length 520: RESP "# Replication^M^Jrole:slave^M^Jmaster_host:172.28.5.0^M^Jmaster_port:6379^M^Jmaster_link_status:up^M^Jmaster_last_io_seconds_ago:1^M^Jmaster_sync_in_progress:0^M^Jslave_repl_offset:210218^M^Jslave_priority:100^M^Jslave_read_only:1^M^Jconnected_slaves:0^M^Jmaster_replid:f8eac6c8a17a641b11523474ffa3dbd0af88977a^M^Jmaster_replid2:0000000000000000000000000000000000000000^M^Jmaster_repl_offset:210218^M^Jsecond_repl_offset:-1^M^Jrepl_backlog_active:1^M^Jrepl_backlog_size:1048576^M^Jrepl_backlog_first_byte_offset:186^M^Jrepl_backlog_histlen:210033^M^J"
12:25:56.183986 IP 172.28.5.5.58206 > 172.28.5.2.6379: Flags [.], ack 528, win 237, options [nop,nop,TS val 1866073872 ecr 1399952846], length 0
12:25:56.486231 IP 172.28.5.5.59230 > 172.28.5.0.6379: Flags [S], seq 2412956675, win 29200, options [mss 1460,sackOK,TS val 3497533184 ecr 0,nop,wscale 7], length 0
12:25:56.486347 IP 172.28.5.0.6379 > 172.28.5.5.59230: Flags [S.], seq 310847247, ack 2412956676, win 28960, options [mss 1460,sackOK,TS val 2880377474 ecr 3497533184,nop,wscale 7], length 0
12:25:56.486408 IP 172.28.5.5.59230 > 172.28.5.0.6379: Flags [P.], seq 1:7, ack 1, win 229, options [nop,nop,TS val 3497533184 ecr 2880377474], length 6: RESP "PING"
12:25:56.486478 IP 172.28.5.0.6379 > 172.28.5.5.59230: Flags [.], ack 7, win 227, options [nop,nop,TS val 2880377474 ecr 3497533184], length 0
12:25:56.486714 IP 172.28.5.0.6379 > 172.28.5.5.59230: Flags [P.], seq 1:8, ack 7, win 227, options [nop,nop,TS val 2880377474 ecr 3497533184], length 7: RESP "PONG"
12:25:56.486800 IP 172.28.5.5.59230 > 172.28.5.0.6379: Flags [P.], seq 7:25, ack 8, win 229, options [nop,nop,TS val 3497533184 ecr 2880377474], length 18: RESP "info replication"
12:25:56.486990 IP 172.28.5.0.6379 > 172.28.5.5.59230: Flags [P.], seq 8:470, ack 25, win 227, options [nop,nop,TS val 2880377475 ecr 3497533184], length 462: RESP "# Replication^M^Jrole:master^M^Jconnected_slaves:2^M^Jslave0:ip=172.28.5.1,port=6379,state=online,offset=210218,lag=1^M^Jslave1:ip=172.28.5.2,port=6379,state=online,offset=210218,lag=1^M^Jmaster_replid:f8eac6c8a17a641b11523474ffa3dbd0af88977a^M^Jmaster_replid2:0000000000000000000000000000000000000000^M^Jmaster_repl_offset:210366^M^Jsecond_repl_offset:-1^M^Jrepl_backlog_active:1^M^Jrepl_backlog_size:1048576^M^Jrepl_backlog_first_byte_offset:1^M^Jrepl_backlog_histlen:210366^M^J"
12:25:56.487064 IP 172.28.5.5.59230 > 172.28.5.0.6379: Flags [P.], seq 25:31, ack 470, win 237, options [nop,nop,TS val 3497533185 ecr 2880377475], length 6: RESP "QUIT"
12:25:56.487178 IP 172.28.5.0.6379 > 172.28.5.5.59230: Flags [P.], seq 470:475, ack 31, win 227, options [nop,nop,TS val 2880377475 ecr 3497533185], length 5: RESP "OK"
12:25:56.487257 IP 172.28.5.0.6379 > 172.28.5.5.59230: Flags [F.], seq 475, ack 31, win 227, options [nop,nop,TS val 2880377475 ecr 3497533185], length 0
12:25:56.487259 IP 172.28.5.5.59230 > 172.28.5.0.6379: Flags [R.], seq 31, ack 475, win 237, options [nop,nop,TS val 3497533185 ecr 2880377475], length 0
12:25:56.487287 IP 172.28.5.5.59230 > 172.28.5.0.6379: Flags [R], seq 2412956706, win 0, length 0
12:25:56.809785 IP 172.28.5.5.35270 > 172.28.5.1.6379: Flags [R.], seq 25, ack 526, win 237, options [nop,nop,TS val 3389444278 ecr 6654303], length 0
12:25:57.142750 IP 172.28.5.5.58206 > 172.28.5.2.6379: Flags [R.], seq 25, ack 528, win 237, options [nop,nop,TS val 1866074830 ecr 1399952846], length 0
12:25:57.488441 IP 172.28.5.5.59234 > 172.28.5.0.6379: Flags [S], seq 2327432259, win 29200, options [mss 1460,sackOK,TS val 3497534186 ecr 0,nop,wscale 7], length 0
12:25:57.488545 IP 172.28.5.0.6379 > 172.28.5.5.59234: Flags [S.], seq 3019595121, ack 2327432260, win 28960, options [mss 1460,sackOK,TS val 2880378476 ecr 3497534186,nop,wscale 7], length 0
12:25:57.488604 IP 172.28.5.5.59234 > 172.28.5.0.6379: Flags [P.], seq 1:7, ack 1, win 229, options [nop,nop,TS val 3497534186 ecr 2880378476], length 6: RESP "PING"
12:25:57.488670 IP 172.28.5.0.6379 > 172.28.5.5.59234: Flags [.], ack 7, win 227, options [nop,nop,TS val 2880378476 ecr 3497534186], length 0
12:25:57.488945 IP 172.28.5.0.6379 > 172.28.5.5.59234: Flags [P.], seq 1:8, ack 7, win 227, options [nop,nop,TS val 2880378476 ecr 3497534186], length 7: RESP "PONG"
12:25:57.489089 IP 172.28.5.5.59234 > 172.28.5.0.6379: Flags [P.], seq 7:25, ack 8, win 229, options [nop,nop,TS val 3497534187 ecr 2880378476], length 18: RESP "info replication"
12:25:57.489361 IP 172.28.5.0.6379 > 172.28.5.5.59234: Flags [P.], seq 8:470, ack 25, win 227, options [nop,nop,TS val 2880378477 ecr 3497534187], length 462: RESP "# Replication^M^Jrole:master^M^Jconnected_slaves:2^M^Jslave0:ip=172.28.5.1,port=6379,state=online,offset=210366,lag=1^M^Jslave1:ip=172.28.5.2,port=6379,state=online,offset=210366,lag=1^M^Jmaster_replid:f8eac6c8a17a641b11523474ffa3dbd0af88977a^M^Jmaster_replid2:0000000000000000000000000000000000000000^M^Jmaster_repl_offset:210514^M^Jsecond_repl_offset:-1^M^Jrepl_backlog_active:1^M^Jrepl_backlog_size:1048576^M^Jrepl_backlog_first_byte_offset:1^M^Jrepl_backlog_histlen:210514^M^J"
12:25:57.489502 IP 172.28.5.5.59234 > 172.28.5.0.6379: Flags [P.], seq 25:31, ack 470, win 237, options [nop,nop,TS val 3497534187 ecr 2880378477], length 6: RESP "QUIT"
12:25:57.489689 IP 172.28.5.0.6379 > 172.28.5.5.59234: Flags [P.], seq 470:475, ack 31, win 227, options [nop,nop,TS val 2880378477 ecr 3497534187], length 5: RESP "OK"
12:25:57.489768 IP 172.28.5.0.6379 > 172.28.5.5.59234: Flags [F.], seq 475, ack 31, win 227, options [nop,nop,TS val 2880378477 ecr 3497534187], length 0
12:25:57.489834 IP 172.28.5.5.59234 > 172.28.5.0.6379: Flags [R.], seq 31, ack 476, win 237, options [nop,nop,TS val 3497534187 ecr 2880378477], length 0
12:25:57.811853 IP 172.28.5.5.35286 > 172.28.5.1.6379: Flags [S], seq 3463456046, win 29200, options [mss 1460,sackOK,TS val 3389445280 ecr 0,nop,wscale 7], length 0
12:25:57.812027 IP 172.28.5.1.6379 > 172.28.5.5.35286: Flags [S.], seq 1641010457, ack 3463456047, win 28960, options [mss 1460,sackOK,TS val 6656306 ecr 3389445280,nop,wscale 7], length 0
12:25:57.812183 IP 172.28.5.5.35286 > 172.28.5.1.6379: Flags [P.], seq 1:7, ack 1, win 229, options [nop,nop,TS val 3389445281 ecr 6656306], length 6: RESP "PING"
12:25:57.812278 IP 172.28.5.1.6379 > 172.28.5.5.35286: Flags [.], ack 7, win 227, options [nop,nop,TS val 6656306 ecr 3389445281], length 0
12:25:57.812633 IP 172.28.5.1.6379 > 172.28.5.5.35286: Flags [P.], seq 1:8, ack 7, win 227, options [nop,nop,TS val 6656306 ecr 3389445281], length 7: RESP "PONG"
12:25:57.812813 IP 172.28.5.5.35286 > 172.28.5.1.6379: Flags [P.], seq 7:25, ack 8, win 229, options [nop,nop,TS val 3389445281 ecr 6656306], length 18: RESP "info replication"
12:25:57.813131 IP 172.28.5.1.6379 > 172.28.5.5.35286: Flags [P.], seq 8:526, ack 25, win 227, options [nop,nop,TS val 6656307 ecr 3389445281], length 518: RESP "# Replication^M^Jrole:slave^M^Jmaster_host:172.28.5.0^M^Jmaster_port:6379^M^Jmaster_link_status:up^M^Jmaster_last_io_seconds_ago:0^M^Jmaster_sync_in_progress:0^M^Jslave_repl_offset:210662^M^Jslave_priority:100^M^Jslave_read_only:1^M^Jconnected_slaves:0^M^Jmaster_replid:f8eac6c8a17a641b11523474ffa3dbd0af88977a^M^Jmaster_replid2:0000000000000000000000000000000000000000^M^Jmaster_repl_offset:210662^M^Jsecond_repl_offset:-1^M^Jrepl_backlog_active:1^M^Jrepl_backlog_size:1048576^M^Jrepl_backlog_first_byte_offset:1^M^Jrepl_backlog_histlen:210662^M^J"
12:25:57.856467 IP 172.28.5.5.35286 > 172.28.5.1.6379: Flags [.], ack 526, win 237, options [nop,nop,TS val 3389445325 ecr 6656307], length 0
12:25:58.144259 IP 172.28.5.5.58222 > 172.28.5.2.6379: Flags [S], seq 3337803683, win 29200, options [mss 1460,sackOK,TS val 1866075832 ecr 0,nop,wscale 7], length 0
12:25:58.144398 IP 172.28.5.2.6379 > 172.28.5.5.58222: Flags [S.], seq 3493495248, ack 3337803684, win 28960, options [mss 1460,sackOK,TS val 1399954848 ecr 1866075832,nop,wscale 7], length 0
