13:36:25.281300 IP 172.28.5.4.50876 > 172.28.5.0.6379: Flags [S], seq 2728815855, win 29200, options [mss 1460,sackOK,TS val 1842685123 ecr 0,nop,wscale 7], length 0
13:36:25.281598 IP 172.28.5.0.6379 > 172.28.5.4.50876: Flags [.], ack 2728815862, win 227, options [nop,nop,TS val 202040057 ecr 1842685123], length 0
13:36:25.281828 IP 172.28.5.0.6379 > 172.28.5.4.50876: Flags [P.], seq 0:7, ack 1, win 227, options [nop,nop,TS val 202040058 ecr 1842685123], length 7: RESP "PONG"
13:36:25.281957 IP 172.28.5.4.50876 > 172.28.5.0.6379: Flags [P.], seq 1:19, ack 7, win 229, options [nop,nop,TS val 1842685124 ecr 202040058], length 18: RESP "info replication"
13:36:25.282203 IP 172.28.5.0.6379 > 172.28.5.4.50876: Flags [P.], seq 7:479, ack 19, win 227, options [nop,nop,TS val 202040058 ecr 1842685124], length 472: RESP "# Replication^M^Jrole:master^M^Jconnected_slaves:2^M^Jslave0:ip=172.28.5.2,port=6379,state=online,offset=3411881,lag=0^M^Jslave1:ip=172.28.5.1,port=6379,state=online,offset=3411881,lag=1^M^Jmaster_replid:186487241cd9594a4921b48b510ea432fa9dc5d5^M^Jmaster_replid2:0000000000000000000000000000000000000000^M^Jmaster_repl_offset:3411881^M^Jsecond_repl_offset:-1^M^Jrepl_backlog_active:1^M^Jrepl_backlog_size:1048576^M^Jrepl_backlog_first_byte_offset:2363306^M^Jrepl_backlog_histlen:1048576^M^J"
13:36:25.282322 IP 172.28.5.4.50876 > 172.28.5.0.6379: Flags [P.], seq 19:25, ack 479, win 237, options [nop,nop,TS val 1842685124 ecr 202040058], length 6: RESP "QUIT"
13:36:25.282446 IP 172.28.5.0.6379 > 172.28.5.4.50876: Flags [P.], seq 479:484, ack 25, win 227, options [nop,nop,TS val 202040058 ecr 1842685124], length 5: RESP "OK"
13:36:25.282534 IP 172.28.5.0.6379 > 172.28.5.4.50876: Flags [F.], seq 484, ack 25, win 227, options [nop,nop,TS val 202040058 ecr 1842685124], length 0
13:36:25.282725 IP 172.28.5.4.50876 > 172.28.5.0.6379: Flags [F.], seq 25, ack 485, win 237, options [nop,nop,TS val 1842685125 ecr 202040058], length 0
13:36:25.282823 IP 172.28.5.0.6379 > 172.28.5.4.50876: Flags [.], ack 26, win 227, options [nop,nop,TS val 202040059 ecr 1842685125], length 0
13:36:25.615788 IP 172.28.5.4.44122 > 172.28.5.1.6379: Flags [S], seq 2178275984, win 29200, options [mss 1460,sackOK,TS val 4040464884 ecr 0,nop,wscale 7], length 0
13:36:25.615911 IP 172.28.5.1.6379 > 172.28.5.4.44122: Flags [S.], seq 1767154522, ack 2178275985, win 28960, options [mss 1460,sackOK,TS val 3557059478 ecr 4040464884,nop,wscale 7], length 0
13:36:25.615992 IP 172.28.5.4.44122 > 172.28.5.1.6379: Flags [P.], seq 1:7, ack 1, win 229, options [nop,nop,TS val 4040464884 ecr 3557059478], length 6: RESP "PING"
13:36:25.616115 IP 172.28.5.1.6379 > 172.28.5.4.44122: Flags [.], ack 7, win 227, options [nop,nop,TS val 3557059478 ecr 4040464884], length 0
13:36:25.616376 IP 172.28.5.1.6379 > 172.28.5.4.44122: Flags [P.], seq 1:8, ack 7, win 227, options [nop,nop,TS val 3557059478 ecr 4040464884], length 7: RESP "PONG"
13:36:25.616520 IP 172.28.5.4.44122 > 172.28.5.1.6379: Flags [P.], seq 7:25, ack 8, win 229, options [nop,nop,TS val 4040464884 ecr 3557059478], length 18: RESP "info replication"
13:36:25.616774 IP 172.28.5.1.6379 > 172.28.5.4.44122: Flags [P.], seq 8:535, ack 25, win 227, options [nop,nop,TS val 3557059479 ecr 4040464884], length 527: RESP "# Replication^M^Jrole:slave^M^Jmaster_host:172.28.5.0^M^Jmaster_port:6379^M^Jmaster_link_status:up^M^Jmaster_last_io_seconds_ago:0^M^Jmaster_sync_in_progress:0^M^Jslave_repl_offset:3412029^M^Jslave_priority:100^M^Jslave_read_only:1^M^Jconnected_slaves:0^M^Jmaster_replid:186487241cd9594a4921b48b510ea432fa9dc5d5^M^Jmaster_replid2:0000000000000000000000000000000000000000^M^Jmaster_repl_offset:3412029^M^Jsecond_repl_offset:-1^M^Jrepl_backlog_active:1^M^Jrepl_backlog_size:1048576^M^Jrepl_backlog_first_byte_offset:2363454^M^Jrepl_backlog_histlen:1048576^M^J"
13:36:25.660146 IP 172.28.5.4.44122 > 172.28.5.1.6379: Flags [.], ack 535, win 237, options [nop,nop,TS val 4040464928 ecr 3557059479], length 0
13:36:25.948625 IP 172.28.5.4.48860 > 172.28.5.2.6379: Flags [S], seq 676341280, win 29200, options [mss 1460,sackOK,TS val 3563692498 ecr 0,nop,wscale 7], length 0
13:36:25.948743 IP 172.28.5.2.6379 > 172.28.5.4.48860: Flags [S.], seq 637104812, ack 676341281, win 28960, options [mss 1460,sackOK,TS val 343155803 ecr 3563692498,nop,wscale 7], length 0
13:36:25.948833 IP 172.28.5.4.48860 > 172.28.5.2.6379: Flags [P.], seq 1:7, ack 1, win 229, options [nop,nop,TS val 3563692499 ecr 343155803], length 6: RESP "PING"
13:36:25.948954 IP 172.28.5.2.6379 > 172.28.5.4.48860: Flags [.], ack 7, win 227, options [nop,nop,TS val 343155803 ecr 3563692499], length 0
13:36:25.949327 IP 172.28.5.2.6379 > 172.28.5.4.48860: Flags [P.], seq 1:8, ack 7, win 227, options [nop,nop,TS val 343155803 ecr 3563692499], length 7: RESP "PONG"
13:36:25.949594 IP 172.28.5.4.48860 > 172.28.5.2.6379: Flags [P.], seq 7:25, ack 8, win 229, options [nop,nop,TS val 3563692499 ecr 343155803], length 18: RESP "info replication"
13:36:25.949830 IP 172.28.5.2.6379 > 172.28.5.4.48860: Flags [P.], seq 8:535, ack 25, win 227, options [nop,nop,TS val 343155804 ecr 3563692499], length 527: RESP "# Replication^M^Jrole:slave^M^Jmaster_host:172.28.5.0^M^Jmaster_port:6379^M^Jmaster_link_status:up^M^Jmaster_last_io_seconds_ago:0^M^Jmaster_sync_in_progress:0^M^Jslave_repl_offset:3412177^M^Jslave_priority:100^M^Jslave_read_only:1^M^Jconnected_slaves:0^M^Jmaster_replid:186487241cd9594a4921b48b510ea432fa9dc5d5^M^Jmaster_replid2:0000000000000000000000000000000000000000^M^Jmaster_repl_offset:3412177^M^Jsecond_repl_offset:-1^M^Jrepl_backlog_active:1^M^Jrepl_backlog_size:1048576^M^Jrepl_backlog_first_byte_offset:2363602^M^Jrepl_backlog_histlen:1048576^M^J"
13:36:25.992504 IP 172.28.5.4.48860 > 172.28.5.2.6379: Flags [.], ack 535, win 237, options [nop,nop,TS val 3563692542 ecr 343155804], length 0
13:36:26.283472 IP 172.28.5.4.50888 > 172.28.5.0.6379: Flags [S], seq 923121743, win 29200, options [mss 1460,sackOK,TS val 1842686125 ecr 0,nop,wscale 7], length 0
13:36:26.283631 IP 172.28.5.0.6379 > 172.28.5.4.50888: Flags [S.], seq 2738978568, ack 923121744, win 28960, options [mss 1460,sackOK,TS val 202041059 ecr 1842686125,nop,wscale 7], length 0
13:36:26.283732 IP 172.28.5.4.50888 > 172.28.5.0.6379: Flags [P.], seq 1:7, ack 1, win 229, options [nop,nop,TS val 1842686126 ecr 202041059], length 6: RESP "PING"
13:36:26.283817 IP 172.28.5.0.6379 > 172.28.5.4.50888: Flags [.], ack 7, win 227, options [nop,nop,TS val 202041060 ecr 1842686126], length 0
13:36:26.284084 IP 172.28.5.0.6379 > 172.28.5.4.50888: Flags [P.], seq 1:8, ack 7, win 227, options [nop,nop,TS val 202041060 ecr 1842686126], length 7: RESP "PONG"
13:36:26.284218 IP 172.28.5.4.50888 > 172.28.5.0.6379: Flags [P.], seq 7:25, ack 8, win 229, options [nop,nop,TS val 1842686126 ecr 202041060], length 18: RESP "info replication"
13:36:26.284520 IP 172.28.5.0.6379 > 172.28.5.4.50888: Flags [P.], seq 8:480, ack 25, win 227, options [nop,nop,TS val 202041060 ecr 1842686126], length 472: RESP "# Replication^M^Jrole:master^M^Jconnected_slaves:2^M^Jslave0:ip=172.28.5.2,port=6379,state=online,offset=3412325,lag=0^M^Jslave1:ip=172.28.5.1,port=6379,state=online,offset=3412177,lag=1^M^Jmaster_replid:186487241cd9594a4921b48b510ea432fa9dc5d5^M^Jmaster_replid2:0000000000000000000000000000000000000000^M^Jmaster_repl_offset:3412325^M^Jsecond_repl_offset:-1^M^Jrepl_backlog_active:1^M^Jrepl_backlog_size:1048576^M^Jrepl_backlog_first_byte_offset:2363750^M^Jrepl_backlog_histlen:1048576^M^J"
13:36:26.284653 IP 172.28.5.4.50888 > 172.28.5.0.6379: Flags [P.], seq 25:31, ack 480, win 237, options [nop,nop,TS val 1842686126 ecr 202041060], length 6: RESP "QUIT"
13:36:26.284810 IP 172.28.5.0.6379 > 172.28.5.4.50888: Flags [P.], seq 480:485, ack 31, win 227, options [nop,nop,TS val 202041061 ecr 1842686126], length 5: RESP "OK"
13:36:26.284913 IP 172.28.5.4.50888 > 172.28.5.0.6379: Flags [R.], seq 31, ack 485, win 237, options [nop,nop,TS val 1842686127 ecr 202041061], length 0
13:36:26.284917 IP 172.28.5.0.6379 > 172.28.5.4.50888: Flags [F.], seq 485, ack 31, win 227, options [nop,nop,TS val 202041061 ecr 1842686126], length 0
13:36:26.284957 IP 172.28.5.4.50888 > 172.28.5.0.6379: Flags [R], seq 923121774, win 0, length 0
13:36:26.617491 IP 172.28.5.4.44122 > 172.28.5.1.6379: Flags [R.], seq 25, ack 535, win 237, options [nop,nop,TS val 4040465885 ecr 3557059479], length 0
13:36:26.950107 IP 172.28.5.4.48860 > 172.28.5.2.6379: Flags [R.], seq 25, ack 535, win 237, options [nop,nop,TS val 3563693500 ecr 343155804], length 0
13:36:27.284668 IP 172.28.5.4.50896 > 172.28.5.0.6379: Flags [S], seq 3687312778, win 29200, options [mss 1460,sackOK,TS val 1842687126 ecr 0,nop,wscale 7], length 0
13:36:27.284794 IP 172.28.5.0.6379 > 172.28.5.4.50896: Flags [S.], seq 3716030487, ack 3687312779, win 28960, options [mss 1460,sackOK,TS val 202042061 ecr 1842687126,nop,wscale 7], length 0
13:36:27.284881 IP 172.28.5.4.50896 > 172.28.5.0.6379: Flags [P.], seq 1:7, ack 1, win 229, options [nop,nop,TS val 1842687127 ecr 202042061], length 6: RESP "PING"
13:36:27.284972 IP 172.28.5.0.6379 > 172.28.5.4.50896: Flags [.], ack 7, win 227, options [nop,nop,TS val 202042061 ecr 1842687127], length 0
13:36:27.285221 IP 172.28.5.0.6379 > 172.28.5.4.50896: Flags [P.], seq 1:8, ack 7, win 227, options [nop,nop,TS val 202042061 ecr 1842687127], length 7: RESP "PONG"
13:36:27.285372 IP 172.28.5.4.50896 > 172.28.5.0.6379: Flags [P.], seq 7:25, ack 8, win 229, options [nop,nop,TS val 1842687127 ecr 202042061], length 18: RESP "info replication"
13:36:27.285693 IP 172.28.5.0.6379 > 172.28.5.4.50896: Flags [P.], seq 8:480, ack 25, win 227, options [nop,nop,TS val 202042061 ecr 1842687127], length 472: RESP "# Replication^M^Jrole:master^M^Jconnected_slaves:2^M^Jslave0:ip=172.28.5.2,port=6379,state=online,offset=3412325,lag=0^M^Jslave1:ip=172.28.5.1,port=6379,state=online,offset=3412325,lag=1^M^Jmaster_replid:186487241cd9594a4921b48b510ea432fa9dc5d5^M^Jmaster_replid2:0000000000000000000000000000000000000000^M^Jmaster_repl_offset:3412325^M^Jsecond_repl_offset:-1^M^Jrepl_backlog_active:1^M^Jrepl_backlog_size:1048576^M^Jrepl_backlog_first_byte_offset:2363750^M^Jrepl_backlog_histlen:1048576^M^J"
13:36:27.285830 IP 172.28.5.4.50896 > 172.28.5.0.6379: Flags [P.], seq 25:31, ack 480, win 237, options [nop,nop,TS val 1842687128 ecr 202042061], length 6: RESP "QUIT"
13:36:27.286051 IP 172.28.5.0.6379 > 172.28.5.4.50896: Flags [P.], seq 480:485, ack 31, win 227, options [nop,nop,TS val 202042062 ecr 1842687128], length 5: RESP "OK"
13:36:27.286144 IP 172.28.5.0.6379 > 172.28.5.4.50896: Flags [F.], seq 485, ack 31, win 227, options [nop,nop,TS val 202042062 ecr 1842687128], length 0
13:36:27.286203 IP 172.28.5.4.50896 > 172.28.5.0.6379: Flags [R.], seq 31, ack 486, win 237, options [nop,nop,TS val 1842687128 ecr 202042062], length 0
13:36:27.619260 IP 172.28.5.4.44142 > 172.28.5.1.6379: Flags [S], seq 3678772873, win 29200, options [mss 1460,sackOK,TS val 4040466887 ecr 0,nop,wscale 7], length 0
13:36:27.619426 IP 172.28.5.1.6379 > 172.28.5.4.44142: Flags [S.], seq 141598137, ack 3678772874, win 28960, options [mss 1460,sackOK,TS val 3557061481 ecr 4040466887,nop,wscale 7], length 0
13:36:27.619537 IP 172.28.5.4.44142 > 172.28.5.1.6379: Flags [P.], seq 1:7, ack 1, win 229, options [nop,nop,TS val 4040466887 ecr 3557061481], length 6: RESP "PING"
13:36:27.619646 IP 172.28.5.1.6379 > 172.28.5.4.44142: Flags [.], ack 7, win 227, options [nop,nop,TS val 3557061481 ecr 4040466887], length 0
13:36:27.619938 IP 172.28.5.1.6379 > 172.28.5.4.44142: Flags [P.], seq 1:8, ack 7, win 227, options [nop,nop,TS val 3557061482 ecr 4040466887], length 7: RESP "PONG"
13:36:27.620132 IP 172.28.5.4.44142 > 172.28.5.1.6379: Flags [P.], seq 7:25, ack 8, win 229, options [nop,nop,TS val 4040466888 ecr 3557061482], length 18: RESP "info replication"
13:36:27.620425 IP 172.28.5.1.6379 > 172.28.5.4.44142: Flags [P.], seq 8:535, ack 25, win 227, options [nop,nop,TS val 3557061482 ecr 4040466888], length 527: RESP "# Replication^M^Jrole:slave^M^Jmaster_host:172.28.5.0^M^Jmaster_port:6379^M^Jmaster_link_status:up^M^Jmaster_last_io_seconds_ago:0^M^Jmaster_sync_in_progress:0^M^Jslave_repl_offset:3412473^M^Jslave_priority:100^M^Jslave_read_only:1^M^Jconnected_slaves:0^M^Jmaster_replid:186487241cd9594a4921b48b510ea432fa9dc5d5^M^Jmaster_replid2:0000000000000000000000000000000000000000^M^Jmaster_repl_offset:3412473^M^Jsecond_repl_offset:-1^M^Jrepl_backlog_active:1^M^Jrepl_backlog_size:1048576^M^Jrepl_backlog_first_byte_offset:2363898^M^Jrepl_backlog_histlen:1048576^M^J"
13:36:27.664531 IP 172.28.5.4.44142 > 172.28.5.1.6379: Flags [.], ack 535, win 237, options [nop,nop,TS val 4040466932 ecr 3557061482], length 0
13:36:27.952191 IP 172.28.5.4.48880 > 172.28.5.2.6379: Flags [S], seq 3312264374, win 29200, options [mss 1460,sackOK,TS val 3563694502 ecr 0,nop,wscale 7], length 0
13:36:27.952362 IP 172.28.5.2.6379 > 172.28.5.4.48880: Flags [S.], seq 1808104191, ack 3312264375, win 28960, options [mss 1460,sackOK,TS val 343157806 ecr 3563694502,nop,wscale 7], length 0
13:36:27.952474 IP 172.28.5.4.48880 > 172.28.5.2.6379: Flags [P.], seq 1:7, ack 1, win 229, options [nop,nop,TS val 3563694502 ecr 343157806], length 6: RESP "PING"
13:36:27.952571 IP 172.28.5.2.6379 > 172.28.5.4.48880: Flags [.], ack 7, win 227, options [nop,nop,TS val 343157806 ecr 3563694502], length 0
13:36:27.953028 IP 172.28.5.2.6379 > 172.28.5.4.48880: Flags [P.], seq 1:8, ack 7, win 227, options [nop,nop,TS val 343157807 ecr 3563694502], length 7: RESP "PONG"
13:36:27.953222 IP 172.28.5.4.48880 > 172.28.5.2.6379: Flags [P.], seq 7:25, ack 8, win 229, options [nop,nop,TS val 3563694503 ecr 343157807], length 18: RESP "info replication"
13:36:27.953505 IP 172.28.5.2.6379 > 172.28.5.4.48880: Flags [P.], seq 8:535, ack 25, win 227, options [nop,nop,TS val 343157807 ecr 3563694503], length 527: RESP "# Replication^M^Jrole:slave^M^Jmaster_host:172.28.5.0^M^Jmaster_port:6379^M^Jmaster_link_status:up^M^Jmaster_last_io_seconds_ago:0^M^Jmaster_sync_in_progress:0^M^Jslave_repl_offset:3412621^M^Jslave_priority:100^M^Jslave_read_only:1^M^Jconnected_slaves:0^M^Jmaster_replid:186487241cd9594a4921b48b510ea432fa9dc5d5^M^Jmaster_replid2:0000000000000000000000000000000000000000^M^Jmaster_repl_offset:3412621^M^Jsecond_repl_offset:-1^M^Jrepl_backlog_active:1^M^Jrepl_backlog_size:1048576^M^Jrepl_backlog_first_byte_offset:2364046^M^Jrepl_backlog_histlen:1048576^M^J"
13:36:27.996517 IP 172.28.5.4.48880 > 172.28.5.2.6379: Flags [.], ack 535, win 237, options [nop,nop,TS val 3563694546 ecr 343157807], length 0
13:36:28.286603 IP 172.28.5.4.50908 > 172.28.5.0.6379: Flags [S], seq 2194559231, win 29200, options [mss 1460,sackOK,TS val 1842688128 ecr 0,nop,wscale 7], length 0
13:36:28.286770 IP 172.28.5.0.6379 > 172.28.5.4.50908: Flags [S.], seq 954275959, ack 2194559232, win 28960, options [mss 1460,sackOK,TS val 202043063 ecr 1842688128,nop,wscale 7], length 0
13:36:28.286899 IP 172.28.5.4.50908 > 172.28.5.0.6379: Flags [P.], seq 1:7, ack 1, win 229, options [nop,nop,TS val 1842688129 ecr 202043063], length 6: RESP "PING"
13:36:28.287026 IP 172.28.5.0.6379 > 172.28.5.4.50908: Flags [.], ack 7, win 227, options [nop,nop,TS val 202043063 ecr 1842688129], length 0
13:36:28.287298 IP 172.28.5.0.6379 > 172.28.5.4.50908: Flags [P.], seq 1:8, ack 7, win 227, options [nop,nop,TS val 202043063 ecr 1842688129], length 7: RESP "PONG"
13:36:28.287413 IP 172.28.5.4.50908 > 172.28.5.0.6379: Flags [P.], seq 7:25, ack 8, win 229, options [nop,nop,TS val 1842688129 ecr 202043063], length 18: RESP "info replication"
13:36:28.287625 IP 172.28.5.0.6379 > 172.28.5.4.50908: Flags [P.], seq 8:480, ack 25, win 227, options [nop,nop,TS val 202043063 ecr 1842688129], length 472: RESP "# Replication^M^Jrole:master^M^Jconnected_slaves:2^M^Jslave0:ip=172.28.5.2,port=6379,state=online,offset=3412769,lag=0^M^Jslave1:ip=172.28.5.1,port=6379,state=online,offset=3412621,lag=1^M^Jmaster_replid:186487241cd9594a4921b48b510ea432fa9dc5d5^M^Jmaster_replid2:0000000000000000000000000000000000000000^M^Jmaster_repl_offset:3412769^M^Jsecond_repl_offset:-1^M^Jrepl_backlog_active:1^M^Jrepl_backlog_size:1048576^M^Jrepl_backlog_first_byte_offset:2364194^M^Jrepl_backlog_histlen:1048576^M^J"
13:36:28.287705 IP 172.28.5.4.50908 > 172.28.5.0.6379: Flags [P.], seq 25:31, ack 480, win 237, options [nop,nop,TS val 1842688130 ecr 202043063], length 6: RESP "QUIT"
13:36:28.287817 IP 172.28.5.0.6379 > 172.28.5.4.50908: Flags [P.], seq 480:485, ack 31, win 227, options [nop,nop,TS val 202043064 ecr 1842688130], length 5: RESP "OK"
13:36:28.287899 IP 172.28.5.4.50908 > 172.28.5.0.6379: Flags [R.], seq 31, ack 485, win 237, options [nop,nop,TS val 1842688130 ecr 202043064], length 0
13:36:28.287900 IP 172.28.5.0.6379 > 172.28.5.4.50908: Flags [F.], seq 485, ack 31, win 227, options [nop,nop,TS val 202043064 ecr 1842688130], length 0
13:36:28.287934 IP 172.28.5.4.50908 > 172.28.5.0.6379: Flags [R], seq 2194559262, win 0, length 0
13:36:28.621754 IP 172.28.5.4.44142 > 172.28.5.1.6379: Flags [R.], seq 25, ack 535, win 237, options [nop,nop,TS val 4040467890 ecr 3557061482], length 0
13:36:28.953409 IP 172.28.5.4.48880 > 172.28.5.2.6379: Flags [R.], seq 25, ack 535, win 237, options [nop,nop,TS val 3563695503 ecr 343157807], length 0
13:36:29.288480 IP 172.28.5.4.50916 > 172.28.5.0.6379: Flags [S], seq 1857737162, win 29200, options [mss 1460,sackOK,TS val 1842689130 ecr 0,nop,wscale 7], length 0
13:36:29.288733 IP 172.28.5.0.6379 > 172.28.5.4.50916: Flags [S.], seq 2734085388, ack 1857737163, win 28960, options [mss 1460,sackOK,TS val 202044065 ecr 1842689130,nop,wscale 7], length 0
13:36:29.288885 IP 172.28.5.4.50916 > 172.28.5.0.6379: Flags [P.], seq 1:7, ack 1, win 229, options [nop,nop,TS val 1842689131 ecr 202044065], length 6: RESP "PING"
13:36:29.289016 IP 172.28.5.0.6379 > 172.28.5.4.50916: Flags [.], ack 7, win 227, options [nop,nop,TS val 202044065 ecr 1842689131], length 0
13:36:29.289509 IP 172.28.5.0.6379 > 172.28.5.4.50916: Flags [P.], seq 1:8, ack 7, win 227, options [nop,nop,TS val 202044065 ecr 1842689131], length 7: RESP "PONG"
13:36:29.289793 IP 172.28.5.4.50916 > 172.28.5.0.6379: Flags [P.], seq 7:25, ack 8, win 229, options [nop,nop,TS val 1842689132 ecr 202044065], length 18: RESP "info replication"
13:36:29.290303 IP 172.28.5.0.6379 > 172.28.5.4.50916: Flags [P.], seq 8:480, ack 25, win 227, options [nop,nop,TS val 202044066 ecr 1842689132], length 472: RESP "# Replication^M^Jrole:master^M^Jconnected_slaves:2^M^Jslave0:ip=172.28.5.2,port=6379,state=online,offset=3412769,lag=0^M^Jslave1:ip=172.28.5.1,port=6379,state=online,offset=3412769,lag=1^M^Jmaster_replid:186487241cd9594a4921b48b510ea432fa9dc5d5^M^Jmaster_replid2:0000000000000000000000000000000000000000^M^Jmaster_repl_offset:3412769^M^Jsecond_repl_offset:-1^M^Jrepl_backlog_active:1^M^Jrepl_backlog_size:1048576^M^Jrepl_backlog_first_byte_offset:2364194^M^Jrepl_backlog_histlen:1048576^M^J"
13:36:29.290465 IP 172.28.5.4.50916 > 172.28.5.0.6379: Flags [P.], seq 25:31, ack 480, win 237, options [nop,nop,TS val 1842689132 ecr 202044066], length 6: RESP "QUIT"
13:36:29.290517 IP 172.28.5.0.6379 > 172.28.5.4.50916: Flags [P.], seq 480:485, ack 31, win 227, options [nop,nop,TS val 202044066 ecr 1842689132], length 5: RESP "OK"
13:36:29.290543 IP 172.28.5.0.6379 > 172.28.5.4.50916: Flags [F.], seq 485, ack 31, win 227, options [nop,nop,TS val 202044066 ecr 1842689132], length 0
13:36:29.290581 IP 172.28.5.4.50916 > 172.28.5.0.6379: Flags [F.], seq 31, ack 486, win 237, options [nop,nop,TS val 1842689132 ecr 202044066], length 0
13:36:29.290605 IP 172.28.5.0.6379 > 172.28.5.4.50916: Flags [.], ack 32, win 227, options [nop,nop,TS val 202044066 ecr 1842689132], length 0
13:36:29.623211 IP 172.28.5.4.44162 > 172.28.5.1.6379: Flags [S], seq 1430156191, win 29200, options [mss 1460,sackOK,TS val 4040468891 ecr 0,nop,wscale 7], length 0
13:36:29.623372 IP 172.28.5.1.6379 > 172.28.5.4.44162: Flags [S.], seq 562416372, ack 1430156192, win 28960, options [mss 1460,sackOK,TS val 3557063485 ecr 4040468891,nop,wscale 7], length 0
13:36:29.623478 IP 172.28.5.4.44162 > 172.28.5.1.6379: Flags [P.], seq 1:7, ack 1, win 229, options [nop,nop,TS val 4040468891 ecr 3557063485], length 6: RESP "PING"
13:36:29.623568 IP 172.28.5.1.6379 > 172.28.5.4.44162: Flags [.], ack 7, win 227, options [nop,nop,TS val 3557063485 ecr 4040468891], length 0
13:36:29.623858 IP 172.28.5.1.6379 > 172.28.5.4.44162: Flags [P.], seq 1:8, ack 7, win 227, options [nop,nop,TS val 3557063486 ecr 4040468891], length 7: RESP "PONG"
13:36:29.624030 IP 172.28.5.4.44162 > 172.28.5.1.6379: Flags [P.], seq 7:25, ack 8, win 229, options [nop,nop,TS val 4040468892 ecr 3557063486], length 18: RESP "info replication"
13:36:29.624348 IP 172.28.5.1.6379 > 172.28.5.4.44162: Flags [P.], seq 8:535, ack 25, win 227, options [nop,nop,TS val 3557063486 ecr 4040468892], length 527: RESP "# Replication^M^Jrole:slave^M^Jmaster_host:172.28.5.0^M^Jmaster_port:6379^M^Jmaster_link_status:up^M^Jmaster_last_io_seconds_ago:0^M^Jmaster_sync_in_progress:0^M^Jslave_repl_offset:3412917^M^Jslave_priority:100^M^Jslave_read_only:1^M^Jconnected_slaves:0^M^Jmaster_replid:186487241cd9594a4921b48b510ea432fa9dc5d5^M^Jmaster_replid2:0000000000000000000000000000000000000000^M^Jmaster_repl_offset:3412917^M^Jsecond_repl_offset:-1^M^Jrepl_backlog_active:1^M^Jrepl_backlog_size:1048576^M^Jrepl_backlog_first_byte_offset:2364342^M^Jrepl_backlog_histlen:1048576^M^J"
13:36:29.668119 IP 172.28.5.4.44162 > 172.28.5.1.6379: Flags [.], ack 535, win 237, options [nop,nop,TS val 4040468936 ecr 3557063486], length 0
13:36:29.955076 IP 172.28.5.4.48900 > 172.28.5.2.6379: Flags [S], seq 669112119, win 29200, options [mss 1460,sackOK,TS val 3563696505 ecr 0,nop,wscale 7], length 0
13:36:29.955213 IP 172.28.5.2.6379 > 172.28.5.4.48900: Flags [S.], seq 1095545889, ack 669112120, win 28960, options [mss 1460,sackOK,TS val 343159809 ecr 3563696505,nop,wscale 7], length 0
13:36:29.955309 IP 172.28.5.4.48900 > 172.28.5.2.6379: Flags [P.], seq 1:7, ack 1, win 229, options [nop,nop,TS val 3563696505 ecr 343159809], length 6: RESP "PING"
13:36:29.955388 IP 172.28.5.2.6379 > 172.28.5.4.48900: Flags [.], ack 7, win 227, options [nop,nop,TS val 343159809 ecr 3563696505], length 0
13:36:29.955714 IP 172.28.5.2.6379 > 172.28.5.4.48900: Flags [P.], seq 1:8, ack 7, win 227, options [nop,nop,TS val 343159809 ecr 3563696505], length 7: RESP "PONG"
13:36:29.955891 IP 172.28.5.4.48900 > 172.28.5.2.6379: Flags [P.], seq 7:25, ack 8, win 229, options [nop,nop,TS val 3563696506 ecr 343159809], length 18: RESP "info replication"
13:36:29.956215 IP 172.28.5.2.6379 > 172.28.5.4.48900: Flags [P.], seq 8:535, ack 25, win 227, options [nop,nop,TS val 343159810 ecr 3563696506], length 527: RESP "# Replication^M^Jrole:slave^M^Jmaster_host:172.28.5.0^M^Jmaster_port:6379^M^Jmaster_link_status:up^M^Jmaster_last_io_seconds_ago:0^M^Jmaster_sync_in_progress:0^M^Jslave_repl_offset:3413065^M^Jslave_priority:100^M^Jslave_read_only:1^M^Jconnected_slaves:0^M^Jmaster_replid:186487241cd9594a4921b48b510ea432fa9dc5d5^M^Jmaster_replid2:0000000000000000000000000000000000000000^M^Jmaster_repl_offset:3413065^M^Jsecond_repl_offset:-1^M^Jrepl_backlog_active:1^M^Jrepl_backlog_size:1048576^M^Jrepl_backlog_first_byte_offset:2364490^M^Jrepl_backlog_histlen:1048576^M^J"
13:36:30.000218 IP 172.28.5.4.48900 > 172.28.5.2.6379: Flags [.], ack 535, win 237, options [nop,nop,TS val 3563696550 ecr 343159810], length 0
13:36:30.292447 IP 172.28.5.4.50928 > 172.28.5.0.6379: Flags [S], seq 1329714953, win 29200, options [mss 1460,sackOK,TS val 1842690134 ecr 0,nop,wscale 7], length 0
13:36:30.292571 IP 172.28.5.0.6379 > 172.28.5.4.50928: Flags [S.], seq 412014249, ack 1329714954, win 28960, options [mss 1460,sackOK,TS val 202045068 ecr 1842690134,nop,wscale 7], length 0
13:36:30.292662 IP 172.28.5.4.50928 > 172.28.5.0.6379: Flags [P.], seq 1:7, ack 1, win 229, options [nop,nop,TS val 1842690134 ecr 202045068], length 6: RESP "PING"
13:36:30.292743 IP 172.28.5.0.6379 > 172.28.5.4.50928: Flags [.], ack 7, win 227, options [nop,nop,TS val 202045069 ecr 1842690134], length 0
13:36:30.293023 IP 172.28.5.0.6379 > 172.28.5.4.50928: Flags [P.], seq 1:8, ack 7, win 227, options [nop,nop,TS val 202045069 ecr 1842690134], length 7: RESP "PONG"
13:36:30.293192 IP 172.28.5.4.50928 > 172.28.5.0.6379: Flags [P.], seq 7:25, ack 8, win 229, options [nop,nop,TS val 1842690135 ecr 202045069], length 18: RESP "info replication"
13:36:30.293471 IP 172.28.5.0.6379 > 172.28.5.4.50928: Flags [P.], seq 8:480, ack 25, win 227, options [nop,nop,TS val 202045069 ecr 1842690135], length 472: RESP "# Replication^M^Jrole:master^M^Jconnected_slaves:2^M^Jslave0:ip=172.28.5.2,port=6379,state=online,offset=3413213,lag=0^M^Jslave1:ip=172.28.5.1,port=6379,state=online,offset=3413065,lag=1^M^Jmaster_replid:186487241cd9594a4921b48b510ea432fa9dc5d5^M^Jmaster_replid2:0000000000000000000000000000000000000000^M^Jmaster_repl_offset:3413213^M^Jsecond_repl_offset:-1^M^Jrepl_backlog_active:1^M^Jrepl_backlog_size:1048576^M^Jrepl_backlog_first_byte_offset:2364638^M^Jrepl_backlog_histlen:1048576^M^J"
13:36:30.293645 IP 172.28.5.4.50928 > 172.28.5.0.6379: Flags [P.], seq 25:31, ack 480, win 237, options [nop,nop,TS val 1842690135 ecr 202045069], length 6: RESP "QUIT"
13:36:30.293840 IP 172.28.5.0.6379 > 172.28.5.4.50928: Flags [P.], seq 480:485, ack 31, win 227, options [nop,nop,TS val 202045070 ecr 1842690135], length 5: RESP "OK"
13:36:30.293962 IP 172.28.5.4.50928 > 172.28.5.0.6379: Flags [R.], seq 31, ack 485, win 237, options [nop,nop,TS val 1842690136 ecr 202045070], length 0
13:36:30.293969 IP 172.28.5.0.6379 > 172.28.5.4.50928: Flags [F.], seq 485, ack 31, win 227, options [nop,nop,TS val 202045070 ecr 1842690135], length 0
13:36:30.294010 IP 172.28.5.4.50928 > 172.28.5.0.6379: Flags [R], seq 1329714984, win 0, length 0
13:36:30.625258 IP 172.28.5.4.44162 > 172.28.5.1.6379: Flags [R.], seq 25, ack 535, win 237, options [nop,nop,TS val 4040469893 ecr 3557063486], length 0
13:36:30.955921 IP 172.28.5.4.48900 > 172.28.5.2.6379: Flags [R.], seq 25, ack 535, win 237, options [nop,nop,TS val 3563697506 ecr 343159810], length 0
13:36:31.294684 IP 172.28.5.4.50936 > 172.28.5.0.6379: Flags [S], seq 46727427, win 29200, options [mss 1460,sackOK,TS val 1842691136 ecr 0,nop,wscale 7], length 0
13:36:31.294833 IP 172.28.5.0.6379 > 172.28.5.4.50936: Flags [S.], seq 2837431305, ack 46727428, win 28960, options [mss 1460,sackOK,TS val 202046071 ecr 1842691136,nop,wscale 7], length 0
13:36:31.294938 IP 172.28.5.4.50936 > 172.28.5.0.6379: Flags [P.], seq 1:7, ack 1, win 229, options [nop,nop,TS val 1842691137 ecr 202046071], length 6: RESP "PING"
13:36:31.295042 IP 172.28.5.0.6379 > 172.28.5.4.50936: Flags [.], ack 7, win 227, options [nop,nop,TS val 202046071 ecr 1842691137], length 0
13:36:31.295294 IP 172.28.5.0.6379 > 172.28.5.4.50936: Flags [P.], seq 1:8, ack 7, win 227, options [nop,nop,TS val 202046071 ecr 1842691137], length 7: RESP "PONG"
13:36:31.295384 IP 172.28.5.4.50936 > 172.28.5.0.6379: Flags [P.], seq 7:25, ack 8, win 229, options [nop,nop,TS val 1842691137 ecr 202046071], length 18: RESP "info replication"
13:36:31.295530 IP 172.28.5.0.6379 > 172.28.5.4.50936: Flags [P.], seq 8:480, ack 25, win 227, options [nop,nop,TS val 202046071 ecr 1842691137], length 472: RESP "# Replication^M^Jrole:master^M^Jconnected_slaves:2^M^Jslave0:ip=172.28.5.2,port=6379,state=online,offset=3413213,lag=0^M^Jslave1:ip=172.28.5.1,port=6379,state=online,offset=3413213,lag=1^M^Jmaster_replid:186487241cd9594a4921b48b510ea432fa9dc5d5^M^Jmaster_replid2:0000000000000000000000000000000000000000^M^Jmaster_repl_offset:3413213^M^Jsecond_repl_offset:-1^M^Jrepl_backlog_active:1^M^Jrepl_backlog_size:1048576^M^Jrepl_backlog_first_byte_offset:2364638^M^Jrepl_backlog_histlen:1048576^M^J"
13:36:31.295595 IP 172.28.5.4.50936 > 172.28.5.0.6379: Flags [P.], seq 25:31, ack 480, win 237, options [nop,nop,TS val 1842691137 ecr 202046071], length 6: RESP "QUIT"
13:36:31.295703 IP 172.28.5.0.6379 > 172.28.5.4.50936: Flags [P.], seq 480:485, ack 31, win 227, options [nop,nop,TS val 202046072 ecr 1842691137], length 5: RESP "OK"
13:36:31.295765 IP 172.28.5.0.6379 > 172.28.5.4.50936: Flags [F.], seq 485, ack 31, win 227, options [nop,nop,TS val 202046072 ecr 1842691137], length 0
13:36:31.295843 IP 172.28.5.4.50936 > 172.28.5.0.6379: Flags [F.], seq 31, ack 486, win 237, options [nop,nop,TS val 1842691138 ecr 202046072], length 0
13:36:31.295902 IP 172.28.5.0.6379 > 172.28.5.4.50936: Flags [.], ack 32, win 227, options [nop,nop,TS val 202046072 ecr 1842691138], length 0
13:36:31.627456 IP 172.28.5.4.44182 > 172.28.5.1.6379: Flags [S], seq 2945894136, win 29200, options [mss 1460,sackOK,TS val 4040470895 ecr 0,nop,wscale 7], length 0
13:36:31.627575 IP 172.28.5.1.6379 > 172.28.5.4.44182: Flags [S.], seq 3127639804, ack 2945894137, win 28960, options [mss 1460,sackOK,TS val 3557065489 ecr 4040470895,nop,wscale 7], length 0
13:36:31.627657 IP 172.28.5.4.44182 > 172.28.5.1.6379: Flags [P.], seq 1:7, ack 1, win 229, options [nop,nop,TS val 4040470895 ecr 3557065489], length 6: RESP "PING"
13:36:31.627737 IP 172.28.5.1.6379 > 172.28.5.4.44182: Flags [.], ack 7, win 227, options [nop,nop,TS val 3557065490 ecr 4040470895], length 0
13:36:31.627961 IP 172.28.5.1.6379 > 172.28.5.4.44182: Flags [P.], seq 1:8, ack 7, win 227, options [nop,nop,TS val 3557065490 ecr 4040470895], length 7: RESP "PONG"
13:36:31.628074 IP 172.28.5.4.44182 > 172.28.5.1.6379: Flags [P.], seq 7:25, ack 8, win 229, options [nop,nop,TS val 4040470896 ecr 3557065490], length 18: RESP "info replication"
13:36:31.628262 IP 172.28.5.1.6379 > 172.28.5.4.44182: Flags [P.], seq 8:535, ack 25, win 227, options [nop,nop,TS val 3557065490 ecr 4040470896], length 527: RESP "# Replication^M^Jrole:slave^M^Jmaster_host:172.28.5.0^M^Jmaster_port:6379^M^Jmaster_link_status:up^M^Jmaster_last_io_seconds_ago:0^M^Jmaster_sync_in_progress:0^M^Jslave_repl_offset:3413361^M^Jslave_priority:100^M^Jslave_read_only:1^M^Jconnected_slaves:0^M^Jmaster_replid:186487241cd9594a4921b48b510ea432fa9dc5d5^M^Jmaster_replid2:0000000000000000000000000000000000000000^M^Jmaster_repl_offset:3413361^M^Jsecond_repl_offset:-1^M^Jrepl_backlog_active:1^M^Jrepl_backlog_size:1048576^M^Jrepl_backlog_first_byte_offset:2364786^M^Jrepl_backlog_histlen:1048576^M^J"
13:36:31.672170 IP 172.28.5.4.44182 > 172.28.5.1.6379: Flags [.], ack 535, win 237, options [nop,nop,TS val 4040470940 ecr 3557065490], length 0
13:36:31.956858 IP 172.28.5.4.48920 > 172.28.5.2.6379: Flags [S], seq 1778813594, win 29200, options [mss 1460,sackOK,TS val 3563698507 ecr 0,nop,wscale 7], length 0
13:36:31.956979 IP 172.28.5.2.6379 > 172.28.5.4.48920: Flags [S.], seq 3026572356, ack 1778813595, win 28960, options [mss 1460,sackOK,TS val 343161811 ecr 3563698507,nop,wscale 7], length 0
13:36:31.957067 IP 172.28.5.4.48920 > 172.28.5.2.6379: Flags [P.], seq 1:7, ack 1, win 229, options [nop,nop,TS val 3563698507 ecr 343161811], length 6: RESP "PING"
13:36:31.957136 IP 172.28.5.2.6379 > 172.28.5.4.48920: Flags [.], ack 7, win 227, options [nop,nop,TS val 343161811 ecr 3563698507], length 0
13:36:31.957384 IP 172.28.5.2.6379 > 172.28.5.4.48920: Flags [P.], seq 1:8, ack 7, win 227, options [nop,nop,TS val 343161811 ecr 3563698507], length 7: RESP "PONG"
13:36:31.957541 IP 172.28.5.4.48920 > 172.28.5.2.6379: Flags [P.], seq 7:25, ack 8, win 229, options [nop,nop,TS val 3563698507 ecr 343161811], length 18: RESP "info replication"
13:36:31.957759 IP 172.28.5.2.6379 > 172.28.5.4.48920: Flags [P.], seq 8:535, ack 25, win 227, options [nop,nop,TS val 343161812 ecr 3563698507], length 527: RESP "# Replication^M^Jrole:slave^M^Jmaster_host:172.28.5.0^M^Jmaster_port:6379^M^Jmaster_link_status:up^M^Jmaster_last_io_seconds_ago:0^M^Jmaster_sync_in_progress:0^M^Jslave_repl_offset:3413523^M^Jslave_priority:100^M^Jslave_read_only:1^M^Jconnected_slaves:0^M^Jmaster_replid:186487241cd9594a4921b48b510ea432fa9dc5d5^M^Jmaster_replid2:0000000000000000000000000000000000000000^M^Jmaster_repl_offset:3413523^M^Jsecond_repl_offset:-1^M^Jrepl_backlog_active:1^M^Jrepl_backlog_size:1048576^M^Jrepl_backlog_first_byte_offset:2364948^M^Jrepl_backlog_histlen:1048576^M^J"
13:36:32.000101 IP 172.28.5.4.48920 > 172.28.5.2.6379: Flags [.], ack 535, win 237, options [nop,nop,TS val 3563698550 ecr 343161812], length 0
13:36:32.296502 IP 172.28.5.4.50948 > 172.28.5.0.6379: Flags [S], seq 2696998483, win 29200, options [mss 1460,sackOK,TS val 1842692138 ecr 0,nop,wscale 7], length 0
13:36:32.297017 IP 172.28.5.0.6379 > 172.28.5.4.50948: Flags [S.], seq 2348235221, ack 2696998484, win 28960, options [mss 1460,sackOK,TS val 202047073 ecr 1842692138,nop,wscale 7], length 0
13:36:32.297603 IP 172.28.5.4.50948 > 172.28.5.0.6379: Flags [P.], seq 1:7, ack 1, win 229, options [nop,nop,TS val 1842692139 ecr 202047073], length 6: RESP "PING"
13:36:32.297949 IP 172.28.5.0.6379 > 172.28.5.4.50948: Flags [.], ack 7, win 227, options [nop,nop,TS val 202047074 ecr 1842692139], length 0
13:36:32.298701 IP 172.28.5.0.6379 > 172.28.5.4.50948: Flags [P.], seq 1:8, ack 7, win 227, options [nop,nop,TS val 202047074 ecr 1842692139], length 7: RESP "PONG"
13:36:32.299220 IP 172.28.5.4.50948 > 172.28.5.0.6379: Flags [P.], seq 7:25, ack 8, win 229, options [nop,nop,TS val 1842692141 ecr 202047074], length 18: RESP "info replication"
13:36:32.299922 IP 172.28.5.0.6379 > 172.28.5.4.50948: Flags [P.], seq 8:480, ack 25, win 227, options [nop,nop,TS val 202047076 ecr 1842692141], length 472: RESP "# Replication^M^Jrole:master^M^Jconnected_slaves:2^M^Jslave0:ip=172.28.5.2,port=6379,state=online,offset=3413671,lag=0^M^Jslave1:ip=172.28.5.1,port=6379,state=online,offset=3413523,lag=1^M^Jmaster_replid:186487241cd9594a4921b48b510ea432fa9dc5d5^M^Jmaster_replid2:0000000000000000000000000000000000000000^M^Jmaster_repl_offset:3413671^M^Jsecond_repl_offset:-1^M^Jrepl_backlog_active:1^M^Jrepl_backlog_size:1048576^M^Jrepl_backlog_first_byte_offset:2365096^M^Jrepl_backlog_histlen:1048576^M^J"
13:36:32.300298 IP 172.28.5.4.50948 > 172.28.5.0.6379: Flags [P.], seq 25:31, ack 480, win 237, options [nop,nop,TS val 1842692142 ecr 202047076], length 6: RESP "QUIT"
13:36:32.300688 IP 172.28.5.0.6379 > 172.28.5.4.50948: Flags [P.], seq 480:485, ack 31, win 227, options [nop,nop,TS val 202047076 ecr 1842692142], length 5: RESP "OK"
13:36:32.300919 IP 172.28.5.0.6379 > 172.28.5.4.50948: Flags [F.], seq 485, ack 31, win 227, options [nop,nop,TS val 202047077 ecr 1842692142], length 0
13:36:32.301437 IP 172.28.5.4.50948 > 172.28.5.0.6379: Flags [F.], seq 31, ack 486, win 237, options [nop,nop,TS val 1842692143 ecr 202047076], length 0
13:36:32.301693 IP 172.28.5.0.6379 > 172.28.5.4.50948: Flags [.], ack 32, win 227, options [nop,nop,TS val 202047077 ecr 1842692143], length 0
13:36:32.633474 IP 172.28.5.4.44182 > 172.28.5.1.6379: Flags [R.], seq 25, ack 535, win 237, options [nop,nop,TS val 4040471901 ecr 3557065490], length 0
13:36:32.959030 IP 172.28.5.4.48920 > 172.28.5.2.6379: Flags [R.], seq 25, ack 535, win 237, options [nop,nop,TS val 3563699509 ecr 343161812], length 0
13:36:33.298777 IP 172.28.5.4.50956 > 172.28.5.0.6379: Flags [S], seq 3655901760, win 29200, options [mss 1460,sackOK,TS val 1842693141 ecr 0,nop,wscale 7], length 0
13:36:33.298962 IP 172.28.5.0.6379 > 172.28.5.4.50956: Flags [S.], seq 877994247, ack 3655901761, win 28960, options [mss 1460,sackOK,TS val 202048075 ecr 1842693141,nop,wscale 7], length 0
13:36:33.299282 IP 172.28.5.4.50956 > 172.28.5.0.6379: Flags [P.], seq 1:7, ack 1, win 229, options [nop,nop,TS val 1842693141 ecr 202048075], length 6: RESP "PING"
13:36:33.299429 IP 172.28.5.0.6379 > 172.28.5.4.50956: Flags [.], ack 7, win 227, options [nop,nop,TS val 202048075 ecr 1842693141], length 0
13:36:33.299717 IP 172.28.5.0.6379 > 172.28.5.4.50956: Flags [P.], seq 1:8, ack 7, win 227, options [nop,nop,TS val 202048075 ecr 1842693141], length 7: RESP "PONG"
13:36:33.299947 IP 172.28.5.4.50956 > 172.28.5.0.6379: Flags [P.], seq 7:25, ack 8, win 229, options [nop,nop,TS val 1842693142 ecr 202048075], length 18: RESP "info replication"
13:36:33.300357 IP 172.28.5.0.6379 > 172.28.5.4.50956: Flags [P.], seq 8:480, ack 25, win 227, options [nop,nop,TS val 202048076 ecr 1842693142], length 472: RESP "# Replication^M^Jrole:master^M^Jconnected_slaves:2^M^Jslave0:ip=172.28.5.2,port=6379,state=online,offset=3413671,lag=0^M^Jslave1:ip=172.28.5.1,port=6379,state=online,offset=3413671,lag=1^M^Jmaster_replid:186487241cd9594a4921b48b510ea432fa9dc5d5^M^Jmaster_replid2:0000000000000000000000000000000000000000^M^Jmaster_repl_offset:3413671^M^Jsecond_repl_offset:-1^M^Jrepl_backlog_active:1^M^Jrepl_backlog_size:1048576^M^Jrepl_backlog_first_byte_offset:2365096^M^Jrepl_backlog_histlen:1048576^M^J"
13:36:33.300499 IP 172.28.5.4.50956 > 172.28.5.0.6379: Flags [P.], seq 25:31, ack 480, win 237, options [nop,nop,TS val 1842693142 ecr 202048076], length 6: RESP "QUIT"
13:36:33.300721 IP 172.28.5.0.6379 > 172.28.5.4.50956: Flags [P.], seq 480:485, ack 31, win 227, options [nop,nop,TS val 202048077 ecr 1842693142], length 5: RESP "OK"
13:36:33.300860 IP 172.28.5.0.6379 > 172.28.5.4.50956: Flags [F.], seq 485, ack 31, win 227, options [nop,nop,TS val 202048077 ecr 1842693142], length 0
13:36:33.300878 IP 172.28.5.4.50956 > 172.28.5.0.6379: Flags [R.], seq 31, ack 485, win 237, options [nop,nop,TS val 1842693143 ecr 202048077], length 0
13:36:33.300916 IP 172.28.5.4.50956 > 172.28.5.0.6379: Flags [R], seq 3655901791, win 0, length 0
13:36:33.635583 IP 172.28.5.4.44202 > 172.28.5.1.6379: Flags [S], seq 3756294567, win 29200, options [mss 1460,sackOK,TS val 4040472903 ecr 0,nop,wscale 7], length 0
13:36:33.635625 IP 172.28.5.1.6379 > 172.28.5.4.44202: Flags [S.], seq 2032691705, ack 3756294568, win 28960, options [mss 1460,sackOK,TS val 3557067497 ecr 4040472903,nop,wscale 7], length 0
13:36:33.635649 IP 172.28.5.4.44202 > 172.28.5.1.6379: Flags [P.], seq 1:7, ack 1, win 229, options [nop,nop,TS val 4040472903 ecr 3557067497], length 6: RESP "PING"
13:36:33.635666 IP 172.28.5.1.6379 > 172.28.5.4.44202: Flags [.], ack 7, win 227, options [nop,nop,TS val 3557067498 ecr 4040472903], length 0
13:36:33.635737 IP 172.28.5.1.6379 > 172.28.5.4.44202: Flags [P.], seq 1:8, ack 7, win 227, options [nop,nop,TS val 3557067498 ecr 4040472903], length 7: RESP "PONG"
13:36:33.635760 IP 172.28.5.4.44202 > 172.28.5.1.6379: Flags [P.], seq 7:25, ack 8, win 229, options [nop,nop,TS val 4040472904 ecr 3557067498], length 18: RESP "info replication"
13:36:33.635811 IP 172.28.5.1.6379 > 172.28.5.4.44202: Flags [P.], seq 8:535, ack 25, win 227, options [nop,nop,TS val 3557067498 ecr 4040472904], length 527: RESP "# Replication^M^Jrole:slave^M^Jmaster_host:172.28.5.0^M^Jmaster_port:6379^M^Jmaster_link_status:up^M^Jmaster_last_io_seconds_ago:0^M^Jmaster_sync_in_progress:0^M^Jslave_repl_offset:3413819^M^Jslave_priority:100^M^Jslave_read_only:1^M^Jconnected_slaves:0^M^Jmaster_replid:186487241cd9594a4921b48b510ea432fa9dc5d5^M^Jmaster_replid2:0000000000000000000000000000000000000000^M^Jmaster_repl_offset:3413819^M^Jsecond_repl_offset:-1^M^Jrepl_backlog_active:1^M^Jrepl_backlog_size:1048576^M^Jrepl_backlog_first_byte_offset:2365244^M^Jrepl_backlog_histlen:1048576^M^J"
13:36:33.676077 IP 172.28.5.4.44202 > 172.28.5.1.6379: Flags [.], ack 535, win 237, options [nop,nop,TS val 4040472944 ecr 3557067498], length 0
13:36:33.960542 IP 172.28.5.4.48940 > 172.28.5.2.6379: Flags [S], seq 3607265503, win 29200, options [mss 1460,sackOK,TS val 3563700510 ecr 0,nop,wscale 7], length 0
13:36:33.960909 IP 172.28.5.2.6379 > 172.28.5.4.48940: Flags [S.], seq 1002602915, ack 3607265504, win 28960, options [mss 1460,sackOK,TS val 343163815 ecr 3563700510,nop,wscale 7], length 0
